SCORE,TITLE,BY,URL
4,Show HN: Our spinoff startup WAYWT.com,DanBlake,http://waywt.com
6,Xkcd: Isolation,ohjeez,http://xkcd.com/1601/
5,Arsenal player Mathieu Flamini reveals mass produced oil replacement,wicket,http://www.thesun.co.uk/sol/homepage/sport/football/6742052/Mathieu-Flaminis-no-fuel.html
117,The Other France,footpath,http://www.newyorker.com/magazine/2015/08/31/the-other-france
65,Jack Yufe dies at 82; he was raised Jewish his identical twin as a Nazi,soundsop,http://www.latimes.com/local/obituaries/la-me-jack-yufe-20151111-story.html
107,Otto: Meet the Successor to Vagrant,clessg,https://ottoproject.io/
37,Gitwatch: Watch a Git repository for changes,oxplot,https://github.com/oxplot/gitwatch
23,Professor Frisby's Mostly Adequate Guide to Functional Programming,laychopy,https://drboolean.gitbooks.io/mostly-adequate-guide/
462,State of emergency declared across France after Paris shootings and explosions,dethi,http://www.theguardian.com/world/live/2015/nov/13/shootings-reported-in-eastern-paris-live
13,Why New York Subway Lines Are Missing Countdown Clocks,nsrivast,http://www.theatlantic.com/technology/archive/2015/11/why-dont-we-know-where-all-the-trains-are/415152/?single_page=true
6,Op-ed: (How) did they break Diffie-Hellman?,fufufanatic,http://arstechnica.com/security/2015/11/op-ed-how-did-they-break-diffie-hellman/
5,Review: Why 'Sense8' Season 1 Is Netflix's Most Baffling Series Yet,walterbell,http://www.indiewire.com/article/review-why-sense8-season-1-is-netflix-most-baffling-series-yet-20150605
37,AvanceDB an in-memory database based on the CouchDB REST API,ronjouch,https://github.com/RipcordSoftware/AvanceDB
74,Network of ‘Scouts’ Spreads Money Through Silicon Valley,ganeumann,http://www.wsj.com/articles/secretive-sprawling-network-of-scouts-spreads-money-through-silicon-valley-1447381377
42,Modern Java,cryptoz,https://github.com/winterbe/java8-tutorial#modern-java---a-guide-to-java-8
32,Drug makers need to disclose more clinical trial data,Amorymeltzer,http://www.statnews.com/2015/11/12/drug-makers-need-disclose-clinical-trial-data-study-says/
3,Offline Data Composition at Nextdoor,siminm,https://engblog.nextdoor.com/2015/11/12/offline-data-composition-at-nextdoor/
8,1958 Lituya Bay megatsunami,rambunco,https://en.wikipedia.org/wiki/1958_Lituya_Bay_megatsunami
11,Facebook Accidentally DDOS'd Me,fareskalaboud,https://medium.com/@fareskalaboud/facebook-accidentally-ddos-d-me-fcbf509b507b
3,Acknowledging Privilege,kirillzubovsky,http://bryce.vc/post/133150443485/acknowledging-privilege
234,On Being Smart (2009) [pdf],jonnybgood,http://sma.epfl.ch/~moustafa/General/onbeingsmart.pdf
45,Oil prices are responding to supply and demand not OPEC,wojer,http://www.economist.com/news/finance/21678198-once-prices-are-responding-supply-and-demand-not-opec-why-market
15,A language wish list,luu,http://www.drmaciver.com/2015/07/a-wish-list/
131,Sid Meier's Civilization Inspired Budget,personjerry,http://alexrecker.com/our-new-sid-meiers-civilization-inspired-budget/
15,Mutability and Persistent Data Structures: Retroactivity,LForLambda,http://www.alexkyte.me/2015/08/mutability-and-persistent-data.html
6,A Measure of Sacrifice (2005),rms,http://szabo.best.vwh.net/synch.html
16,Deep Drone: A Flying Object Detector with Caffe Dronekit and Zeromq,dgorissen,http://dirkgorissen.com/2015/11/12/deep-drone-a-flying-object-detector-with-caffe-dronekit-and-zeromq/
157,Rocket Fiber Launches 100GB/s Internet Service in Downtown Detroit,prostoalex,http://techcrunch.com/2015/11/12/rocket-fiber-launches-100gbs-internet-service-in-downtown-detroit/
22,The Invention of Nature:  Alexander von Humboldt the Lost Hero of Science,Hooke,http://www.theguardian.com/books/2015/nov/13/the-invention-of-nature-the-adventures-of-alexander-von-humboldt-andrea-wulf-review
16,Memories of a printer,mwcampbell,http://changelog.complete.org/archives/9420-memories-of-a-printer
249,How Insects Breathe,srikar,http://noticing.co/how-insects-breathe/
21,When Military School Offers the Right Kind of Discipline for At-Risk Students,curtis,http://www.theatlantic.com/education/archive/2015/11/the-right-kind-of-school-discipline/415506/?single_page=true
142,Dozens of oil tankers cluster off the coast of Texas due to oil price fall,cryoshon,http://www.marinetraffic.com/en/ais/home/centerx:-95/centery:29/zoom:10
68,Devmag.io: A network for software developers,somecoder,https://devmag.io/
114,Breaking all the Eggs in C++,ingve,http://scottmeyers.blogspot.com/2015/11/breaking-all-eggs-in-c.html
186,Fuel for nuclear bomb in hands of unknown Russian black marketeer officials say,yurisagalov,http://www.publicintegrity.org/2015/11/12/18850/fuel-nuclear-bomb-hands-unknown-black-marketeer-russia-us-officials-say
27,Engineered bat virus stirs debate over risky research,Amorymeltzer,http://www.nature.com/news/engineered-bat-virus-stirs-debate-over-risky-research-1.18787
5,Impacto: a wearable that simulates physical impact in VR,3eto,https://hpi.de/en/baudisch/projects/impacto.html
9,Custom pattern-matching and advanced macrology,eduardoejp,http://luxlang.blogspot.com/2015/11/custom-pattern-matching-and-advanced.html
88,Edward Snowden and spread of encryption blamed after Paris terror attacks,NN88,http://www.dailydot.com/politics/paris-attack-encryption-snowden/?fb=dd
3,Scrum is dead: breaking down the Open Development Method,plurby,http://opensource.com/business/15/11/open-development-method
1,Remote volunteer and internship opportunities at Zidisha (YC W14),jkurnia,https://www.zidisha.org/volunteer
18,A Recipe for Witchcraft in Seventeenth-Century Ireland,pepys,http://recipes.hypotheses.org/6905
126,Elasticsearch as a Time Series Data Store,trampi,https://www.elastic.co/blog/elasticsearch-as-a-time-series-data-store
20,Ariso: Contactless connector for data and power,fezz,https://www.arrow.com/en/research-and-events/articles/ariso-contactless-connectivity-enables-advanced-communication-in-smart-factories?utm_source=eloqua&utm_medium=email&utm_content=amcr.gi00.388r83&utm_campaign=amca.sm00.384n12&elq=6c66e667623641edb4a8a18a3c33819a&elqCampaignId=511&elqaid=1498&elqat=1&elqTrackId=7cc7b083c1d24306bb51c1e3ee0dbf8a
250,Five years of Scala and counting: debunking some myths,logician_insa,http://manuel.bernhardt.io/2015/11/13/5-years-of-scala-and-counting-debunking-some-myths-about-the-language-and-its-environment/
11,What Is Conservatism and What Is Wrong with It? (2004),nkurz,http://polaris.gseis.ucla.edu/pagre/conservatism.html
94,How Apple Is Giving Design a Bad Name,digitalmud,http://fastcompany.com/3053406/how-apple-is-giving-design-a-bad-name
44,Role-based authorization in Rails,opiotrek,http://blog.chaps.io/2015/11/13/role-based-authorization-in-rails.html
86,When Disney Got Adult and Trippy,prismatic,http://www.bbc.com/culture/story/20151112-when-disney-got-adult-and-trippy
19,Airbnb introduces dynamic pricing to meet surging demand,mollmerx,http://www.ft.com/cms/s/0/bc875c4c-88ee-11e5-9f8c-a8d619fa707c.html
49,Photos NASA picked to explain our world to aliens,_dps,http://www.vox.com/2015/11/11/9702090/voyager-golden-record-pictures
38,A Boy Who Became a World War II Veteran at 13 Years Old,lujim,http://www.smithsonianmag.com/history/the-boy-who-became-a-world-war-ii-veteran-at-13-years-old-168104583/?no-ist
62,Usernames reveal the age and psychology of game players,limbicsystem,http://www.sciencedirect.com/science/article/pii/S0747563215301655
76,Assembly is shutting down December 6 2015,acadet,http://assembly.com
9,Show HN: Wheretocredit API - Display miles earned with flight search results,iakh,http://www.wheretocredit.com/api
98,Charities we’d like to see,BenjaminTodd,http://blog.givewell.org/2015/10/15/charities-wed-like-to-see/
616,f.lux for iOS is no longer available,kilian,https://justgetflux.com/sideload/#notanymore
8,When is one thing equal to some other thing? (2007) [pdf],espeed,http://www.math.harvard.edu/~mazur/preprints/when_is_one.pdf
21,Wish rumored to have rejected acquisition offers from Amazon and Alibaba,coloneltcb,http://www.businessinsider.com/wish-rumored-to-reject-acquisition-offers-from-amazon-and-alibaba-2015-11
12,Mach Match:  Did an XP-86 Beat Yeager to the Punch? (1999),lujim,http://www.airspacemag.com/history-of-flight/mach-match-361247/?no-ist
19,MIG: Search through your infrastructure in real-time from the command line,jvehent,https://mig.ninja/lisa15
209,Reports that Bassel Khartabil has been sentenced to death,ahtierney,http://joi.ito.com/weblog/2015/11/13/urgent-reports-.html
1,Benchling (YC S12) is hiring full stack engineers to accelerate biotech research,sajithw,https://jobs.lever.co/benchling/f916b4d9-59ea-4346-a4a0-daa18bf46fa4?lever-source=Hacker%20News
25,Tmux Chess,surganov,http://andreykeske.com/#/en/works/tmux-chess
53,How Walter Murch Merged “Apocalypse Now” and “Ride of the Valkyries”,pmcpinto,http://nautil.us/issue/30/identity/how-i-tried-to-transplant-the-musical-heart-of-apocalypse-now
29,“Use bubble sort for insertion sets because it's faster than std::stable_sort”,mmastrac,https://bugs.webkit.org/show_bug.cgi?id=150828
7,Show HN: Go library to improve tabular data readability in terminal apps,gosuri,https://github.com/gosuri/uitable
6,Show HN: Pygraph_redis directed graph python library for redis,kakwa_,https://github.com/kakwa/pygraph_redis
24,Why Hackers Must Eject the SJWs,davidgerard,http://esr.ibiblio.org/?p=6918
18,A Tale of Two Northern European Cities: Meeting the Challenges of Sea Level Rise,cpeterso,http://e360.yale.edu/feature/a_tale_of_two_northern_european_cities_meeting_the_challenges_of_sea_level_rise/2926/
57,Why the Cure for a Sluggish Economy Is Actually Longer Vacations,lujim,http://www.cepr.net/publications/op-eds-columns/why-the-cure-for-a-sluggish-economy-is-actually-longer-vacations
3,Entropy Attacks (2014),monort,http://blog.cr.yp.to/20140205-entropy.html
90,How the Mad Men Lost the Plot,zbravo,http://www.ft.com/cms/s/2/cd1722ba-8333-11e5-8e80-1574112844fd.html#axzz3qWkMqSSR
12,Rio: Design of a Concurrent Window System (2000) [pdf],vezzy-fnord,http://herpolhode.com/rob/lec5.pdf
31,The Psychology and Neuroscience of Curiosity [pdf],brianclements,http://www.cell.com/neuron/pdf/S0896-6273(15)00767-9.pdf
149,It’s Way Too Easy to Hack the Hospital,jeo1234,http://www.bloomberg.com/features/2015-hospital-hack/
67,Emulators written in JavaScript,ingve,https://github.com/BigEd/jsemu
3,Claimed Breakthrough Slays Classic Computing Problem; Encryption Could Be Next,kp25,http://www.technologyreview.com/news/543511/claimed-breakthrough-slays-classic-computing-problem-encryption-could-be-next/
181,Public Beta: December 3 2015,arash_milani,https://letsencrypt.org/2015/11/12/public-beta-timing.html
8,Show HN: Letter Boilerplate – Typeset your letters painlessly through LaTeX,mrzool,https://github.com/mrzool/letter-boilerplate
6,Awesome-Selfhosted -  FOSS web applications that can be hosted locally,networked,https://github.com/Kickball/awesome-selfhosted
105,Marc Andreessen Sold 73 Percent of His Facebook Stock in the Last Two Weeks,techaddict009,https://recode.net/2015/11/14/marc-andreessen-sold-73-percent-of-his-facebook-stock-in-the-last-two-weeks/
18,Ask HN: What can we do against terrorist attacks like the one in Paris?,mininao,
8,Why Edward Snowden thinks you should use an ad blocker,Jerry2,https://www.washingtonpost.com/news/the-switch/wp/2015/11/13/why-edward-snowden-thinks-you-should-use-an-ad-blocker/
129,Microsoft Open Sources Distributed Machine Learning Toolkit,kostandin_k,http://www.dmtk.io/index.html
4,Lime Text: A text editor primarily developed in Go,albertzeyer,http://limetext.org/
12,Teen entrepreneur who invented a smartphone lens magnifier,bootload,http://www.huffingtonpost.co.uk/2015/11/12/teen-toby-liew-invented-smartphone-purchase-magniband_n_8544730.html?utm_hp_ref=uk
61,Thursday Beirut suicide bombings kill 43,personjerry,http://www.cnn.com/2015/11/12/middleeast/beirut-explosions/
63,Banish the Kardashians from the web,rfjedwards,http://kblocker.co/
31,ESR: Why Hackers Must Eject the SJWs,smudgy,http://esr.ibiblio.org/?p=6918
19,In a world where all terrorist attacks are not equal,yinghang,http://stateofmind13.com/2015/11/14/from-beirut-this-is-paris-in-a-world-that-doesnt-care-about-arab-lives/
28,Redox is Serious,jaxondu,http://dictator.redox-os.org/index.php?controller=post&action=view&id_post=17
32,Lectures from the Dawn of Computing,Oatseller,http://www.computerhistory.org/atchm/first-steps-lectures-from-the-dawn-of-computing/
172,Writing code doesn't mix well with oration,jf,https://inconshreveable.com/11-13-2015/your-live-coding-demo-is-boring/
139,America's poorest white town: abandoned by coal swallowed by drugs,dthal,http://www.theguardian.com/us-news/2015/nov/12/beattyville-kentucky-and-americas-poorest-towns
94,Carl Sagan's idea for Contact video game (1983) [video],danso,https://cdn.loc.gov/service/mss/mss85590/099/099.pdf
1,Spire (YC W15) is looking for a Head of Operations to join our team,matsur,
20,​Supercomputer leaders come together on new open-source framework,CrankyBear,http://www.zdnet.com/article/supercomputer-leaders-come-together-on-new-open-source-framework/
19,Pool_party – A leak-free memory allocator for short-lived objects,rileyberton,http://techblog.appnexus.com/blog/2015/11/09/transactional-allocation-for-short-lived-requests-dot/
13,Vincent Asaro Accused in 1978 Lufthansa Heist Is Found Not Guilty,sc90,http://www.nytimes.com/2015/11/13/nyregion/vincent-asaro-accused-in-lufthansa-heist-is-found-not-guilty.html
