SCORE,TITLE,BY,URL
88,The Reddit Front Page Is Not a Meritocracy,lil_tee,http://toddwschneider.com/posts/the-reddit-front-page-is-not-a-meritocracy/
107,Microsoft Making Office Suite Free on Mobile,shitehawk,http://www.nytimes.com/2014/11/07/technology/microsoft-to-give-away-mobile-version-of-office-software.html?src=twr&_r=0
24,Operator of Silk Road 2.0 Website Charged in Manhattan Federal Court,pc,http://www.fbi.gov/newyork/press-releases/2014/operator-of-silk-road-2.0-website-charged-in-manhattan-federal-court
68,GnuPG 2.1.0 “modern” released,bruo,http://lists.gnupg.org/pipermail/gnupg-announce/2014q4/000358.html
44,Show HN: Colores – A simple app I built to find color palettes based on words,manueslapera,http://colores.manugarri.com
593,The Sixth Stage of Grief Is Retro-Computing,daddy_drank,https://medium.com/message/networks-without-networks-7644933a3100/
29,ARM multiprocessor support,fcambus,http://blog.netbsd.org/tnf/entry/working_arm_multiprocessor_support
1,Impraise (YC S14) looking for iOS dev. Own the full development process,kohnke,http://checkthis.com/87vz
84,Making a brain for my model plane,evansd,http://story.glass/uav
229,Winamp 2 in HTML5,jazzychad,http://jordaneldredge.com/projects/winamp2-js/
27,A bit more about LXD,rlpb,http://blog.dustinkirkland.com/2014/11/sexy-rhymes-with-lxc.html
109,Apple might be running a web crawler written in Go,beltex,http://jan.moesen.nu/2014/11/06/apple-crawler.txt
10,7 Colorado communities just secured the right to build their own broadband,Libertatea,http://www.washingtonpost.com/blogs/the-switch/wp/2014/11/05/7-colorado-communities-just-voted-themselves-the-right-to-build-their-own-broadband/
101,Improved Error Handling in Rust,steveklabnik,http://lucumr.pocoo.org/2014/11/6/error-handling-in-rust/
42,Rails JS frameworks: Ember.js vs. AngularJS,fervisa,http://www.airpair.com/ruby-on-rails/posts/ember-vs-angular-with-rails
3,Artificial Neural Networks – Introduction,rzagabe,http://www.rzagabe.com/artificial-neural-network-introduction/
253,Independence Day,AndrewGaspar,http://news.microsoft.com/stories/independence-day/
89,Database of all H1B petitions by company,ambrood,http://visadoor.com/h1bvisa-database#.VFssBVPF-hE
718,Reverse OCR,mrtbld,http://reverseocr.tumblr.com/
269,Reflected File Download: A New Web Attack Vector,lelf,https://drive.google.com/file/d/0B0KLoHg_gR_XQnV4RVhlNl96MHM/view
467,How I reverse-engineered Google Docs to play back any document's keystrokes,jsomers,http://features.jsomers.net/how-i-reverse-engineered-google-docs/
67,Show HN: Wall of Text,louisstow,http://walloftext.co
322,Creating 3D worlds with HTML and CSS,tambourine_man,http://keithclark.co.uk/articles/creating-3d-worlds-with-html-and-css/
53,What Do You Need?,nreece,http://developer.amd.com/community/blog/2014/11/04/what-do-you-need/
175,Weekly Coding Interview Problems by Email,gameguy43,https://www.interviewcake.com/free-weekly-coding-interview-problem-newsletter
242,EFF asks for the right to revive “abandoned” online games,sinak,http://arstechnica.com/gaming/2014/11/eff-asks-for-the-right-to-revive-abandoned-online-games
105,Why Intel is adding instructions to speed up non-volatile memory,joe_bleau,http://danluu.com/clwb-pcommit/
307,Proxygen Facebook's C++ HTTP Framework,mikeevans,https://code.facebook.com/posts/1503205539947302/introducing-proxygen-facebook-s-c-http-framework/
19,SmartDataCenter and Manta are now open source,porker,http://www.joyent.com/blog/sdc-and-manta-are-now-open-source
22,Terrorists used false DMCA claims to get personal data of anti-islamic YouTuber,amalag,http://beta.slashdot.org/submission/3961131/terrorists-used-false-dmca-claims-to-get-personal-data-of-anti-islamic-youtuber
46,How Accurate Are These Smartphone Sound Measurement Apps?,liyanage,http://blogs.cdc.gov/niosh-science-blog/2014/04/09/sound-apps/
1,Know someone who'd make a great office manager? Tell them about Flexport (YC W14),thedogeye,
181,Building C Projects,rsaarelm,http://nethack4.org/blog/building-c.html
121,If you use a Mac or Android e-commerce sites may be charging you more,altern8,http://www.washingtonpost.com/posteverything/wp/2014/11/03/if-you-use-a-mac-or-an-android-e-commerce-sites-may-be-charging-you-more/?tid=rssfeed
230,The poetry and brief life of a Foxconn worker: Xu Lizhi (1990-2014),jimmer,https://libcom.org/blog/xulizhi-foxconn-suicide-poetry
39,Germany's top publisher bows to Google in news licensing row,BogdanCalin,http://www.reuters.com/article/2014/11/05/us-google-axel-sprngr-idUSKBN0IP1YT20141105
38,Inflatable baby incubator wins James Dyson Award,twicenone,http://www.bbc.co.uk/news/technology-29900968
148,Nature: IPython interactive demo,ivoflipse,http://www.nature.com/news/ipython-interactive-demo-7.21492
86,How My Printer Caused Excessive Syscalls and UDP Traffic,rzezeski,http://zinascii.com/2014/how-my-printer-caused-excessive-syscalls.html
131,Delegative Democracy – a scalable voting model,bdr,http://www.andrewbadr.com/log/24/delegative-democracy-a-scalable-voting-model/
7,FBI seizes Silk Road 2.0 names operator,codezero,https://twitter.com/NewYorkFBI/status/530386208099426304
52,Stop Using Constructors in JS (2012),outdooricon,http://ericleads.com/2012/09/stop-using-constructor-functions-in-javascript/
316,Alaskans vote to legalize marijuana,lygi,http://www.adn.com/article/20141104/alaskans-vote-legalize-marijuana
31,Apple malware affects mostly Chinese users,dan1234,http://m.bbc.co.uk/news/technology-29928751
176,Universal Fund,koopajah,https://watsi.org/universal-fund
10,How did Apple forget to focus its product line-up?,ricw,http://ricw.svbtle.com/has-apple-forgotten-to-focus-its-products
151,How to Survive in SF as a Broke Startup,wlimdo,http://wlimdo.com/how-to-survive-in-sf-as-a-broke-startup
115,Drop dead,_pius,http://tilde.club/~mathowie/files/e0c99a3e95d5d907ab156fca2ba889bf-36.html
91,Metafilter The Internet's First Family,samclemens,http://penguinrandomhouse.ca/hazlitt/longreads/internets-first-family
95,The Mysterious Mental Side Effects of Traveling into Space,benbreen,http://www.fastcoexist.com/3036887/out-of-this-world-the-mysterious-mental-side-effects-of-traveling-into-space
88,Study shows brain interface between humans,UWNews,http://www.washington.edu/news/2014/11/05/uw-study-shows-direct-brain-interface-between-humans/
1,Apptimize hiring a lead UX/UI designer,nancyhua,http://apptimize.com/wp-content/uploads/2014/11/UXUIDesigner_ApptimizeJobs.pdf
127,C# Autocomplete Demo Using Bing Code Search Engine,miket,http://codesnippet.research.microsoft.com/
5,An easier way of using polyfills,rnyman,https://hacks.mozilla.org/2014/11/an-easier-way-of-using-polyfills/
105,PyPy IO improvements,jerven,http://morepypy.blogspot.com/2014/11/pypy-io-improvements.html
39,The Gondola web framework,georgyo,https://github.com/rainycape/gondola
35,Let's read a Truetype font file from scratch,eadler,http://stevehanov.ca/blog/index.php?id=143
40,The People Who Run Wikipedia,WestCoastJustin,https://medium.com/matter/the-36-people-who-run-wikipedia-21ecca70bcca
78,Duke Engines' compact lightweight valveless axial engine,anovio,http://www.gizmag.com/duke-engines-axial/33631/
89,Let's build a browser engine part 7: Intro to Painting,mbrubeck,http://limpet.net/mbrubeck/2014/11/05/toy-layout-engine-7-painting.html
4,Large Bitcoin farm in Thailand burns down,typedweb,https://bitcointalk.org/index.php?topic=849183.0
78,Show HN: Timely for iPhone – Scheduling and Time Tracking Simultaneously,matmik,http://www.timelyapp.com/iphone
5,The Deal to Sell 6000 of Detroit's Blighted Properties Falls Apart,coreymgilmore,http://www.businessweek.com/articles/2014-11-05/the-deal-to-sell-6-000-of-detroits-blighted-properties-falls-apart#r=hp-ls
83,McFly – Flux Architecture Made Easy,danso,https://github.com/kenwheeler/mcfly
66,Attack Surface: Why I Unikernel Part 1,luu,http://www.somerandomidiot.com/blog/2014/08/11/attack-surface-area/
64,Neovim: input encoding and you,bpierre,http://www.aktau.be/2014/11/04/neovim-input-encoding-and-you/
60,NSA Director Says Agency Shares Vast Majority of Bugs It Finds,randomname2,http://threatpost.com/nsa-director-says-agency-shares-vast-majority-of-bugs-it-finds/109170
150,Lyft Accuses Former COO of Stealing Confidential Docs Before Joining Uber,bruceb,http://techcrunch.com/2014/11/05/lyft-sues-travis-vanderzanden
9,Show HN: Pendo.io – A data driven platform for product teams,eboduch,http://www.pendo.io
12,Apple iPsum: Lorem Ipsum Apple Style,taylanpince,http://appleipsum.org
45,Ask HN: How do I get my team to write better code?,kamakazizuru,
1,URX (YC S13) is hiring distributed systems and front end engineers,jmilinovich,http://urx.com/careers/
20,Sea of Crises,prostoalex,http://grantland.com/features/sumo-wrestling-tokyo-japan-hakuho-yukio-mishima-novelist-seppuku/
64,Gravity Might Explain Why Time Never Runs Backward,ghosh,http://www.wired.com/2014/11/time-gravity/
684,The Other Side of Diversity,rouma7,https://medium.com/@ericajoy/the-other-side-of-diversity-1bb3de2f053e
512,Principles of Rich Web Applications,rafaelc,http://rauchg.com/2014/7-principles-of-rich-web-applications/
37,Optimizing Tail Call Recursion,silentbicycle,https://spin.atomicobject.com/2014/11/05/tail-call-recursion-optimization/#
4,MVP vs. MVE – minimal viable experience,kedron,http://www.kedronrhodes.com/mvp-vs-mve/
35,Show HN: OJ – A Clojure library for talking to your database,taylorlapeyre,https://github.com/taylorlapeyre/oj
4,Show HN: Gondola a Django like web framework in Go,hierro,http://gondolaweb.com
52,Leaked Documents Expose Global Companies’ Secret Tax Deals in Luxembourg,flexie,http://www.icij.org/project/luxembourg-leaks/leaked-documents-expose-global-companies-secret-tax-deals-luxembourg
10,The $5 Logo,altern8,http://blog.folyo.me/the-5-dollar-logo/
3,Why Wave Race was Nintendo's most elaborate tech demo ever,tbana,http://www.redbull.com/en/games/stories/1331688784942/wave-race-nintendo-retrospective
12,Show HN: Meteor Day Checkin – Follow Meteor Developers Around the World,kimar,http://meteorday.meteor.com
8,Changing the currency of academic science,benbreen,http://johnhawks.net/weblog/topics/metascience/ioannidis-prescription-currency-2014.html
62,Who has been running this classified ad for more than ten years?,radagaisus,http://workingwithwords.blogspot.com/2004/08/gee-i-wonder-if-this-will-attract-any.html
164,Secure Messaging Scorecard,sinak,https://www.eff.org/secure-messaging-scorecard
3,Fort Lauderdale Charges 90-Year-Old Two Pastors for Feeding Homeless,monsterix,http://www.nbcnews.com/news/us-news/fort-lauderdale-charges-90-year-old-two-pastors-feeding-homeless-n241971
35,Man and Uber Man,r0h1n,http://www.vanityfair.com/business/2014/12/uber-travis-kalanick-controversy
7,“A New Equation for Intelligence” – Dr. Alex Wissner-Gross MIT Media Lab,espeed,http://www.ted.com/talks/alex_wissner_gross_a_new_equation_for_intelligence
64,How Google Will Use Firebase to Supercharge Its Cloud Computing,ghosh,http://www.wired.com/2014/11/why-google-acquired-firebase/
401,The Art of Not Working at Work,jamessun,http://www.theatlantic.com/business/archive/2014/11/the-art-of-not-working-at-work/382121/?single_page=true
33,DNSSEC: Complexities and Considerations,fcambus,http://blog.cloudflare.com/dnssec-complexities-and-considerations/
85,Segment SQL Powered by Amazon Redshift,ihodes,https://segment.com/blog/segment-sql-amazon-redshift/?utm_source=newsletter&utm_medium=email&utm_campaign=redshift
10,Shippable raises $8M to help companies accelerate software development,prostoalex,http://www.geekwire.com/2014/shippable-raises-8-million/
7,Ask HN: When if ever will 128-bit CPUs become mainstream?,gjvc,
4,The Mystical and Magical SemVer Ranges Used by NPM and Bower,remotesynth,http://developer.telerik.com/featured/mystical-magical-semver-ranges-used-npm-bower/
33,Asciilands: An adventure game composed of text,bnj,http://asciilands.blogspot.com/
504,C4 – C in 4 functions,petercooper,https://github.com/rswier/c4
