SCORE,TITLE,BY,URL
24,Oolu (YC S15) Is Bringing Solar Energy to West Africa’s Off-Grid Population,S4M,http://techcrunch.com/2015/07/31/oolu-is-bringing-solar-energy-to-west-africas-off-grid-population/
4,HI I'm HN Vimmy Bot I check Hacker News for stories on VIM then I tweet 'em,lando2319,http://hnvimmybot.com/
11,Elon Musk: Tesla SpaceX and the Quest for a Fantastic Future,jonathansizz,http://www.nybooks.com/articles/archives/2015/aug/13/elon-musk-man-mars/
6,A year-long web app effort that made absolutely no money,prawn,https://medium.com/@dsabar/the-zero-dollar-web-app-8886bf4ae030
22,How to Compute with Data You Can’t See,sohkamyung,http://spectrum.ieee.org/computing/software/how-to-compute-with-data-you-cant-see
8,The Genesis of the Gang (1899),montrealer,http://www.theatlantic.com/magazine/archive/1899/09/the-genesis-of-the-gang/305737/?single_page=true
13,College textbook prices have gone up 1041% since 1977,adibchoudhury,http://www.nbcnews.com/feature/freshman-year/college-textbook-prices-have-risen-812-percent-1978-n399926
15,Summary of Privacy Policy and Breach Notification Requirements in California,lutesfuentes,https://casetext.com/posts/summary-of-privacy-policy-and-breach-notification-requirements-in-california
110,Strange C Syntax,Tideflat,http://blog.robertelder.org/weird-c-syntax/
116,A Bestseller Book That Didn't Exist,Tomte,http://www.jmarkpowell.com/the-bestseller-book-that-didnt-exist-how-the-author-of-a-beloved-christmas-classic-pulled-off-the-hoax-of-the-century/
61,What are SDF's origins and history?,erikschoster,http://sdf.org/?faq?BASICS?02
95,Linux-insides: Linkers,0xAX,https://github.com/0xAX/linux-insides/blob/master/Misc/linkers.md
12,Valuations Mean Nothing Anymore,austenallred,http://austenallred.com/_site/valuations-mean-nothing/
7,Hackers are exploiting an OS X flaw to install unwanted adware,erickhill,http://mashable.com/2015/08/04/os-x-flaw-adware-mac/
14,Jensen's Device,grhmc,https://en.wikipedia.org/wiki/Jensen%27s_Device
61,The Museum of Modern Art Research Dataset,danso,https://github.com/MuseumofModernArt/collection/
77,Fermat's Little Theorem (2013) [video],ColinWright,https://www.youtube.com/watch?v=XPMzosLWGHo&feature=youtu.be
3,By Bill Gates: Why I'm Investing $1B into Clean Energy Research,act9,http://qz.com/470592/by-bill-gates-why-im-investing-1-billion-of-my-own-money-into-clean-energy-research/
59,A Conversation with Michael Lopp Pinterest’s Head of Engineering,gkrishnan,http://techcrunch.com/2015/08/01/a-conversation-with-michael-lopp-pinterests-head-of-engineering/
26,Exercises in Programming Style,signa11,https://github.com/crista/exercises-in-programming-style
9,Coinbase Developer Spotlight: Julia a Telegram Bot for Bitcoin,ntomaino,https://developers.coinbase.com/blog/2015/08/03/julia-telegram-bot-for-bitcoin
16,Show HN: Simpler alternative to WebEx and GoToWebinar built with WebRTC,Adams472,https://breakoutroom.co
9,China Curbs Online Payment in Fresh Blow to Internet Finance,T-A,http://www.bloomberg.com/news/articles/2015-08-03/china-tightens-online-payment-in-latest-blow-to-internet-finance
75,Recreating Megaman 2 Using JavaScript and WebGL,jyrki,https://medium.com/recreating-megaman-2-using-js-webgl
5,Lexus Hoverboard,georgecalm,http://www.wired.com/2015/08/lexus-hoverboard
68,Diffoscope: in-depth comparison of files archives and directories,chei0aiV,http://diffoscope.org/
20,Goldenballs: Not for Nothing Was Jacob Fugger Known as “Jacob the Rich”,diodorus,http://www.economist.com/news/books-and-arts/21660074-not-nothing-was-jacob-fugger-known-jacob-rich-goldenballs
10,Grothendieck’s gribouillis,valera_rozuvan,http://www.neverendingbooks.org/grothendiecks-gribouillis
70,Millions of Facebook users have no idea they’re using the internet,jakub_g,http://qz.com/333313/milliions-of-facebook-users-have-no-idea-theyre-using-the-internet/
7,Movie Studios Seek SOPA Power Through Broad Site-Blocking Order,DiabloD3,https://www.eff.org/deeplinks/2015/08/movie-studios-seek-sopapower-through-broad-site-blocking-order
8,Show HN: Optical Magnetic Stripe Reading,deutronium,https://www.anfractuosity.com/projects/optical-magnetic-stripe-reading/
109,HIV flushed out by cancer drug,kungfudoi,http://www.bbc.com/news/health-33720325
15,Ask HN: How to become a better at writing?,soulbadguy,
9,Web Inspector Interface Changes,om2,https://www.webkit.org/blog/3574/web-inspector-interface-changes/
8,Hackers Can Seize Control of Electric Skateboards and Toss Riders,ghosh,http://www.wired.com/2015/08/hackers-can-seize-control-of-electric-skateboards-and-toss-riders-boosted-revo/
21,Researchers Create First Firmware Worm That Attacks Macs,ghosh,http://www.wired.com/2015/08/researchers-create-first-firmware-worm-attacks-macs/
22,Congratulations HN: 10M posts and comments,rsp1984,https://news.ycombinator.com/item?id=10000000
22,Torvalds 2.0: Patricia Torvalds on computing college feminism and diversity,tanglesome,http://opensource.com/life/15/8/patricia-torvalds-interview
67,A College Without Classes,Jtsummers,http://www.theatlantic.com/business/archive/2015/07/a-college-without-classes/400115/?single_page=true
93,I run a university. I’m also an Uber driver,e15ctr0n,https://www.washingtonpost.com/posteverything/wp/2015/07/29/i-run-a-university-im-also-an-uber-driver/
131,Tech industry's persistent claim of worker shortage may be phony,veryluckyxyz,http://www.latimes.com/business/hiltzik/la-fi-hiltzik-20150802-column.html#page=1
4,Show HN: Learnpad is an HTML/CSS/JS editor for students to use in the classroom,glossybrown,https://github.com/outoftime/learnpad
608,The Really Big One,Thevet,http://www.newyorker.com/magazine/2015/07/20/the-really-big-one
9,Option Stacks: Solving the Horowitz-Altman Conundrum,brudgers,http://www.kludgecode.com/index.php/optionstacks/
11,Comparing Performance of Blaze React Angular-Meteor and Angular 2,robgering,http://info.meteor.com/blog/comparing-performance-of-blaze-react-angular-meteor-and-angular-2-with-meteor
187,Introducing Incremental,kilimchoi,https://blogs.janestreet.com/introducing-incremental/?utm_source=rss&utm_medium=rss&utm_campaign=introducing-incremental
61,Ask HN: Freelancer? Seeking freelancer? (August 2015),whoishiring,
5,Hoverboard by Lexus,goqu,http://www.lexus-int.com/amazinginmotion/slide/?utm_campaign=SLIDE-02&utm_source=YouTube&utm_content=YT-Card-0627&utm_medium=social
38,Open Code of Conduct,jp_sc,http://todogroup.org/opencodeofconduct#definitions
14,Ask HN: How do I make a lot of money quickly?,makufiru,
4,The Screenings Launch: A Meteor Scaling Case Study,younes0,http://www.telescopeapp.org/blog/screenings-launch-meteor-scaling-case-study/
86,CUPS 2.1 Is Adding Basic 3D Printer Support,tomkwok,http://www.cups.org/blog.php?L1087
6,“Reverse-ism” is the stupidest phrase I’ve heard since “politically correct”,sebkomianos,https://skeptopia.wordpress.com/2011/10/01/reverse-ism/
15,Ask HN: Where is Dropbox headed?,untilHellbanned,
3,Lexus hoverboard in motion,bitzerlander,https://www.youtube.com/watch?v=awAzM9kTvC0&feature=youtu.be&sf11678837=1
55,Cofactor Genomics (YC S15) Pursues RNA Testing Offers Better Diagnoses Than DNA,katm,http://techcrunch.com/2015/07/31/cofactor-genomics/
24,Dear Startups: Stop Asking Me Math Puzzles to Figure Out If I Can Code (2013),ColinWright,https://countaleph.wordpress.com/2013/10/20/dear-startups-stop-asking-me-math-puzzles-to-figure-out-if-i-can-code/?HN2
15,How America Fell in Love with Crazy Amounts of Air Conditioning,esparantogod,http://www.washingtonpost.com/news/wonkblog/wp/2015/08/03/how-america-fell-in-love-with-crazy-amounts-of-air-conditioning/?tid=sm_fb
6,Obama Takes a Crucial Step on Climate Change,lkurtz,http://www.nytimes.com/2015/08/04/opinion/obama-takes-a-crucial-step-on-climate-change.html
3,Ask HN: Best libraries for converting JavaScript comments to both docs and tests?,tfb,
64,Is This the End for South Asia Shipbreakers?,protomyth,http://gcaptain.com/is-this-the-end-for-south-asia-shipbreakers/
292,“Googles 'vertical center div css' for the 100th time. reads for 7 minutes”,sebkomianos,http://www.bleonard.com/blog/2015/08/01/teaching-css/
62,GetAwesomeness – retrieve all amazing awesomeness from GitHub,snake_case,http://getawesomeness.com/
102,Serve2d – A protocol detecting server,wakaflockafliz,https://github.com/joushou/serve2d
23,I laugh so hard I get tears: Hacker News Onion (Twitter feed),gw666,https://twitter.com/HackerNewsOnion
6,Why Greatness Cannot Be Planned – The Myth of the Objective,signaler,http://www.amazon.com/gp/product/3319155237/ref=as_li_qf_sp_asin_il_tl?ie=UTF8&camp=1789&creative=9325&creativeASIN=3319155237&linkCode=as2&tag=signaler-20&linkId=MI6232CJT5R3QF2T
6,New Email Archive Tool to Sift Literary Legacies,diodorus,http://www.wsj.com/articles/new-email-archive-tool-to-sift-literary-legacies-1438194059
55,Show HN: Chrome/FF plugin brings the HN and Reddit conversation to you as you surf,spenvo,http://www.metafruit.com/kiwi
12,Jacquard Loom: Early Computer Programing (2011) [video],codeisawesome,https://www.youtube.com/watch?v=lwozgRPLVC8
4,Feds admit storing checkpoint body scan images,v4n4d1s,http://www.cnet.com/news/feds-admit-storing-checkpoint-body-scan-images/
50,The Banach–Tarski Paradox [video],selectnull,https://www.youtube.com/watch?v=s86-Z-CbaHA
40,Reverse Logic,Lyrric,http://unabridged.merriam-webster.com/blog/2015/07/reverse-logic/
7,Go(lang) Books,hippo8,https://github.com/dariubs/GoBooks
3,The killer gaming apps for Apple Watch…might not be games at all,michaelone,https://medium.com/@michael_one/the-killer-gaming-apps-for-apple-watch-might-not-be-games-at-all-26a8375c635b
78,SolarCity didn’t invent solar panel but it invented something more important,prostoalex,http://www.slate.com/articles/business/the_juice/2015/07/solarcity_the_company_didn_t_invent_the_solar_panel_but_it_invented_something.single.html
4,Lacona: A Siri like text based command utility for mac,lapitopi,http://www.lacona.io/
3,This App Lets Anyone 3-D Print 'Do-Not-Duplicate' Keys,thisisblurry,http://www.wired.com/2015/08/this-app-lets-anyone-3-d-print-do-not-duplicate-keys/
3,Why Kotlin is my next programming language,octaveguin,https://medium.com/@octskyward/why-kotlin-is-my-next-programming-language-c25c001e26e3
12,Tell HN: VirtKick has pulled the rug out from under us,Sir_Cmpwn,
3,RIG Exploit Kit 3.0 Used to Infect Over 1.3M Computers Worldwide,ck2,http://www.securityweek.com/rig-exploit-kit-30-used-infect-over-13-million-computers-worldwide
7,On the Displacement for Covering a Unit Interval with Randomly Placed Sensors,user_235711,http://arxiv.org/abs/1507.08923
8,New research shows non-wetting surfaces promote chemical reaction rates,user_235711,http://newsoffice.mit.edu/2015/looking-for-catalysts-with-perovskites-0730
50,Open the Music Industry’s Black Box,stuartmemo,http://www.nytimes.com/2015/08/02/opinion/sunday/open-the-music-industrys-black-box.html
77,Twitter’s stock falls toward IPO-level prices,zhuxuefeng1994,http://techcrunch.com/2015/08/03/twitter-collapses-5-tumbling-toward-ipo-level-prices/
179,The World Needs a Secular Community Revolution,TVOLmag,https://evolution-institute.org/article/the-world-needs-a-secular-community-revolution/?source=tvol
6,Here's a look at just how big a problem 'freebooting' is for Facebook,datashovel,http://www.businessinsider.com/freebooting-video-on-facebook-2015-8
10,LHC Computing [video],jonbaer,https://www.youtube.com/watch?v=Ig35vEImzYE
5,Tomorrow – Magic decorator syntax for asynchronous code in Python,avinassh,https://github.com/madisonmay/Tomorrow
9,Lacona – Real Natural Language Text Commands for Mac [In-Browser Demo],brandonhorst,http://lacona.io
81,Vim: Takeaways from One Year of Typing,sankho,http://sankho.github.io/web_log/2015/08/02/vim-8-takeaways-from-one-year-of-typing.html
