SCORE,TITLE,BY,URL
26,Google Has Secret Interview Challenges Based on Your Search History,staringispolite,http://thehustle.co/the-secret-google-interview-that-landed-me-a-job
10,YouTube Gaming is launched,neumino,http://youtube-global.blogspot.com/2015/08/lets-play.html
8,Death to Bullshit,Mojah,http://deathtobullshit.com/
59,My wife found my email in the Ashley Madison database,antr,https://evan.atavist.com/my-wife-found-my-email-in-the-ashley-madison-database
10,Experimental Zero-Latency Typing in IntelliJ IDEA,ingve,http://blog.jetbrains.com/idea/2015/08/experimental-zero-latency-typing-in-intellij-idea-15-eap/
13,Google's Secret Interview Process,Xcelerate,http://www.businessinsider.com/i-was-invited-by-google-to-its-secret-interview-process-2015-8
1,Join our engineering team and build a product used by millions (The Muse YC W12),KMinshew,https://www.themuse.com/jobs/themuse/senior-backend-engineer
21,Show HN: Tune.js – A microtonal web audio library with 3300 historical tunings,suncanon,http://abbernie.github.io/tune/
21,Command-line for your email,bradavogel,https://mixmax.com/blog/the-best-way-to-write-email
48,This Is Not America: Why Wal-Mart Left Germany (2006),Tomte,http://www.atlantic-times.com/archive_detail.php?recordID=615
39,Thunderbird and end-to-end email encryption – should this be a priority?,slasaus,https://blog.mozilla.org/thunderbird/2015/08/thunderbird-and-end-to-end-email-encryption-should-this-be-a-priority/#comment-939
129,A Graduate Course in Applied Cryptography [pdf],windhamdavid,https://crypto.stanford.edu/~dabo/cryptobook/draft_0_2.pdf
29,Revisiting Network I/O APIs: The netmap Framework (2012),yankcrime,http://queue.acm.org/detail.cfm?id=2103536
13,YouTube Gaming is LIVE,uptown,https://gaming.youtube.com/
40,The MUD Connector,mindcrime,http://www.mudconnect.com/
111,Vulcan-74 – A 6502 Retro MegaProject,cmrdporcupine,http://forum.6502.org/viewtopic.php?f=4&t=3329
136,What Does the OS X Activity Monitor’s “Energy Impact” Actually Measure?,nnethercote,https://blog.mozilla.org/nnethercote/2015/08/26/what-does-the-os-x-activity-monitors-energy-impact-actually-measure/
11,Software packages of interest to number theory,mindcrime,http://homepages.warwick.ac.uk/~masgaj/packages.html
8,Facebook Salaries,tomkwok,http://www.glassdoor.com/Salary/Facebook-Salaries-E40772.htm
8,Show HN: Run Go code directly from Python,FiloSottile,https://blog.filippo.io/building-python-modules-with-go-1-5/
23,EU's new VAT rules forcing thousands out of business,jacquesm,https://euobserver.com/opinion/129961
46,Free books to get started with Artificial Intelligence,gobinath-mani,http://bigdata-madesimple.com/20-free-books-to-get-started-with-artificial-intelligence/
224,Show HN: Ear training using midi.js,dncrane,http://tonedear.com/
10,See the Ratio of Single Men to Women Where You Live,sgrove,http://labs.time.com/story/see-the-ratio-of-single-men-to-women-where-you-live/
8,Ask HN: Whether to join in Microsoft or continue in growing startup?,nitinreddy88,
104,What Killed Smalltalk?,Garbage,http://pointersgonewild.com/2015/08/20/what-killed-smalltalk/
156,Lessons Learned from Reading Post Mortems,ingve,http://danluu.com/postmortem-lessons/
15,Ray Kurzweil – How the world will change,dluan,http://genius.com/Ray-kurzweil-how-the-world-will-change-annotated
7,Learn Scala in one video,snake117,https://www.youtube.com/watch?v=DzFt0YkZo8M
77,Ask HN: Which recruiters do you like?,ryanmickle,
201,Chebyshev Approximation,alexcasalboni,http://www.embeddedrelated.com/showarticle/152.php
199,Court: Feds Can't Just Grab Someone's Laptop at the Border,headShrinker,https://www.techdirt.com/articles/20150818/16495632000/doj-dismisses-case-after-court-explains-that-feds-cant-just-grab-someones-laptop-border.shtml
5,Show HN: Write Python modules in Go with 1.5 new buildmode,FiloSottile,https://blog.filippo.io/building-python-modules-with-go-1-5/?showhn
101,Abandoning the Work I Hated,aspanda,http://opinionator.blogs.nytimes.com/2015/08/20/abandoning-the-work-i-hated/
26,Show HN: Caman – A self-signing certificate authority manager,radiac,https://github.com/radiac/caman
46,How and Why We Designed Lucida,Tomte,http://bigelowandholmes.typepad.com/bigelow-holmes/2014/10/how-and-why-we-designed-lucida.html
11,Aphantasia: A Life Without Mental Images,DanBC,http://www.bbc.co.uk/news/health-34039054
1,Kamcord is looking for iOS engineers who want to democratize mobile gaming,vecter,https://jobs.lever.co/kamcord/8480c014-d88c-4d2a-8286-2b99c9923905?lever-source=hackernews
31,From Chaos to Control – Netflix's Resiliency Tests,Chris911,http://techblog.netflix.com/2015/08/from-chaos-to-control-testing.html
55,A Photographer Inside the Wildfires,arnie001,http://news.nationalgeographic.com/2015/08/150820-fighting-forest-fires-first-person/
8,Ask HN: What role do you identify as in your occupation?,jamesknelson,
9,Angry Birds maker Rovio plans to cut up to 260 staff,yitchelle,http://www.theguardian.com/technology/2015/aug/26/angry-birds-rovio-lay-off-260-staff
175,Literary Magazines for Socialists Funded by the CIA Ranked,samclemens,http://www.theawl.com/2015/08/literary-magazines-for-socialists-funded-by-the-cia-ranked
101,Facebook ‘Spam King’ Guilty for Sending 27M Messages,denzil_correa,http://www.bloomberg.com/news/articles/2015-08-25/facebook-spam-king-guilty-over-27-million-messages-u-s-says
75,Tesla owner drives 452 miles on single charge,SQL2219,http://techcrunch.com/2015/08/25/programmer-drives-his-tesla-model-s-a-record-breaking-452-8-miles-on-a-single-charge/?ncid=rss&cps=gravity_1730_-7755888158177957146
56,Stop using React for everything,zackargyle,https://medium.com/p/c8297ac1a644
207,Will Your Hardware Startup Make Money?,tigrella,https://medium.com/@BoltVC/will-your-hardware-startup-make-money-677a8e6c665b
19,Ask HN: If you had 15-20k to take a 2-4 week trip solo what would you do?,throwaway9er,
16,Ask HN: What would you like to see in the Golang course?,atrust,
20,A Venture Capital History Perspective from Jack Tankersley,t23,http://feld.com/archives/2015/08/venture-capital-history-perspective-jack-tankersley.html
10,Pseudo-Meritocracies,fab1an,http://medium.com/@fabianstelzer/on-pseudo-meritocracies-1a00d4b4da2e
10,Startup Wants Better IoT Radios,jakobdabo,http://www.eetimes.com/document.asp?doc_id=1327510&
31,Things mimicking other things,puremachinery,http://csvoss.mit.edu/thingsmimickingotherthings/
66,Scaling Analytics at Amplitude,blader,https://amplitude.com/blog/2015/08/25/scaling-analytics-at-amplitude/
55,The Case for Teaching Ignorance,trevordixon,http://www.nytimes.com/2015/08/24/opinion/the-case-for-teaching-ignorance.html
33,Show HN: Deckchair – Holiday Management for Small Teams,squiggy22,https://www.getdeckchair.com
199,Angular 1 and Angular 2 integration: the path to seamless upgrade,hswolff,http://angularjs.blogspot.com/2015/08/angular-1-and-angular-2-coexistence.html
116,Silicon Brain: 100000 ARM cores [video],DiabloD3,https://www.youtube.com/watch?v=2e06C-yUwlc
14,What Happens to OO When Processors Are Free?,mpweiher,http://blog.metaobject.com/2015/08/what-happens-to-oo-when-processors-are.html
10,Quantifying Controversy in Social Media,bootload,http://arxiv.org/abs/1507.05224
20,Let Vim Do the Typing,tambourine_man,https://www.youtube.com/watch?v=3TX3kV3TICU
4,Ask HN: How does the Activity Monitor in OS X calculate memory usage?,x0054,
9,Best programs to protect kids from porn /monitor on internet?,CamatHN,
50,Announcing the Computation Graph Toolkit,phreeza,http://joschu.github.io/index.html#Announcing CGT
294,Haskell for Mac,grayprog,http://haskellformac.com
328,It Is Done,kryptiskt,http://ascii.textfiles.com/archives/4728
19,E-CAT Patent Granted by USPTO,jonbaer,http://ecat.com/news/e-cat-patent-granted-by-uspto
120,Debian GNU/Hurd Status Update [pdf],Tsiolkovsky,http://people.debian.org/~sthibault/hurd-i386/2015-08-17-debconf.pdf
29,Uber Open Source,adrianbordinc,http://uber.github.io/
9,ATCOM: GPU-Accelerated Real-Time Enhancement of Long-Range Imagery,bsprings,http://devblogs.nvidia.com/parallelforall/atcom-real-time-enhancement-long-range-imagery/
1,Blockspring Hiring Lead Designer: Make APIs Useful for Everyone,hackerews,https://jobs.lever.co/blockspring/6065dd68-93dc-4341-b7a6-5571350a4bdc
68,Mobile TCP optimization – lessons learned in production,luu,https://www.snellman.net/blog/archive/2015-08-25-tcp-optimization-in-mobile-networks/
8,How to run Firefox in a Linux container,hendry,http://dabase.com/e/12009/
10,Snowden of the Sea: Researchers Name New Crayfish After NSA Leaker,koops,http://www.newsweek.com/snowden-sea-researchers-name-new-crayfish-after-nsa-leaker-365782
5,ECL Quarterly Volume II,jackdaniel,https://common-lisp.net/project/ecl/quarterly/volume2.html
79,Fun with time travel: retroactive data structures in Python,puremachinery,https://github.com/csvoss/retroactive
129,Traceroute,evandrix,http://csvoss.scripts.mit.edu/traceroute
3,Stop Checking on Your Netflix Stock,gedrap,http://www.bloombergview.com/articles/2015-08-25/stop-checking-on-your-netflix-stock-every-minute
20,Ask HN: How to plan your career for an Architect role?,antoaravinth,
131,As Coursera Evolves Colleges Stay On and Investors Buy In,jyosim4,http://chronicle.com/blogs/wiredcampus/as-coursera-evolves-colleges-stay-on-and-investors-buy-in/57267
22,Expresso? The x spelling has considerable historical precedent (2014),edward,http://www.slate.com/blogs/lexicon_valley/2014/08/18/espresso_or_expresso_the_x_spelling_actually_has_considerable_historical.html
7,Visualize $15 trillion of world trade with one dot for every $100M,romsson,http://globe.cid.harvard.edu/
8,Whenever.js: A JavaScript reinterpretation of the Whenever esolang,Argentum01,https://github.com/sarahgp/whenever.js
8,With $100M in Funding Carbon3D Aiming to Make 3D Manufacturing a Reality,fictivmade,http://techcrunch.com/2015/08/20/with-100m-in-funding-carbon3d-will-make-3d-manufacturing-a-reality/#.dynucu:M2no
76,Shipwrecks Under Istanbul,fitzwatermellow,http://www.newyorker.com/magazine/2015/08/31/the-big-dig
14,Prestel Hacking (1988),walshemj,http://securitydigest.org/rutgers/mirror/pyrite.rutgers.edu/prestel.hacking
82,What It Looks Like to Use the Internet for the First Time,danso,http://motherboard.vice.com/read/what-it-looks-like-to-use-internet-for-the-first-time
10,Prostitution in the Byzantine Holy Land (2010),davisclark,https://mybyzantine.wordpress.com/2010/08/17/brothels-baths-and-babes-prostitution-in-the-byzantine-holy-land/
26,Competition in Cambrian seas helped cause an explosion in diversity (2014),dnetesn,http://nautil.us/issue/17/big-bangs/the-greatest-animal-war
6,Tim Berners-Lee on StackOverflow,gamesbrainiac,http://stackoverflow.com/users/1162584/timbl
47,A trip through the Graphics Pipeline (2011),sagargv,https://fgiesen.wordpress.com/2011/07/09/a-trip-through-the-graphics-pipeline-2011-index/
1,Lead Product Marketing  Rescale (YC W12),gpoort,
14,Fuzz Testing Zstandard,ot,http://fastcompression.blogspot.com/2015/08/fuzz-testing-zstandard.html
8,OBFS: A File System for Object-Based Storage Devices (2004) [pdf],Sanddancer,http://www.ssrc.ucsc.edu/Papers/wang-mss04b.pdf
56,We only know about a small fraction of the matter in the Universe,kostyk,http://www.bbc.com/earth/story/20150824-what-is-the-universe-made-of
34,Show HN: Import CSV and JSON into PostgreSQL the Easy Way,morgenkaffee,https://github.com/lukasmartinelli/pgfutter
10,Burning Man One Percent Silicon Valley Tech,adamrights,https://www.jacobinmag.com/2015/08/burning-man-one-percent-silicon-valley-tech/
4,Free subscription to CVs of the best specialists for remote work,superchink,http://talentboard.me/
183,What’s New in Bootstrap 4,scotchio,https://scotch.io/bar-talk/whats-new-in-bootstrap-4
5,Hotel Okura meets the wrecking ball,inatreecrown,http://www.bloomberg.com/news/articles/2015-08-25/last-call-tokyo-s-iconic-okura-hotel-meets-the-wrecking-ball
8,When your TV can spy on you,bootload,http://www.latimes.com/business/la-fi-lazarus-20150825-column.html
63,Benchmarks for Blaze A high-performance C++ math library,wall_words,https://code.google.com/p/blaze-lib/wiki/Benchmarks
4,LambdaWerk: Lisp company in Berlin,muratk,http://lambdawerk.com/
116,How Sick Is the Stock Market?,gedrap,http://www.bloombergview.com/articles/2015-08-24/how-serious-is-the-stock-market-s-decline-
44,A deep exploration of the CPython code-base with Philip Guo,mikeckennedy,http://talkpython.fm/episodes/show/22/cpython-internals-and-learning-python-with-pythontutor.com
16,Large Scale Decision Forests: Lessons Learned,atpaino,http://blog.siftscience.com/blog/2015/large-scale-decision-forests-lessons-learned
14,Offensive and Defensive Android Reverse Engineering [pdf],adamnemecek,https://github.com/rednaga/training/blob/master/DEFCON23/O%26D%20-%20Android%20Reverse%20Engineering.pdf
32,DeepMind: inside Google's super-brain,edward,http://www.wired.co.uk/magazine/archive/2015/07/features/deepmind/viewall
134,Towards Neural Network-based Reasoning,lucidrains,http://arxiv.org/abs/1508.05508
119,50 years ago today the word “hypertext” was introduced,epsylon,https://gigaom.com/2015/08/24/hypertext-50/
4,As legacy media cuts back on FOIA digital-only news outlets step in,aaronbrethorst,http://www.cjr.org/first_person/foia_requests_down_legacy.php
61,Dawn Sends Sharper Scenes from Ceres,taylorwc,http://www.nasa.gov/jpl/dawn-sends-sharper-scenes-from-ceres/
116,Writing a Linux Kernel Module — Part 3: Buttons and LEDs,OrangeTux,http://derekmolloy.ie/kernel-gpio-programming-buttons-and-leds/
4,The Debian ghetto,gizi,https://bitcoinrevolt.wordpress.com/2015/08/26/the-debian-ghetto
19,How the modern world came to recognize autistic people ,Sanddancer,http://www.wired.com/2015/08/neurotribes-with-steve-silberman/
1,Citus Data Is Hiring Developers to Scale Out PostgreSQL,umur,https://www.citusdata.com/about-us/jobs
37,Operational Challenges with Unikernels,transpute,http://www.morethanseven.net/2015/08/21/operating-unikernel-challenges/
8,Building Python modules with Go 1.5,jgrahamc,https://blog.filippo.io/building-python-modules-with-go-1-5/?hn
16,Firefox OS: New Design,dumindunuwan,https://www.youtube.com/watch?v=JIiIjjIsuzc
400,John Carmack's son's game in Racket,tesmar2,https://groups.google.com/forum/?hl=en#!topic/racket-users/yjRuIxypUQc
13,Life of a Ticket,akerl_,http://nerds.airbnb.com/life-of-a-ticket/
10,Show HN: DocLayer – A modern document editor,doclayer,https://standaert.net/doclayer
148,Writ – Opinionated classless styles for semantic HTML,citizenk,https://cmcenroe.me/writ/
23,ClearSky Data Exits Stealth with Novel Approach to Cloud Storage,colanderman,http://techcrunch.com/2015/08/24/clearsky-data-exits-stealth-to-deliver-data-lifecycle-as-a-service/
26,PipelineDB's Engineering Workflow,grammr,http://www.pipelinedb.com/blog/pipelinedb-s-engineering-workflow
9,Is backbonejs dead?,scapbi,http://www.quora.com/Is-backbone-js-dead?share=1
94,Learn X in Y minutes – Tcl,notduncansmith,http://learnxinyminutes.com/docs/tcl/
10,Determining the Age of Fingerprints,brisance,http://www.nist.gov/mml/mmsd/20150824fingerprints.cfm
40,Crash-tolerant data storage,Tomte,https://news.mit.edu/2015/crash-tolerant-data-storage-0824
16,Light Field Photography with a Hand-Held Plenoptic Camera (2005),fgeorgy,http://graphics.stanford.edu/papers/lfcamera/
9,Is There Awareness Behind Vegetative States?,rl3,http://nautil.us/blog/is-there-awareness-behind-vegetative-states
13,Jury nullification is not a crime Denver,taivare,http://www.denverpost.com/editorials/ci_28662070/jury-nullification-is-not-crime-denver/mobile-web
1,Teespring (YC W13) Is Hiring a Director of Engineering,estitesc,
8,China's Brewing Crisis Is a Thousand Times Greece's,ytNumbers,http://www.forbes.com/sites/panosmourdoukoutas/2015/08/25/chinas-brewing-crisis-is-a-thousand-times-greeces/
18,The Hurricane Station,gerjomarty,http://www.bbc.co.uk/news/resources/idt-20ed5228-1f23-4906-9057-ffdd9d5272f2
15,Ask HN: Do you take anti-depressants?,septerr,
363,Windows 10 users are being banned from torrent sites,ourmandave,http://www.irishexaminer.com/technow/tech/windows-10-users-are-being-banned-from-torrent-sites-349932.html
5,Why the Public Stock Markets Will Affect Your Funding Round,t23,http://www.bothsidesofthetable.com/2015/08/25/the-morning-after/
7,Electronic Sniffing Dog Brought Down Fogle,ZoeZoeBee,http://www.nbcnews.com/news/us-news/porn-sniffing-dog-helped-bring-down-subway-star-jared-fogle-n415826
125,Amazon's 401(k) Plan Is Pretty Brutal Too,m_haggar,http://www.bloomberg.com/news/articles/2015-08-24/amazon-s-401-k-plan-is-pretty-brutal-too-idpw28hz
38,Researchers show that an iron bar is capable of decision-making,sfrechtling,http://phys.org/news/2015-08-iron-bar-capable-decision-making.html
7,Why Billion-Dollar Valuations Don’t Matter,gaxelrod23,http://techcrunch.com/2015/08/25/why-billion-dollar-valuations-dont-matter/
5,How to Track NBA Player Movements in Python,savvas_tj,http://savvastjortjoglou.com/nba-play-by-play-movements.html
360,Updates Make Windows 7 and 8 Spy on You Like Windows 10,Sami_Lehtinen,http://www.hakspek.com/security/updates-make-windows-7-and-8-spy-on-you-like-windows-10/
10,How Linux was born as told by Linus Torvalds himself,shawndumas,http://arstechnica.com/information-technology/2015/08/how-linux-was-born-as-told-by-linus-torvalds-himself/
36,Hummingbirds Are Fierce,fezz,http://www.slate.com/blogs/wild_things/2015/08/19/hummingbird_aggression_fierce_deadly_fights_for_territory_nectar_feeders.html
66,FBI Files on Ray Bradbury (1959),edward,http://www.openculture.com/2015/08/who-was-afraid-of-ray-bradbury-science-fiction-the-fbi-it-turns-out-1959.html
6,Psychological effects of Internet use,g_delgado14,https://en.wikipedia.org/wiki/Psychological_effects_of_Internet_use
7,U.S. scientists successfully turn human cancer cells back to normal,jader201,http://news.nationalpost.com/news/world/u-s-scientists-successfully-turn-human-cancer-cells-back-to-normal-in-process-theyre-hopeful-can-one-day-switch-off-disease
11,Verified Compilers for a Multi-Language World [pdf],arto,http://www.ccs.neu.edu/home/amal/papers/verifcomp.pdf
7,Thinking Fast and Slow: Efforts to Reduce Youthful Crime in Chicago,MaysonL,http://www.nber.org/digest/jul15/w21178.html
5,Uber will partner with University of Arizona for self-driving car research,cryptoz,http://www.theverge.com/2015/8/25/9207229/uber-university-of-arizona-tucson-autonomous-self-driving-cars
7,How It’s Made Series: Beats by Dre,snake117,https://medium.com/bolt-blog/how-it-s-made-series-beats-by-dre-154aae384b36
11,Effective Feature Flags,luu,http://yellerapp.com/posts/2015-07-20-feature-flag-tips.html
5,75000 Popcorn Time Users in Crosshairs of Anti-Piracy Group,mmt,https://torrentfreak.com/75000-popcorn-time-users-in-crosshairs-of-anti-piracy-group-150825/
84,My Great Grandmother’s Industrially Processed Food,heydenberk,http://www.rachellaudan.com/2015/07/great-grandmothers-industrially-processed-food.html?repost=hn_encouraged
8,Ask HN: Why are people afraid to answer a Stack Overflow question?,hgezim,
6,Redditor SexyCyborg designs cool 3D printed shoes,confiscate,http://www.3ders.org/articles/20150824-redditor-sexycyborg-designs-3d-printed-shoes-filled-with-penetration-test-kit.html
4,Lexus Hoverboard: The Science,kitcar,https://www.youtube.com/watch?v=k_j1dKWkRLU
3,Why is Safari 9.0 beta on iPhone 6 Plus simulator pretending its Android?,irae,http://imgur.com/a/dhDco
12,Ask HN: What was it like to be a developer after the crash of 2008-2009?,sudo_bang_bang,
54,Following WWII a plan to use a Nazi rocket to put a Briton in space,williamhpark,http://www.bbc.com/future/story/20150824-how-a-nazi-rocket-could-have-put-a-briton-in-space
5,Harvard MIT researchers find cheating in online courses,Anechoic,http://www.bostonglobe.com/metro/2015/08/25/harvard-mit-researchers-highlight-line-class-cheating/ZmGMZC76hazZoply4lYrNL/story.html
7,Crowd-sourced songwriting. A melody is being generated note by note from votes,applause,http://crowdsound.net/
168,Sandstorm App Market,petethomas,https://github.com/sandstorm-io/sandstorm-app-market
6,How to actually ship software that actually works,blakegardner,https://medium.com/@thomasfuchs/how-to-actually-ship-software-that-actually-works-cf269f6578f7
59,Why Some Dead OSes Still Matter (2007) [pdf],vezzy-fnord,https://www.usenix.org/legacy/publications/login/2007-10/openpdfs/mirtchovski.pdf
10,Thank You for Using Adblock,bbcbasic,http://i.share.pho.to/6c7078ab_o.png
197,GitHub had connectivity problems,webmonkeyuk,https://status.github.com
83,Parents' Math Anxiety Is Contagious to Their Kids,euske,http://well.blogs.nytimes.com/2015/08/24/square-root-of-kids-math-anxiety-their-parents-help/
72,Samsung Exynos-5422 Octa-Core Servers,lesingerouge,https://www.hetzner.de/gb/hosting/produktmatrix/rootserver-produktmatrix-ax
1,PlanGrid (YC W12) needs back-end Android PMs – come build with us,tyoung,http://www.plangrid.com/en/jobs
107,Convert any Python file into a single line of code,odeke-em,https://github.com/csvoss/oneliner
4,Stephen Hawking says there's a way out of a black hole,snehesht,http://www.cnet.com/news/physicist-hawking-says-theres-a-way-out-of-a-black-hole/
5,The best and worst of San Francisco’s rent control,kqr2,http://blog.sfgate.com/ontheblock/2015/08/25/the-best-and-worst-of-san-franciscos-rent-control/
15,The darknet's biggest drug market to cease operations due to Tor vulnerability,jamesmoss,http://pastebin.com/7AVDGVpV
5,Ionic 2,javierprovecho,https://www.npmjs.com/package/ionic2
7,Genetic transmission of reading ability,luxoria,http://www.sciencedirect.com/science/article/pii/S0093934X15001662
4,Reconstructing Visual Experiences from Brain Activity Evoked by Movies (2011),nopinsight,http://gallantlab.org/publications/nishimoto-et-al-2011.html
249,Fix Windows 10,xDola,https://fix10.isleaked.com/
9,Remember the Ice Bucket Challenge? Here’s What Happened to the Money,confiscate,http://time.com/money/4000583/ice-bucket-challenge-money-donations/
10,The Product Manager vs. Project Manager,schneidmaster,http://blog.aha.io/index.php/the-product-manager-vs-project-manager/
130,Creating a Pluto flyby using unaligned New Horizons images,misiti3780,http://matthewearl.github.io/2015/08/11/pluto-flyby/?take=two
1539,“Two days ago the police came to me and wanted me to stop working on this”,realfuncode,https://github.com/shadowsocks/shadowsocks-iOS/issues/124#issuecomment-133630294
24,Facebook files patent for credit worthiness based on your friend group,chollida1,http://www.psmag.com/nature-and-technology/mo-friends-mo-problems-might-have-to-defriend-joey-with-the-jet-ski-bankruptcy
187,Learn the Command Line,margotcodes,https://www.codecademy.com/en/courses/learn-the-command-line?utm_campaign=lcl_release&utm_source=hackernews
4,Uber Is Laying the Groundwork for Perpetual Rides in San Francisco,prawn,http://www.buzzfeed.com/johanabhuiyan/uber-is-laying-the-groundwork-for-perpetual-rides-in-san-fra#.fo6R2olpK
4,The Mystery of John Titor: Hoax or Time Traveler?,smacktoward,http://www.psmag.com/nature-and-technology/the-mystery-of-john-titor-hoax-or-time-traveler-57001
10,Apple Watch Sales Sink,j_hanbanan,http://www.technewsworld.com/story/82250.html
5,Show HN: The Globe $15 Trillion of exports visualized with webGL,Polyframe,http://globe.cid.harvard.edu
13,Police Have a Much Bigger Domestic-Abuse Problem Than the NFL Does,willow9886,http://www.theatlantic.com/national/archive/2014/09/police-officers-who-hit-their-wives-or-girlfriends/380329/?single_page=true
1,FundersClub (YC S12) Is Hiring a Venture Analyst,borisms,http://careers.fundersclub.com/
11,90% of WeWork Cleaners Jobless After Contract Termination,nikolasavic,http://gothamist.com/2015/08/25/wework_janitors_union.php
73,Vim on a Mechanical Typewriter,luu,http://qqrs.github.io/blog/2013/05/03/vim-on-a-mechanical-typewriter/
8,Linus Torvalds: Security is never going to be perfect,dsr12,http://www.itworld.com/article/2973995/linux/linus-torvalds-security-is-never-going-to-be-perfect.html
148,The most profitable source of income for banks? Overdraft fees,mrmirz,https://www.loannow.com/bank-overdraft-policy-reform-overdue/
9,Court Says the FTC Can Slap Companies for Getting Hacked,hackuser,http://www.wired.com/2015/08/court-says-ftc-can-slap-companies-getting-hacked/
8,How corporate data brokers sell your life and why you should be concerned,MAshadowlocked,https://thestack.com/security/2015/08/24/how-corporate-data-brokers-sell-your-life-and-why-you-should-be-concerned/
5,Author Joe Hill experiments with free ebook bundling via Shelfie app,kamilszybalski,http://joehillsthrills.tumblr.com/
13,The FDA Says That Hampton Creek Can't Call Its Product “Mayonnaise”,chapulin,http://www.bloomberg.com/news/articles/2015-08-25/mayo-isn-t-mayo-without-eggs-fda-warns-startup-backed-by-gates
13,Technical Interview Cheat Sheet,coob,https://gist.github.com/TSiege/cbb0507082bb18ff7e4b
219,July 2015 was warmest month ever recorded,yawz,http://www.ncdc.noaa.gov/sotc/summary-info/global/201507
164,‘Pharmacy of the developing world’ under attack from the US EU Japan,shekhar101,http://handsoff.msf.org/generics-under-attack
4,Mysterious blue clouds may portend disaster,snake117,http://www.usatoday.com/story/news/2015/08/24/mysterious-blue-clouds-may-portend-disaster/32258399/
11,CloudABI an ABI built around capability-based security,Sanddancer,https://github.com/NuxiNL/cloudlibc
5,+1UP your kanban with Trello IFTTT and more,shireboy,http://leanpub.com/trellodojo
9,An honest account of what it's like to drop out,jjeremycai,https://medium.com/simple-thoughts/an-honest-year-as-a-dropout-73ce63f78240
58,Trading in Stocks ETFs Was Halted More Than 1200 Times Early Monday,brbcoding,http://www.wsj.com/articles/trading-in-stocks-etfs-paused-more-than-1-200-times-early-monday-1440438173
