SCORE,TITLE,BY,URL
68,Show HN: Drive – a tiny program to pull or push Google Drive files,odeke-em,https://github.com/odeke-em/drive
3,Found a potentionally good partner but cant come up with good idea,a_lifters_life,
4,IBM finds another Android phone bug,jojoicee,http://www.infoworld.com/article/2968403/mobile-security/ibm-finds-another-android-phone-bug.html
89,Kali Linux 2.0 Released,kriro,https://www.kali.org/releases/kali-linux-20-released/
11,The Google Search That Made the CIA Spy on the US Senate,ikeboy,https://news.vice.com/article/the-google-search-that-made-the-cia-spy-on-the-us-senate
69,Lenovo modifying Windows OS files from BIOS to install Lenovo software,JoshTriplett,http://arstechnica.com/civis/viewtopic.php?p=29497693&sid=ddf3e32512932172454de515091db014#p29497693
6,ProtonMail goes Open Source with version 2.0,mostafah,https://blog.protonmail.ch/protonmail-secure-email-open-source/
10,Disable green merge button for a specific repository,infodroid,https://github.com/isaacs/github/issues/5
127,Building the Next New York Times Recommendation Engine,jprob,http://open.blogs.nytimes.com//2015/08/11/building-the-next-new-york-times-recommendation-engine/
5,Ask HN: Linear vs. Nonlinear Thinkers in Programming,hanniabu,
476,The Hamburger Menu Doesn't Work,networked,http://deep.design/the-hamburger-menu/
1,Campus Job (W15) is looking for a senior engineer to be a leader on our team,jdotjdot,https://www.campusjob.com/joinus/#Lead-Full-Stack-Engineer
21,Sushi: a tiny simple hypervisor-based monitoring tool,adulau,https://github.com/tandasat/Sushi
8,New ATM “Shimmer” Fits Invisibly Inside the Card Slot,prostoalex,http://techcrunch.com/2015/08/12/new-atm-shimmer-fits-invisibly-inside-the-card-slot/?ncid=rss&utm_source=feedburner&utm_medium=feed&utm_campaign=Feed%3A+Techcrunch+%28TechCrunch%29
30,Convox (YC S15) Wants to Make AWS as Easy as Heroku,ddollar,http://venturebeat.com/2015/08/12/y-combinator-backed-convox-wants-to-make-aws-as-easy-as-heroku/
240,Ubuntu One file syncing code Open Sourced,progval,https://insights.ubuntu.com/2015/08/10/ubuntu-one-file-syncing-code-open-sourced
6,Lenovo laying off 3200,shawndumas,http://www.theverge.com/2015/8/12/9146321/lenovo-layoffs-q1-2015-earnings
18,Migrating stateful containers using native Docker 1.8 Flocker plugin and Compose,ferrantim,https://clusterhq.com/2015/08/04/docker-volume-plugins/
9,Quantum Computer Science (2007),luu,http://www.lassp.cornell.edu/mermin/qcomp/CS483.html
42,Rark: A Racket language inspired by Arc,zeeshanm,https://github.com/kogir/rark
7,Announcing General Availability of Google Cloud Dataflow and PubSub,vgt,http://googlecloudplatform.blogspot.com/2015/08/Announcing-General-Availability-of-Google-Cloud-Dataflow-and-Cloud-Pub-Sub.html
501,Show HN: Big List of Naughty Strings for testing user-input data,minimaxir,https://github.com/minimaxir/big-list-of-naughty-strings
6,Who Saved the Most Lives in History?,zbravo,http://www.scienceheroes.com/index.php?option=com_content&view=article&id=258&Itemid=27
3,Felicia Day's “You're Never Weird on the Internet (Almost)”,a_w,http://boingboing.net/2015/08/11/felicia-days-youre-never.html
7,A Blank 4-Minute Video Receives Over 100000 Views on YouTube,WritelyDesigned,https://writelydesigned.com/news/a-blank-4-minute-video-receives-over-100000-views-on-youtube/
255,The ethics of modern web ad-blocking,kyleslattery,http://www.marco.org/2015/08/11/ad-blocking-ethics
11,Baidu explains how it’s mastering Mandarin with deep learning,sherjilozair,https://medium.com/s-c-a-l-e/how-baidu-mastered-mandarin-with-deep-learning-and-lots-of-data-1d94032564a5
7,Memory mappings limit in Linux kernel,mkevac,http://blog.kevac.org/2015/08/memory-mappings-limit.html
227,The pressure to achieve academically is a crime against learning,tokenadult,http://www.theatlantic.com/education/archive/2015/08/when-success-leads-to-failure/400925/?single_page=true
91,For Sale in Spain: Entire Villages Cheap,juanplusjuan,http://www.csmonitor.com/World/Europe/2015/0809/For-sale-in-Spanish-paradise-entire-villages.-Cheap
7,Student Wrongfully Expelled for Rape Triumphs in Court,GeorgeOrr,http://reason.com/blog/2015/08/12/student-wrongfully-expelled-for-rape-tri
321,Using a single AWS account is a serious risk,hellomichibye,https://cloudonaut.io/your-single-aws-account-is-a-serious-risk/
4,We Should Abandon the Concept of “Alternative Medicine”,tokenadult,https://www.sciencebasedmedicine.org/we-should-abandon-the-concept-of-alternative-medicine/
132,SICP in Clojure,MattF,http://www.afronski.pl/sicp-in-clojure/2015/08/07/sicp-in-clojure-chapter-2.html
10,A Graphics Breakthrough Makes Perfect CGI Skin,jonbaer,http://gizmodo.com/a-graphics-breakthrough-makes-perfect-cgi-skin-1723675920
1,Bluesmart (YC W15) Is Hiring an Android Developer (Hong Kong),dfuego,http://hk.jobsdb.com/hk/en/job/android-mobile-developer-100003003892002
507,Presumption of stupidity,garry,http://www.aaronkharris.com/presumption-of-stupitidy
3,What Every Hardware Startup Needs to Know about Accelerator Programs,fictivmade,https://www.fictiv.com/resources/spotlight/hardware-lessons-from-moxxly
6,List of awesome university courses for learning Computer Science,lobo_tuerto,https://github.com/prakhar1989/awesome-courses
5,Server Admin for Programmers,lobo_tuerto,https://serversforhackers.com/
4,Vim and I – A Love Story (2014),Stevo11,http://schier.co/blog/2014/02/07/vim-and-i-a-love-story.html
6,Pro-CISA Comcast trying to shutdown service for anti-CISA fax campaign,rubbingalcohol,http://tumblr.fightforthefuture.org/post/126517363443/when-unlimited-is-not-unlimited-comcast-cisas
13,Oracle explain exactly why you should only use Open Source software,mindcrime,http://fogbeam.blogspot.com/2015/08/oracle-explain-exactly-why-you-should.html
602,“Stop reverse engineering our code”,hughstephens,https://blogs.oracle.com/maryanndavidson/entry/no_you_really_can_t
32,Zirtual: What Happened and What’s Next,brianmwang,https://medium.com/@marenkate/zirtual-what-happened-and-what-s-next-f9bd493ecc49
5,Don't Hate the Phone Call Hate the Phone,hackuser,http://www.theatlantic.com/technology/archive/2015/08/why-people-hate-making-phone-calls/401114/?single_page=true
11,Show HN: Free cloud server for life,koonk,https://www.cloudrino.net
125,High precision air bearing CNC lathe and grinder [video],djoldman,https://www.youtube.com/watch?v=sFrVdoOhu1Q
11,Firefox sticks it to Microsoft redirects Bing searches in Cortana to Yahoo,ntakasaki,http://www.pcworld.com/article/2969381/browsers/firefox-sticks-it-to-microsoft-redirects-cortana-searches-in-windows-10.html
6,How to hire recruiters,snowmaker,http://blog.jaredfriedman.com/2015/08/11/how-to-hire-recruiters
21,Complete failure of Oracle security response (2005),soupboy,http://seclists.org/bugtraq/2005/Oct/56
6,Tinder Lashes Out on Twitter After 'Vanity Fair' Article,taytus,http://fortune.com/2015/08/12/tinder-twitter/
68,HP Asks That Redacted Documents Be Sealed Judge Responds with Redacted Refusal,nkurz,https://www.techdirt.com/articles/20150807/11181931885/hp-asks-heavily-redacted-documents-to-be-sealed-judge-responds-with-heavily-redacted-refusal.shtml
4,20 Things I've Learned from Larry Page,minic,https://www.linkedin.com/pulse/20-things-ive-learned-from-larry-page-james-altucher
8,The neural networks behind Google Voice transcription,_jomo,http://googleresearch.blogspot.com/2015/08/the-neural-networks-behind-google-voice.html
8,Do You Trust Larry Page?,ishansharma,https://stratechery.com/2015/do-you-trust-larry-page/
177,Miyazaki's Beautiful Anti-War Dreams,shadowmoses,https://medium.com/dan-sanchez/miyazaki-s-beautiful-antiwar-dreams-44951be1be11
22,The Coddling of the American Mind,z_,http://www.theatlantic.com/magazine/archive/2015/09/the-coddling-of-the-american-mind/399356/?single_page=true
111,PyJS: write your JavaScript-powered web applications entirely in Python,alexcasalboni,http://pyjs.org/
16,A Traffic Analysis of Windows 10,pearjuice,http://localghost.org/posts/a-traffic-analysis-of-windows-10
13,I built a Twitter bot that entered–and won–1000 online contests for me,jonbaer,http://qz.com/476914/i-built-a-twitter-bot-that-entered-and-won-1000-online-contests-for-me/
94,The technology behind preview photos,anand-s,https://code.facebook.com/posts/991252547593574/the-technology-behind-preview-photos/
4,Ask HN: Book of Programming Examples?,hanniabu,
16,Ask HN: Police in your country,daveth3cat,
163,Algorithmic Trading: The Play-at-Home Version,likeapub,http://www.wsj.com/articles/an-algo-and-a-dream-for-day-traders-1439160100?
6,Saturated fats in meat and dairy not as bad for health as previously thought,rl3,http://www.independent.co.uk/life-style/health-and-families/health-news/saturated-fats-in-meat-and-dairy-produce-not-as-bad-for-health-as-previously-thought-study-finds-10450663.html
265,Why Not Insider Trade on Every Company?,dsri,http://www.bloombergview.com/articles/2015-08-11/why-not-insider-trade-on-every-company-
3,So Pitted – Wingsuit Terrain Flying – Brendan Weinstein,brendanw,https://www.youtube.com/watch?v=YB5VVGmruaI
3,Chip Card ATM ‘Shimmer’ Found in Mexico,scott_karana,http://krebsonsecurity.com/2015/08/chip-card-atm-shimmer-found-in-mexico/
13,MapLatency.com – check latency to your website from any country,forcer,http://www.maplatency.com/
5,Android Experiments,jorgecastillo,https://www.androidexperiments.com/
23,Mapping London's great plague of 1665,trusche,http://www.theguardian.com/society/ng-interactive/2015/aug/12/london-great-plague-1665-bills-of-mortality
155,Thunderstrike 2: Mac firmware worm details,georgyo,https://trmm.net/Thunderstrike2_details
3,What Online Dating Was Like in the 1960s,jonwachob91,http://fivethirtyeight.com/features/what-online-dating-was-like-in-the-1960s/
4,Police search Uber offices in Hong Kong and arrest 5 drivers,notsony,http://www.cnbc.com/2015/08/12/police-search-uber-offices-in-hong-kong-and-arrest-5-drivers.html
19,Ask HN: Any HN stats analysis been done?,lifeisstillgood,
5,Show HN: Adventure Capitalists – Loud Music for Startup People,RobSpectre,https://adcap.biz/music/?utm_source=personal-outreach&utm_medium=hackernews&utm_campaign=rob
11,Show HN: Stand App – Make standing up a habit,reddavis,https://getstandapp.com
5,Under siege for-profit colleges cry foul over new federal rules,rottyguy,http://www.mcclatchydc.com/news/nation-world/national/article30646605.html
8,Massive explosion in Tianjin,dogecoinbase,http://www.rt.com/news/312292-china-tianjin-massive-blast/
9,Algorithms and Bias: Q. And A. With Cynthia Dwork,v4n4d1s,http://www.nytimes.com/2015/08/11/upshot/algorithms-and-bias-q-and-a-with-cynthia-dwork.html
5,Ask HN: What legal mumbo jumbo does my startups website need?,helly,
17,Web-Scale Training for Face Identification,fgeorgy,https://research.facebook.com/publications/787935884654205/web-scale-training-for-face-identification/
1,Flexport is hiring a senior front-end engineer,thedogeye,https://flexport.com/careers
5,Ask HN: Why are property managers slow at adopting software?,aml183,
4,Goldman Sachs: Secret Sauce vs Open Source,joshuapayne,http://blog.quantopian.com/secret-sauce-vs-open-source/
3,Uzbekistan Airways to weigh passengers before boarding,antimora,http://www.telegraph.co.uk/travel/travelnews/11799490/Uzbekistan-Airways-to-weigh-passengers-before-boarding.html
4,Fractal-plan – Animated operations with plane geometry,lerax,https://github.com/ryukinix/fractal-plan
3,Ask HN: What if you kept employee count low?,fooshint,
9,Firefox contacts URL on mouse-over,luso_brazilian,https://www.reddit.com/r/firefox/comments/3fiaan/firefox_contacts_url_on_mouseover_why/
286,Firefox 42 will not allow unsigned extensions,fernandotakai,https://wiki.mozilla.org/Addons/Extension_Signing
5,Ask HN: Microsoft launches competitor to my startup – should I pivot?,etewiah,
6,Show HN: Arbiter – an instant feedback es6/7 coding environment for classrooms,matthiasak,https://medium.com/@matthiasak/releasing-arbiter-v1-5467fc39d70e
96,The Covert World of People Trying to Edit Wikipedia for Pay,ohjeez,http://www.theatlantic.com/business/archive/2015/08/wikipedia-editors-for-pay/393926/?single_page=true
100,Gene Therapy Makes Near-Blind Patients See by Strengthening Neural Connections,forloop,http://www.dddmag.com/articles/2015/07/gene-therapy-makes-near-blind-patients-see-strengthening-neural-connections
164,When One App Rules Them All: The Case of WeChat and Mobile in China,rxin,https://a16z.com/2015/08/06/wechat-china-mobile-first/
4,Ask HN: Do you use Lua in Production?,josep2,
157,ExDOS is developed by Omar “almost 14 years old”,vmorgulis,http://exdos.eu.pn/
5,A startup just blew up and laid off its 400 employees via email with no warning,mhoad,http://www.businessinsider.com.au/zirtual-suddenly-laid-off-400-employees-via-email-2015-8
10,Oracle Offers New PULA Database License,DigitalWarlord,http://www.samchannel.com/oracle-offers-new-pula-database-license/
46,Dash Hacking: Bare-Metal STM32 Programming,ptorrone,https://learn.adafruit.com/dash-hacking-bare-metal-stm32-programming
14,Tiny dirty iffy good enough basic multi-threaded web crawler in Python,rangeva,http://blog.webhose.io/2015/08/12/tiny-basic-multi-threaded-web-crawler-in-python/
703,Newegg vs. Patent Trolls: When We Win You Win,nkurz,http://blog.newegg.com/newegg-vs-patent-trolls-when-we-win-you-win
102,Lenovo announces laptops using new mobile Xeon processors,ChuckMcM,http://arstechnica.com/information-technology/2015/08/lenovo-announces-powerhouse-laptops-powered-by-new-mobile-xeon-processors/
296,Convox – Launch a Private Cloud in Minutes,lox,https://convox.com/
43,Russian plutonium-fueled breeder reactor reaches first criticality (2014),jcfrei,http://bellona.org/news/nuclear-issues/nuclear-russia/2014-08-holy-grail-epic-fail-russia-readies-commission-first-plutonium-breeder-uninspiring-global-track-record
348,Change Your Name,franze,http://paulgraham.com/name.html
8,My First ebook on Python is complete - https://leanpub.com/intermediatepython,c4obi,
3,The Tech Productivity Mystery,o_nate,http://www.bloombergview.com/articles/2015-08-10/tech-as-a-productivity-engine-remains-a-mystery
4,We Stopped Publishing New Blog Posts for One Month. Here’s What Happened,LeonW,https://blog.bufferapp.com/blog-strategies
9,Show HN: A tool to personalize pages with geolocational data in pure HTML,giordanobd,https://targetingmonkey.com/
3,Not Even Close: The State of Computer Security,giles,https://vimeo.com/135347162
56,HTC Is Now Essentially Worthless (And Insecure),rhapsodyv,http://techcrunch.com/2015/08/10/htc-is-now-essentially-worthless-and-insecure/?ncid=rss
4,Ask HN: Adjustable height desk recommendations?,tgibson,
131,Ignition: V8 Interpreter,hittaruki,https://docs.google.com/document/d/11T2CRex9hXxoJwbYqVQ32yIPMh0uouUZLdyrtmMoL44/edit?pli=1#heading=h.6jz9dj3bnr8t
13,Gradle vs. Maven Feature Comparison,aechsten,http://gradle.org/maven_vs_gradle/
3,Sources: Zirtual founders hid financial mess from investors,gmisra,https://pando.com/2015/08/11/sources-zirtual-founders-hid-financial-mess-investors-theyve-found-buyer/
4,Why are software development task estimations regularly off by a factor of 2-3?,larrys,https://www.quora.com/Engineering-Management/Why-are-software-development-task-estimations-regularly-off-by-a-factor-of-2-3/answer/Michael-Wolfe?share=1
149,A faster way to compute edit distance does not exist,dnt404-1,http://www.bostonglobe.com/ideas/2015/08/10/computer-scientists-have-looked-for-solution-that-doesn-exist/tXO0qNRnbKrClfUPmavifK/story.html
5,How Putin got caught in his own trap: Global energy markets and Ukraine,jseliger,http://www.theatlantic.com/international/archive/2015/08/putin-russia-ukraine-energy/401003/?single_page=true
64,Why I'm Selling My Google Stock Grant,aveshcsingh,http://www.avesh.me/tech/2015/8/10/why-im-selling-my-google-stock
83,Compilers Are Databases [video],oelang,https://www.youtube.com/watch?v=48js0H6ooBY
74,Building a desktop application with Electron,bojzi,https://medium.com/@bojzi/building-a-desktop-application-with-electron-204203eeb658
6,Markhor (YC S15) Takes the Middleman Out of Designer Shoemaking,sandeepmzr,http://techcrunch.com/2015/08/11/markhor-takes-the-middleman-out-of-designer-shoemaking/
34,What is Concrete?,mikecarlton,http://gizmodo.com/what-is-concrete-1721627320
12,Please security test our code!,waffle_ss,http://www.databasesoup.com/2015/08/please-security-test-our-code.html
20,Ellen Pao Appealing Order to Pay Kleiner Perkins Trial Costs,m_haggar,http://www.bloomberg.com/news/articles/2015-08-11/ellen-pao-appealing-order-to-pay-kleiner-perkins-trial-costs
270,New Court Evidence Reveals Hollywood’s Plan to Smear Google,voidingw,http://www.wired.com/2015/07/new-court-evidence-reveals-hollywoods-plans-smear-google/
539,GitHub threatens to shut down a repository for using the word 'retard',necessity,https://github.com/nixxquality/WebMConverter/commit/c1ac0baac06fa7175677a4a1bf65860a84708d67
120,How I Gave Up Alternating Current,ropiku,http://robrhinehart.com/?p=1331
23,Why I Stopped Angel Investing (And You Should Never Start),halcyondaze,http://observer.com/2015/08/why-i-stopped-angel-investing-and-you-should-never-start/
4,Drive the Curiosity Rover,astrosi,http://eyes.nasa.gov/curiosity/
5,Twitter finally flicks the switch on 10000 character DMs,davidbarker,http://www.theguardian.com/technology/2015/aug/12/twitter-finally-unlimited-direct-messages-dm
12,Vim-plug – a minimalist vim plugin manager,yankcrime,https://github.com/junegunn/vim-plug
31,Scientists Film Entire Nervous System at Work,adventured,http://www.nbcnews.com/science/science-news/scientists-film-entire-nervous-system-work-first-time-n407986
38,The deceptively complex world of RRULEs,systemizer,https://nylas.com/blog/rrules?hackernews
13,tiny Linux-WiFi-H.265 board form WRTnode and turnkey PCBA manufacturing service,Noel_lo,http://wrtnode.com/w/?p=671
11,Ask HN: Best hands-on security/cybersecurity training?,nsshey,
27,Branch’s Deep Links Let You Preview Apps in Your Browser,sdpurtill,http://techcrunch.com/2015/08/12/branchs-deep-links-let-you-preview-apps-in-your-browser/
40,How Uber Is Changing Life for Women in Saudi Arabia,AnkhMorporkian,http://www.fastcompany.com/3048461/app-economy/how-uber-is-changing-life-for-women-in-saudi-arabia
4,Culture Clash in Iowa,hharnisch,http://www.cnn.com/interactive/2015/07/us/culture-clash-american-story/
3,Google's Life Sciences is making bandage-sized glucose monitors,falcor84,http://www.theverge.com/2015/8/12/9136743/google-dexcom-cloud-connected-disposable-glucose-monitor
3,Yes We Will Live with Artificial Intelligence. But It Will Be Friend Not Foe,Artemis2,https://medium.com/backchannel/a-future-with-artificial-intelligence-friend-or-foe-5e0af3238389
17,VMWare Lightwave,jgrahamc,https://vmware.github.io/lightwave/
22,The Connoisseur of Number Sequences,retupmoc01,https://www.quantamagazine.org/20150806-neil-sloane-oeis-interview/
4,Freedom on the Centralized Web,traverseda,http://slatestarcodex.com/2015/07/22/freedom-on-the-centralized-web/
109,Old graph paper,ingve,http://leancrew.com/all-this/2015/08/old-graph-paper/
9,Show HN: Hug – A radically simple approach to creating HTTP/JSON APIs in Python,timothycrosley,https://github.com/timothycrosley/hug
182,DigitalOcean Teams Up with Bitnami Install Over 100 Web Apps with a Few Clicks,mitchwainer,http://techcrunch.com/2015/08/11/digitalocean-teams-up-with-bitnami-now-lets-you-install-over-100-web-apps-with-a-few-clicks/
8,The Advent of Artisanal Cash,mathattack,http://www.nytimes.com/2015/08/09/fashion/change-for-a-bowie-the-advent-of-artisanal-cash.html?hp&action=click&pgtype=Homepage&module=second-column-region&region=top-news&WT.nav=top-news&_r=0
1,Crowdbooster (YC S10) Is Hiring a PR Hacker,rickyyean,
71,The Philosopher of Surveillance,stefantalpalaru,https://firstlook.org/theintercept/2015/08/11/surveillance-philosopher-nsa/
7,Ask HN: Privacy Badger locking down gmail accounts?,buserror,
12,Ask HN: What is your front-end stack of choice if you start a new web-app today?,yonibot,
10,UK’s proposed 10-year max jail term for file sharing,teh_klev,http://arstechnica.co.uk/tech-policy/2015/08/the-uks-proposed-10-year-max-jail-term-for-online-copyright-infringement-must-be-stopped/
23,IEX Ideology and the Role of an Exchange,minimax,https://mechanicalmarkets.wordpress.com/2015/08/11/iex-ideology-and-the-role-of-an-exchange/
8,IoT and the Uncloud: Why Owning Your Data Matters More on the Internet of Things,pgrieselhuber,http://blog.thingstud.io/philosophy/the-uncloud-why-owning-your-data-matters-more-on-the-internet-of-things/
9,New software mimics the human perception of style,jonbaer,http://phys.org/news/2015-08-scientists-graphics-software.html
15,Twenty Four Hours in Ramallah,akiber,http://www.beingbecca.com/twenty-four-hours-in-ramallah/
10,Miscellaneous interesting quotes from Coders at Work,luu,http://scraps.benkuhn.net/2015/08/10/caw-tips.html
14,Startups Vie to Build an Uber for Health Care,mattee,http://www.wsj.com/articles/startups-vie-to-build-an-uber-for-health-care-1439265847?mod=trending_now_1
9,Building Almost Dependent Types in Swift,lexicalscope,https://sectionfive.net/blog/2015/08/11/building-almost-dependent-types-in-swift/
37,Axis Mundi – A secure resilient distributed and open communication platform,kbody,https://six-pack.github.io/Axis-Mundi/
12,Memory1: An All-Flash DDR4 Memory Module,pwnna,http://www.diablo-technologies.com/memory1/
103,How much we still don’t know about Watergate and the Nixon Administration,lermontov,http://daily.jstor.org/watergate-nixon-administration/
5,Y Combinator’s non-profit mission,BenjaminTodd,http://www.ft.com/intl/cms/s/0/72d90f7a-3c20-11e5-8613-07d16aad2152.html
144,OpenSSH 7.0 released,fs111,http://www.openssh.com/txt/release-7.0
94,How We Beat C++ STL Binary Search,timanglade,https://realm.io/news/how-we-beat-cpp-stl-binary-search/
24,How to convert a Facebook page into a mobile chat app using Ionic and Socket.io?,herve76,http://jsapp.me/#jspager
15,Why is Africa still poor?,antman,https://www.foreignaffairs.com/reviews/review-essay/2015-06-16/plunder-africa
74,Tell HN: Kevin will comment on more Show HNs this Friday,dang,
76,Crafting Icons,bpolania,http://www.elischiff.com/blog/2015/8/4/crafting-icons?utm_campaign=iOS%2BDev%2BWeekly&utm_medium=email&utm_source=iOS_Dev_Weekly_Issue_210
49,Startups.co to Acquire Zirtual Service to Resume,7Figures2Commas,https://www.startups.co/articles/acquire-zirtual-service-to-resume
9,Who actually reads the code?,fcambus,https://www.fsf.org/blogs/community/who-actually-reads-the-code
7,Ask HN: Is Twitter failing?,ziodave,
72,Nine Charged in Insider Trading Case Tied to Hackers,jackgavigan,http://www.nytimes.com/2015/08/12/business/dealbook/insider-trading-sec-hacking-case.html
26,Problems with Computer Science Education,deanmen,https://www.fusionbox.com/blog/detail/problems-with-computer-science-education/567/
65,Zirtual may have just abruptly shut down,opendoorryan,
19,Ask HN: Time to update my skills.  What should I do?,gadhra,
5,Why Larry Page Is Stepping Away,tim_sw,http://www.newyorker.com/news/news-desk/why-larry-page-is-stepping-down
96,Deconcentration of Attention: Addressing the Complexity of Software (2012),miles,http://deconcentration-of-attention.com
10,The BitLicense Hurts New York Not Bitcoin,murtali,https://www.coinprices.io/articles/the-bitlicense-hurts-new-york-not-bitcoin
12,Is Your Content Marketing Making Brand Withdrawals?,Mr_Ed,https://chartmogul.com/blog/2015/08/is-your-content-marketing-making-brand-withdrawals/
64,How We Tested Our Food Blog’s Expected CPM with Premium Images,Cherian,https://magazine.cucumbertown.com/putting-your-plate-where-your-money-is-the-food-blog-monetization-experiment-part-1-54dde9e5e5a2
55,Death Threats Against Co-Workers Defeat Employee Disability Discrimination Claim,lutesfuentes,https://casetext.com/posts/death-threats-against-co-workers-defeat-employee-disability-discrimination-claim-federal-court-rules
32,Ask HN: Do you have a side project you want to sell?,duked,
4,Elastic Beanstalk adds support for enhanced application health monitoring,crabasa,https://aws.amazon.com/blogs/aws/elastic-beanstalk-update-enhanced-application-health-monitoring/
3,U.S. Population Distribution by Age 1900 through 2060,mooreds,http://www.calculatedriskblog.com/2015/08/us-population-distribution-by-age-1900.html
150,Best practices for building large React applications,mtschopp,http://blog.siftscience.com/blog/2015/best-practices-for-building-large-react-applications
6,Interlocking Boards of Directors (2010),walterbell,http://www.thenetworkthinkers.com/2010/03/overlapping-networks.html
75,Don’t Hit Send: Angry Emails Just Make You Angrier,rubikscube,http://www.wsj.com/articles/dont-hit-send-angry-emails-just-make-you-angrier-1439227360
4,The Problem with 'Eat Local',SonicSoul,http://www.forbes.com/2009/08/31/agriculture-food-james-mcwilliams-business-logistics.html
17,A Little Kelp from My Friends,tintinnabula,http://luckypeach.com/a-little-kelp-from-my-friends/
90,Understanding ARM Assembly Part 1,ingve,http://blogs.msdn.com/b/ntdebugging/archive/2013/11/22/understanding-arm-assembly-part-1.aspx
20,One Class to Rule Them All: 0-Day Deserialization Vulnerabilities in Android [pdf],QUFB,https://www.usenix.org/system/files/conference/woot15/woot15-paper-peles.pdf
435,CS for All,joeclef,http://www.cs.hmc.edu/csforall/
61,Military-Industrial Complex Speech Dwight D. Eisenhower 1961,js2,http://coursesa.matrix.msu.edu/~hst306/documents/indust.html
7,Project VRM: Vendor Relationship Management,jcr,http://cyber.law.harvard.edu/projectvrm/Main_Page
280,How yuppies hacked the hacker ethos,edward,http://aeon.co/magazine/technology/how-yuppies-hacked-the-original-hacker-ethos/
4,Documentation at Scale: The Principles,sww_,http://250bpm.com/blog%3A58
