SCORE,TITLE,BY,URL
85,Unbounded High Dynamic Range Photography Using a Modulo Camera,dnt404-1,http://www.media.mit.edu/research/highlights/unbounded-high-dynamic-range-photography-using-modulo-camera
16,P2P WebRTC file sharing app: Broker using Elixir Phoenix,zabi_rauf,http://zohaib.me/p2p-webrtc-file-sharing-app-broker-using-phoenix/
19,Show HN: Hasp – A minimal CSS preprocessor using the M4 macro language,djanowski,https://github.com/djanowski/hasp
247,Ember.js 2.0 Released,makepanic,http://emberjs.com/blog/2015/08/13/ember-2-0-released.html
124,Tesla Announces $500M Common Stock Offering,cpwright,http://ir.teslamotors.com/releasedetail.cfm?ReleaseID=927533
221,Ferrolic,jpatokal,http://www.ferrolic.com/
75,Chaos Communication Camp 2015 Live Streams [video],fs111,https://streaming.media.ccc.de/
49,Facial Recognition Software Moves from Overseas Wars to Local Police,aethertap,http://www.nytimes.com/2015/08/13/us/facial-recognition-software-moves-from-overseas-wars-to-local-police.html?_r=0
243,Even when told not to Windows 10 doesn't stop talking to Microsoft,gregmolnar,http://arstechnica.co.uk/information-technology/2015/08/even-when-told-not-to-windows-10-just-cant-stop-talking-to-microsoft/
1,Citus Data is hiring distributed systems experts to scale out PostgreSQL,umur,https://www.citusdata.com/about-us/jobs
108,Disable Windows 10 Tracking,SoMuchToGrok,https://github.com/10se1ucgo/DisableWinTracking
63,NYC Mesh is trying to get around the big ISPs one node at a time,winstonford,http://technical.ly/brooklyn/2015/08/11/brooklyn-mesh-networks-red-hook-initiative/
5,‘Sesame Street’ Heading to HBO in Fall,uptown,http://www.nytimes.com/2015/08/14/business/media/sesame-street-heading-to-hbo-in-fall.html
27,Movie Recommendation with MLlib,eaxitect,http://ampcamp.berkeley.edu/big-data-mini-course/movie-recommendation-with-mllib.html
77,Announcing Docker ToolBox,anand-s,https://blog.docker.com/2015/08/docker-toolbox/
70,The story behind ITA's $700M sale to Google (2014),bootload,http://mixergy.com/interviews/david-baggett-ita-software-interview/
172,One trillion edges: graph processing at Facebook scale [pdf],mrry,http://www.vldb.org/pvldb/vol8/p1804-ching.pdf
7,Experiences Using Go as a Teaching Language with Young Programmers,soheilhy,https://groups.google.com/forum/#!msg/golang-nuts/FIRSDBehb3g/BFiHYVNCwzUJ
42,The Future of Work: Why Wages Aren't Keeping Up,bpolania,http://www.psmag.com/business-economics/the-future-of-work-why-wages-arent-keeping-up
46,Unix System V Release 1 Programming Guide (1983) [pdf],ingve,http://bitsavers.trailing-edge.com/pdf/att/unix/System_V_Release_1/341-930_Programming_Guide_UNIX_System_Jan83.pdf
26,Confessions of a Grown-Up Kick-Scooter Rider,monort,http://www.wsj.com/articles/confessions-of-a-grown-up-kick-scooter-rider-1431098923
35,Resize.ly – Images resized responsive and retina ready,jsingleton,https://resize.ly/#
18,Show HN: Route Your Bluetooth Low Energy Hardware out to the Internet,iamflimflam1,https://www.nodule.io
34,Robinhood: At a Play Store Near You,busterc,http://blog.robinhood.com/news/2015/8/12/robinhood-at-a-play-store-near-you
100,Julian Assange 'disappointed' as sex assault case dropped,ourmandave,http://www.bbc.com/news/world-europe-33907874
33,Critical and Significant Dates,Tomte,http://www.merlyn.demon.co.uk/critdate.htm
29,Community service: Vetting my local library's children's space books,sohkamyung,http://www.planetary.org/blogs/emily-lakdawalla/2015/08121703-community-service-vetting-library.html
33,Eye movements 'change scenes' during dreams,sakopov,http://www.bbc.com/news/science-environment-33860994
117,Niantic Labs splitting from Google,martindale,https://plus.google.com/+Ingress/posts/GVvbYZzWyTT
83,Emscripten gains experimental pthreads support,vmorgulis,https://groups.google.com/forum/#!topic/emscripten-discuss/gQQRjajQ6iY
4,Renting in America Has Never Been This Expensive,uptown,http://www.bloomberg.com/news/articles/2015-08-13/renting-in-america-has-never-been-this-expensive
58,Skin Microstructure Deformation with Displacement Map Convolution,ferrari8608,http://gl.ict.usc.edu/Research/SkinStretch/
1,BuildZoom is hiring a designer,the_economist,
25,How a UN intern was forced to live in a tent in Geneva,codewithcheese,http://www.bbc.com/news/world-europe-33893384
624,“It’s done there is no way back. We tried we failed”,danso,https://www.kickstarter.com/projects/45588301/woolfe-the-red-hood-diaries/posts/1168409
7,Ask HN: Recruiter took my money what to do?,understanding,
255,Every 30 minutes Windows 10 sends all typed text to Microsoft,cantrevealname,https://translate.google.com/translate?hl=en&sl=cs&tl=en&u=http%3A%2F%2Faeronet.cz%2Fnews%2Fanalyza-windows-10-ve-svem-principu-jde-o-pouhy-terminal-na-sber-informaci-o-uzivateli-jeho-prstech-ocich-a-hlasu%2F
68,Oracle Adds New Android Versions to Copyright Battle with Google,ghosh,http://www.bloomberg.com/news/articles/2015-08-12/oracle-files-new-complaint-against-google-in-android-battle
17,Get the latest Wikipedia updates easily with IFTTT,edward,https://blog.wikimedia.org/2015/07/14/wikipedia-recipes-with-ifttt/
8,Samsung unveils 2.5-inch 16TB SSD: The world’s largest hard drive,twsted,http://arstechnica.com/gadgets/2015/08/samsung-unveils-2-5-inch-16tb-ssd-the-worlds-largest-hard-drive/
16,Legendary Update,ingve,http://mamedev.emulab.it/haze/2015/08/13/legendary-update/
3,Facebook cancelled a student's internship after he highlighted privacy issue,ladzoppelin,http://www.msn.com/en-us/news/itinsider/facebook-cancels-internship-after-student-flags-privacy-flaw/ar-BBlHH1a?ocid=spartandhp&pfr=1
12,Dropbox automatically searches for illicit files,pbhjpbhj,http://gizmodo.com/dropbox-refuses-to-explain-its-mysterious-child-porn-de-1722573363
20,A Look inside Google’s Data Center Networks,dweekly,http://googlecloudplatform.blogspot.com/2015/06/A-Look-Inside-Googles-Data-Center-Networks.html
263,Ohm (YC S15) is a smarter lighter car battery that works with your existing car,blueintegral,http://techcrunch.com/2015/08/12/ohm-is-a-smarter-lighter-car-battery-that-works-with-your-existing-car/
19,Glia Cells: The Neuron’s Secret Partner,dnetesn,http://nautil.us/issue/27/dark-matter/the-neurons-secret-partner
30,Sleeping on your side may help to remove waste products in the brain,dnt404-1,http://www.sciencealert.com/sleeping-on-your-side-could-reduce-alzheimer-s-and-parkinson-s-risk-study-finds
9,10 most voted C++ best practices,cppdesign,http://www.codergears.com/Blog/?p=1957
258,Projects and Companies,runesoerensen,http://blog.samaltman.com/projects-and-companies
7,FlashGraph performance,codewithcheese,https://github.com/icoming/FlashGraph/wiki/FlashGraph-performance
3,Architects crowdfund to build £1.85B replica of Minas Tirith in England,ohjeez,http://www.telegraph.co.uk/film/lord-of-the-rings/minas-tirit-crowdfund/
1,Fullstack Academy top-ranked coding school is hiring devs to teach code in NYC,dy,http://www.fullstackacademy.com/careers/positions#fulltime
27,The Last Days of Kathy Acker,colinprince,http://penguinrandomhouse.ca/hazlitt/feature/last-days-kathy-acker
118,Show HN: NaSC – Do maths like a normal person,macco,http://parnold-x.github.io/nasc/
462,Discovery of a new irregular pentagon that can cover the plane,tokenadult,http://www.theguardian.com/science/alexs-adventures-in-numberland/2015/aug/10/attack-on-the-pentagon-results-in-discovery-of-new-mathematical-tile
40,Learning How to Die in the Anthropocene (2013),bootload,http://opinionator.blogs.nytimes.com/2013/11/10/learning-how-to-die-in-the-anthropocene
101,Octopus’ sophistication driven by hundreds of previously unknown genes,Audiophilip,http://arstechnica.com/science/2015/08/octopus-sophistication-driven-by-hundreds-of-previously-unknown-genes/
7,Tracking the Flow of Ideas Through the Programming Languages Literature [pdf],luu,http://www.cs.princeton.edu/~mg19/papers/snapl2015.pdf
51,Observational Signatures of Self-Destructive Civilisations,gnocchi,http://arxiv.org/abs/1507.08530
165,Squeak 5 is out,Fice,http://news.squeak.org/2015/08/12/squeak-5-is-out/
10,The Man Who Found the Titanic Is Not Done Yet,fourmii,http://www.popularmechanics.com/adventure/a16715/bob-ballard-oceanographer-titanic/?Src=longreads
141,How I develop with Nix,ayberkt,https://ocharles.org.uk/blog/posts/2014-02-04-how-i-develop-with-nixos.html
15,Falling in Love with Web Development Again,prezjordan,http://thatjdanisso.cool/loving-web-development-again/
47,Books That Shaped America,mudil,http://www.loc.gov/bookfest/books-that-shaped-america/
156,Deep Learning Courses,cjdulberger,https://developer.nvidia.com/deep-learning-courses
4,198 charges against Uber drivers in Toronto,braythwayt,http://www.thestar.com/news/city_hall/2015/08/13/198-charges-against-uber-drivers-in-toronto.html?utm_source=twitterfeed&utm_medium=twitter
127,Linux Assembly How To: “Hello World”,mindcrime,http://www.tldp.org/HOWTO/Assembly-HOWTO/hello.html
152,AppHub – Update React Native Apps Without Re-Submitting to Apple,arbesfeld,https://apphub.io/
41,Lockfree protection of data structures that are frequently read,panagios,https://www.arangodb.com/2015/08/lockfree-protection-of-data-structures-that-are-frequently-read/
345,The Teflon Toxin,sidko,https://firstlook.org/theintercept/2015/08/11/dupont-chemistry-deception/
1,Zesty (YC W14) is hiring Ember.js engineers,hol,https://jobs.lever.co/zesty/43afe895-11d2-4428-aa71-4cbc74c1fdd1
6,Investors Find Ways to Indirectly Profit from Valuable Startups,zbravo,http://www.nytimes.com/2015/08/10/technology/investors-find-ways-to-indirectly-profit-from-valuable-start-ups.html
189,Comparison of machine learning libraries used for classification,pzs,https://github.com/szilard/benchm-ml
28,Real-time data for cancer therapy,openmaze,http://newsoffice.mit.edu/2015/real-time-data-for-cancer-therapy-0804
5,Firefox disabled my extensions,sergimansilla,http://sergimansilla.com/blog/firefox-disabled-my-extensions/
6,Why there are so many vid lectures in online learningwhy there shouldn’t be,dnt404-1,https://medium.com/@medialab/why-there-are-so-many-video-lectures-in-online-learning-and-why-there-probably-shouldn-t-be-2fad009c30b5
6,Categorical Variable Encoding and Feature Importance Bias with Random Forests,luu,http://rnowling.github.io/machine/learning/2015/08/10/random-forest-bias.html
151,Open sourcing Grid the Guardian’s new image management service,room271,https://www.theguardian.com/info/developer-blog/2015/aug/12/open-sourcing-grid-image-service
3,Show HN: Webmon.com website monitoring with unlimited SMS,halayli,https://webmon.com/
5,Elves Anal and Breeding Fetishes: Inside World of Warcraft's Thriving Sex Club,fraqed,https://broadly.vice.com/en_us/article/world-of-warcraft-sex-club
33,JVMLS 2015 – Multi-Language Runtime [video],chrisseaton,https://www.youtube.com/watch?v=kOnyJurioyw&list=PLX8CzqL3ArzUo2dtMurvpUTAaujPMeuuU&index=14
3,Defense Distributed Injunction Denied in Suppression of Gun-Related Net Speech,hga,https://reason.com/blog/2015/08/07/defense-distributed-injunction-denied-in
420,Thor – A Project to Hammer Out a Royalty Free Video Codec,TD-Linux,http://blogs.cisco.com/collaboration/world-meet-thor-a-project-to-hammer-out-a-royalty-free-video-codec
5,Ask HN: How do you deal with ADD?,noobie,
4,Gnome Turns 18 this Saturday!,dumindunuwan,https://www.gnome.org/news/2015/08/gnome-turns-18-this-saturday/
4,If You Haven't Done It Before All Bets Are Off,draegtun,http://prog21.dadgum.com/209.html
6,This Is What the Earth Would Look Like Without Its Oceans,thrusong,http://www.huffingtonpost.com/entry/this-is-what-earth-would-look-like-without-its-oceans_55ca1e11e4b0923c12be2b76?utm_hp_ref=canada&ir=Canada&section=canada&adsSiteOverride=ca&kvcommref=mostpopular
49,Lenovo Is Laying Off 3200,ghosh,http://techcrunch.com/2015/08/12/lenovo-is-laying-off-3200-staff-after-a-poor-quarter-of-business/
58,“(null)” is a bad idea,cperciva,http://www.daemonology.net/blog/2015-08-13-null-is-a-bad-idea.html
22,Even when told not to Windows 10 just can’t stop talking to Microsoft,chris-at,http://arstechnica.com/information-technology/2015/08/even-when-told-not-to-windows-10-just-cant-stop-talking-to-microsoft/
467,Relay Technical Preview,cpojer,http://facebook.github.io/react/blog/2015/08/11/relay-technical-preview.html
8,Realise Minas Tirith,taietel,https://www.indiegogo.com/projects/realise-minas-tirith
225,IPython 4.0 Released,erikcw,http://blog.jupyter.org/2015/08/12/first-release-of-jupyter/
5,Ask HN: Why enable Facebook comments on TechCrunch if they're used for spamming?,ziodave,
3,Thoughts about the cutting-edge of server programming,feylikurds,
31,We Still Let Harassers Participate in Our Community,fortawesome,http://kovalc.in/2015/08/12/harassers.html
431,Windows 10 phones home when you search your start menu even with Bing disabled,ultramancool,https://up1.ca/#Dpl7PlGX6DHUqQ8B9p9oAQ
64,Commuting Kills,mmaunder,https://www.wordfence.com/blog/2015/08/commuting-kills/
208,An explosion in Tianjin China [video],djyde,http://video.weibo.com/show?fid=1034:f2df4e43a94dc5caa90960ecf2b89c44
63,Let’s Build a Simple Interpreter Part 3,rspivak,http://ruslanspivak.com/lsbasi-part3/
107,2015 Engineering Salaries Reviewed,seattle_spring,http://rivierapartners.com/engineering-salaries-reviewed-3/
9,A database of paper airplanes with easy to follow folding instructions,hunglee2,http://www.foldnfly.com/#/1-1-1-1-1-1-1-1-2
21,Ask HN: How do you pitch your B2B product when no one knows you?,tsenkov,
5,A cryptography-enabled technology called smart contracts,etiam,http://www.technologyreview.com/news/540151/bitcoins-dark-side-could-get-darker/
38,Show HN: Building a JavaScript Recommendation Engine with Graph Theory,keithwhor,https://medium.com/@keithwhor/using-graph-theory-to-build-a-simple-recommendation-engine-in-javascript-ec43394b35a3
4,YC-Backed Zen99 to shut down return remaining capital to investors,williamgogan,https://medium.com/@tmzier/zen99-is-closing-its-doors-8-25-169830ec7da8
113,Gitfs,edward,http://www.presslabs.com/gitfs/
35,Congratulations HN: 10M posts and comments,rsp1984,https://news.ycombinator.com/item?id=10000000
108,Infiniverse,dgellow,http://play.infiniverse-game.com/
13,Student exposes Messenger flaw loses Facebook internship,vilmosi,http://thenextweb.com/facebook/2015/08/13/every-step-you-take-every-move-you-make/
49,How the UK found Japanese speakers in a hurry in WW2,samaysharma,http://www.bbc.com/news/magazine-33860778
35,Harvard student loses Facebook internship after pointing out privacy flaws,huac,http://www.boston.com/news/nation/2015/08/12/harvard-student-loses-facebook-internship-after-pointing-out-privacy-flaws/zASZFdUjn6PoliUiR9kVHJ/story.html
30,Svsh: process supervision shell,idop,https://ido50.github.io/Svsh
95,Netflix – Chasing 60fps [video],tilt,https://www.youtube.com/watch?v=g01dGsKbXOk
433,The magic of the Kalman filter in pictures,tbabb,http://www.bzarg.com/p/how-a-kalman-filter-works-in-pictures/
88,Show HN: Find a home close to work,rgbrgb,https://www.openlistings.co/near
177,For only the second time in our history the ownership of The Economist changes,ucaetano,http://www.economist.com/news/leaders/21660919-only-second-time-our-history-ownership-economist-changes-new-chapter
162,Removing the 140-character limit from Direct Messages,uptown,https://blog.twitter.com/2015/removing-the-140-character-limit-from-direct-messages
79,A Minimal Architecture for General Cognition [pdf],luu,http://axon.cs.byu.edu/mrsmith/2015IJCNN_MANIC.pdf
1,Instavest (YC W15) seeking software engineer,zallarak,
68,A Look at Embedded WiFi Development Boards,hlfshell,https://blog.fusiondigital.io/the-internet-of-things-a-look-at-embedded-wifi-development-boards-7abee1311711?source=your-stories
14,Building a Scalable Geospatial Infrastructure,bhuvanbamba,https://engblog.nextdoor.com/2015/08/12/geospatial/
28,Show HN: “Remind to Read” button on your website,rememberlenny,http://www.remindtoread.com/
7,Inspiration and Obsession in Life and Literature,fitzwatermellow,http://www.nybooks.com/articles/archives/2015/aug/13/inspiration-and-obsession-life-and-literature/
48,LA is dumping millions of plastic balls into its reservoir to tackle the drought,chris-at,http://www.sciencealert.com/la-is-dumping-millions-of-small-plastic-balls-into-its-reservoir-to-tackle-the-drought?utm_source=feedburner&utm_medium=feed&utm_campaign=Feed%3A+sciencealert-latestnews+%28ScienceAlert-Latest%29
61,Show HN: Droners.io – Get anything filmed by a drone,daveumr,https://droners.io
37,Analyzing stylistic similarity amongst authors,lingben,http://markallenthornton.com/blog/stylistic-similarity/
113,Firefox Under Fire: Anatomy of latest 0-day attack,adamnemecek,http://www.welivesecurity.com/2015/08/11/firefox-under-fire-anatomy-of-latest-0-day-attack/
15,Geologist predicts EPA toxic mine disaster in Colorado,RickHull,http://www.silvertonstandard.com/news.php?id=847
9,Ask HN: What is best strategy for selling a new product to SMB?,aml183,
6,Get ready: We’re going to see more GigaOms Quirkys and Zirtuals. Here’s why,jackgavigan,https://pando.com/2015/08/12/get-ready-were-going-see-more-gigaoms-quirkys-and-zirtuals-heres-why/3a65ea0e85b13e4fc9c9658e22e581f695adee65/
23,How Google ‘Tricks’ Users into Sharing Location Data,kavehs2,https://www.sherbit.io/how-google-tricks-users-into-sharing-location-data/
25,Learning Deep Neural Networks with Caffe,umarniz,https://medium.com/@Rapchik/deep-neural-networks-with-caffe-c888ad54c0f5
5,JUnit Lambda: The Future of Testing on the JVM Gets Crowdfunded,larleys,https://www.voxxed.com/blog/2015/08/junit-lambda-crowdfunding-to-secure-the-future-of-testing-on-the-jvm/
72,Indian immigrants are tech's new titans,kungfudoi,http://www.latimes.com/business/la-fi-indians-in-tech-20150812-story.html
4,Ask HN: Simulating an Availability Zone Outage in AWS,abrookewood,
74,BPMN 2.0 rendering toolkit and web modeler,plumeria,http://bpmn.io/
13,Has asking for a raise ever ruined your relationship with your employer?,dm03514,
6,Show HN: The customer service guide for startups,instakill,http://www.paweljaniak.co.za/customer-service-ebook?utm_source=hn&utm_medium=post&utm_campaign=hn
8,A License to Kill Innovation: Why California’s Bitcoin License Is Bad,kushti,https://www.eff.org/deeplinks/2015/08/license-kill-innovation-why-ab-1326-californias-bitcoin-license-bad-business
8,How the American Health Care System Compares,fezz,http://www.vox.com/2014/6/24/5837832/is-america-better-than-europe-at-treating-cancer
100,Introducing Docker Content Trust,dkasper,https://blog.docker.com/2015/08/content-trust-docker-1-8/
291, GitHub Desktop is now available ,bpierre,https://github.com/blog/2046-github-desktop-is-now-available
66,SourceDNA (YC S15) finds hidden security and quality flaws in apps,katm,http://venturebeat.com/2015/08/11/sourcedna-launches-searchlight-a-developer-tool-to-find-coding-problems-in-any-app/
99,Integration over Invention,bgentry,http://blog.convox.com/integration-over-invention
56,Kodak’s First Digital Moment,tysone,http://lens.blogs.nytimes.com/2015/08/12/kodaks-first-digital-moment/
189,A Miserable Debt-Free Life,zdw,http://www.rowetel.com/blog/?p=4316
45,Like Airbnb but for algorithms?,prostoalex,http://www.bostonglobe.com/ideas/2015/03/21/like-airbnb-but-for-algorithms/HRx2sUg9fWQMvWZOsQ7xqL/story.html?p1=Article_Related_Box_Article_More
173,Russia bans Reddit,HillRat,https://meduza.io/en/news/2015/08/12/russia-bans-reddit
101,Stronger Shell,mattbowen,http://m.odul.us/blog/2015/8/12/stronger-shell
25,CCAN – Comprehensive C Archive Network,vmorgulis,http://ccodearchive.net/list.html
81,Remind HN: The Perseid meteor shower peaks tonight,js2,
75,Ask HN: Who is interested in a book about high performance Erlang?,robinson_k,
278,Google reveals details about its datacenters,toddh,http://highscalability.com/blog/2015/8/10/how-google-invented-an-amazing-datacenter-network-only-they.html/
10,New model describes decision making as the collapse of a quantum superstate,jonbaer,http://phys.org/news/2015-08-cognitive-decision-collapse-quantum-superstate.html
106,Docker 1.8 released,Spiritus,http://blog.docker.com/2015/08/docker-1-8-content-trust-toolbox-registry-orchestration/
42,Your name is fine,polysaturate,http://blog.standupti.me/post/126530670964/paul-graham-is-wrong-and-your-name-is-fine
13,Building maintainable step-by-step tutorials with Git,djmashko2,http://info.meteor.com/blog/step-by-step-tutorials-with-git
18,A glossary of Boontling the Strange Jargon of Boonvile CA,Thorondor,http://www.theparisreview.org/blog/2015/07/16/rout-the-kimmie-in-the-boat/
1,HelloSign (YC W11) Is Hiring a Technical Product Manager for Its API,burnout1540,http://grnh.se/ipfyb3
91,The Bitcoin Blocksize: A Summary,alexcasalboni,http://rusty.ozlabs.org/?p=535
234,Windows 10 IoT Core for Raspberry Pi 2,vyrotek,https://blogs.windows.com/buildingapps/2015/08/10/hello-windows-10-iot-core/
6,Intel's diversity hiring doubles in six months,cpeterso,http://www.usatoday.com/story/tech/2015/08/12/intel-diversity-hiring-doubled/31490141/
45,How Quantum Randomness Saves Relativity,jonbaer,http://www.forbes.com/sites/chadorzel/2015/08/11/how-quantum-randomness-saves-relativity/
23,Analyzing Julia's issue counts over time,idunning,http://iaindunning.com/blog/juliaissuecount.html
105,An interactive Python profiler,Spiritus,https://github.com/what-studio/profiling
3,Twitter has removed the 140-character limit on direct messages,spYa,http://thenextweb.com/apps/2015/08/12/twitter-makes-direct-messages-unlimited-updates-ios-android-and-mac-apps/
5,Plan 9 System Calls,vezzy-fnord,http://aiju.de/misc/plan9-syscalls
48,The Last Kings of Donkey Kong,MattF,http://fivethirtyeight.com/features/the-last-kings-of-donkey-kong-high-score/
70,Relaunched TrueCrypt site with original content and documentation,unr3al011,https://www.truecrypt71a.com
54,What lies beneath the surface of New York Harbor? (2009),craigds,http://nymag.com/news/features/56609/
263,RethinkDB 2.1 is out: high availability,coffeemug,http://rethinkdb.com/blog/2.1-release/
34,Exposure to Ideologically Diverse Information on Facebook,fgeorgy,https://research.facebook.com/publications/1629735407303857/exposure-to-ideologically-diverse-information-on-facebook/
66,S3 and High Availability,mnutt,https://blog.movableink.com/s3-and-high-availability/
10,Newspeak on Squeak (2014) [pdf],MaysonL,http://bracha.org/newspeak-101.pdf
8,Quantum darwinism – From quantum to classical,jonbaer,https://uwaterloo.ca/institute-for-quantum-computing/news/quantum-classical
63,Kala: A Modern Job Scheduler (written in Go),jaytaylor,http://github.com/ajvb/kala
9,PeerVote: A Decentralized Voting Mechanism for P2P Collaboration Systems (2009) [pdf],xiler,http://dl.ifip.org/db/conf/aims/aims2009/BocekPHHS09.pdf
55,Dalga: Job scheduler written in Go,cenkalti,https://github.com/cenkalti/dalga
9,Why are America’s top technology jobs going to Indian executives?,minic,http://blogs.wsj.com/digits/2015/08/11/why-indian-managers-are-succeeding-in-techs-c-suite/?mod=e2fb
10,Fast and Vulnerable: A Story of Telematic Failures [pdf],teh_klev,https://www.usenix.org/system/files/conference/woot15/woot15-paper-foster.pdf
115,Ask PG: How is Arc coming along?,shawndumas,
9,VS Code v0.7.0 (August 2015),T-A,https://code.visualstudio.com/updates#VSCode
1,Le Tote (YC S13) Is Hiring Their First Growth Engineer,brettnorthart,https://jobs.lever.co/letote/3cf549ca-9bf7-45cb-b203-c3cff10f2982
3,The Manipulation Tactics of GPL Violators,chei0aiV,https://identi.ca/bkuhn/note/pGGHps-1T52A-cgrTpUngQ
11,Tracking the flow of ideas through the programming languages literature,ingve,http://tmpl.weaselhat.com/
5,Here’s the map of the world if size was determined by market cap,bandrami,http://www.marketwatch.com/story/heres-the-map-of-the-world-if-size-was-determined-by-market-cap-2015-08-12?dist=countdown&link=sfmw_fb
6,Ask HN: How to deal with increasing “brain farts” and small silly mistakes?,igammarays,
440,Lawrence Lessig wants to run for president in an unconventional way,nkassis,http://www.washingtonpost.com/news/post-politics/wp/2015/08/11/lawrence-lessig-wants-to-run-for-president-in-a-most-unconventional-way/
8,Why are Apple's products so confusing? They ignore design principles,jkaljundi,https://www.linkedin.com/pulse/why-apples-products-so-confusing-ignore-design-don-norman?redirectFromSplash=true
18,How We Spend Money at Mattermark,dmor,http://mattermark.com/how-we-spend-money-at-mattermark/
6,Show HN: BrandKoop – Discover the brand personality of your website,geo77,http://beta.brandkoop.com
12,Ask HN: Should I change my company name and domain to a proper spelling?,joshontheweb,
7,Why we should get rid of rotating sliders,gorachel007,http://catchi.co.nz/articles/copy-ux-design/just-say-no-to-the-rotating-slider/
9,Xfers (YC S15) simplifies C2C payments in Singapore,arcfenix,https://www.techinasia.com/xfers-c2c-payments-startup-profile/
77,The slinky machine: a slinky escalator,bpolania,http://woodgears.ca/toys/slinky.html
171,How Cheap Can Solar Get?,prostoalex,http://rameznaam.com/2015/08/10/how-cheap-can-solar-get-very-cheap-indeed/
46,End-to-End Encryption,DaveWalk,https://blog.pushbullet.com/2015/08/11/end-to-end-encryption/
17,Lenovo used Windows anti-theft feature to install persistent crapware,Deinos,http://arstechnica.com/information-technology/2015/08/lenovo-used-windows-anti-theft-feature-to-install-persistent-crapware/
83,The San Francisco Rent Explosion Part III,nikunjk,http://priceonomics.com/the-san-francisco-rent-explosion-part-iii/
60,Longevity in JavaScript Frameworks,MatthewPhillips,http://blog.bitovi.com/longevity-or-lack-thereof-in-javascript-frameworks/
8,A violin cold case is solved,11thEarlOfMar,http://www.bendbulletin.com/lifestyle/3400054-151/a-violin-cold-case-is-solved#
45,Ask HN: GitHub cloned your project what can I do?,luck87,
