SCORE,TITLE,BY,URL
41,“Pixar in a Box” on Khan Academy – How Pixar uses math to make movies,beneater,http://pixarinabox.org
164,China Sells U.S. Treasuries to Support Yuan,randomname2,http://www.bloomberg.com/news/articles/2015-08-27/china-said-to-sell-treasuries-as-dollars-needed-for-yuan-support
21,Google asks developers to disable App Transport Security preceeding iOS 9 launch,Kallikrates,http://googleadsdeveloper.blogspot.com/2015/08/handling-app-transport-security-in-ios-9.html
21,Tesla’s Model S P85D Scores 103 Out of 100 on Consumer Reports’ Ratings System,chriskanan,http://techcrunch.com/2015/08/27/teslas-model-s-p85d-just-broke-consumer-reports-ratings-system-scoring-103-out-of-100/?ncid=rss
66,Go enjoy Python3,crncosta,http://blog.surgut.co.uk/2015/08/go-enjoy-python3.html
109,Encrypted database case #1,kushti,http://yurichev.com/blog/encrypted_DB_case_1/
216,Ad Blocking Extensions Tested for Performance,rayshan,https://www.raymond.cc/blog/10-ad-blocking-extensions-tested-for-best-performance/view-all/
36,London Calling: Two-Factor Authentication Phishing from Iran,secfirstmd,https://citizenlab.org/2015/08/iran_two_factor_phishing/
37,Show HN: Rei – Process lists easily,sapsan,https://github.com/kerkomen/rei/blob/master/README.md
158,The Best Jobs Now Require You to Be a People Person,kareemm,https://fivethirtyeight.com/features/the-best-jobs-now-require-you-to-be-a-people-person/
186,Ghost: $411k Annual Revenue with a team of 6,edpichler,http://blog.ghost.org/april-2015-update/
41,Can Servo be a clean and modern reference platform for developers?,slasaus,https://github.com/servo/servo/issues/7409
151,OCamlers' critiques of Haskell,a0,https://www.reddit.com/r/ocaml/comments/3ifwe9/what_are_ocamlers_critiques_of_haskell/
20,Show HN: Flarum – Delightfully simple open-source forum software,tobyzerner,http://flarum.org
123,The Gracie jiu-jitsu story,fezz,http://grantland.com/one-hundred-years-arm-bars-gracie-jiu-jitsu-mma/?ex_cid=GrantlandTW
86,Prenav hello world drone drawing cubes inside a building [video],alain94040,http://www.prenav.com/blog/2015/8/26/hello-world
37,The Humvee’s replacement: Oshkosh’s L-ATV,Killah911,http://arstechnica.com/tech-policy/2015/08/meet-the-humvees-replacement-oshkoshs-l-atv/
58,Embedding D3 in an IPython Notebook,c_moscardi,http://www.christianmoscardi.com/blog/2015/08/12/embedding-d3-in-ipython-notebook.html
35,Destroyed by Rockefellers Diego Rivera Mural Trespassed on Political Vision,walterbell,http://www.npr.org/2014/03/09/287745199/destroyed-by-rockefellers-mural-trespassed-on-political-vision
1,Zidisha is hiring a remote engineer,jkurnia,http://p2p-microlending-blog.zidisha.org/2015/06/22/zidisha-is-hiring-a-remote-engineer/
133,Windows 10 Review,sinak,http://www.anandtech.com/show/9543/the-windows-10-review
35,Prison Camps in Siberia,snake117,http://spartacus-educational.com/RUSsiberia.htm
43,Emulating exceptions in C: a case study,sevko,http://sevko.io/articles/exceptions-in-c/
26,Interview with Randy Ubillos Adobe Premiere Final Cut Pro and iMovie Developer,beltex,http://alex4d.com/notes/item/back-to-1-0-randy-ubillos-interview
47,A Short Lesson in Perspective (2012),sp527,http://www.lindsredding.com/2012/03/11/a-overdue-lesson-in-perspective/
21,First-Class Predicate,sorpaas,http://thursdays.null.tl/2015/08/27/first-class-predicate/
20,Employee arrested for theft of trade secrets from Machine Zone Inc,gdeglin,http://www.justice.gov/usao-ndca/pr/silicon-valley-employee-arrested-theft-trade-secrets
333,Amazon Underground,acjohnson55,https://www.amazon.com/gp/feature.html?ie=UTF8&docId=1003016361
70,MITIE: MIT Information Extraction,bane,https://github.com/mit-nlp/MITIE
126,Lantern – Open Internet for Everyone,obilgic,https://getlantern.org/
78,Mr. Wizard Television's Original Science Guy,snake117,http://www.smithsonianmag.com/smithsonian-institution/meet-mr-wizard-science-guy-inspired-bill-nye-180956371/
17,The Global Bike-Share Boom: An Interactive History,elorant,http://www.citylab.com/city-makers-connections/bike-share/
35,Recovering from the wrong abstraction (2014),makmanalp,http://us3.campaign-archive2.com/?u=1090565ccff48ac602d0a84b4&id=92902a19e4&e=7f00539c7d
18,Garrett Camp is taking over StumbleUpon,tlrobinson,http://www.businessinsider.com/uber-cofounder-garrett-camp-taking-over-stumbleupon-2015-8
17,Proceedings of the International Conference on Machine Learning 2015,sshravan,https://github.com/KirkHadley/icml2015_papers
41,The One-Man $1.2B ETF Shop,qCOVET,http://www.bloomberg.com/news/articles/2015-08-26/how-a-one-man-etf-shop-attracted-1-4-billion-in-just-8-months?cmpid=twtr1
19,With Obi Smartphones John Sculley Takes Old Lessons From Apple and Pepsi,kanche,http://www.fastcompany.com/3050377/tech-forecast/with-obi-smartphones-john-sculley-takes-old-lessons-from-apple-and-pepsi-to-ne
314,M a personal digital assistant inside Facebook Messenger,jasonlbaptiste,http://www.wired.com/2015/08/how-facebook-m-works/
216,A Russian Family Was Isolated for 40 Years Unaware of WWII (2013),sergeant3,http://www.smithsonianmag.com/history/for-40-years-this-russian-family-was-cut-off-from-all-human-contact-unaware-of-world-war-ii-7354256/
275,A Woman Who Spent Six Years Fighting a Traffic Stop,danso,https://www.themarshallproject.org/2015/08/10/the-woman-who-spent-six-years-fighting-a-traffic-stop
9,A New Computer Glitch Is Rocking the Mutual Fund Industry,somerandomness,http://www.wsj.com/articles/securities-pricing-problems-hit-u-s-mutual-funds-etfs-1440601913
73,Lecture from the Man Who Dropped Both Atomic Bombs,vinnyglennon,http://warisboring.com/articles/listen-to-this-lecture-from-the-man-who-dropped-both-atomic-bombs/
224,Important Notice Regarding Public Availability of Stable Patches,dantiberian,https://grsecurity.net/announce.php
239,YC Stats,macleanjr,http://blog.ycombinator.com/yc-stats
366,Unity Comes to Linux: Experimental Build Now Available,fractalb,http://blogs.unity3d.com/2015/08/26/unity-comes-to-linux-experimental-build-now-available/
44,Samsung's ‘Safety Truck’,domyplace,http://global.samsungtomorrow.com/the-safety-truck-could-revolutionize-road-safety/
149,NeXTBSD aka FreeBSD X,tachion,http://www.slideshare.net/iXsystems/nextbsd-aka-freebsd-x
33,Here's what happens when you try to replicate Climate Contrarian Papers,nakedrobot2,http://www.theguardian.com/environment/climate-consensus-97-per-cent/2015/aug/25/heres-what-happens-when-you-try-to-replicate-climate-contrarian-papers?
95,PyPy Vectorization,hencq,http://pypyvecopt.blogspot.com/2015/08/the-end-of-summer-pypy-simd.html
107,India turned off mobile internet for 63M citizens amid protests in Ahmedabad,ankurpatel,http://thenextweb.com/in/2015/08/26/india-just-turned-off-mobile-internet-for-67-million-citizens-amid-protests-in-ahmedabad?
14,Study: Algorithmic word analysis can predict schizophrenia,owlish,http://www.theatlantic.com/technology/archive/2015/08/speech-analysis-schizophrenia-algorithm/402265/?single_page=true
21,Show HN: FundingHunt – Daily Updates on Startup Funding,vikasr111,http://www.fundinghunt.co/
241,Apple Loses German Top Court Case on Swipe-to-Unlock Patent,bitzerlander,http://www.bloomberg.com/news/articles/2015-08-25/apple-loses-german-top-court-case-over-swipe-to-unlock-patent
111,Amazon Curtails Development of Consumer Devices,shawndumas,http://www.wsj.com/articles/amazon-curtails-development-of-consumer-devices-1440632203
60,Show HN: EtherPot – A decentralized autonomous provably fair lottery,aakilfernandes,http://etherpot.github.io/
3,Zano drones struggle to achieve lift-off,buserror,http://www.bbc.co.uk/news/technology-34069150
160,Secretive fusion company claims reactor breakthrough,sparrowlisted,http://news.sciencemag.org/physics/2015/08/secretive-fusion-company-makes-reactor-breakthrough
206,Potentially Reprogramming Cancer Cells Back to Normal Cells,jaoued,http://neurosciencenews.com/mirna-cancer-cell-reprogramming-2491/
39,The Advanced Persistent Threat You Have: Google Chrome [pdf],epsylon,http://www.netsq.com/Documents/GoogleAPT.pdf
42,Why FreeBSD should not adopt launchd,vezzy-fnord,http://blog.darknedgy.net/technology/2015/08/26/0/
271,How to Onboard Software Engineers,GarethX,http://blog.fogcreek.com/how-to-onboard-software-engineers-interview-with-kate-heddleston/
55,KittyCam – Cat Facial Recognition Powered by Raspberry Pi,girlie_mac,https://github.com/girliemac/RPi-KittyCam
8,Pentaquine (2013),senorgusto,https://github.com/rvantonder/pentaquine
6,An American Startup Is Letting Cubans Share Internet Connections for Free,lx,http://motherboard.vice.com/read/an-american-startup-is-letting-cubans-share-internet-connections-for-free
55,Joseph Traub Who Helped Bring Computer Science to Universities Dies at 83,sew,http://www.nytimes.com/2015/08/27/science/joseph-traub-who-helped-bring-computer-science-to-universities-dies-at-83.html?hpw&rref=science&action=click&pgtype=Homepage&module=well-region&region=bottom-well&WT.nav=bottom-well&_r=0
8,Compression and Information Leakage of Plaintext (2002) [pdf],signaler,https://www.iacr.org/cryptodb/archive/2002/FSE/3091/3091.pdf
18,Quantum Game of Life (2012),michaelsbradley,http://arxiv.org/abs/1010.4666
239,A heads up display for git,michaelallen,https://github.com/michaeldfallen/git-radar
13,Virginia Shooting Gone Viral in a Well-Planned Rollout on Social Media,aaronbrethorst,http://www.nytimes.com/2015/08/27/technology/personaltech/violence-gone-viral-in-a-well-planned-rollout-on-social-media.html
403,Who Hacked Ashley Madison?,david_shaw,http://krebsonsecurity.com/2015/08/who-hacked-ashley-madison/
21,Building a probabilistic programming interpreter,wcbeard10,http://zinkov.com/posts/2015-08-25-building-a-probabilisitic-interpreter/
6,GitHub attacked again as Chinese developers forced by police to pull code,mukyu,http://arstechnica.com/security/2015/08/github-attacked-again-as-chinese-developers-forced-to-pull-code-by-police/
51,BlackRock acquires FutureAdvisor,chauzer,https://www.futureadvisor.com/content/blog/announcement-blackrock-acquires-futureadvisor
16,Numerical Modeling [pdf],brudgers,http://flh.fhwa.dot.gov/innovation/td/geotech/velocity/documents/05_chapter_3_numerical_modeling.pdf
7,Startup School Radio: Thumbtack's Marco Zappacosta,katm,https://blog.ycombinator.com/yc-startup-school-radio-thumbtacks-marco-zappacosta-on-the-always-changing-job-of-a-ceo
7,Slowly improving copyright clarity,mdlincoln,http://labs.cooperhewitt.org/2015/slowly-improving-copyright-clarity/
83,A Word Is Worth a Thousand Vectors,legel,http://multithreaded.stitchfix.com/blog/2015/03/11/word-is-worth-a-thousand-vectors/
58,The Problem with Problems,veb,http://000fff.org/the-problem-with-problems/
105,Network handover in Google Fi,ndrarmst,http://nicholasarmstrong.com/2015/08/network-handover-google-fi/
48,The Tools We Use,Impossible,https://storystudio.oculus.com/en-us/blog/the-tools-we-use-as-of-august-2015/
49,Unix command line queue utility,evandrix,https://github.com/chneukirchen/nq
4,Sentiment Analysis Tutorial Using Doc2Vec,linanqiu,http://linanqiu.github.io/2015/05/20/word2vec-sentiment/
44,How many national anthems are plagiarised?,Tideflat,http://www.bbc.com/news/magazine-34052000
11,Ashley Madison was mostly men,zabramow,http://www.businessinsider.com/ashley-madison-almost-no-women-2015-8
423,WordSafety – Check a name for unwanted meanings in foreign languages,randall,http://wordsafety.com/?hn=1
54,Google Vision APIs for Android provide face detection and barcode scanning,fitzwatermellow,https://developers.google.com/vision/?hl=en
5,To be rational about Tesla is to miss the point,jackgavigan,http://www.ft.com/cms/s/0/bb6abd4a-4b4f-11e5-b558-8a9722977189.html
158,A Computational Introduction to Number Theory and Algebra,luu,http://www.shoup.net/ntb/
76,Quantitative Economic Modeling in Python and Julia,k0nartist,http://quant-econ.net/
21,MicroServices (2014),brudgers,http://martinfowler.com/articles/microservices.html
6,Netflix Viewership Finally Gets a Yardstick,valhalla,http://www.wsj.com/articles/netflix-viewership-finally-gets-a-yardstick-1440630513
6,Reduce LinkedIn Spam with This Profile Headline,ksowocki,http://owocki.com/reduce-linkedin-spam-profile-headline/
47,Nuremberg: A Fair Trial? A Dangerous Precedent (1946),vezzy-fnord,http://www.theatlantic.com/magazine/archive/1946/04/nuremberg-a-fair-trial-a-dangerous-precedent/306492/?single_page=true?hn
80,A new role for Qasar,runesoerensen,http://blog.ycombinator.com/a-new-role-for-qasar
13,Lugg (YC S15) an App for On-Demand Short-Distance Moves Raises $3.8M,kreutz,http://techcrunch.com/2015/08/26/lugg-an-app-for-on-demand-short-distance-moves-raises-3-8-million/
22,Welcome to Quakelahoma,cryptoz,https://news.vice.com/article/welcome-to-quakelahoma
9,Ranking News Items with Upvotes,kiudee,http://www.evanmiller.org/ranking-news-items-with-upvotes.html
31,Go LD_PRELOAD backdoor experiment,mattbostock,https://github.com/mattbostock/go-ldpreload-backdoor
3,Learn Lisp in One Video,snake117,https://www.youtube.com/watch?v=ymSq4wHrqyU
1,Le Tote (YC S13) Is Hiring Ruby Developers,brettnorthart,https://jobs.lever.co/letote/9814cd4e-24eb-43b8-af38-862d757b59d8
17,Interview with Brian McKenna: Roy Purescript Haskell Idris Dependent Types,pyotrgalois,https://medium.com/this-is-not-a-monad-tutorial/interview-with-brian-mckenna-about-roy-purescript-haskell-idris-and-dependent-types-63bb1289ea3d
6,The benefits of Long term thinking in decision making,yotamgut12,http://owntrepreneurship.com/2015/03/30/the-benefits-of-long-term-thinking-and-decision-making/
51,Legendary Deep-Sea Fish Sighting Continues to Be Debated After 60 Years,dnetesn,http://nautil.us/blog/this-legendary-deep_sea-fish-sighting-continues-to-be-debated-after-60-years
134,A Dubious Deal with the NSA,sinalc0,http://www.zeit.de/digital/datenschutz/2015-08/xkeyscore-nsa-domestic-intelligence-agency
4,One Way to Fight the California Drought: Study Trees [video],cossatot,http://fivethirtyeight.com/features/one-way-to-fight-the-california-drought-study-trees/
6,Student-built tree-planing robot prototype [video],danbolt,https://www.youtube.com/watch?v=Le86A5KUAHE
24,Erlang Basics,rdtsc,https://abdullin.com/erlang/basics/
7,When Tragedy Dictates Software User Experience,burritofanatic,http://www.williamha.com/when-tragedy-dictates-software-user-experience/
174,WebExtensions FAQ,jtgeibel,https://wiki.mozilla.org/WebExtensions/FAQ
64,Tsunami Warnings Written in Stone (2011),superfx,http://www.nytimes.com/2011/04/21/world/asia/21stones.html
147,How security flaws work: the buffer overflow,guardian5x,http://arstechnica.com/security/2015/08/how-security-flaws-work-the-buffer-overflow/
46,'Temperamental' Big Ben was ringing up to six seconds late,bootload,http://www.bbc.com/news/uk-england-london-34051053
1,Flexport is hiring senior front-end engineers who love real-world problems,thedogeye,https://flexport.com/careers
50,Almost None of the Women in the Ashley Madison Database Ever Used the Site,coldcode,http://gizmodo.com/almost-none-of-the-women-in-the-ashley-madison-database-1725558944
4,Go-lua: An implementation of Lua written in Go,Spiritus,http://www.shopify.com/technology/17605604-announcing-go-lua
5,Revolution in Minecraft Command Blocks computing fractals 40 times faster,mirceasoaica,https://www.youtube.com/watch?v=nfkkMFLtlUg
10,More than half of students chasing dying careers report warns,joeyespo,http://www.abc.net.au/news/2015-08-24/next-generation-chasing-dying-careers/6720528
28,Mini flash crash? Trading anomalies on manic Monday hit small investors,molecule,http://www.washingtonpost.com/business/economy/mini-flash-crash-trading-anomalies-on-manic-monday-hit-small-investors/2015/08/26/6bdc57b0-4c22-11e5-bfb9-9736d04fc8e4_story.html
63,All evidence points to OOP being bullshit (2013),bontoJR,http://blog.pivotal.io/labs/labs/all-evidence-points-to-oop-being-bullshit
35,UX Is a Canary in a Coal Mine,kathliu,https://blog.growth.supply/ux-is-a-canary-in-a-coal-mine-b7764b77f371
108,Rovio to Cut 260 Jobs as the Angry Birds Franchise Becomes Irrelevant,vvvv,http://techcrunch.com/2015/08/26/rovio-to-cut-260-jobs-as-the-angry-birds-franchise-becomes-irrelevant/
10,Placement New Memory Dumps and Alignment,ingve,http://jrruethe.github.io/blog/2015/08/23/placement-new/
195,State of the Common Lisp Ecosystem,dwc,http://eudoxia.me/article/common-lisp-sotu-2015/
35,Apple’s content blocking is chemo for the cancer of adtech,cpeterso,https://blogs.law.harvard.edu/doc/2015/08/26/apples-content-blocking-is-chemo-for-the-cancer-of-adtech/
6,OS X for Hackers: Yosemite Edition,gabamnml,https://gist.github.com/brandonb927/3195465
7,McWhopper - Hamburger proposal for Peace,Ideabile,http://mcwhopper.com/
6,Ants self-medicate on toxins when sick,snake117,http://www.wired.co.uk/news/archive/2015-08/21/ants-eat-poison-to-survive-self-medicate
18,Isomorphism in Information Carrying Systems (2004) [pdf],brudgers,http://ruccs.rutgers.edu/tempdocs/Kulvicki_PAPQ.pdf
8,Captive breeding of pandas at the Edinburgh zoo,arelangi,http://www.theguardian.com/world/2015/aug/25/everything-about-panda-sex-edinburgh-zoo-long-read
105,Python Extension Proposal 498: Literal String Formatting,ptest1,https://www.python.org/dev/peps/pep-0498/
120,Why Do Colleges Give Honorary Degrees?,bpolania,http://priceonomics.com/why-do-colleges-give-out-honorary-degrees/
7,ELENA Programming Language,vmorgulis,https://github.com/ELENA-LANG/elena-lang
99,How developers search for code: a case study,pramodbiligiri,https://research.google.com/pubs/pub43835.html
11,A Storm of Stories,thenomad,http://www.antipope.org/charlie/blog-static/2015/08/a-storm-of-stories---and-what-.html
11,What you get when you search for “Guitar Tuner” on Bing,ColinCochrane,http://www.bing.com/search?q=guitar+tuner
3,Is a Hacked Vehicle Also Defective?,eliyak,http://www.wsj.com/articles/is-a-hacked-vehicle-also-defective-1440457334?mod=e2fb
5,Zano drones struggle to achieve lift-off,domdip,http://www.bbc.com/news/technology-34069150
8,Traversing the Seas,tobinstokes,http://www.hakaimagazine.com/article-short/traversing-seas
9,Pocket: The App That Irked Me Over Privacy Today,teaneedz,http://teaz.me/pocket-the-app-that-irked-me-over-privacy-today/
5,Russia Inadvertently Posts Its Casualties in Ukraine,funkyy,http://www.forbes.com/sites/paulroderickgregory/2015/08/25/kremlin-censors-rush-to-erase-inadvertent-release-of-russian-casualties-in-east-ukraine/
1,Zesty (YC W14) is hiring engineers to work on routing/scheduling automation,hol,https://jobs.lever.co/zesty/571e9424-7f3f-4424-a7e8-357cbb63dec3
83,Paxos Made Moderately Complex,sargun,http://paxos.systems
11,The Upside of a Downturn in Silicon Valley,valleyer,http://www.nytimes.com/2015/08/27/technology/the-upside-of-a-downturn-in-silicon-valley.html
19,Ashley Madison looks like it was always a big sad scam,BadassFractal,http://boingboing.net/2015/08/26/ashley-madison-looks-like-it-w.html
23,YouTube Gaming,ropiku,https://gaming.youtube.com
3,Css-ratiocinator: automatically refactors CSS and generates a new stylesheet,jasim,https://github.com/begriffs/css-ratiocinator
77,The Contiki OS Version 3.0 Released,adunk,http://contiki-os.blogspot.com/2015/08/contiki-30-released-new-hardware-from.html
3,In Search of the Keys to the Virtual City,donohoe,http://www.newyorker.com/tech/elements/cities-skylines-and-the-search-for-the-keys-to-the-virtual-city
109,How to support PGP encryption in Gmail,conorpp,http://conorpp.com/blog/How-to-support-PGP-encryption-in-Gmail/
172,An example Python machine learning notebook for newcomers,rhiever,https://github.com/rhiever/Data-Analysis-and-Machine-Learning-Projects/blob/master/example-data-science-notebook/Example%20Machine%20Learning%20Notebook.ipynb
92,Inside the Fight Over Bitcoin’s Future,donohoe,http://www.newyorker.com/business/currency/inside-the-fight-over-bitcoins-future?intcid=mod-yml
214,The Beauty of Clojure,erikcw,http://owenrh.me.uk/blog/2015/08/24/
28,San Francisco Request for Information – New Voting System,stonesixone,http://sfgov2.org/index.aspx?page=4892
147,AT&T Hotspots: Now with Advertising Injection,jeo1234,http://webpolicy.org/2015/08/25/att-hotspots-now-with-advertising-injection/
167,A new Stephen Hawking presentation about black holes,ColinCochrane,http://www.washingtonpost.com/news/speaking-of-science/wp/2015/08/25/stephen-hawking-believes-hes-solved-a-huge-mystery-about-black-holes/?tid=sm_tw
6,Presentation Domain Data Layering,Garbage,http://martinfowler.com/bliki/PresentationDomainDataLayering.html
6,Researchers Use 'Seafloor Gardens' to Switch on Light Bulb,abustamam,http://www.jpl.nasa.gov/news/news.php?feature=4679
71,3D printing titanium: Learning to learn from success,pencerw,http://pencerw.com/feed/2015/8/6/3d-printing-titanium-learning-to-learn-from-success
75,Making Ocean Water Drinkable,prawn,http://www.popularmechanics.com/technology/infrastructure/a17040/how-it-works-desalinating-ocean-water/
11,The One-Man $1.2B ETF Shop,minimax,http://www.bloomberg.com/news/articles/2015-08-26/how-a-one-man-etf-shop-attracted-1-4-billion-in-just-8-months
246,How companies make millions off lead-poisoned poor blacks,eplanit,http://www.washingtonpost.com/local/social-issues/how-companies-make-millions-off-lead-poisoned-poor-blacks/2015/08/25/7460c1de-0d8c-11e5-9726-49d6fa26a8c6_story.html
8,New Orleans Is Katrina-Ready – Is It Also Ready for the Future?,tobinstokes,http://www.hakaimagazine.com/article-short/new-orleans-katrina-ready-it-also-ready-future
13,Show HN: Codementor Live Classes,weitingliu,https://www.codementor.io/classes
3,The Great Bitcoin Fork – Heart Bleed or Bleeding Hearts?,pelle,http://financialcryptography.com/mt/archives/001576.html
18,InfluxDB 0.9.3 out with compression improved write throughput and 0.8 migration,pauldix,https://influxdb.com/blog/2015/08/26/InfluxDB-0_9_3-released-with-compression-and-improved-write-throughput.html
19,All Websites Look the Same,tambourine_man,http://www.novolume.co.uk/blog/all-websites-look-the-same/
1,Le Tote (YC S13) Is Hiring a Lead Ruby Developer – Change Fashion with Us,brettnorthart,https://jobs.lever.co/letote/ed9d8d28-6250-4997-8571-cba22618e8a3
14,More Layoffs for Intuit as Company Continues Realignment,zhuxuefeng1994,http://techcrunch.com/2015/08/25/more-layoffs-for-intuit-as-company-continues-realignment/
69,How a Volcanic Eruption in 1815 Darkened the World but Colored the Arts,danso,http://www.nytimes.com/2015/08/25/science/mount-tambora-volcano-eruption-1815.html
99,The Uber endgame: privatized public transit,enkiv2,http://www.theawl.com/2015/08/ubiquity
444,“I Had a Baby and Cancer When I Worked at Amazon”,denzil_correa,https://medium.com/@jcheiffetz/i-had-a-baby-and-cancer-when-i-worked-at-amazon-this-is-my-story-9eba5eef2976
13,Show HN: CodeSnap – Git workflow-based community blogging platform,kidmillions,http://www.codesnap.io
310,UK surveillance “worse than 1984” says new UN privacy chief,fukusa,http://arstechnica.co.uk/tech-policy/2015/08/uk-surveillance-worse-than-1984-says-new-un-privacy-chief/
18,Cops decide to collect less license plate data after 80GB drive got full,mtuncer,http://arstechnica.com/tech-policy/2015/08/cops-decide-to-collect-less-license-plate-data-after-80gb-drive-got-full/
9,The problem with JPEG,fezz,https://www.youtube.com/watch?v=yBX8GFqt6GA
7,Ask HN: Publishing a copyleft book,Schiphol,
19,Netflix Is Dumping Anti-Virus Presages Death of an Industry,therealmarv,http://www.forbes.com/sites/thomasbrewster/2015/08/26/netflix-and-death-of-anti-virus/
5,Hidden Costs of Software,gvajravelu,http://gopivajravelu.com/2015/08/25/hidden-costs-of-software/
55,The Melting of Mark Zuckerberg’s $100MM Donation to Newark Schools,obilgic,http://www.nytimes.com/2015/08/27/business/dealbook/the-melting-of-mark-zuckerbergs-donation-to-newark-schools.html?smid=tw-share
25,Show HN: ObjectiveFS – Shared file system for EC2 and laptop,objectivefs,https://objectivefs.com
8,The Way GCHQ Obliterated the Guardian’s Laptops Revealed More Than It Intended,robin_reala,https://firstlook.org/theintercept/2015/08/26/way-gchq-obliterated-guardians-laptops-revealed-intended/
425,Bernie Sanders' 404 page,duggieawesome,https://berniesanders.com/404
16,Ask HN: What are the most annoying things in software development?,ThePhysicist,
39,Bernie Sanders’ Success Attracting Small Donors Tests Importance of ‘Super PACs’,nkzednan,http://www.nytimes.com/2015/08/26/us/politics/bernie-sanders-success-in-attracting-small-donors-tests-importance-of-super-pacs.html
4,7 Security Measures to Protect Your Servers,vinnyglennon,https://www.digitalocean.com/community/tutorials/7-security-measures-to-protect-your-servers
6,India just turned off mobile internet for 63M citizens amid protests,mayukh,http://thenextweb.com/in/2015/08/26/india-just-turned-off-mobile-internet-for-67-million-citizens-amid-protests-in-ahmedabad/
4,Why GoGo's Expensive Slow Internet Still Owns the Skies,gwallens,http://www.bloomberg.com/features/2015-gogo-airplane-wireless-internet/
12,Cancer cells “programmed back to normal” by US scientists,weddpros,http://www.telegraph.co.uk/news/science/science-news/11821334/Cancer-cells-programmed-back-to-normal-by-US-scientists.html
12,Understanding Phase-Locked Loops,signa11,http://arachnoid.com/phase_locked_loop/index.html
11,Netflix Update: Try This at Home (2006),dstein64,http://sifter.org/~simon/journal/20061211.html
42,Ask HN: When compensation includes equity can I ask proof of valuation?,kohanz,
25,Ask HN: How many hours do you work?,fantominous,
3,Vactrol,garrettdreyfus,http://electronicmusic.wikia.com/wiki/Vactrol
9,The Sensel Morph – pressure-sensitive multi-touch input device,davidbarker,https://kickstarter.com/projects/1152958674/the-sensel-morph-interaction-evolved
19,Intercom.io raises $35M Series C,dh,https://blog.intercom.io/35m-series-c-funding/
