SCORE,TITLE,BY,URL
18,Rebar and the Alvord Lake Bridge (2013),stevewilhelm,http://99percentinvisible.org/episode/episode-81-rebar-and-the-alvord-lake-bridge/
43,High quality entropy with nothing up its sleeves,chei0aiV,http://www.bitbabbler.org/
39,Clojure to MiniZinc,brudgers,https://github.com/tanders/clojure2minizinc/blob/master/README.org
7,Lenovo used a hidden Windows feature to ensure its software could not be deleted,polemic,http://thenextweb.com/insider/2015/08/12/lenovo-used-a-hidden-windows-feature-to-ensure-its-software-could-not-be-deleted/
162,Uber Is Serving New York’s Outer Boroughs More Than Taxis Are,svtrent,http://fivethirtyeight.com/features/uber-is-serving-new-yorks-outer-boroughs-more-than-taxis-are/
57,Ask HN: How much do you earn with donations vs. ads?,tobltobs,
96,Branch Prediction and the Performance of Interpreters – Don’t Trust Folklore,nkurz,https://hal.inria.fr/hal-01100647/document
9,Tell HN: Submissions about Oracle's position on reverse engineering,ColinWright,
4,Show HN: Project Repat - Turn t-shirts into quilts,iatek,http://projectrepat.com
10,Show HN: Run Elixir code in your browser,stevedomin,http://play.elixirbyexample.com/
65,How to make a book with Pollen,lobo_tuerto,http://pollenpub.com/
373,Show HN: JAWS – A JavaScript and AWS Stack,ac360,https://github.com/servant-app/JAWS
385,A Plan to Turn Engineers into Managers,prawn,http://firstround.com/review/this-90-day-plan-turns-engineers-into-remarkable-managers/
105,An Oakland shooting reveals how cops snoop on cell phones,anamexis,http://arstechnica.com/tech-policy/2015/08/ping-susp-phone-an-oakland-shooting-reveals-how-cops-snoop-on-cell-phones/
4,A small modular efficient fusion plant,user_235711,http://newsoffice.mit.edu/2015/small-modular-efficient-fusion-plant-0810
11,Let's Build a New Borough,smacktoward,http://www.theawl.com/2015/08/lets-build-a-borough
69,Why $53M Wasn't Enough to Scale Good Eggs,dhgisme,http://www.foodtechconnect.com/foodtechconnect/2015/08/10/why-53m-wasnt-enough-to-scale-good-eggs/
14,The Art of Nomography I: Geometric Design (2008),Nickersf,http://myreckonings.com/wordpress/2008/01/09/the-art-of-nomography-i-geometric-design/
4,The Advent of Artisanal Cash,zbravo,http://www.nytimes.com/2015/08/09/fashion/change-for-a-bowie-the-advent-of-artisanal-cash.html
9,Words without borders: Greek myths and medieval scribes,diodorus,http://www.laphamsquarterly.org/roundtable/words-without-borders
63,A Large-Scale Study of Flash Memory Failures in the Field,danso,https://research.facebook.com/publications/492813337536234/a-large-scale-study-of-flash-memory-failures-in-the-field/
47,Making Sense of Misery: The Dialect Notebooks of a Teenage Breton Farm Servant,benbreen,https://manyheadedmonster.wordpress.com/2015/08/10/making-sense-of-misery-the-dialect-notebooks-of-a-teenage-breton-farm-servant/
20,Introduction to Scaling Laws,drallison,http://www.av8n.com/physics/scaling.htm
12,Kala – A Modern Mesos Job Scheduler,jaytaylor,https://github.com/ajvb/kala
58,Fermilab experiment sees neutrinos change over 500 miles,wfunction,http://www.fnal.gov/pub/presspass/press_releases/2015/NOvA-Neutrinos-Change-20150807.html
140,PostgreSQL 9.5 New Features with Examples [pdf],snaga,http://h30507.www3.hp.com/hpblogs/attachments/hpblogs/Japan-Enterprise-Topics/124/1/PostgreSQL%209.5%20New%20Features%20English%2020150807-1.pdf
29,Architectural Changes in Math.js v2,MrQuincle,http://josdejong.com/blog/2015/08/08/architectural-changes-in-mathjs-v2/
18,Homemade X-ray inspector reveals PCB secrets,zaaaaz,http://makezine.com/2015/08/11/homemade-x-ray-inspector-reveals-pcb-secrets/
127,New design could finally help to bring fusion power closer to reality,curtis,http://phys.org/news/2015-08-fusion-power-closer-reality.html
56,Nebia (YC S15) a Shower Head Start-Up Receives Funding from Tim Cook of Apple,marcjones281,http://bits.blogs.nytimes.com/2015/08/11/nebia-a-shower-head-start-up-gets-funded-by-apple-ceo-cook/?_r=0
96,Hand-Coded Assembly Beats Intrinsics in Speed and Simplicity,ingve,http://danluu.com/assembly-intrinsics/
584,Ask HN: I will help your startup in exchange for food and a place to stay,codeornocode,
15,Firefox 40 Release Notes,jaredtking,https://www.mozilla.org/en-US/firefox/40.0/releasenotes/
10,No Silver Bullet – Essence and Accidents of Software Engineering (1986) [pdf],Permit,http://worrydream.com/refs/Brooks-NoSilverBullet.pdf
81,China Moves to Devalue Yuan,ethanhunt_,http://www.wsj.com/articles/china-moves-to-devalue-the-yuan-1439258401
31,Lenovo shipping a BiOS rootkit?,plantain,http://arstechnica.com/civis/viewtopic.php?p=29497693#p29497693
3,Firefox Brings Fresh New Look to Windows 10 and Makes Add-Ons Safer,jvehent,https://blog.mozilla.org/blog/2015/08/11/firefox-brings-fresh-new-look-to-windows-10-and-makes-add-ons-safer/
4,How ‘Rock Star’ Became a Business Buzzword,tysone,http://www.nytimes.com/2015/08/16/magazine/how-rock-star-became-a-business-buzzword.html
7,Show HN: WebGL/ThreeJS game with source,nergal,https://www.chromeexperiments.com/experiment/saving-nemo
35,Skipping breakfast might help you lose weight,takee,http://www.washingtonpost.com/news/wonkblog/wp/2015/08/10/the-science-of-skipping-breakfast-how-government-nutritionists-may-have-gotten-it-wrong/
14,Latis the first smart notification system that’s – well smart,AshMokhberi,http://thenextweb.com/insider/2015/08/12/latis-may-be-the-first-smart-notification-system-thats-well-smart/
6,Truth about Booking.com,sinamdar,http://blogs.perl.org/users/bookingemployee/2012/03/truth-about-bookingcom.html
26,Show HN: Shape-powered movie search,bgnm2000,http://www.croovies.com/movies?signup=hackernews
67,It’s the spec bugs that kill you,yoav_hollander,http://blog.foretellix.com/2015/07/28/its-the-spec-bugs-that-kill-you/
54,NASA Astronauts Eat Space-Grown Food,jimschley,http://www.npr.org/sections/thetwo-way/2015/08/10/431239435/one-small-bite-for-man-nasa-astronauts-to-eat-space-grown-food
34,Linguistic Harbingers of Betrayal: A Case Study on an Online Strategy Game [pdf],cpeterso,http://vene.ro/betrayal/niculae15betrayal.pdf
9,Things I’ve learned about making portable binaries,DonPellegrino,http://simongrondin.name/?p=394
135,XMPP Myths,AndrewDucker,http://wiki.xmpp.org/web/index.php?title=Myths
84,Bohr's trip about spin,grey-area,http://commandcenter.blogspot.com/2013/05/eisenbahnnet-bohrs-trip-about-spin.html
9,Show HN: Fetchpost – Save HN post and comments as mails in maildir format,nazri1,https://asciinema.org/a/593u87rrsa3mevktyekepm4ke
7,Orthodontics Company's Patent Strategy Threatens the Open Internet,DiabloD3,https://www.eff.org/deeplinks/2015/08/rightsholders-seeking-expansion-executive-power-over-internet-through-backdoor-itc
7,The race to preserve disappearing data,prostoalex,http://www.bostonglobe.com/ideas/2015/05/16/the-race-preserve-disappearing-data/0KPHAx5iK6jaLIvWQqIl4O/story.html?p1=Article_Related_Box_Article
26,Docker 1.8.0,bomberlot,https://github.com/docker/docker/blob/master/CHANGELOG.md#180-2015-08-11
41,The Impact of MINIX (2014) [video],vezzy-fnord,https://www.youtube.com/watch?v=86_BkFsb4eI
58,GitHub's Atom Switches from the Open Code of Conduct to the Contributor Convent,pauloday,https://github.com/atom/atom/commit/5a24d550628d76e39c401ee5e10e23ecdb65270b#diff-04c6e90faac2675aa89e2176d2eec7d8
32,Ask HN: Help me choose the best first book for Algorithms,learnerburner,
9,Ask HN: Can I earn 2000$ in 3 months by making sample apps/wireframes?,sourabh86,
14,GAM: A powerful and simple predictive modeling technique,bpolania,http://multithreaded.stitchfix.com/blog/2015/07/30/gam/?utm_campaign=Data%2BElixir&utm_medium=email&utm_source=Data_Elixir_47
127,Freight Startups Attract Silicon Valley’s Attention,shahryc,http://www.wsj.com/articles/freight-startups-attract-silicon-valleys-attention-1438875678
171,Apache Kafka Samza and the Unix Philosophy of Distributed Data,gmalay,http://www.confluent.io/blog/apache-kafka-samza-and-the-unix-philosophy-of-distributed-data
163,Ask HN: Best resources on webapp security?,zipfle,
91,A Submerged Monolith Near Sicily: Evidence for Mesolithic Human Activity,Petiver,http://www.sciencedirect.com/science/article/pii/S2352409X15300535
179,Tinder and the Dawn of the “Dating Apocalypse”,declan,http://www.vanityfair.com/culture/2015/08/tinder-hook-up-culture-end-of-dating
52,The Internet of Compromised Things,jdkanani,http://blog.codinghorror.com/welcome-to-the-internet-of-compromised-things/
173,A curated list of data science blogs,istinspring,https://github.com/rushter/data-science-blogs
21,Tips and Tricks for debugging unfamiliar AngularJS code,abuggia,http://eng.localytics.com/tips-and-tricks-for-debugging-unfamiliar-angularjs-code/
180,The World Needs a Secular Community Revolution,TVOLmag,https://evolution-institute.org/article/the-world-needs-a-secular-community-revolution/?source=tvol
3,Scaling Front End Build Steps by Necessity,mikaelbr,http://open.bekk.no/scaling-frontend-build-steps-by-necessity
5,The Appeal of Outsourcing,brathouz,http://robrhinehart.com/?p=1366
288,Stephen Hawking and Yuri Milner Announce $100M Initiative to Seek ET,saticmotion,http://www.scientificamerican.com/article/stephen-hawking-and-yuri-milner-announce-100m-initiative-to-seek-extraterrestrial-intelligence/
7,Complementing Hadoop at Yahoo: Interactive Analytics with Druid,fangjin,http://yahooeng.tumblr.com/post/125287346011/complementing-hadoop-at-yahoo-interactive
346,Oracle’s license agreement as it pertains to reverse engineering,shin_lao,https://web.archive.org/web/20150811052336/https://blogs.oracle.com/maryanndavidson/entry/no_you_really_can_t
103,The end of capitalism has begun,gburnett,http://www.theguardian.com/books/2015/jul/17/postcapitalism-end-of-capitalism-begun
61,Why we're all-in on virtual reality,lux,https://www.campfireunion.com/blog/post/26/why-were-all-virtual-reality
5,Building communications networks in the stratosphere,warunsl,https://code.facebook.com/posts/993520160679028/building-communications-networks-in-the-stratosphere/
11,Who actually reads the code?,vdfs,https://www.fsf.org/blogs/community/who-actually-reads-the-code
5,Not Even Close: The State of Computer Security – James Mickens,epsylon,https://vimeo.com/135347162
8,Are web frameworks actually useful?,nikhilkalegregg,
3,Einstein Was Boring Before He Was Brilliant,ph0rque,http://calnewport.com/blog/2015/08/05/einstein-was-boring-before-he-was-brilliant/
10,Easy A/B testing at Nextdoor,kilimchoi,https://engblog.nextdoor.com/2015/07/09/ab-testing//
8,Ask HN: You can get a recommended book list from any businessperson who is it?,meetbryce,
8,Scaling the Instagram Data Team,mikeyk,http://instagram-engineering.tumblr.com/post/125356491637/scaling-the-datagram-team
12,Show HN: Penny – simpler than Mint,dontmitch,https://www.pennyapp.io
121,The Visual Microphone: Passive Recovery of Sound from Video,csom,http://people.csail.mit.edu/mrub/VisualMic/
279,Coca-Cola Funds Scientists Who Shift Blame for Obesity Away from Bad Diets,drsilberman,http://well.blogs.nytimes.com/2015/08/09/coca-cola-funds-scientists-who-shift-blame-for-obesity-away-from-bad-diets/?hp&action=click&pgtype=Homepage&module=first-column-region&region=top-news&WT.nav=top-news&_r=0
92,The Graphing Calculator Story (2004),rsagula,http://www.pacifict.com/Story/
47,Finland Home of the $103000 Speeding Ticket,ronlkah,http://www.theatlantic.com/business/archive/2015/03/finland-home-of-the-103000-speeding-ticket/387484/?single_page=true
4,Hillary Clinton relents gives up possession of private email server,itprofessional4,http://news.yahoo.com/us-official-fbi-hillary-clinton-emails-home-server-222216318--election.html
44,Lenovo firmware overrides Windows system files after no-internet DVD install,jakub_g,http://arstechnica.com/civis/viewtopic.php?p=29497693&sid=ddf3e32512932172454de515091db014
12,Making sense out of 8-bit and 32-bit MCU options for your next IoT application,dchester195,http://www.embedded.com/design/mcus-processors-and-socs/4440036/Making-sense-out-of-8-bit-and-32-bit-MCU-options-for-your-next-IoT-application
4,96M Black Spheres Protect Los Angeles Water,rsuelzer,http://www.dailymail.co.uk/sciencetech/article-3194098/Could-plastic-balls-bring-relief-drought-stricken-California-Los-Angeles-releases-96-million-spheres-protect-reservoir-water.html
6,Ask HN: Co-founder split company not yet incorporated,throwawayuname,
6,Firefox 40 brings Windows 10-friendly design and better security for Android,samaysharma,http://thenextweb.com/dd/2015/08/11/firefox-40-brings-windows-10-friendly-design-and-better-security-for-android-users/
6,Ask HN: How well do you remember previous projects?,kensentme,
58,Let's Build a Simple Interpreter Part 2,danso,http://ruslanspivak.com/lsbasi-part2/
5,Ask HN: Do you practice for technical interview screens?,nuhusky2003,
577,Twitter Contest Winning as a Service,zeckalpha,http://www.hscott.net/twitter-contest-winning-as-a-service/
