SCORE,TITLE,BY,URL
197,Backdooring JavaScript using minifier bugs,joshsharp,https://zyan.scripts.mit.edu/blog/backdooring-js/
227,LLVM Foundation Granted 501(c)(3) Nonprofit Status,ingve,http://blog.llvm.org/2015/08/llvm-foundation-granted-501c3-nonprofit.html
23,React JSX and ES6: The Weird Parts,ponyfoo,http://ponyfoo.com/articles/react-jsx-and-es6-the-weird-parts
7,ClearSky Data Exits Stealth with Novel Approach to Cloud Storage,boulos,http://techcrunch.com/2015/08/24/clearsky-data-exits-stealth-to-deliver-data-lifecycle-as-a-service
10,Facebook 'spam king' faces 3 years in prison,bdehaaff,http://fortune.com/2015/08/25/facebook-spam-king/
12,How Linux was born as told by Linus Torvalds himself,wyclif,http://arstechnica.co.uk/business/2015/08/how-linux-was-born-as-told-by-linus-torvalds-himself/
15,In Uber’s Quest to Win Over China Tencent Blocks the Way,domdip,http://www.bloomberg.com/news/articles/2015-08-23/in-uber-s-quest-to-win-over-china-tencent-blocks-the-way
25,Understanding Trade-Offs in Distributed Messaging,tylertreat,http://bravenewgeek.com/what-you-want-is-what-you-dont-understanding-trade-offs-in-distributed-messaging/
45,Type Profiling and Code Coverage Profiling for JavaScript,mrspeaker,https://www.webkit.org/blog/3846/
25,Whis is Donald Trump so persuasive?,zabramow,http://blog.dilbert.com/post/127479255236/trump-vs-bush-persuasion-wars
4,Less than perfect,nate,https://signalvnoise.com/posts/3923-less-than-perfect
7,Show HN: WTFDYUM: Why the f*** did you unfollow me?,jchampem,https://github.com/jchampemont/WTFDYUM
7,Why the Wingdings font exists,davesailer,http://www.vox.com/2015/8/25/9200801/wingdings-font-history
48,Lock-Free Work Stealing Part 1: Basics,tivolo,http://blog.molecular-matters.com/2015/08/24/job-system-2-0-lock-free-work-stealing-part-1-basics/
95,Jungle – Simple CLI for AWS operations,achiku,https://github.com/achiku/jungle
25,Show HN: Distributed MapReduce framework in Go,sajal83,https://github.com/turbobytes/gomr
9,Show HN: Host your own open source Slack-like chat platform,onuryavuz,https://rocket.chat/
10,Five Years Post-Quake Cholera Threatens to Become Endemic in Haiti,tobinstokes,http://www.hakaimagazine.com/article-short/five-years-post-quake-cholera-threatens-become-endemic-haiti
13,Ask HN: Why are we still not encrypting email?,luxpir,
14,We need Geneva convention for the internet says new UN privacy chief,walterbell,http://www.theguardian.com/world/2015/aug/24/we-need-geneva-convention-for-the-internet-says-new-un-privacy-chief
8,Show HN: Deep Type - validate JavaScript objects and arrays using GraphQL,benjamin_st,https://github.com/BSteephenson/Deep-Type
9,A metabolic master switch underlying human obesity,amelius,http://news.mit.edu/2015/pathway-controls-metabolism-underlying-obesity-0819
254,Here’s what Ashley Madison members have told me,kitd,http://www.troyhunt.com/2015/08/heres-what-ashley-madison-members-have.html
169,How to Fold a Julia Fractal,rosstex,http://acko.net/blog/how-to-fold-a-julia-fractal/
165,HTTP/2 technology demo,LeZuse,http://www.http2demo.io/
365,Designing and Building Stockfighter Our Programming Game,jsnell,http://www.kalzumeus.com/2015/08/20/designing-and-building-stockfighter-our-programming-game/
7,Show HN: A C# Implementation of Apple's Grand Central Dispatch Serial Queues,borland,https://github.com/borland/SerialQueue
17,A First Encounter with Machine Learning (2011) [pdf],sonabinu,http://www.ics.uci.edu/~welling/teaching/ICS273Afall11/IntroMLBook.pdf
11,MiningZinc: A Language for Constraint-Based Mining,brudgers,https://dtai.cs.kuleuven.be/CP4IM/miningzinc/
4,All Employment Growth Since 2000 Went to Immigrants,kzahel,http://cis.org/all-employment-growth-since-2000-went-to-immigrants
48,Neural Transformation Machine: Sequence-To-Sequence Learning,groar,http://arxiv.org/abs/1506.06442
19,10 Steps for Ramping into Ember.js Quickly,micahalles,http://spin.atomicobject.com/2015/08/24/learn-ember-js-quickly/
31,Email from a Married Female Ashley Madison User,etiam,https://firstlook.org/theintercept/2015/08/24/email-ashley-madison-user/
23,StreetCode Academy Bridges the Gap Between East Palo Alto and Silicon Valley,levin3790,http://techcrunch.com/2015/08/18/streetcode-academy-bridges-the-gap-between-east-palo-alto-and-silicon-valley/
10,Ask HN: It used to be that when stocks fall Bitcoin goes up. What happened?,traviagio,
264,Hackpad source code,z1mm32m4n,https://github.com/dropbox/hackpad
119,Obama Administration Supports Privacy-Invasive “Cybersecurity” Bill,jeo1234,https://www.eff.org/deeplinks/2015/08/obama-administration-supports-privacy-invasive-cybersecurity-bills
124,Lazy load responsive images,ivopetkov,https://github.com/ivopetkov/responsively-lazy
26,Ask HN: Best Server Hardening Guide?,Kinnard,
56,Ask HN: What's a good real-time stock trading platform?,tradinup,
32,Deanonymization Made Simple,r721,http://antukh.com/blog/2015/08/22/dark-appsec/
21,Results: We surveyed 200+ startup founders to find out how much money they have,keraz,http://thehustle.co/how-much-money-do-startup-founders-have
7,Ask HN: Why is Telegram Messenger not popular in US?,tuyguntn,
6,500000 Canadian Dollars to Turn in Ashley Madison Hackers,Donzo,http://www.cnet.com/news/ashley-madison-puts-bounty-on-hackers-heads/
22,[haskell] Why we don't chuck our readers into web apps,yawaramin,http://bitemyapp.com/posts/2015-08-23-why-we-dont-chuck-readers-into-web-apps.html
30,Introducing Improved Performance Dynos,narfz,http://blog.heroku.com/archives/2015/8/20/introducing-improved-performance-dynos
3,Linux Turns 24 Happy Birthday,Tsiolkovsky,http://linux.softpedia.com/blog/linux-turns-24-happy-birthday-489974.shtml
187,Google ordered to remove links to stories about Google removing links to stories,PretzelFisch,http://arstechnica.co.uk/tech-policy/2015/08/google-ordered-to-remove-links-to-stories-about-google-removing-links-to-stories/
279,The Future of Developing Firefox Add-ons,zawaideh,https://blog.mozilla.org/addons/2015/08/21/the-future-of-developing-firefox-add-ons/https://blog.mozilla.org/addons/2015/08/21/the-future-of-developing-firefox-add-ons/
46,The Teflon Toxin Part 3: How DuPont Slipped Past the EPA,thisjustinm,https://firstlook.org/theintercept/2015/08/20/teflon-toxin-dupont-slipped-past-epa/
16,Leaked AshleyMadison Emails Suggest Execs Hacked Competitors,forgottenpass,http://krebsonsecurity.com/2015/08/leaked-ashleymadison-emails-suggest-execs-hacked-competitors/
35,The Second Coming of Deep Linking,dmitrig01,http://techcrunch.com/2015/08/20/the-second-coming-of-deep-linking/
19,Drawing in the third dimension,jonbaer,http://www.nsf.gov/discoveries/disc_summ.jsp?cntn_id=135955
123,C# 6.0: An Introduction,bookerio,https://booker.codes/csharp-6-an-introduction/
27,Mycroft – A distributed declarative logic language,enkiv2,https://github.com/enkiv2/mycroft
40,Two Danes face up to six years in jail for explaining how to use Popcorn Time,rinesh,http://arstechnica.co.uk/tech-policy/2015/08/two-danes-face-up-to-six-years-in-jail-for-explaining-how-to-use-popcorn-time/
54,Rb: A Redis parallelization toolkit for Python,zeeg,http://blog.getsentry.com/2015/08/20/rb-redis-parallelization-toolkit.html
7,7 Hidden Truths About WebAssembly: The Next Evolution of Web Development,dokamoto,http://developerboards.att.lithium.com/t5/AT-T-Developer-Program-Blogs/7-Hidden-Truths-About-WebAssembly-The-Next-Evolution-of-Web/ba-p/40436
107,Show HN: Generate React forms from JSON form schemas,SteveVitali,https://github.com/SteveVitali/react-form-generator
80,Will Hollywood's Whining Thwart Better TPP Copyright Rules?,walterbell,https://www.eff.org/deeplinks/2015/08/will-hollywoods-whining-thwart-better-tpp-copyright-rules
93,Announcing the D-Wave 2X Quantum Computer,johlo,http://www.dwavesys.com/blog/2015/08/announcing-d-wave-2x-quantum-computer
7,Securing the Internet: Let's Encrypt to release first security certificates,tanglesome,http://www.zdnet.com/article/securing-the-internet-lets-encrypt/
6,Proposal: native.js to “embrace and extend” the WebExtensions API,dbcooper,https://discourse.mozilla-community.org/t/proposal-native-js-to-embrace-extend-the-webextensions-api/3457
24,Ask HN: Which $1B startups will fail if the bubble bursts?,webmasterraj,
6,iOS 9 content blocking will transform the mobile Web: I’ve tried it,gmatty,http://thenextweb.com/apple/2015/08/24/ios-9-content-blocking-will-transform-the-mobile-web-ive-tried-it/
7,Encryption is our best chance to stop mass surveillance,yelgo,https://tutanota.com/blog/posts/encryption-mass-surveillance
11,Js-code-structure:  Analyse the structure of your js project,timqian,https://github.com/timqian/jsCodeStructure
47,Scaling China’s Great Firewall,danso,http://www.nytimes.com/2015/08/18/opinion/murong-xuecun-scaling-chinas-great-firewall.html?partner=rssnyt&emc=rss
257,The likely end of DownThemAll,deltaprotocol,http://www.downthemall.net/the-likely-end-of-downthemall/
12,Benchmarking Apache Samza: 1.2M messages per second on a single node,fintler,https://engineering.linkedin.com/performance/benchmarking-apache-samza-12-million-messages-second-single-node
10,JSPON – JavaScript Persistent Object Notation,znpy,http://www.jspon.org/
51,I Can't Wait for NoSQL to Die (2010),bontoJR,http://widgetsandshit.com/teddziuba/2010/03/i-cant-wait-for-nosql-to-die.html
14,Proposal: Observables for ECMAScript,dmmalam,https://github.com/zenparsing/es-observable
12,Exploiting Domain-Specific Knowledge: Spiral [pdf],minthd,http://vjovanov.github.io/dsldi-summer-school/materials/thursday/spiral-dsl-jul15.pdf
16,An Awesome List of Awesome Lists,stevekinney,https://github.com/sindresorhus/awesome
4,Intelligent Energy's Hydrogen Fuel Cell Technology Can Now Fit Inside an iPhone,t23,http://www.macrumors.com/2015/08/24/hydrogen-fuel-cell-phone/
34,Ask HN: Recommend books for a software developer opening a business,JamesReeves1988,
14,Data Wrangling: Making data useful again,DrNuke,http://www.sciencedirect.com/science/article/pii/S2405896315001986
9,REPL with R JavaScript and C working together fast thanks to Truffle and Graal,pron,https://dl.dropboxusercontent.com/u/292832/useR_multilang_demo.mp4
7,The End of the Internet Dream,bhartzer,http://www.stateofdigital.com/the-end-of-the-internet-dream/
12,BitcoinXT appears to be the biggest attack on Bitcoin in history,kristianp,https://twitter.com/taoeffect/status/634534985328906240
3,The Case for Teaching Ignorance,eevilspock,http://www.nytimes.com/2015/08/24/opinion/the-case-for-teaching-ignorance.html
7,Proofing Spirits with a Homemade Electrobalance,luu,http://qqrs.github.io/blog/2015/08/21/proofing-spirits-with-homemade-electrobalance/
18,The MOOC revolution that wasn’t,PretzelFisch,http://kernelmag.dailydot.com/issue-sections/headline-story/14046/mooc-revolution-uber-for-education/
6,Police secretly track cellphones to solve routine crimes,eplanit,http://www.usatoday.com/story/news/2015/08/23/baltimore-police-stingray-cell-surveillance/31994181/#
53,Why I’m dumping Google Chrome,RachelF,http://www.extremetech.com/computing/210576-why-im-dumping-google-chrome
18,Bitcoin in China: An Insider’s View,skunkwerks,http://www.coindesk.com/bitcoin-in-china-an-insiders-view/
17,Stop Writing JavaScript Frameworks – Joe Gregorio – OSCON 2015,spankalee,https://www.youtube.com/watch?v=GMWAHzXQnNM
50,Companies That May Be the Next $1B Startups,dankohn1,http://bits.blogs.nytimes.com/2015/08/23/here-are-the-companies-that-may-be-the-next-50-start-up-unicorns/
55,Mozilla CEO threatens to fire person responsible for anonymous hate speech,fabrice_d,http://www.theverge.com/2015/8/24/9202067/mozilla-ceo-chris-beard-reddit-hate-speech
5,10 factors to consider when choosing a software library,cppdesign,http://www.codergears.com/Blog/?p=823
8,US strategy to create a new global legal and economic system: TPP TTIP TISA,kome,https://www.youtube.com/watch?v=Rw7P0RGZQxQ
12,Why I Don't Do Unpaid Overtime and Neither Should You,HigginsNinja,http://thecodist.com/article/why_i_don_39_t_do_unpaid_overtime_and_neither_should_you
83,Xhyve hypervisor a port of bhyve to OS X,dmmalam,https://github.com/mist64/xhyve/
5,Carbon nanofibres made from CO2 in the air,theklub,http://www.bbc.com/news/science-environment-33998697
54,Ask HN: Staying focused on your project,tmaly,
70,Ask HN: Has anyone else noticed Stack Overflow clones in Google search results?,rchrd2,
