SCORE,TITLE,BY,URL
216,Class action lawsuit filed against Lenovo over Superfish,jayess,https://www.unitedstatescourts.org/federal/cand/284981/1-0.html
75,Rust Discovery Or: How I Figure Things Out,steveklabnik,http://carol-nichols.com/2015/05/10/rustc-discovery/
28,Please stop calling databases CP or AP,martinkl,https://martin.kleppmann.com/2015/05/11/please-stop-calling-databases-cp-or-ap.html
34,Wind Power Without the Mills,mrfusion,http://www.forbes.com/sites/billtucker/2015/05/07/wind-power-without-the-mills/
82,CloudFlare “Interview Questions”,jgrahamc,https://blog.cloudflare.com/cloudflare-interview-questions/
1,Airware (YC W13) Is Hiring: Code and Fly,jbdowney,
23,PyCon 2015: Are we still changing the world?,tedmiston,http://blog.lisnr.com/2015/05/11/pycon-2015-are-we-still-changing-the-world/
6,HTTP/2 for TCP/IP Geeks,akerl_,http://daniel.haxx.se/blog/2015/05/07/http2-for-tcpip-geeks/
172,The Mind of Marc Andreessen,cpeterso,http://www.newyorker.com/magazine/2015/05/18/tomorrows-advance-man
10,Latency Tricks,cgaebel,http://clarkgaebel.com/latency-tricks.html
28,The Libertarian Futurism of Peter Thiel (2011),romefort,http://www.newyorker.com/magazine/2011/11/28/no-death-no-taxes
24,Counting ants,madflame991,http://grahamshawcross.com/2014/07/26/counting-ants/
3,Stewart Butterfield: We don't sell saddles here,tim_sw,https://medium.com/@stewart/we-dont-sell-saddles-here-4c59524d650d
5,Highly intelligent and successful people who hold weird beliefs,luu,http://kruel.co/2014/05/30/highly-intelligent-and-successful-people-who-hold-weird-beliefs/#sthash.N53BYtps.dpbs
19,Fuzzing Bitcoin Consensus,nicklerj,https://jonasnick.github.io/blog/2015/05/09/fuzzing-bitcoin-consensus/
26,Russian WW2 parade: A tank-spotter's guide,aymenim,http://www.bbc.com/news/world-europe-32588868
46,The need for timezone awareness,laut,http://www.creativedeletion.com/2015/05/10/the-need-timezones.html
3,Game theory’s cure for corruption,vimes656,http://aeon.co/magazine/society/game-theorys-cure-for-corruption-make-us-all-cops/
211,Show HN: Deck of Cards – A playing card API,crobertsbmw,http://deckofcardsapi.com
15,Making Games with Python and Pygame (2012) [pdf],colund,http://inventwithpython.com/makinggames.pdf?27f655
8,How to implement a constant-expression counter in C++,refp,http://b.atch.se/posts/constexpr-counter/
10,Mining Zookeeper’s transaction log to track down bugs,ivankelly,https://medium.com/@ivankelly/mining-zookeeper-s-transaction-log-to-track-down-bugs-63b4c653bb6
63,More Consensus on Coffee’s Benefits Than You Might Think,mgav,http://www.nytimes.com/2015/05/12/upshot/more-consensus-on-coffees-benefits-than-you-might-think.html
85,Narrowing a residential street – McAllister,waffle_ss,http://narrowstreetssf.com/mcallister/
69,British Gut Project,tokenadult,http://www.britishgut.org/
13,Museums Can Change – Will They?,phreeza,http://www.democracyjournal.org/36/museums-can-change-will-they.php?page=all
226,Go Lang: Comments Are Not Directives,Merkur,
4,How to write a software 3D polygon pipeline (2000),marktangotango,http://www.cbloom.com/3d/techdocs/pipeline.txt
8,Justice.js – A performance metric bar with a streaming FPS graph,niix,http://okor.github.io/justice/
22,Coolors – color scheme generator for designers,epaga,http://coolors.co
90,Windows 1.01 in Your Browser,eliyak,http://www.pcjs.org/devices/pc/machine/5160/cga/256kb/win101/
91,Lawnmower robots – the end of VLF time signals?,icehawk,http://phk.freebsd.dk/time/20150509.html
59,BBS the Documentary (2013) [video],tambourine_man,https://www.youtube.com/watch?v=mJgRHYw9-fU
49,A machine that speeds up evolution is revolutionizing genome design,edward,http://wyss.harvard.edu/viewpage/330/
63,Ninja Blocks – What’s been happening what’s happening next,bentoner,https://discuss.ninjablocks.com/t/ninja-blocks-whats-been-happening-whats-happening-next/3608
5,Clump – A library for expressive and efficient service composition,boothead,https://github.com/getclump/clump
41,Inventing an algebraic knot theory for eight year olds (III),theaeolist,http://researchblogs.cs.bham.ac.uk/thelablunch/2015/05/inventing-an-algebraic-knot-theory-for-eight-year-olds-iii/
45,JavaScript library for the visualization of statistical distributions,r0muald,https://github.com/richarddmorey/stat-distributions-js
57,Show HN: Website launch checklist,latteperday,https://tryblocks.com/departure/
3,Fixstars Announces Six-Terabyte Solid State Drive,Errorcod3,http://techxplore.com/news/2015-05-fixstars-six-terabyte-solid-state.html
216,Anti-Patterns Every Programmer Should Be Aware Of,willk,http://sahandsaba.com/nine-anti-patterns-every-programmer-should-be-aware-of-with-examples.html
95,Intro to Node on AWS Lambda for S3 and Kinesis,nicksergeant,http://eng.localytics.com/taming-aws-lambda-for-s3-and-kinesis-at-localytics/
9,Ghost 2 Year Anniversary: How We Spent the Kickstarter Funding,auhn,http://blog.ghost.org/year-2/
24,Emacs Script Pitfalls (2014),brudgers,http://www.lunaryorn.com/2014/08/12/emacs-script-pitfalls.html
8,Google and blogs: “Shit.”,kanamekun,http://www.marco.org/2015/02/16/google-and-blogs-shit
64,A Bitcoin Technology Gets Nasdaq Test,prostoalex,http://www.wsj.com/articles/a-bitcoin-technology-gets-nasdaq-test-1431296886
8,Best Buy Uses WebGL to Create Interactive Appliances,relaunched,http://esd.bbystatic.com/3d/1540319/
339,Did I ever mention that I fucking hate the fucking web,sagargv,http://cbloomrants.blogspot.com/2015/05/05-10-15-did-i-ever-mention-that-i.html
66,How World of Warcraft led to Glassdoor,bmahmood,http://www.businessinsider.com/how-world-of-warcraft-led-to-glassdoor-2015-5
11,More Entrepreneurs Are Coming Out About Depression Seeking Support Online,zackmiller84,http://www.entrepreneur.com/article/246010
79,Matrix HiFi – Blind testing high end full equipment,ZeljkoS,http://matrixhifi.com/contenedor_ppec_eng.htm
16,Sentinel’s Mission to Find 500000 Near-Earth Asteroids,molteanu,http://spectrum.ieee.org/aerospace/satellites/sentinels-mission-to-find-500000-nearearth-asteroids
404,Microsoft to stop producing Windows versions,ahelwer,http://m.bbc.com/news/technology-32658340
34,The Power of Bugs (2007),luu,https://technet.microsoft.com/en-us/magazine/2007.04.windowsconfidential.aspx
50,Press Me: The buttons that lie to you,otoolep,http://www.bbc.com/future/story/20150415-the-buttons-that-do-nothing
31,SSDs lose data if left without power for just 7 days,pyabo,http://www.ibtimes.co.uk/ssds-lose-data-if-left-without-power-just-7-days-1500402
17,Buoys: Implicitly Anchored Sketches in Flowing Text,akumpf,http://research.kumpf.cc/2015-Buoys/?recent
6,Cuomo Orders Emergency Measures to Protect Workers at Nail Salons,joe5150,http://www.nytimes.com/2015/05/11/nyregion/cuomo-orders-emergency-measures-to-protect-workers-at-nail-salons.html
4,Something about DNS,yxhuvud,http://cdybedahl.github.io/
6,An Open Letter to Tony Hsieh,julespitt,http://danieltenner.com/2015/05/11/an-open-letter-to-tony-hsieh/
6,Free Kindle EBook – DIY VPN and Smart DNS,virtualjj,
65,Re:publica 15: Google Promotes Privacy But Not Too Much,kricko,https://tutanota.de/blog/posts/republica-google-promotes-privacy-but-not-too-much
14,What it’s like to run Google’s $2B venture capital fund,prostoalex,http://qz.com/399232/what-its-like-to-run-googles-2-billion-venture-capital-fund/
274,Git in six hundred words,monsterix,http://maryrosecook.com/blog/post/git-in-six-hundred-words
5,Let Over Lambda–50 Years of Lisp,pykello,http://letoverlambda.com/
208,The Killing of Osama Bin Laden,clarkm,http://www.lrb.co.uk/v37/n10/seymour-m-hersh/the-killing-of-osama-bin-laden
3,Screen space projected grid with GLSL and WebGL,mariuz,http://jeremybouny.fr/en/articles/screen_space_grid/
3,Lessons from Tracking My Productivity and Sleep,muneeb,https://medium.com/@muneeb/my-obsession-with-personal-analytics-3db6f4e0d690
66,Google Map Maker will be temporarily unavailable for editing,chippy,https://productforums.google.com/forum/?hl=en#!category-topic/map-maker/news-and-announcements/crFEbGXJ-HI
1,Interested in building a new credentialing system? HackerRank is hiring PMs,rvivek,
7,IBM's Watson Designed the Worst Burrito I've Ever Had,simonster,http://www.fastcodesign.com/3045147/ibms-watson-designed-the-worst-burrito-ive-ever-hadestination=http://www.fastcodesign.com/3045147/ibms-watson-designed-the-worst-burrito-ive-ever-had
5,Adverts for robot housekeepers are terrifying a lot of people,byaruhaf,http://mashable.com/2015/05/11/persona-synthetics-advert-robot/
153,Rtop – agentless sever monitoring tool built with Go,kylequest,http://www.rtop-monitor.org/
7,The Return of Perry Rhodan (1998),Tomte,https://www.sfsite.com/vault/john38.htm
4,Report accuses Obama of lying about bin Laden killing,jaboutboul,http://www.cnn.com/2015/05/11/politics/seymour-hersh-obama-bin-laden-raid-lied/
6,Brief history of the 160 character length of SMS (2009),e12e,http://latimesblogs.latimes.com/technology/2009/05/invented-text-messaging.html
19,Ask HN: Do you feel Excel is dangerously overused?,Dwolb,
71,A Response to “What's the Point of a Professor?”,slvv,http://www.thetattooedprof.com/archives/356#comment-1030
120,The Texas Instruments TMX 1795: the first forgotten microprocessor,dezgeg,http://www.righto.com/2015/05/the-texas-instruments-tmx-1795-first.html
27,What kind of jobs do the software engineers who earn $500K a year do?,signa11,http://www.aminariana.com/essays/million-dollar-handcuffs
7,Killing Off Characters Won't Fix 'Game of Thrones',bradbo,http://www.forbes.com/sites/erikkain/2015/05/11/killing-off-characters-wont-fix-game-of-thrones/
160,Your cyberpunk games are dangerous,jgrahamc,http://boingboing.net/2015/05/08/your-cyberpunk-games-are-dange.html
11,Only positive drug studies have a good chance of being published,greenyoda,http://www.salon.com/2015/04/25/drug_companies_arent_telling_you_the_whole_truth/
147,Fundraising While Female,doppp,http://advice.datingring.com/fundraising-while-female/
7,Introducing Passcards Your Digital Identity,larrysalibra,http://blog.onename.com/passcards/
4,Linux Mint Will Continue to Provide Both Systemd and Upstart,Errorcod3,http://news.softpedia.com/news/Linux-Mint-Will-Continued-to-Provide-Both-Systemd-and-Upstart-Users-Will-Choose-480758.shtml
86,Linux kernel initialization part 8,0xAX,https://github.com/0xAX/linux-insides/blob/master/Initialization/linux-initialization-8.md
26,Social referral hacking,pfista,http://michaelpfister.com/2015/05/10/social-referral-hacking.html
6,The history of lead in gasoline (2005) [pdf],afarrell,http://www.radford.edu/~wkovarik/ethylwar/IJOEH.pdf
120,Autonomous truck cleared to drive on US roads for the first time,edward,http://www.newscientist.com/article/dn27485-autonomous-truck-cleared-to-drive-on-us-roads-for-the-first-time.html#.VU-vqfSNFuE
4,TxRep was designed as an enhanced replacement of the AutoWhitelist plugin,edward,https://wiki.apache.org/spamassassin/TxRep
8,Ask HN: Any successful startups that is founded by a designer?,taylorling,
148,Show HN: Turn GNU command line tools into SaaS – Stupid Hackathon Project,diafygi,https://github.com/diafygi/gnu-pricing
6,Ski Lifts in a Tropical City? An Indonesian Answer to Gridlock,adventured,http://www.bloomberg.com/news/articles/2015-05-10/ski-lifts-in-a-tropical-city-an-indonesian-answer-to-gridlock
38,Sweden rejects Assange appeal to drop arrest warrant,ghosh,http://www.bbc.com/news/world-europe-32688063?ocid=socialflow_twitter
6,NASA rover captures stunning blue sunset on Mars tweets ‘let us go you and I’,bandrami,http://indianexpress.com/article/technology/science/nasa-rover-captures-stunning-blue-sunset-on-mars-tweets-let-us-go-you-and-i/
260,Typedrummer,moritzplassnig,http://typedrummer.com
4,Uber Funding Talks Highlight the Speedy Pace of Investments,carlchenet,http://www.nytimes.com/2015/05/11/technology/uber-valuation-highlights-the-speedy-pace-of-investments.html
45,Let's Crowd-Write a GitHub Novel,why-el,https://github.com/why-el/crowd-written-novel
157,Anko – Pleasant Android development in Kotlin,ericweyant,https://github.com/JetBrains/anko
18,Discounts for developers who happen to be students,bepolite,https://github.com/najela/discount-for-student-dev
216,Code Review Best Practices,Kaedon,http://kevinlondon.com/2015/05/05/code-review-best-practices.html
6,60 Days of Watching Hackers Attack Elasticsearch,jwcrux,http://jordan-wright.github.io/blog/2015/05/11/60-days-of-watching-hackers-attack-elasticsearch/
5,vi vs. Emacs: The Oldest Rivalry in Computing,rbanffy,http://www.slate.com/articles/technology/bitwise/2014/05/oldest_software_rivalry_emacs_and_vi_two_text_editors_used_by_programmers.html
103,SKYNET: Applying Advanced Cloud-Based Behavior Analytics [pdf],Errorcod3,http://cryptome.org/2015/05/nsa-skynet-intercept-15-0507.pdf
122,Chat Wars: Microsoft vs. AOL (2014),ingve,https://nplusonemag.com/issue-19/essays/chat-wars/
27,Show HN: Summarise – A personal talking wake-up alarm for iOS,AndrewHart,https://itunes.apple.com/app/id986735499
1,Edyn (YC W14) is looking for Node.js engineers to build smart gardening sensors,jasonlaramburu,https://angel.co/edyn/jobs/43482-back-end-engineer
178,Django 1.8 and Python 3: Complex app tutorial end-to-end,dlcmh,http://www.marinamele.com/taskbuster-django-tutorial
72,The World Religions Tree (huge visualization),dirtyaura,http://000024.org/religions_tree/religions_tree_4.html
342,Scroll Back: The Theory and Practice of Cameras in Side-Scrollers,sp332,https://docs.google.com/document/d/1iNSQIyNpVGHeak6isbP6AHdHD50gs8MNXF1GCf08efg/pub
422,210 Zappos employees – 14% of the staff – take buyouts after CEO ultimatum,jhonovich,http://www.businessinsider.com/zappos-employees-take-buyouts-new-self-management-structure-2015-5
89,Ask HN: How to talk smart?,youngtolearn,
26,Machinery: An asynchronous task/job queue for Golang,richardknop,https://github.com/RichardKnop/machinery
6,Put.io doubled storage of all plans,refik,https://twitter.com/putdotio/status/596790555734061056
40,A Look at Altera's OpenCL SDK for FPGAs,luu,http://www.anandtech.com/show/7334/a-look-at-alteras-opencl-sdk-for-fpgas
4,Hacker News London Meet-Up – May 21st,Peroni,http://www.meetup.com/HNLondon/events/222449176/
6,Snowden warns Australia: 'You are being watched',stanislavb,http://mashable.com/2015/05/10/edward-snowden-australia-data-retention/
6,Can we fix the 'fear of failure' in Europe to stimulate entrepreneurship?,robinwauters,http://tech.eu/inside/4584/fail-better/
221,Computational Hydrographic Printing [video],bpierre,https://www.youtube.com/watch?v=YlUhPrAqiY0
183,Harvard engineering students devise BBQ smoker,mhb,http://www.bostonglobe.com/metro/2015/05/05/harvard-class-cooks-ultimate-bbq-smoker/0O4fLQ0rbt9qMGsllPoTjK/story.html?p1=Article_Trending_Most_Viewed#
219,Stupid certificate tricks,ryan-c,https://rya.nc/cert-tricks.html
134,Ask HN: If I were your dream hire would you hire me? I live in Somalia,xtrumanx,
19,“Map Maker will be temporarily unavailable for editing starting May 12”,nilsjuenemann,https://productforums.google.com/forum/#!category-topic/map-maker/news-and-announcements/crFEbGXJ-HI
48,Show HN: Servant – A Haskell web framework with type-level API DSL,jkarni,http://haskell-servant.github.io/
3,PHP hash comparison flaw is a risk for million users,paganinip,http://securityaffairs.co/wordpress/36732/hacking/php-hash-comparison-flaw.html
248,Whoever Is Leaking Trans-Pacific Partnership Drafts: Please Leak More,DiabloD3,http://motherboard.vice.com/read/whoever-is-leaking-trans-pacific-partnership-drafts-please-leak-more
4,The dangers of SSH tunnel nesting: Generating 200MB of traffic from 1 byte,fla,https://www.youtube.com/watch?v=8QlNUzWB-iI
3,Tackling the awkward squad: monadic input/output concurrency  in Haskell,nathankot,http://research.microsoft.com/en-us/um/people/simonpj/papers/marktoberdorf/
4,Jack Barsky worked at top US firms and lived normally–while spying for the USSR,NN88,http://www.cbsnews.com/news/former-kgb-spy-jack-barsky-steve-kroft-60-minutes/
4,Decentralized trust model (web of trust),cranium,http://en.wikipedia.org/wiki/Web_of_trust
91,First Firefox OS Smartphones in Africa,igravious,https://blog.mozilla.org/blog/2015/05/08/orange-launches-first-firefox-os-smartphones-in-africa/
59,The abundance of JavaScript libraries,velmu,http://joonaspajunen.com/the-abundance-of-javascript-libraries
3,Lost in Space: Half of All Stars Are Rogues Between Galaxies,kaybe,http://www.space.com/27682-rogue-stars-between-galaxies.html
4,Wayland on Gnome 3.16: New generation of desktop,paulcarroty,https://www.youtube.com/watch?v=N8dR8azaSEs
3,Glass delusion,andyjohnson0,http://en.wikipedia.org/wiki/Glass_delusion
94,Introduction to Object-Oriented JavaScript,Garbage,https://developer.mozilla.org/en-US/docs/Web/JavaScript/Introduction_to_Object-Oriented_JavaScript
4,Apple Watch hacked a developer runs a web browser on it,paganinip,http://securityaffairs.co/wordpress/36724/hacking/apple-watch-hacked.htmlhttp://securityaffairs.co/wordpress/36724/hacking/apple-watch-hacked.html
4,Entrepreneurship is Not Business,tathan,http://takisathanassiou.com/entrepreneurship-is-not-business/
11,Ask HN: Digital Ocean vs. AWS,davismwfl,
4,Investigation and Analysis of Anomalous Electromagnetic Propulsion Devices,api,http://www.slideshare.net/mobile/KurtZeller/investigation-and-analysis-of-anomalous-electromagnetic-propulsion-devices-41315-46946953
246,React JS Best Practices,lopatin,http://blog.siftscience.com/blog/2015/react-applications-that-scale
4,Courting Controversy: Jesselyn Radack,zz1,http://www.more.com/news/personalities/courting-controversy
6,Jitsu: Just-in time summoning of unikernels,amirmc,http://blog.acolyer.org/2015/05/11/jitsu-just-in-time-summoning-of-unikernels/
17,Ask HN: I am giving up early on things I want to achieve.What is the way forward?,newsignup,
987,Postgres gets support for upsert,anarazel,http://git.postgresql.org/gitweb/?p=postgresql.git;a=commit;h=168d5805e4c08bed7b95d351bf097cff7c07dd65
3,World’s first 6TB SSD will be available to buy in July,neverminder,http://www.geek.com/chips/worlds-first-6tb-ssd-will-be-available-to-buy-in-july-1622377/
71,Haskell at Front Row Education,mightybyte,https://github.com/commercialhaskell/commercialhaskell/blob/master/usage/frontrow.md
75,Overkill,danso,http://www.newyorker.com/magazine/2015/05/11/overkill-atul-gawande/
9,The US payday loans crisis,japhyr,http://www.theguardian.com/us-news/2015/may/09/us-payday-loans-crisis-borrow-100-to-make-ends-meet-owe-36-times-that-sum
74,Accused of Spying for China Until She Wasn’t,dredmorbius,http://www.nytimes.com/2015/05/10/business/accused-of-spying-for-china-until-she-wasnt.html
4,Why Apps Need a New Data Center Stack,Errorcod3,http://techcrunch.com/2015/05/10/why-apps-need-a-new-data-center-stack/
5,Spooky Quantum Action Might Hold the Universe Together,sunsu,http://www.wired.com/2015/05/spooky-quantum-action-might-hold-universe-together/
26,How to Survive 80+ Hours of Programming Every Week,sauldcosta,https://medium.com/@scosta/how-to-survive-80-hours-of-programming-every-week-3cc1db75695a
50,OpsDash Self-hosted server and service monitoring,andor,http://www.opsdash.com/
66,Syncify.js – Eliminates the need for callbacks in the browser,dgellow,https://github.com/aldonline/syncify
252,The Discovery of Apache ZooKeeper’s Poison Packet,gregone,http://www.pagerduty.com/blog/the-discovery-of-apache-zookeepers-poison-packet/
268,UN Experts Say TPP and Fast Track Threaten Human Rights,DiabloD3,https://www.eff.org/deeplinks/2015/05/how-tpp-and-fast-track-threaten-human-rights
20,A computing scientist's approach to a once-deep theorem of Sylvester's (1988),deanmen,https://www.cs.utexas.edu/users/EWD/transcriptions/EWD10xx/EWD1016.html
1,Memebox (YC W14) is hiring an iOS developer lead,memebox,https://jobs.lever.co/memebox/f623326e-7256-4527-a839-f366028171cb
81,Floating city project,hernantz,http://www.seasteading.org/
55,Show HN: OhMyPocket – Open-source version of getpocket.com,zhy0216,https://github.com/zhy0216/random-read
14,A Quick Spin Around the Big Dipper,dnetesn,http://nautil.us/issue/19/illusions/a-quick-spin-around-the-big-dipper?utm_source=tss&utm_medium=desktop&utm_campaign=linkfrom
49,Where’s The Beef?,firebones,http://fivethirtyeight.com/features/wheres-the-beef/
14,Game or Cult? The Alternate Reality of the Jejune Institute,DiabloD3,http://motherboard.vice.com/read/game-or-cult-the-alternate-reality-of-the-jejune-institute
50,Beyond the PDP-11: Processor support for a memory-safe C abstract machine [pdf],jsnell,http://www.cl.cam.ac.uk/research/security/ctsrd/pdfs/201503-asplos2015-cheri-cmachine.pdf
30,Jellyfish: GPU rootkit PoC,adamnemecek,https://github.com/x0r1/jellyfish
3,IBM’s Watson Wants to Help Pick a Therapist for You,doppp,http://techcrunch.com/2015/05/10/ibms-watson-wants-to-help-pick-a-therapist-for-you/
55,Arq for Windows finally available,bvrlt,https://www.arqbackup.com/arq-for-windows/
7,Show HN: Transfer data over sound,rraval,https://github.com/rraval/pied-piper
6,The Synthesizer Generator (1984) [pdf],luu,http://www.ics.uci.edu/~andre/ics228s2006/repsteitelbaum.pdf
396,Take the Money and Run,nkohari,http://nate.io/posts/take-the-money-and-run.html
5,Show HN: VimBox – Modern MacVim Configuration,jordwalke,https://github.com/jordwalke/vimbox
4,The AI Breakthrough That Won’t Happen,zekers,http://pointersgonewild.com/2015/05/10/the-ai-breakthrough-that-wont-happen/
275,A re-introduction to JavaScript,hikz,https://developer.mozilla.org/en-US/docs/Web/JavaScript/A_re-introduction_to_JavaScript
23,The Science of Craving,dgallagher,http://moreintelligentlife.com/content/features/wanting-versus-liking?page=full#_
114,There’s more to mathematics than rigour and proofs,jonnybgood,https://terrytao.wordpress.com/career-advice/there%E2%80%99s-more-to-mathematics-than-rigour-and-proofs
293,Under the hood: Facebook’s cold storage system,slyall,https://code.facebook.com/posts/1433093613662262/-under-the-hood-facebook-s-cold-storage-system-/?hn=1
9,Goldman Sachs Invests in Bitcoin Startup Circle Internet Financial,ghosh,http://www.latimes.com/business/la-fi-goldman-sachs-bitcoin-20150430-story.html?utm_content=bufferf7c8c&utm_medium=social&utm_source=twitter.com&utm_campaign=buffer
155,Implementing a Virtual Machine in C,freefouran,http://www.blog.felixangell.com/virtual-machine-in-c/
48,Why we should't judge a country by its GDP,plumeria,http://ideas.ted.com/why-we-shouldnt-judge-a-country-by-its-gdp/
37,Engineer creates a 3D metal printer prototype for $2 using electroplating,praptak,http://www.3ders.org/articles/20150301-low-cost-metal-3d-printing-made-possible-with-electroplating-technology-and-prototype.html
55,Microsoft nixes ActiveX add-on technology in new Edge browser,uladzislau,http://www.computerworld.com/article/2920892/web-browsers/microsoft-nixes-activex-add-on-technology-in-new-edge-browser.html
4,New FarmLogs Alerts Put Crop Health in Crosshairs,denzil_correa,http://www.agweb.com/article/new-farmlogs-alerts-put-crop-health-in-crosshairs-NAA-chris-bennett/
83,A Java EE Startup: Filtering information with zeef.com,john-waterwood,http://www.adam-bien.com/roller/abien/entry/a_java_ee_startup_filtering
305,Unison: a next-generation programming platform,adamwk,http://unisonweb.org/2015-05-07/about.html
336,How to Build a Unicorn and Walk Away with Nothing,whbk,http://heidiroizen.tumblr.com/post/118473647305/
43,Why People Are Irrational about Politics,aylons,http://spot.colorado.edu/~huemer/irrationality.htm
157,CλaSH – From Haskell to Hardware,jdmoreira,http://www.clash-lang.org/
16,Dodging Abilify,luu,http://wp.rxisk.org/dodging-abilify/
83,Video game execution watched by 325K players,cpeterso,http://www.theguardian.com/technology/2015/may/08/video-game-execution-guild-wars-2-arena-net
5,Hashdown stores your text content in url hash nothing is stored on server,panggit,http://www.hashdown.net/edit.html
268,Full text search in milliseconds with PostgreSQL,maxnov,https://blog.lateral.io/2015/05/full-text-search-in-milliseconds-with-postgresql/
37,PC-BSD 10.1.2-RC1 Now Available,tete,http://blog.pcbsd.org/2015/05/pc-bsd-10-1-2-rc1-now-available/
3,Cracking Stern's SPIKE pinball platform,misentropy,http://misentropic.com/spike_cracked.html
8,Icosahedron disjoint visual effect,michaelsbradley,http://timothypratley.blogspot.com/2015/05/icosahedron-disjoint-visual-effect.html
8,Rkt Appc and Docker: A Take on the Linux Container Upstream,bryanlarsen,http://rhelblog.redhat.com/2015/05/05/rkt-appc-and-docker-a-take-on-the-linux-container-upstream/
30,Understanding ECMAScript 6,miralabs,https://leanpub.com/understandinges6/read/
32,Don't believe Orson Welles,drjohnson,http://www.spectator.co.uk/arts/arts-feature/9520712/dont-believe-orson-welles-says-his-biographer-simon-callow-especially-when-he-calls-himself-a-failure/
36,Dart's Macro Language,tosh,https://docs.google.com/document/d/1-We05W0xsd5hTWGsTDCY6pibf2EmmTAsm-4EhIFZoOA/
13,Inaugural SF Stupid Hackathon – Presentations Today,rfong,
8,The Human Upgrade – The Revolution Will Be Digitized,henk53,http://www.washingtonpost.com/sf/national/2015/05/09/the-revolution-will-be-digitized
36,What's the Point of a Professor?,mikemajzoub,http://www.nytimes.com/2015/05/10/opinion/sunday/whats-the-point-of-a-professor.html?hp&action=click&pgtype=Homepage&module=c-column-top-span-region&region=c-column-top-span-region&WT.nav=c-column-top-span-region&_r=0
39,“Superfish is currently transitioning our focus”,taspeotis,http://www.home.superfish.com/
22,Ad Injection at Scale: Assessing Deceptive Advertisement Modifications [pdf],us0r,https://static.googleusercontent.com/media/research.google.com/en//pubs/archive/43346.pdf
104,Remind HN: Call your mother,rquantz,
163,The CHIP Is a $9 Computer That Can Almost Do It All,Errorcod3,http://techcrunch.com/2015/05/08/the-chip-is-a-9-computer-that-can-almost-do-it-all/
