SCORE,TITLE,BY,URL
104,Ask HN: How much money does an average VC make?,srameshc,
71,Next Chapter,TimWolla,http://blog.nodejs.org/2015/05/08/next-chapter/
8,The transition to Ember 2.0 in detail,steveklabnik,http://emberjs.com/blog/2015/05/10/run-up-to-two-oh.html
6,EFF Case Analysis: Appeals Court Rules NSA Phone Records Dragnet Is Illegal,DiabloD3,https://www.eff.org/deeplinks/2015/05/eff-case-analysis-appeals-court-rules-nsa-phone-records-dragnet-illegal
8,On Designing and Deploying Internet-Scale Services (2007),joeclef,https://www.usenix.org/legacy/event/lisa07/tech/full_papers/hamilton/hamilton_html/index.html
3,Ancient Babylonian Tablet Is Oldest Customer Service Complaint Ever Discovered,bandrami,http://www.ancient-origins.net/artifacts-ancient-writings/4000-year-old-ancient-babylonian-tablet-oldest-complaint-020313
7,Interview with Clojure-Loving Dan Hammer about Open Source Deforestation Project,MissInterpret,http://clojureforscience.novonon.com/?p=53
41,What is the appeal of dynamically-typed languages?,luu,https://gist.github.com/non/ec48b0a7343db8291b92
10,Solid-state drives lose data if left without power for just a few days,velodrome,http://www.zdnet.com/article/solid-state-disks-lose-data-if-left-without-power-for-just-a-few-days/
5,What are your pain points?,adrianbg,
5,Ask HN: Does your project use Emacs lisp for build automation?,christianbryant,
4,The program that ate itself,nl,http://pastebin.com/TV2spnu6
15,Ask a Hostage Negotiator: What's the Best Way to Get a Raise?,SonicSoul,http://www.theatlantic.com/business/archive/2015/04/ask-a-hostage-negotiator-whats-the-best-way-to-talk-about-a-raise/391943/?single_page=true
5,Activists Turn Tables on Political Surveillance Hawks,christianbryant,http://falkvinge.net/2015/01/14/hilarious-activists-turn-tables-on-political-surveillance-hawks-wiretaps-them-with-honeypot-open-wi-fi-at-security-conference/
87,FFI from Go to Rust,steveklabnik,https://github.com/medimatrix/rust-plus-golang
4,Ask HN: Games with good API?,duiker101,
14,The trojan Emoji,krogsgard,https://poststatus.com/the-trojan-emoji/
18,Show HN: Edit and convert between Markdown Org HTML and more in your browser,osener,http://markup.rocks
170,Django Community Survey,jsmeaton,https://www.djangoproject.com/weblog/2015/may/07/community-survey/
57,Berlin startup Blacklane serves more cities and airports worldwide than Uber,robinwauters,http://tech.eu/features/4507/blacklane-jens-wohltorf-interview/
40,The Counterculture Is Better in the Suburbs,proveanegative,http://www.triggerwarning.us/the-counterculture-is-better-in-the-suburbs/
9,Ask HN: Whats the best way to get a Product Manager role?,pmrd,
4,Uber Is Looking for Another $1.5B in Funding at a $50B Valuation,minimaxir,http://techcrunch.com/2015/05/09/uber-50-billion/
14,Programming Isn't Manual Labor but It Still Sucks,fredkelly,http://mashable.com/2014/04/30/programming-sucks/
7,Why Lawsuits Are on the Rise at Startups and What to Do About It,bootload,http://www.bothsidesofthetable.com/2015/05/10/why-your-co-founder-may-just-sue-you/
15,The Formation of a Blast Wave by a Very Intense Explosion (1950) [pdf],anacleto,http://www3.nd.edu/~powers/ame.90931/taylor.blast.wave.II.pdf
21,Is the Universe a Giant Computer Simulation? Here's the Evidence,DiabloD3,http://motherboard.vice.com/read/is-the-universe-a-giant-computer-simulation-heres-the-evidence
3,Why enforce development dependencies? Use Nginx+lua to serve LESS/SASS and ES6,titpetric,https://github.com/titpetric/nginx-lesscss
8,Show HN: We made a Buy Button for real estate,rgbrgb,https://chrome.google.com/webstore/detail/buy-this-home-with-open-l/bldldniiddmphkkghbibggfampdgpefc
9,A Lisp syntax with less parentheses,jiyinyiyong,https://medium.com/@jiyinyiyong/a-lisp-syntax-with-less-parentheses-915384011008
7,Can I get a good job as an iOS developer after learning just Swift,uofmihnea,
29,MMIX 2009,chipsy,http://www-cs-faculty.stanford.edu/~uno/mmix.html
33,Free Open-Source OCR Software for Windows and the Web,booston,http://blog.a9t9.com/p/free-ocr-software.html
3,The technique behind laminated dough used for pastry puff pastry croissant,ezl,http://www.kvalifood.com/recipes/the-technique-behind-laminated-dough-used-for-pastry-puff-pastry-croissant-etc
5,Show HN: Curated database of awesome dinosaur pictures,typpo,http://dinosaurpictures.org/
14,Jet – Lightweight Realtime Message Bus for the Web,ChrisGaudreau,http://jetbus.io/
533,Facebook PathPicker,ben_hall,http://facebook.github.io/PathPicker/
84,Hasura – A Batteries-included App Development Platform,mataug,http://hasura.io/
7,My Mom the Homeless Man the Prostitute and the Jamaican with 8 Fingers,strukturedkaos,http://donpottinger.net/blog/2015/05/04/my-mom.html
47,Parallel STL,wfunction,https://parallelstl.codeplex.com/
221,Accepting payments is getting harder,jaredtobin,https://medium.com/@folsen/accepting-payments-is-getting-harder-1b2f342e4ea
11,Show HN: Open source password manager for GNU/Linux,nvr82,https://github.com/nrosvall/fort
76,Andrew Ng: Why 'Deep Learning' Is a Mandate for Humans Not Just Machines,prostoalex,http://www.wired.com/2015/05/andrew-ng-deep-learning-mandate-humans-not-just-machines/
126,In Mathematics Mistakes Aren’t What They Used to Be,tosh,http://www.nautil.us/issue/24/error/in-mathematics-mistakes-arent-what-they-used-to-be
103,EFF Asks Patent Office to Focus on Protecting Public from Bad Patents,DiabloD3,https://www.eff.org/deeplinks/2015/05/eff-asks-patent-office-focus-protecting-public-bad-patents
17,Does donation matching work?,luu,http://www.benkuhn.net/matching
40,Ask HN: What will be the future for email?,anacleto,
53,Are There Deep Reasons Underlying the Pathologies of Deep Learning Algorithms? [pdf],Jach,http://goertzel.org/DeepLearning_v1.pdf
37,Despite DNA the Rapist Got Away,nkzednan,http://www.nytimes.com/2015/05/10/opinion/sunday/nicholas-kristof-despite-dna-the-rapist-got-away.html
54,Under the Hood of Xcode Server,joeblau,http://honzadvorsky.com/blog/2015/5/4/under-the-hood-of-xcode-server
6,Apple TV Remote Expected to Add Touch Pad in Redesign,karmakaze,http://www.nytimes.com/2015/05/05/technology/apple-tv-remote-expected-to-add-touch-pad-in-redesign.html
3,Organic Electronics Deliver Pain-Canceling Molecules,aylons,http://spectrum.ieee.org/tech-talk/biomedical/devices/organic-electronics-deliver-pain-canceling-molecules
56,Human Eyes Are Wired Backwards,CrocodileStreet,https://theconversation.com/look-your-eyes-are-wired-backwards-heres-why-38319
24,Watch: Engineers 3D Printed a Model Jet Engine Then Started it Up,downandout,http://www.gereports.com/post/118394013625/light-my-fire-ge-engineers-3d-printed-a-model-jet
41,Spotify as a simple case study in making something people want,gedrap,http://blog.garrytan.com/spotify-as-a-simple-case-study-in-making-something-people-want
52,It’s Not a ‘Stream’ of Consciousness,pldpld,http://www.nytimes.com/2015/05/10/opinion/sunday/its-not-a-stream-of-consciousness.html
415,The Psychology of Pricing: A Gigantic List of Strategies,nkolenda,http://www.nickkolenda.com/psychological-pricing-strategies/
74,Researchers reverse bacterial resistance to antibiotics,ca98am79,http://www.kurzweilai.net/researchers-reverse-bacterial-resistance-to-antibiotics?utm_source=KurzweilAI+Daily+Newsletter&utm_campaign=25c9e284af-UA-946742-1&utm_medium=email&utm_term=0_6de721fb33-25c9e284af-281895037
4,Uber Is Looking for Another $1.5B in Funding at a $50B Valuation,yla92,http://techcrunch.com/2015/05/09/uber-50-billion
28,The Open Source Web Performance Dashboard,soulislove,http://www.peterhedenskog.com/blog/2015/04/open-source-performance-dashboard/
11,Impossible Dream: Computing e to 116000 Places with a Personal Computer (1981) [pdf],Someone,http://www.downloads.reactivemicro.com/Public/Users/Grant_Stockley/Apple%202%20Woz%20e%20Calc%201981.pdf
85,In Getting Work by Ella Frost We Ate Our Own Dog Food,trentmc,http://blog.ascribe.io/we-just-ate-our-own-dog-food/
8,Show HN: Over engineered weekend project to aggregate top Reddit r/aww posts,ukjadoon,http://topcuteanimals.com
7,Ultimate validation,mijustin,http://justinjackson.ca/ultimate-validation/
5,“Would you choose a coding bootcamp or a computer science related degree? Why?”,brux,http://www.quora.com/Would-you-choose-a-coding-bootcamp-or-a-computer-science-related-degree-Why?share=1
79,Output of Dutch solar bike lane exceeds expectations,Rafert,https://translate.google.com/translate?sl=nl&tl=en&js=y&prev=_t&hl=nl&ie=UTF-8&u=http%3A%2F%2Ftweakers.net%2Fnieuws%2F102994%2Fopbrengst-fietspad-met-geintegreerde-zonnepanelen-is-boven-verwachting.html&edit-text=
39,How do you dismantle a nuclear submarine?,otoolep,http://www.bbc.com/future/story/20150330-where-nuclear-subs-go-to-die
67,Fast Approximate Logarithms Part I: The Basics,r4um,http://www.ebaytechblog.com/2015/05/01/fast-approximate-logarithms-part-i-the-basics/
7,How Tor Works: Part Two – Relays vs. Bridges,jwcrux,http://jordan-wright.github.io/blog/2015/05/09/how-tor-works-part-two-relays-vs-bridges/
147,Gonix – Unix tools written in Go,polegone,https://github.com/polegone/gonix
113,Memory Layouts for Binary Search,rcfox,http://cglab.ca/~morin/misc/arraylayout/
218,Join the Engineering Leisure Class,ChrisLoer,https://medium.com/@chrisloer/join-the-engineering-leisure-class-b3083c09a78e
101,This is what happens after you die,otoolep,http://mosaicscience.com/story/what-happens-after-you-die
181,The Best and Worst Places to Grow Up in the U.S.,nepstein,http://www.nytimes.com/interactive/2015/05/03/upshot/the-best-and-worst-places-to-grow-up-how-your-area-compares.html
34,The nine dollar computer,Stronico,https://www.kickstarter.com/projects/1598272670/chip-the-worlds-first-9-computer
54,What afl-fuzz is bad at,doty,http://blog.regehr.org/archives/1238
73,The Hezbollah Connection,bootload,http://www.nytimes.com/2015/02/15/magazine/the-hezbollah-connection.html
240,When Is Cheryl's Birthday?,jonp,http://nbviewer.ipython.org/url/norvig.com/ipython/Cheryl.ipynb
3,Creatures Avoiding Planks,gigasquid,http://blog.otoro.net/2015/05/07/creatures-avoiding-planks/
28,Ask HN: Is it sane to ask for a non Apple PC when starting at startup?,VeriPine,
6,This Team Used Apache Cassandra You Won't Believe What Happened Next,pixelmonkey,http://blog.parsely.com/post/1928/cass/
166,Why Open Source Startups Fail,simas,http://techcrunch.com/2015/04/12/the-real-reason-open-source-startups-fail/
6,The great unraveling of globalization,Futurebot,http://www.washingtonpost.com/business/reconsidering-the-value-of-globalization/2015/04/24/7b5425c2-e82e-11e4-aae1-d642717d8afa_story.html
594,Android Is Peeing on an Apple in Pakistan - Google Maps,ezhik_,https://www.google.com/maps/place/33%C2%B030%2752.5%22N+73%C2%B003%2733.2%22E/@33.511743173.055874815z/data=!4m2!3m1!1s0x0:0x0
14,The Asshole Factory,rwc,https://medium.com/bad-words/the-asshole-factory-71ff808d887c
275,Microsoft Is the New Google Google Is the Old Microsoft,hashx,http://www.forbes.com/sites/gordonkelly/2015/02/18/microsoft-google-swap/?
241,Show HN: Restore tmux environment after a system restart,brunosutic,https://github.com/tmux-plugins/tmux-resurrect
170,Atlantropa,luu,https://en.wikipedia.org/wiki/Atlantropa
6,How Russians Lost the War,dawkins,http://mobile.nytimes.com/2015/05/09/opinion/mikhail-shishkin-how-russians-lost-the-war.html
100,LeakCanary: Detect all Android memory leaks,juandg,https://corner.squareup.com/2015/05/leak-canary.html
460,PyPy.js: A fast compliant Python implementation for the web,doublextremevil,http://pypyjs.org/
27,Ask HN: What can I do to improve social skills?,angleofatt,
198,GitHub and Jupyter IPython Notebooks,benn_88,https://github.com/blog/1995-github-jupyter-notebooks-3
44,Carnac the Magnificent,smcgivern,http://raganwald.com/2015/05/08/carnac-the-magnificent.html
7,Peter Thiel Is Wrong About Lean Startups,cpeterso,http://techcrunch.com/2015/05/09/peter-thiel-is-wrong-about-lean-startups/
10,Nibblesort: Adventures in Optimization,jsnell,http://belkadan.com/blog/2015/05/Nibblesort/
20,The Science of Craving,sergeant3,http://moreintelligentlife.com/content/features/wanting-versus-liking
9,The NSA named one of its top-secret programs Skynet,hobs,http://www.theverge.com/2015/5/9/8577515/nsa-skynet-program-is-real
472,NASA's Radar Found 4 Men Trapped in Rubble in Nepal by Their Heartbeats,kaa2102,http://gizmodo.com/nasas-radar-found-4-men-trapped-in-rubble-in-nepal-by-t-1702553957
35,Show HN: rust-rss – library for serializing the RSS web content format,frewsxcv,https://github.com/frewsxcv/rust-rss
214,Microsoft Surface Hub,SanderMak,https://www.microsoft.com/microsoft-surface-hub/en-us
56,Floating Point Routines for the 6502 (1976),acqq,http://www.6502.org/source/floats/wozfp1.txt
61,In the Tenderloin,pmcpinto,https://stories.californiasunday.com/2015-05-03/in-the-tenderloin/
383,Racking Mac Pros,zacman85,http://photos.imgix.com/racking-mac-pros
650,U.S. NSA domestic phone spying program illegal: appeals court,dnewms,http://www.reuters.com/article/2015/05/07/us-usa-security-nsa-idUSKBN0NS1IN20150507
108,Finding Closure in Rust,dbaupp,http://huonw.github.io/blog/2015/05/finding-closure-in-rust
40,Magnetic field applied to brain increases acceptance of false statements (2008),monort,http://www.ncbi.nlm.nih.gov/pubmed/19037785
103,Whistleblower accuses cybersecurity company of extorting clients,Osiris,http://money.cnn.com/2015/05/07/technology/tiversa-labmd-ftc/index.html
353,Tmux 2.0 released,byaruhaf,http://sourceforge.net/projects/tmux/files/tmux/tmux-2.0/
3,The World Is Knapsack Problem and We're Just Living in It,rvikmanis,http://motherboard.vice.com/read/the-world-is-knapsack-problem-and-were-just-living-in-it?trk_source=recommended
107,Signal Processing for Everyone (2000) [pdf],primroot,http://www-math.mit.edu/~gs/papers/newsigproc.pdf
6,Google-play-scraper v0.1.0 out,facundo_olano,https://github.com/facundoolano/google-play-scraper
44,Meet the Newest State of Matter,DiabloD3,http://motherboard.vice.com/read/meet-the-newest-state-of-matter-2
37,How music evolves,frrp,http://www.economist.com/news/science-and-technology/21650444-statistical-analysis-music-reveals-truth-about-its-periods
220,Chile is introducing free higher education,rememberlenny,http://www.attn.com/stories/836/chile-makes-college-tuition-free
164,Every freelancer starts out undervaluing their work,philipmorg,http://kenwestgaard.com/the-gurus-got-5-questions-set-rate/
13,The real reason young people are the poorest generation in 25 years,danboarder,http://www.dailydot.com/opinion/millennial-parents-poverty-internet-scapegoat/?fb=ss&prtnr=attn
15,Ask HN: What has changed for developers in the last 20 years,mukundmohan,
141,A Quick Introduction to LXD,tych0,http://blog.scottlowe.org/2015/05/06/quick-intro-lxd/
57,Chemicals in plastics alter the brains of baby boys making them “more feminine”,notsony,http://news.bbc.co.uk/2/hi/health/8361863.stm
85,Python 3 in Science: the great migration has begun,ngoldbaum,http://astrofrog.github.io/blog/2015/05/09/2015-survey-results/
47,A digital skeleton key to access any website,signaler,http://docs.higg.so/2015/03/10/a-digital-skeleton-key-for-accessing-any-website-proposal/
14,‘Hermit of the Jungle’ Guards a Brazilian Ghost City Rich in History,bvrlt,http://www.nytimes.com/2015/05/09/world/americas/airao-velho-brazil-shigeru-nakayama.html?hp&action=click&pgtype=Homepage&module=photo-spot-region&region=top-news&WT.nav=top-news&_r=0
180,Crossing the US in an open-air two-seat aeroplane,smacktoward,http://www.bbc.com/travel/bespoke/story/20150424-a-view-that-puts-window-seats-to-shame/index.html
106,Don Knuth – Constraint Based Music Composition,e7mac,https://www.youtube.com/watch?v=e_1a6bHGQGo
88,Smart watches are dumb,sxates,https://medium.com/@brianscates/lets-be-honest-smart-watches-are-dumb-ec3b2bdb0d73
6,Ask HN: Who uses Oracle and why?,gamesbrainiac,
32,Stone Bracelet May Have Been Made by Denisovans,diodorus,http://www.archaeology.org/news//3270-150507-siberia-denisovan-bracelet
113,IndieWeb,pandatigox,http://indiewebify.me/
84,The tensor renaissance in data science,datascientist,http://radar.oreilly.com/2015/05/the-tensor-renaissance-in-data-science.html
91,Four Years of Success and Failure on the App Store,clarky07,https://medium.com/@clarky07/4-years-of-success-and-failure-on-the-app-store-195dd35bd6a3
4,Scientists Crack a 50-Year-Old Mystery About the Measles Vaccine,soundsop,http://www.npr.org/blogs/goatsandsoda/2015/05/07/404963436/scientists-crack-a-50-year-old-mystery-about-the-measles-vaccine?utm_source=facebook.com&utm_medium=social&utm_campaign=npr&utm_term=nprnews&utm_content=20150508
14,Show HN: Prelaunch sign up app – angular node mongodb Mailgun,eddywashere,https://github.com/eddywashere/node-prelaunch
7,Under the hood: Facebook’s cold storage system,lopatin,https://code.facebook.com/posts/1433093613662262/-under-the-hood-facebook-s-cold-storage-system-/
13,Redesigning Overcast’s Apple Watch App,aaronbrethorst,http://www.marco.org/2015/05/08/overcast-apple-watch-redesign
32,Wang Tiles and Turing Machines (2012),monort,http://grahamshawcross.com/2012/10/12/wang-tiles-and-turing-machines/
90,Show HN: I made a command-line Slack chat client,bkanber,https://github.com/TidalLabs/Slacker
6,Chrome extension pub/sub lib,moejangda,https://github.com/mistermoe/daily-bugle
3,The Sinking of the USS Guitarro (1994),MichaelCrawford,http://catless.ncl.ac.uk/Risks/16.52.html#subj2.1
15,Show HN: Manage your app icons centrally and get notifications for new sizes,sebsebsn,https://resizeappicon.com/icons
40,Quinn – A web framework designed for things to come,betacar,http://quinnjs.com/
22,David Deutsch Explains Why It’s Good to Be Wrong,sasvari,http://nautil.us/blog/david-deutsch-explains-why-its-good-to-be-wrong
23,Highway Networks,rndn,http://arxiv.org/abs/1505.00387
66,Julia founders commercialize language create new startup,henk53,http://economictimes.indiatimes.com/small-biz/startups/julia-founders-commercialise-language-create-new-startup/articleshow/47211869.cms
35,Olympic: Frontier Pre-Release,zmanian,https://blog.ethereum.org/2015/05/09/olympic-frontier-pre-release/
25,What Reddit's 'ridiculous' button tells us about mortality,jackgavigan,http://www.bbc.co.uk/news/blogs-trending-32660378
4,Disavow-above-repository: a repo to help you disavow contributions on GitHub,jambo,https://github.com/disavow/above-repository
12,For Zynga a Journey From the Cloud to Home – and Back Again,boynamedsue,http://blogs.wsj.com/digits/2015/05/08/for-zynga-a-journey-from-the-cloud-to-home-and-back-again/
4,Ask HN: Will the Price of Bitcoins and Alts Skyrocket Again?,cdvonstinkpot,
20,William Gibson: “What would my superpower be? Redistribution of wealth”,kurren,http://www.theguardian.com/lifeandstyle/2015/may/09/q-and-a-william-gibson-interview
4,HTTP for Humans in Swift,DaNmarner,https://github.com/JustHTTP/Just
6,Ask HN: What Code That We Write Today Will Still Be Used in Ten Thousand Years?,MichaelCrawford,
74,How I Got Converted to G.M.O. Food,mortenjorck,http://www.nytimes.com/2015/04/25/opinion/sunday/how-i-got-converted-to-gmo-food.html
9,A scenario planning for interbank payments and Decentralized Ledger Platforms,edward,http://essay.utwente.nl/66966/
322,Why Lisp?,lisper,http://blog.rongarret.info/2015/05/why-lisp.html
4,Skip Googling with Facebook’s New “Add a Link” Mobile Status Search Engine,ot,http://techcrunch.com/2015/05/09/share-without-leaving/
56,The first news article ever written about Apple,shawndumas,http://www.businessinsider.com/first-article-ever-written-about-apple-kilobaud-sheila-clarke-craven-2015-5
647,Talking About Money,craigkerstiens,http://www.kalzumeus.com/2015/05/01/talking-about-money/
20,How to Build a Unicorn from Scratch – And Walk Away with Nothing,jedc,http://heidiroizen.tumblr.com/post/118473647305/how-to-build-a-unicorn-from-scratch-and-walk
5,Robot stitches a grape back together,tarikozket,https://www.youtube.com/watch?v=EOzGQMnRTNw
21,Business Travelers Want to Be Left to Their Own Devices,romefort,http://www.nytimes.com/2015/05/07/business/business-travelers-want-to-be-left-to-their-own-devices.html
55,Ask HN: I feel like I'm in a filter bubble. How can I “expand my horizons”?,rayalez,
171,Tarsnap performance issues in late March most of April,pndmnm,http://mail.tarsnap.com/tarsnap-announce/msg00031.html
102,Problems with Go Get,chiwawa,http://0x74696d.com/posts/go-get-considered-harmful/
65,Internal value representation in PHP 7 part 1,nikic,http://nikic.github.io/2015/05/05/Internal-value-representation-in-PHP-7-part-1.html
272,Spiders Ingest Nanotubes Then Weave Silk Reinforced with Carbon,lelf,http://www.technologyreview.com/view/537301/spiders-ingest-nanotubes-then-weave-silk-reinforced-with-carbon/
3,Windows 10 will be the last Windows: Here's why it's a great thing,assholeblackguy,http://www.hindustantimes.com/technology-topstories/windows-10-will-be-the-last-windows-here-s-why-it-s-a-great-thing/article1-1345717.aspx
17,The Science of Craving,CrocodileStreet,http://moreintelligentlife.com/content/features/wanting-versus-liking?page=full
11,Is There Enough Meat for Everyone?,Red_Tarsius,http://www.gatesnotes.com/Books/Should-We-Eat-Meat?WT.mc_id=04_23_2015_Smil_TbT_tw&WT.tsrc=Twitter
71,The Real Mayors of 'SimCity',samclemens,http://motherboard.vice.com/read/the-real-mayors-of-simcity
74,Gallium Nitride Power Transistors Priced Cheaper Than Silicon,rbanffy,http://spectrum.ieee.org/tech-talk/semiconductors/design/gallium-nitride-transistors-priced-cheaper-than-silicon
30,Choosing a License for Mailpile 1.0,HerraBRE,https://www.mailpile.is/blog/2015-05-08_Choosing_a_License.html
142,Engineering Statistics Handbook,brudgers,http://www.itl.nist.gov/div898/handbook/index.htm
12,Show HN: Buoys – Implicitly Anchored Sketches in Flowing Text,akumpf,http://research.kumpf.cc/2015-Buoys/
12,Ask HN: How do you read your programming books?,atmosx,
5,Ask HN: Depth or breadth?,careeradvice,
31,Elon Musk: The World’s Raddest Man,laacz,http://waitbutwhy.com/2015/05/elon-musk-the-worlds-raddest-man.html
41,On Mathematical Intelligence and How It Grows,__Joker,http://appliedsentience.com/2015/02/10/on-mathematical-intelligence-and-how-it-grows
3,US SOCOM and the Special Forces to Scrutinize Social Media,paganinip,http://securityaffairs.co/wordpress/36693/intelligence/us-socom-social-media.html
21,The right time to refuse a search is always,PeterWhittaker,http://peter-whittaker.com/the-right-time-to-refuse/
5,Allocation Styles (2005),aryehof,https://sites.google.com/site/steveyegge2/allocation-styles
141,Weak Homegrown Crypto Dooms Open Smart Grid Protocol,tptacek,https://threatpost.com/weak-homegrown-crypto-dooms-open-smart-grid-protocol/112680
32,An MIT student who filmed his own brain surgery,rmason,http://www.vox.com/2015/5/2/8532381/steven-keating
3,The Universe Is Still Not a Hologram,Schiphol,http://briankoberlein.com/2015/04/29/the-universe-is-still-not-a-hologram/
211,Go crypto: bridging the performance gap,jgrahamc,https://blog.cloudflare.com/go-crypto-bridging-the-performance-gap/
4,HTML5 Motion Sensing Using the Doppler Effect,datasink,https://danielrapp.github.io/doppler/
6,How Not to Drown in Numbers,pldpld,http://www.nytimes.com/2015/05/03/opinion/sunday/how-not-to-drown-in-numbers.html
76,Unnecessary medical care is harming patients physically and financially,goodJobWalrus,http://www.newyorker.com/magazine/2015/05/11/overkill-atul-gawande
7,Image Scaling Using Deep Convolutional Neural Networks,davidbarker,http://engineering.flipboard.com/2015/05/scaling-convnets
17,JuJu: An Arch-based distro that runs on any Linux distros without root access,modinfo,https://github.com/fsquillace/juju
5,What 9000 years of breeding has done to corn peaches and other crops,tokenadult,https://www.vox.com/2014/10/15/6982053/selective-breeding-farming-evolution-corn-watermelon-peaches
9,Hitler's Drugged Soldiers,todayiamme,http://www.spiegel.de/international/the-nazi-death-machine-hitler-s-drugged-soldiers-a-354606.html
5,Biochemists Create a Programmable Cell Membrane,DiabloD3,http://motherboard.vice.com/read/biochemists-created-a-programmable-cell-membrane
10,Snowden warnt vor Industriespionage durch Geheimdienste,Errorcod3,http://www.spiegel.de/politik/deutschland/edward-snowden-warnt-vor-geheimdienst-industriespionage-a-1032858.html
4,The Next Generation Open Compute Hardware: Tried and Tested,ram535ii,http://anandtech.com/show/9138/open-compute-hardware-tried-and-tested
1,Kamcord is looking for Android Engineers,vecter,https://jobs.lever.co/kamcord/890f2be5-4a0b-4c11-b7c1-9b104081adba
17,Have you pressed the button?,signaler,http://www.brookings.edu/blogs/techtank/posts/2015/04/27-reddit-button?utm_content=bufferf8fb8&utm_medium=social&utm_source=facebook.com&utm_campaign=buffer
10,Tesla has already received an estimated $800M worth of battery orders,ghosh,https://www.yahoo.com/tech/s/tesla-already-received-estimated-800-million-worth-battery-021527137.html
5,Machine Teaching: An Inverse Problem to Machine Learning,baristaGeek,http://www.cccblog.org/2015/05/05/great-innovative-idea-machine-teaching/
9,We Accidentally Turned the Entire Statue of Liberty into a Battery,fraqed,http://io9.com/we-accidentally-turned-the-entire-statue-of-liberty-int-1702334758
8,Ask HN: What's current U.S. law regarding building and deployment of honeypots?,christianbryant,
40,Ask HN: How much equity should I ask for?,Catalyst4NaN,
79,How friendship became a tool of the powerful,sergeant3,http://www.theguardian.com/media/2015/may/07/how-friendship-became-tool-of-powerful
3,Ask HN: What are your daily websites?,bojo,
199,MIT alumni in their 50s,zootar,http://blogs.law.harvard.edu/philg/2015/04/
190,The state of Computer Vision and AI: we are really really far (2012),harperlee,http://karpathy.github.io/2012/10/22/state-of-computer-vision/
