SCORE,TITLE,BY,URL
354,Servo Continues Pushing Forward,robin_reala,http://blog.servo.org/2015/05/01/forward/
401,Test drive of a petrol car,caio1982,http://teslaclubsweden.se/test-drive-of-a-petrol-car
66,Ask HN: Why are Silicon Valley interviews such a drag now?,algoal,
11,Emojineering Part 2: Implementing Hashtag Emoji,cosbynator,http://instagram-engineering.tumblr.com/post/118304328152/emojineering-part-2-implementing-hashtag-emoji
4,The Data That Threatened to Break Physics,pmcpinto,http://nautil.us/issue/24/error/the-data-that-threatened-to-break-physics
4,Move over Raspberry Pi. This startup is building a $9 computer,leephillips,http://arstechnica.com/information-technology/2015/05/move-over-raspberry-pi-this-startup-is-building-a-9-computer/
79,What Hollywood Can Teach Us About the Future of Work,Chinjut,http://www.nytimes.com/2015/05/10/magazine/what-hollywood-can-teach-us-about-the-future-of-work.html
6,Uber Seeks to Raise Up to $2B in New Funding,prostoalex,http://www.wsj.com/article_email/uber-plans-large-new-funding-round-1431137142-lMyQjAxMTA1NzA0ODkwODgwWj
3,Anything is possible. But what is your purpose?,awa-uk,http://www.adventureswithagile.com/anything-is-possible-but-what-is-your-purpose/
4,Jenny – A tool for generating regression tests (2005),gowan,http://burtleburtle.net/bob/math/jenny.html
51,Keurig CEO Blames Coffee Pod DRM for Falling Sales,jonas21,http://techcrunch.com/2015/05/08/keurig-ceo-blames-coffee-pod-drm-for-falling-sales/
10,Io.js Proposal: Join the Node Foundation?,bpp,https://github.com/iojs/io.js/issues/1664
3,California Tells Businesses: Stop Trying to Ban Consumer Reviews (2014),greenyoda,http://www.forbes.com/sites/ericgoldman/2014/09/10/california-tells-businesses-stop-trying-to-ban-consumer-reviews/
6,Assessing Employee Performance: You're Doing It Rong,ericelliott,https://medium.com/javascript-scene/assessing-employee-performance-1a8bdee45c1a
7,José Valim: What's Ahead for Elixir?,andrewmutz,https://www.youtube.com/watch?v=EaP0y4pdKD0
149,The Earl Grey programming language,breuleux,http://breuleux.github.io/earl-grey/
80,How New York and San Francisco's Tight Housing Markets Are Hurting the Economy,raldi,http://www.bloomberg.com/news/articles/2015-05-07/here-s-how-much-new-york-and-san-francisco-s-tight-housing-markets-are-hurting-the-economy
22,“Chip.” $9 computer faster/smaller than a Raspberry Pi,zaaaaz,http://makezine.com/2015/05/07/next-thing-co-releases-worlds-first-9-computer/
1,Watsi is hiring a full-stack engineer,chaseadam17,http://blog.watsi.org/post/83439441964/watsi-is-hiring-a-full-stack-engineer
5,Everything I thought I knew about water in California is wrong,wooster,http://grist.org/food/everything-i-thought-i-knew-about-water-in-california-is-wrong/
9,“Socket activation is a messy mixture of three different things”,vezzy-fnord,https://forums.gentoo.org/viewtopic-t-994548-postdays-0-postorder-asc-start-25.html#7581522
6,Read the NDA a Comcast customer was told to sign to get a $600 refund,Deinos,http://arstechnica.com/business/2015/05/read-the-nda-a-comcast-customer-was-told-to-sign-to-get-a-600-refund/
6,React.js Tutorial Pt 3: Architecting React.js Apps with Flux,tilt,http://tylermcginnis.com/reactjs-tutorial-pt-3-architecting-react-js-apps-with-flux/
10,Ask HN: How to find investors?,Zera,
437,Vault – A tool for managing secrets,eloycoto,https://hashicorp.com/blog/vault.html
4,Shut down your office.  You are now working in Slack,steven,https://medium.com/backchannel/shut-down-your-office-you-now-work-in-slack-fa83cb7cce6c
72,Introducing FIDO: Automated Security Incident Response,akerl_,http://techblog.netflix.com/2015/05/introducing-fido-automated-security.html
85,David Simon on Baltimore’s Anguish,ekianjo,https://www.themarshallproject.org/2015/04/29/david-simon-on-baltimore-s-anguish
3,There Is Growing Evidence That Our Universe Is a Giant Hologram,bkurtz13,http://motherboard.vice.com/read/there-is-growing-evidence-that-our-universe-is-a-giant-hologram?trk_source=popular
10,A Bitcoin-like solution for Greece,mazsa,http://www.cnbc.com/id/102663713
5,Facial Performance Sensing Head-Mounted Display (Oculus),ahamino,https://www.youtube.com/watch?v=rgKkEnaaSDc
9,Ask HN: How can a successful startup adopt a strong testing workflow?,notdonspaulding,
5,Ask HN: Any success with Toastmasters?,giaour,
7,Show HN: For myself – Building things people want,Andrewbass,http://www.usermethod.com/blog/usermethod/for-myself-2/
1,Heap is hiring engineers to build a new approach to analytics,matm,https://heapanalytics.com/jobs
166,Bill C-51 passes in House of Commons,alfredxing,http://www.cbc.ca/news/politics/bill-c-51-passes-in-house-of-commons-1.3064235
281,Python on Android,mariuz,http://kivy.org/planet/2015/04/python-on%C2%A0android/
4,US asks China to investigate cyber attacks,bifrost,http://www.reuters.com/article/2015/05/08/us-cybersecurity-usa-china-idUSKBN0NT1S820150508
99,Jquerymy.js – Purely declarative apps with complex two-way data-binding,fiatjaf,http://jquerymy.com/
60,Physics of Light and Optics,sasvari,http://optics.byu.edu/textbook.aspx
514,Agar.io,primigenus,http://agar.io
7,Rise of the machines,pliny,http://www.economist.com/news/briefing/21650526-artificial-intelligence-scares-peopleexcessively-so-rise-machines
62,Without Systemd,turrini,http://without-systemd.org/wiki/index.php/Main_Page
44,Engineer asks Quora which job offer to take. CEO replies: not ours. (Zenefits),RockyMcNuts,http://qz.com/400027/engineer-asks-quora-which-job-offer-to-take-ceo-replies-not-ours/
4,Code Review at Originate,ingve,http://www.originate.com/stories/code-review-at-originate?es_p=410793
6,Ask HN: Is OpenGL Worth Learning?,solidgriever,
115,Harj Taggar Is Building a New Technical Hiring Pipeline with TripleByte,bvrlt,http://techcrunch.com/2015/05/07/triplebyte/
18,5 programming problems every Software Engineer should be able to solve,fwilliams,https://blog.svpino.com/2015/05/07/five-programming-problems-every-software-engineer-should-be-able-to-solve-in-less-than-1-hour
33,Ask HN: Where do you get content?,nemexy,
5,Ask HN: I want to learn a new language tell me why I should use your language,DiabloD3,
362,No Longer an Inspiration,e_d_g_a_r,http://www.gina.codes/2015/04/13/no-longer-an-inspiration.html
15,Show HN: Deck of Cards – A playing card API,crobertsbmw,http://deckofcardsapi.com
244,Ask HN: Those who quit their jobs to travel the world how did it go?,temp_-_,
30,The CHERI capability model: Revisiting RISC in an age of risk [pdf],mpweiher,http://www.cl.cam.ac.uk/research/security/ctsrd/pdfs/201406-isca2014-cheri.pdf
54,Pycket – A Tracing JIT for a Functional Language [pdf],michaelsbradley,http://homes.soic.indiana.edu/samth/pycket-draft.pdf
4,The Short Life and Speedy Death of Russia’s Silicon Valley,kposehn,http://foreignpolicy.com/2015/05/06/the-short-life-and-speedy-death-of-russias-silicon-valley-medvedev-go-russia-skolkovo/
85,Paul Krugman: The austerity delusion,jhnpckr,http://www.theguardian.com/business/ng-interactive/2015/apr/29/the-austerity-delusion
258,Why Some Men Pretend to Work 80-Hour Weeks,bootload,https://hbr.org/2015/04/why-some-men-pretend-to-work-80-hour-weeks
365,NoTCP,rcoppolo,http://notcp.io/
26,Ask HN: How does a 16 year old go about getting work on software?,thethinker1032,
256,Announcing Google Cloud Bigtable,suprgeek,http://googlecloudplatform.blogspot.com/2015/05/introducing-Google-Cloud-Bigtable.html
4,95 percent of SAP systems were exposed to vulnerabilities,paganinip,http://securityaffairs.co/wordpress/36701/hacking/sap-systems-vulnerable.html
16,Optimizing Battery Life on iOS,incanus77,https://www.mapbox.com/blog/optimizing-battery-ios/
92,Kids hack their Dad's computer on her Raspberry Pi [video],lukashed,https://www.youtube.com/watch?v=W76o_iG7Y7g
21,Let's build a compiler in Delphi/Lazarus,mariuz,http://www.pp4s.co.uk/main/tu-trans-comp-jc-intro.html
23,Afl-fuzz code coverage with afl-cov,michaelrash,https://github.com/mrash/afl-cov
33,CPU Jitter Based True Random Generator,billconan,http://www.chronox.de/jent/doc/CPU-Jitter-NPTRNG.html
53,Research on fusion engine is AIAA Best Paper,sconklin,http://www.uah.edu/news/research/research-on-fusion-engine-that-could-be-a-mars-hot-rod-is-aiaa-best-paper
14,Language Models for Image Captioning: The Quirks and What Works,exgrv,http://arxiv.org/abs/1505.01809
12,The Old Boys: The Decline and Rise of the Public School,benbreen,http://www.theguardian.com/books/2015/apr/16/the-old-boys-the-decline-and-rise-of-the-public-school-david-turner-review
5,Smart Pieces: a framework for code snippets,webNeat,https://github.com/webNeat/smart-pieces
22,Keurig’s K-Cup screw-up and how it capitulated,nikomen,http://www.washingtonpost.com/news/morning-mix/wp/2015/05/07/keurigs-k-cup-screw-up-and-how-it-k-pitulated-wednesday-to-angry-consumers/
13,A command-line fuzzy finder written in Go,weitzj,https://github.com/junegunn/fzf
32,Using Rust to generate Mercurial short-hash collisions,jordigh,http://www.jandemooij.nl/blog/2015/05/05/using-rust-to-generate-mercurial-short-hash-collisions/
8,The Betrayal of Brazil,adventured,http://www.bloomberg.com/news/features/2015-05-08/brazil-s-massive-corruption-scandal-has-bitterness-replacing-hope
21,Show HN: Sssaving – Are you gaining or losing money each month?,guillelopez,https://www.sssaving.com/?ref=hn
4,Pao Asks Court to Dismiss Kleiner’s $1M Reimbursement Claim,bruceb,http://www.wired.com/2015/05/ellen-pao-asks-court-dismiss-kleiners-1m-reimbursement-claim/
51,Osquery Security Audit,hiby007,http://yahoo-security.tumblr.com/post/118445868880/osquery-security-audit
9,Why Windows 10 is the 'last' version of Windows,bahularora,http://mashable.com/2015/05/08/windows-10-last/
15,Microsoft to stop producing Windows versions,Robadob,http://www.bbc.co.uk/news/technology-32658340
3,List of Public Datasets on GitHub,yarapavan,http://www.kdnuggets.com/2015/04/awesome-public-datasets-github.html
52,UK Election: What difference would proportional representation have made?,davidbarker,http://www.bbc.co.uk/news/election-2015-32601281
7,Ask HN: How to build quality software in a fast paced startup enviorment?,plaban123,
4,Ask HN: How do I solve problems/code outside of the book I used to learn python?,wowitsnotabot,
55,Show HN: How to make your own glowing notification cube,achariam,http://achariam.com/prototyping/
5,Just Say No to More End-To-End Tests,r4um,http://googletesting.blogspot.com/2015/04/just-say-no-to-more-end-to-end-tests.html
4,Announcing Visual Studio Code – Preview,tosh,http://blogs.msdn.com/b/vscode/archive/2015/04/29/announcing-visual-studio-code-preview.aspx
