SCORE,TITLE,BY,URL
174,Uber has defeated Bill de Blasio’s plan to rein them in,jseliger,http://www.vox.com/2015/7/22/9015443/bill-de-blasio-uber
21,QOR: First CMS Written in Go,cmod,http://getqor.com
7,The Myth of the Flat Earth (1997),bmmayer1,http://www.asa3.org/ASA/topics/history/1997Russell.html
8,Uncovering a Triceratops: Experiment searches for dinosaurs in Wyoming,npt4279,https://experiment.exposure.co/uncovering-a-triceratops
43,HP bans T-shirts at work,gw5815,http://www.theregister.co.uk/2015/07/24/hp_dress_code/
56,Types for an Untyped World: Bracha vs. Felleisen [video],namarkiv,https://www.youtube.com/watch?v=JBmIQIZPaHY
46,What if anything have we learned from C++? [video],rdudekul,https://www.youtube.com/watch?v=2egL4y_VpYg
11,NSA will destroy millions of American calling records 'as soon as possible',rl3,http://www.theguardian.com/us-news/2015/jul/27/nsa-destroy-american-calling-records
6,Uber and the lawlessness of 'sharing economy' corporates,trusche,http://www.theguardian.com/technology/2015/jul/28/uber-lawlessness-sharing-economy-corporates-airbnb-google
3,The climb that left me frozen with fear,yitchelle,http://www.bbc.com/news/magazine-32814403
7,Get Started with Amazon Machine Learning,SteB,https://cloudacademy.com/amazon-web-services/courses/amazon-machine-learning/
14,Track your seizures with your smartphone or smartwatch,yatoomy,http://pebilepsy.com
12,JMH Perfasm Explained: Looking at False Sharing on Conditional Inlining,dmit,http://psy-lob-saw.blogspot.com/2015/07/jmh-perfasm.html
18,Mimir (YC S15) speeds up feedback with automated grading for professors,prahv,http://venturebeat.com/2015/07/27/y-combinator-backed-mimir-speeds-up-feedback-with-automated-grading-for-professors/
4,Golomb coding,fgeorgy,https://en.wikipedia.org/wiki/Golomb_coding
15,Change-Making at the Largest Public Interest Startup [video],brandonb,https://www.youtube.com/watch?v=y6nMQg9qs7k
12,How to Protect Your Android Device from StageFright Exploit,shakes,https://www.twilio.com/blog/2015/07/how-to-protect-your-android-device-from-stagefright-exploit.html
10,History of the Amiga (1992) [video],doener,https://www.youtube.com/watch?v=zq1s77nzpYk
9,Why you’ll Never nail that DevOps interview,gigajeremy,http://getcloudify.org/2015/07/28/devops-days-interview-ops-operations-engineer-culture.html
8,Minimal containers for Go binaries,durdn,https://developer.atlassian.com/blog/2015/07/osx-static-golang-binaries-with-docker?hn
3,How We’re Changing the Way We Respond to Petitions,sethbannon,https://medium.com/@Goldman44/how-we-re-changing-the-way-we-respond-to-petitions-74ed0ffd1d77
3,JavaScript Standard Style,yoshuaw,http://standardjs.com/
19,Raising Floor for Minimum Wage Pushes Economy into the Unknown,danso,http://www.nytimes.com/2015/07/27/business/economy/scale-of-minimum-wage-rise-has-experts-guessing-at-effect.html
18,Go1 (YC S15) Wants to Make Compliance Training Suck Less,loyalelectron,http://techcrunch.com/2015/07/27/yc-backed-go1-wants-to-make-compliance-training-suck-less/
15,A simplified variant of Tetris in fewer than 140 bytes of JavaScript,tilt,https://gist.github.com/aemkei/1672254
11,CPS soup continuation passing style without nested scopes,jsnell,https://wingolog.org/archives/2015/07/27/cps-soup
8,Open Mutation Miner,PaulHoule,http://www.semanticsoftware.info/open-mutation-miner
126,CoreCLR building on ARM,shahid-pk,https://github.com/dotnet/coreclr/pull/1210
109,Documenting your PostgreSQL database,dmmalam,http://www.craigkerstiens.com/2013/07/29/documenting-your-postgres-database/
148,JerryScript – A JavaScript Engine for Internet of Things,talles,http://samsung.github.io/jerryscript/
16,Console-Based Audio Visualiser for ALSA,an_ko,https://github.com/karlstav/cava
10,How We Impersonate Users to Fix Problems Faster,bosdev,https://eager.io/blog/how-we-impersonate-users/
7,Searching for Jagari: The “Mick Jagger of Zambia” (2014),benbreen,http://theappendix.net/posts/2014/9/searching-for-jagari
27,Fan is a Tool-Using Animal,maxerickson,http://idlewords.com/talks/fan_is_a_tool_using_animal.htm
114,From Burma to Nagasaki: the man who walked through hell,rdl,http://www.theguardian.com/world/2015/jul/26/nagasaki-man-who-walked-through-hell-jan-bras
10,It’s Not Climate Change – It’s Everything Change,ph0rque,https://medium.com/matter/it-s-not-climate-change-it-s-everything-change-8fd9aa671804
107,Why slow thinking wins,JohnHammersley,https://www.bostonglobe.com/ideas/2015/07/25/the-power-slow-thinking/ToZbzYl7rG0yVMCtsZ7WnJ/story.html
12,Frege – A pure functional language for the JVM in the spirit of Haskell,arh68,https://github.com/frege/frege
57,Foundations of a good UI,codelitt,http://www.codelitt.com/blog/the-foundations-of-a-good-ui/
397,The Battle for Wesnoth needs help,mproud,http://www.wesnoth.org
70,Uber Engineering's Great Data Migration: Project Mezzanine,myhrvold,https://eng.uber.com/mezzanine-migration/
54,The Automation Myth,vermontdevil,http://www.vox.com/2015/7/27/9038829/automation-myth
192,How Academia Resembles a Drug Gang (2013),7402,http://blogs.lse.ac.uk/impactofsocialsciences/2013/12/11/how-academia-resembles-a-drug-gang/
4,What I Learned Writing a Haiku Every Day for 100 Days,weavie,https://medium.com/the-lighthouse/what-i-learned-writing-a-haiku-every-day-for-100-days-ad23865ef760
11,The World’s Leading Startup Cities,bjoernlasseh,http://www.citylab.com/tech/2015/07/the-worlds-leading-startup-cities/399623/
226,Rwasa – A high-performance web server in x86_64 assembly,jonathonf,https://2ton.com.au/rwasa/
4,iPhone 6 triggers record number of Android switchers,swah,http://bgr.com/2015/07/22/iphone-vs-android-switchers
262,Why Debian returned to FFmpeg,vezzy-fnord,https://lwn.net/Articles/650816/
10,Writing a Flash player in assembler (2014),userbinator,https://flashasm.wordpress.com/
9,The Forgotten Sense (Fragment),Thevet,http://www.buenosairesreview.org/2015/07/the-forgotten-sense-fragment/
7,Tragedy of ‘golden’ daughter’s fall resonates with Asian immigrant children,corndoge,http://www.washingtonpost.com/news/morning-mix/wp/2015/07/27/tragedy-of-golden-daughters-murder-plot-against-parents-resonates-with-asian-immigrant-children/?tid=sm_fb
106,What It Was Like to Seek Asylum in Medieval England,Thevet,http://www.atlasobscura.com/articles/what-it-was-like-to-seek-asylum-in-medieval-england
3,Interactive Chart of Hard Drive Prices 1950-2010 (2014),bootload,https://www.thatdatadude.com/interactive-chart-hard-drive-prices-1950-2010/
7,Howard Stern’s easy billion dollar pay day – courtesy of Spotify or an app,daegloe,http://calacanis.com/2015/07/27/howard-sterns-easy-billion-dollar-pay-day-courtesy-of-spotify-or-an-app/
5,Comparison of 7 solutions for storing large binary files in Git repositories,kontulai,http://blog.deveo.com/storing-large-binary-files-in-git-repositories/
9,What the Pyra Linux Handheld Should Look Like: Final Renders,ekianjo,http://pandoralive.info/?p=5257..
3,Can Bitcoin Change Wi-Fi for the Better?,bpolania,http://www.coindesk.com/can-bitcoin-change-wi-fi-for-the-better/?utm_source=CoinDesk+subscribers&utm_campaign=5bf3632c2b-EMAIL_RSS_CAMPAIGN&utm_medium=email&utm_term=0_74abb9e6ab-5bf3632c2b-78980309
101,Linux kernel compilation,0xAX,https://github.com/0xAX/linux-insides/blob/master/Misc/how_kernel_compiled.md
3,Aleynikov Prosecutor to Appeal Second Verdict Reversal,PhantomGremlin,http://www.bloomberg.com/news/articles/2015-07-27/aleynikov-prosecutor-will-appeal-dismissal-of-state-charges
146,Hacking Team: a zero-day market case study,colinprince,https://tsyrklevich.net/2015/07/22/hacking-team-0day-market/
80,One man's obsession with rediscovering the Doves typeface,tankenmate,http://www.bbc.co.uk/news/magazine-31534032
101,Nginx with dynamic upstreams,Tenzer,http://tenzer.dk/nginx-with-dynamic-upstreams/
4,Fuzix OS: Alan Cox's POSIX Unix for Zilog 8-bit Z80,emersonrsantos,https://github.com/EtchedPixels/FUZIX
30,Some first results from the new higher-energy Large Hadron Collider,ingve,http://www.theguardian.com/science/life-and-physics/2015/jul/26/some-first-results-from-the-new-higher-energy-large-hadron-collider
237,Plasma Mobile,jbk,http://plasma-mobile.org/
96,The Linear Algebra Behind Google (2006) [pdf],sonabinu,http://www.rose-hulman.edu/~bryan/googleFinalVersionFixed.pdf
4,Ask HN: Does your productivity suffer because of too many phone notifications?,arey_abhishek,
8,Java for Mobile – iOS Android Windows,fishyfishy,https://www.codenameone.com/index.html
5,Find Email Addresses by Name Search,noahorb,http://www.findanyemail.net
3,A Hundred Cities Within Seoul,Petiver,http://www.nytimes.com/2015/07/26/travel/seouls-hundred-faces.html
6,Brinks' Super-Secure Smart Safes: Not So Secure,ghosh,http://www.wired.com/2015/07/brinks-super-secure-smart-safes-not-secure/
187,What Makes Founders Succeed,revorad,http://foundersatwork.posthaven.com/what-makes-founders-succeed
63,What are tholins?,personjerry,http://www.planetary.org/blogs/guest-blogs/2015/0722-what-in-the-worlds-are-tholins.html
19,Evolt.org Browser Archive,sb057,http://browsers.evolt.org/
118,Detecting VPN (and its configuration) and proxy users on the server side,diafygi,https://medium.com/@ValdikSS/detecting-vpn-and-its-configuration-and-proxy-users-on-the-server-side-1bcc59742413
67,Show HN: Iosevka Open Source Programming Typeface,be5invis,http://be5invis.github.io/Iosevka/
62,Writing a Simple Decompiler for .NET Part 1,zerratar,http://www.codeandux.com/writing-a-simple-decompiler-for-net-part-1/
33,Ask HN: Would you pay for a code similarity detection tool?,pka,
82,Anatomy of an Attack: How I Hacked StackOverflow (2012),chdir,http://blog.ircmaxell.com/2012/11/anatomy-of-attack-how-i-hacked.html
22,US State of Georgia sues 'terrorist' for publishing its own laws on the internet,myleshenderson,http://www.theregister.co.uk/2015/07/25/georgia_sues_terrorist_for_publishing_its_own_laws/
547,I am an 18-year-old techie/student. I have leukemia and need your help,mehrzad,https://github.com/m3hr/swabbathon-swabbers
11,Forget Passwords.Use JAR,moujan,
44,Browserify vs. Webpack – Configuration isn't evil,housecor,https://medium.com/@housecor/browserify-vs-webpack-b3d7ca08a0a9
10,Temperature fraud at NOAA,briandear,https://stevengoddard.wordpress.com/2015/07/27/mind-blowing-temperature-fraud-at-noaa/
3,Ask HN: DiskDefrag comes with “Optimize SSD” option does it make any sense?,MegaLeon,
22,A Manhattan Project Veteran Reflects on His Atomic Bomb Work,wornoutman,http://www.nytimes.com/2015/07/27/nyregion/a-manhattan-project-veteran-reflects-on-his-atomic-bomb-work.html?smid=tw-nytimes
4,The Insecure World of Freelancing,danboarder,http://www.theatlantic.com/business/archive/2015/07/building-social-safety-net-freelancers/399551/?single_page=true
91,Advanced Mesos Course,luu,http://open.mesosphere.com/intro-course/
