SCORE,TITLE,BY,URL
7,How to Keep a 1500-Foot Skyscraper from Falling Over,do-fuss,http://www.wired.com/2015/07/keep-1500-foot-skyscraper-falling/?mbid=social_twitter
7,Number Theory books,valera_rozuvan,https://leonettipaolo.wordpress.com/number-theory-collection/
4,LSU professor fired over F-word P-word off-color joke,jseliger,http://www.slate.com/blogs/browbeat/2015/06/30/lsu_professor_fired_over_f_word_p_word_off_color_joke_finally_academia_s.html?wpisrc=obnetwork
6,Nokia OZO,posix,https://ozo.nokia.com/
15,ThankYouEdwardSnowden.org,joering2,http://ThankYouEdwardSnowden.org
5,Sleepwalking into a Monoculture and Lock-In with Linux Containers,tobbyb,https://www.flockport.com/sleepwalking-into-a-monoculture-lock-in-with-linux-containers/
7,Newegg vs. Patent Trolls: When We Win You Win,act9,http://blog.newegg.com/newegg-vs-patent-trolls-when-we-win-you-win/
10,I'm a JavaScript engineer. How can I get into Robotics?,jiert,
9,Ask HN: Those of you running Mac OS X El Capitan Beta how stable is it?,adamnemecek,
14,Ask HN: How would you fire a cofounder when you aren’t one?,tech_nofounder,
148,Final Steps,Moshe_Silnorin,https://blog.ethereum.org/2015/07/27/final-steps/
11,Why the Chrome Web Store Sucks,klarrimore,http://www.firertc.com/blog/why-the-chrome-web-store-sucks
11,Ask HN: Best new or modern languange for game dev?,makufiru,
3,Plasma Mobile SDK,martgnz,http://www.proli.net/2015/07/27/plasma-mobile-sdk/
54,The tech boom may get bumpy but it will not end in a repeat of the dotcom crash,edward,http://www.economist.com/news/briefing/21659722-tech-boom-may-get-bumpy-it-will-not-end-repeat-dotcom-crash-fly?fsrc=permar|image1
192,Metal Captcha,v4n4d1s,http://metalcaptcha.heavygifts.com/
14,Quantum Mechanical Words and Mathematical Organisms,MichaelAO,http://blogs.scientificamerican.com/guest-blog/quantum-mechanical-words-and-mathematical-organisms/
5,We Should Not Ban 'Killer Robots' and Here's Why,mcspecter,http://spectrum.ieee.org/automaton/robotics/artificial-intelligence/we-should-not-ban-killer-robots
14,Social Justice Bullies: The Authoritarianism of Millennial Social Justice,istvan__,https://medium.com/@aristoNYC/social-justice-bullies-the-authoritarianism-of-millennial-social-justice-6bdb5ad3c9d3
307,The Hitchhiker's Guide to Modern JavaScript Tooling,voter101,http://reactkungfu.com/2015/07/the-hitchhikers-guide-to-modern-javascript-tooling/
15,Tail Call Bug in RyuJIT - Incorrect parameters passed,Systemic33,https://github.com/dotnet/coreclr/issues/1296
4,Amazon provides new details on its plan for a drone superhighway in the sky,phreeza,http://www.theverge.com/2015/7/28/9058211/amazon-new-details-plan-delivery-drone
7,Let's Make Offline Web Applications Secure,nthitz,http://sakurity.com/blog/2015/07/28/appcache.html
395,Major Flaw in Android Phones Would Let Hackers in with Just a Text,dynofuz,http://www.npr.org/sections/alltechconsidered/2015/07/27/426613020/major-flaw-in-android-phones-would-let-hackers-in-with-just-a-text
5,Ask HN: Just tested 200 gov websites and 2 were SSL-encrypted. What should I do?,r3bl,
9,Ask HN: Would you ever pay to use a search engine?,tima101,
42,Japanese-Style Entrepreneurship: An Interview with Softbank’S CEO,doppp,https://hbr.org/1992/01/japanese-style-entrepreneurship-an-interview-with-softbanks-ceo-masayoshi-son
36,The Struggle for the Soul of Ben and Jerry’s (2014),walterbell,http://www.greenmoneyjournal.com/march-2014/ice-cream/
29,Perfect Audience (YC S11) Launches Mobile Retargeting iOS SDK,brandnewlow,http://blog.perfectaudience.com/2015/07/28/new-feature-mobile-retargeting/
3,The Museum of Modern Art (MoMA) Collection Data,brbcoding,https://github.com/MuseumofModernArt/collection
3,Lawyers Squabble Over $81M in Fees for Tech Wage Suit,ryanmonroe,http://blogs.wsj.com/digits/2015/07/28/lawyers-squabble-over-81-million-in-fees-for-tech-wage-suit/?mod=ST1
4,As Tech Booms Workers Turn to Coding for Career Change,cadlin,http://www.nytimes.com/2015/07/29/technology/code-academy-as-career-game-changer.html?_r=0
3,Managing Unconcious Bias,archivator,http://managingbias.fb.com/
5,Bring Your Own Encryption Keys to Google Cloud Platform,turing,http://googlecloudplatform.blogspot.com/2015/07/Bring-Your-Own-Encryption-Keys-to-Google-Cloud-Platform.html
4,Ask HN: Are you happy with your project management tool?,chinmaymk,
8,Spatial Interfaces,ingve,https://medium.com/elepath-exports/spatial-interfaces-886bccc5d1e9
22,Ask HN: I just got fired for being a junior developer. What do I do now?,bsima,
10,[Bitcoin-dev] Disclosure: consensus bug indirectly solved by BIP66,haakon,https://lists.linuxfoundation.org/pipermail/bitcoin-dev/2015-July/009697.html
6,TPP Undermines User Control and That's Disastrous for Accessibility,DiabloD3,https://www.eff.org/deeplinks/2015/07/tpp-undermines-user-control-and-thats-disastrous-accessibility
168,Stripe Raises New Funding and Partners with Visa,brianchu,http://www.nytimes.com/2015/07/28/technology/stripe-digital-payments-start-up-raises-new-funding-and-partners-with-visa.html
7,How the way you type can shatter anonymity–even on Tor,vixsomnis,http://arstechnica.com/security/2015/07/how-the-way-you-type-can-shatter-anonymity-even-on-tor/
9,Ask HN: Why can't we build unhackable software?,bikamonki,
13,Show HN: First ever FPGA CPU built using open source tools?,jamesbowman,http://www.excamera.com/sphinx/article-j1a-swapforth.html
10,Man born with “virtually no brain” has advanced math degree,batguano,http://boingboing.net/2015/07/28/man-born-with-virtually-no-b.html
5,Higher Ed's Event Horizon: How Universities Will Collapse Under Their Own Weight,MLMorley,https://medium.com/@MLMorley/higher-education-s-event-horizon-9b150898a59d
40,FANN.js – Fast Artificial Neural Network Compiled with Emscripten,louisstow,https://github.com/louisstow/fann.js/
62,The Time Zone Rebels of the World,nols,http://www.hopesandfears.com/hopes/city/city/215293-the-time-zone-rebels-of-the-world
12,DHI Group plans to sell off Slashdot and Sourceforge,fapjacks,http://arstechnica.com/information-technology/2015/07/dhi-group-plans-to-sell-off-slashdot-and-sourceforge/
3,Don't listen to your users,geverett,https://medium.com/@gillianim/the-user-is-always-right-eab73c620e7d
231,Filmmakers fighting “Happy Birthday” copyright find their “smoking gun”,MBCook,http://arstechnica.com/apple/2015/07/filmmakers-fighting-happy-birthday-copyright-find-their-smoking-gun/
36,How NSA and GCHQ Spied on the Cold War World,chrisprice,http://www.bbc.co.uk/news/uk-33676028
268,Show HN: A Hand-Drawn QR Code Alternative,samfpetersen,http://www.meshtag.com
47,My First Kaggle ConvNet: Getting to 3rd Percentile in 3 Months,ilzmastr,http://ilyakava.tumblr.com/post/125230881527/my-1st-kaggle-convnet-getting-to-3rd-percentile
7,Scrum and Technical Debt,thedevil,
41,Show HN: Atmel AVR 8-bit Emulator in Rust and React,ferrarif545,http://realscout.github.io/avr-emulator/
5,Alan Kay on Getting a CS Degree [video],kennethfriedman,https://m.youtube.com/watch?v=Lb-cKVxmVGk
21,Ask HN: How do you prioritize your reading material?,jfe,
4,Slicedham - engineering stories,tilt,http://www.slicedham.co/
6,CEO shares $27M with staff after selling his firm,codegeek,http://money.cnn.com/2015/07/28/news/companies/turkish-ceo-staff-bonus-millions/index.html?iid=ob_homepage_money_pool&iid=obnetwork
10,Amazon Announces Launchpad an All-In-One Marketing and Sales Portal,bfstein,http://techcrunch.com/2015/07/28/amazon-takes-on-product-hunt-shopify-with-launchpad-an-all-in-one-marketing-and-sales-portal/
7,DHI Group Inc. Announces Plans to Sell Slashdot Media,JeremyNT,http://news.slashdot.org/story/15/07/28/1855254/dhi-group-inc-announces-plans-to-sell-slashdot-media
12,Ask HN: Inspiring female programming blogs?,cpursley,
3,The Codeless Code Case 33: Fear,bcjordan,http://thecodelesscode.com/case/33
5,German privacy watchdog orders Facebook to stay out of usernames,Zweihander,http://www.engadget.com/2015/07/28/german-privacy-watchdog-orders-facebook-to-stay-out-of-usernames/?ncid=rss_truncated
51,Show HN: Nod – Anonymous proximity messenger,fo0x,http://yougotthenod.com
90,Syd Mead the Artist Who Illustrates the Future,diodorus,http://curbed.com/archives/2015/07/23/syd-mead-city-architecture-blade-runner-design-future.php
19,Uber's real time car map is fake,dsheynin,http://www.wired.co.uk/news/archive/2015-07/28/uber-algorithm-fake
6,'Impossible' rocket drive works and could get to Moon in four hours,kposehn,http://www.telegraph.co.uk/news/science/space/11769030/Impossible-rocket-drive-works-and-could-get-to-Moon-in-four-hours.html
3,HP acquires Stackato PaaS,ridruejo,http://venturebeat.com/2015/07/28/hp-acquires-activestates-stackato-paas-business/
12,Millennials who are financially thriving have one characteristic in common,s_kilk,http://www.businessinsider.com/millennials-who-are-financially-thriving-have-one-characteristic-in-common-2015-7?IR=T
10,Project Spartan Forensics,Resilldoux,http://articles.forensicfocus.com/2015/07/27/project-spartan-forensics/
35,Redesigning Chrome Android. Part 1 of 2,Zweihander,https://medium.com/google-design/redesigning-chrome-android-11eab15dc7ee
3,Challenges to Adopting Stronger Consistency at Scale [pdf],jcr,https://www.usenix.org/conference/hotos15/workshop-program/presentation/ajoux#
102,Voyager’s Golden Record for Aliens Now Available on SoundCloud,Tekker,http://www.popsci.com/now-you-can-listen-voyager-golden-records-soundcloud
32,Linux IPv6 improvement: Routing cache on demand,warunsl,https://code.facebook.com/posts/1123882380960538/linux-ipv6-improvement-routing-cache-on-demand/?utm_source=codedot_rss_feed&utm_medium=rss&utm_campaign=RSS+Feed
5,Open Source FPGA Toolchain Builds CPU,jamesbowman,http://hackaday.com/2015/07/28/open-source-fpga-toolchain-builds-cpu/
19,One rower two cats 900 miles,Vigier,http://www.bbc.com/news/magazine-33176857
7,Windows 10 review: Microsoft goes back to the future,ingve,http://www.neowin.net/news/windows-10-review-microsoft-goes-back-to-the-future
64,The OnePlus 2 pushes the boundaries of how cheap a flagship phone can be,Zweihander,http://www.theverge.com/2015/7/27/9051753/oneplus-2-smartphone-hands-on
3,Stagefright Vulnerability in Android Phones,DiabloD3,https://www.schneier.com/blog/archives/2015/07/stagefright_vul.html
27,Haskell Code Navigation [video],begriffs,http://begriffs.com/posts/2015-07-27-haskell-source-navigation.html
74,1000 tech experts warn against AI arms race,callum85,http://www.bbc.co.uk/news/technology-33686581
3,Windows 10 Launch Could Seriously Break the Internet Could Peak at 40Tb/s,ethana,http://blog.streamingmedia.com/2015/07/windows-10-launch-huge-traffic.html
99,Which oils are best to cook with?,7952,http://www.bbc.co.uk/news/magazine-33675975
73,Show HN: A career test for people who want to have a social impact,BenjaminTodd,https://80000hours.org/career-guide/career-recommender/
260,Review of Nestle water permit neglected for decades,umeboshi,http://www.desertsun.com/story/news/environment/2015/07/23/review-nestle-water-permit-neglected-decades/30562241/
193,Moving Fast with High Code Quality,kilimchoi,http://engineering.quora.com/Moving-Fast-With-High-Code-Quality?share=1
35,Introduction to Neural Machine Translation on GPUs Part 3,bsprings,http://devblogs.nvidia.com/parallelforall/introduction-neural-machine-translation-gpus-part-3/
3,Ask HN: Have you bought prescription glasses online?,J-dawg,
7,Adobe Brackets 1.4 released,hit8run,http://blog.brackets.io/2015/07/27/brackets-1-4-is-here/
4,Miscomputation: Learning to live with errors,mrry,http://tomasp.net/blog/2015/failures/
9,Skyscrapers and Doghouses,waffle_ss,https://www.valent.io/article/skyscrapers-and-doghouses/
4,Amazon Machine Learning: use cases and a real example in Python,alexcasalboni,http://cloudacademy.com/blog/aws-machine-learning/
104,The Brain vs. Deep Learning Part I: Computational Complexity,mbeissinger,https://timdettmers.wordpress.com/2015/07/27/brain-vs-deep-learning-singularity/
12,China shares gyrate as Beijing scrambles to calm markets,tokenadult,http://www.reuters.com/article/2015/07/28/us-china-markets-idUSKCN0Q207920150728
66,Taming Complexity with Reversibility,KentBeck,https://www.facebook.com/notes/kent-beck/taming-complexity-with-reversibility/1000330413333156
24,Show HN: Open-Source Anonymous Encrypted TLS+OTR Messaging Written in Go,RomanPushkin,https://hacktunnel.com
213,China stocks drop over 8%,pingec,http://www.reuters.com/article/2015/07/27/us-markets-china-stocks-idUSKCN0Q10KE20150727
62,Electric Planes Usher in the Second Great Age of Aviation,lelf,http://www.wired.com/2015/07/electric-planes-usher-second-great-age-aviation/
25,Apple Commits Over 100 Workers to New Electric Car “Project Titan”,gregsahne,http://shiftinglanes.com/2015/07/project-titan-lovechild-of-bmw-apple/
5,Exploring the Secret Nazi Tunnels under a German Vacation Town,rshrsh,http://www.atlasobscura.com/articles/exploring-the-secret-nazi-tunnels-under-a-german-vacation-town
10,The Man for Mars: Elon Musk Tesla SpaceX and the Quest for a Fantastic Future,balbaugh,http://www.nybooks.com/articles/archives/2015/aug/13/elon-musk-man-mars/
90,The Skysphere,techaddict009,http://www.theskysphere.com/
20,Uber's Phantom Cabs,deverton,http://motherboard.vice.com/read/ubers-phantom-cabs
3,In the Future Everyone Will Wear a Smartwatch,melling,https://h4labs.wordpress.com/2015/07/28/in-the-future-everyone-will-wear-a-smartwatch/
25,Run Nasm X86/x64 Assembly Code Online,bemmu,https://dbgr.cc/l/nasm
3,Show HN: A rating and review website for iOS and OS X frameworks,drewolbrich,http://www.sdkcritic.com
13,Dockerfiles considered harmful,rgbrgb,http://blog.wercker.com/2015/07/28/Dockerfiles-considered-harmful.html
63,Sparc removal,buster,https://lists.debian.org/debian-devel-announce/2015/07/msg00006.html
31,Faster than Bresenham's Algorithm? (2009),userbinator,http://hbfs.wordpress.com/2009/07/28/faster-than-bresenhams-algorithm/
13,Dockerfiles considered harmful,termiefoo,http://blog.wercker.com/2015/07/28/Dockerfiles-considered-harmful.html
16,A neural network in 13 lines of python (Part 2 - Stochastic Gradient Descent),williamtrask,http://iamtrask.github.io/2015/07/27/python-network-part2/
5,Ask HN: What do you guys think of SAP?,thewarrior,
5,Beyond the k-Means – the Right k,brendamorgan,http://www.edupristine.com/blog/beyond-k-means
300,Steam hit by major security breach,aestetix,http://masterherald.com/steam-hit-by-major-security-breach-many-accounts-hacked/23239/
66,RcSim - A Model Flight Simulator,eggy,http://picolisp.com/wiki/?rcsim
11,Ask HN: What is the best device for reading technical e-books?,honest_joe,
147,Drowning Doesn’t Look Like Drowning (2010),Tomte,http://mariovittone.com/2010/05/154/?resubmit=hn
108,A Tiny Bank’s Surreal Trip Through a Fraud Prosecution,jessaustin,http://www.nytimes.com/2015/07/19/business/a-tiny-banks-surreal-trip-through-a-fraud-prosecution.html
4,Independent expert confirms that the “impossible” EM Drive actually works,eplanit,http://www.sciencealert.com/independent-scientists-confirm-that-the-impossible-em-drive-produces-thrust
5,Show HN: Open Source PDF Compression API,pea,http://stackhut.com/#/u/lanthias/pdf-compress
43,Is the Sharing Economy Due for Extinction?,lutesfuentes,https://casetext.com/posts/is-the-sharing-economy-due-for-extinction
10,Build Your Own Lisp: Learn C and build your own language in 1000 lines of code,sebg,https://leanpub.com/buildyourownlisp/
4,Ask HN: Website owners how do you ensure abuse complaints are directed to you?,gbl08ma,
9,Hedge funds tell Puerto Rico: lay off teachers and close schools to pay us back,aeno,http://www.theguardian.com/world/2015/jul/28/hedge-funds-puerto-rico-close-schools-fire-teachers-pay-us-back
13,Show HN: Match names and faces of YC and 500 Startups partners,stollercyrus,http://guesswho.cyrusstoller.com/?ref=hn
5,How an Epilepsy Treatment Shaped Our Understanding of Consciousness,balbaugh,http://www.theatlantic.com/health/archive/2015/07/split-brain-research-sperry-gazzaniga/399290/?single_page=true
6,Four reasons startup founders should go to hackathons,eob,https://medium.com/codex-hack/four-reasons-startup-founders-should-go-to-hackathons-it-s-not-what-i-originally-thought-8194db5d219c
4,Twitter will stream Q2 earnings at Periscope,roffel,https://twitter.com/jack/status/626084673098158080
5,Amazon proposes drones-only airspace to facilitate high-speed delivery,callum85,http://www.theguardian.com/technology/2015/jul/28/amazon-autonomous-drones-only-airspace-package-delivery
361,Play GTA V in your Browser Sort of,luastoned,http://phoboslab.org/log/2015/07/play-gta-v-in-your-browser-sort-of
23,Introduction to Hurd translators,vezzy-fnord,https://www.debian.org/ports/hurd/hurd-doc-translator
3,VimGolf - Real Vim ninjas count every keystroke,melling,http://www.vimgolf.com
4,Uber Admits Showing Fake Cabs,paulsutter,http://gizmodo.com/uber-is-faking-us-out-with-ghost-cabs-on-its-passenge-1720576619
11,For First Time Robot Displays Self-Awareness in Logic Puzzle,ankitaggarwal,http://www.engineering.com/DesignerEdge/DesignerEdgeArticles/ArticleID/10473/Robot-Displays-Self-Awareness-in-Logic-Puzzle.aspx
7,Rapper Who Is Very Concerned with Password Security,modinfo,http://www.youtube.com/watch?v=v59CX2DiX0Y
61,Show HN: Ceryx – Open-source dynamic Nginx,akalipetis,https://www.sourcelair.com/blog/articles/75/ceryx-dynamic-nginx
5,Ask HN: Any useful resource for learning Amazon Machine Learning?,anacleto,
246,A LinkedIn Hack That Led to a $120k Investment,samp615,http://thehustle.co/the-linkedin-hack-that-made-me-120000
12,How to Write a Git Commit Message (2014),hazbo,http://chris.beams.io/posts/git-commit/
31,A cellular puzzle: The weird and wonderful architecture of RNA,xiler,http://www.nature.com/news/a-cellular-puzzle-the-weird-and-wonderful-architecture-of-rna-1.18014
53,Miscomputation: Learning to live with errors,kogir,http://tomasp.net/blog/2015/failures/index.html
92,Annoyed by Mobile Sites That “Ask” You to Download Their App? You’re Not Alone,sssilver,http://techcrunch.com/2015/07/23/i-dont-want-your-app/
5,“Never confuse early adopters with a market that actually matter”,nuSchooler,
78,Learning from the Enemy: The Gunman Project (2007) [pdf],grouchysmurf,https://www.nsa.gov/public_info/_files/cryptologic_histories/learning_from_the_enemy.pdf
34,Subresource Integrity Sample,mondainx,https://googlechrome.github.io/samples/subresource-integrity/index.html
41,California Coastal Records: Aerial photographic survey of California Coastline,jhedwards,http://www.californiacoastline.org/
42,Researchers Hack Air-Gapped Computer with Simple Cell Phone,sergeant3,http://www.wired.com/2015/07/researchers-hack-air-gapped-computer-simple-cell-phone/
13,Secret IPO Filings Feed Deal Frenzy,ryanmonroe,http://www.wsj.com/articles/secret-ipo-filings-feed-deal-frenzy-1438039559?mod=WSJ_TechWSJD_NeedToKnow
62,QEMU heap overflow flaw while processing certain ATAPI commands,JosephRedfern,http://seclists.org/oss-sec/2015/q3/212
143,The Itanium processor part 1: Warming up,ingve,http://blogs.msdn.com/b/oldnewthing/archive/2015/07/27/10630772.aspx
93,On Hurd Linux and the Misadventures of Cross-Compiling a GNU Hurd Toolchain,vezzy-fnord,http://blog.darknedgy.net/technology/2015/07/25/0/
7,WordPress Performance Benchmarks (2015),ohashi,http://reviewsignal.com/blog/2015/07/28/wordpress-hosting-performance-benchmarks-2015/
40,Oliver a New Apartment-Finding App Cuts Out the Middlemen,user_235711,http://techcrunch.com/2015/07/28/oliver-a-new-apartment-finding-app-cuts-out-the-middlemen/
79,The Alameda-Weehawken Burrito Tunnel (2007),panic,http://idlewords.com/2007/04/the_alameda-weehawken_burrito_tunnel.htm
6,Ask HN: Favorite IRC Channels,kzisme,
209,The Craigslist Lawsuit,squigs25,https://3taps.com/the-craigslist-lawsuit.php
20,PipelineDB: streaming Postgres,usman-m,http://www.databasesoup.com/2015/07/pipelinedb-streaming-postgres.html
128,The Software Paradox: The Rise and Fall of the Commercial Software Market [pdf],rdudekul,http://www.oreilly.com/programming/free/files/software-paradox.pdf
157,Brazil Is An Alternate Video Game Universe Where Sega Beat Nintendo,rshrsh,http://www.atlasobscura.com/articles/brazil-is-a-video-game-alternate-universe-where-sega-beat-nintendo
37,Private infrastructure,katm,http://www.aaronkharris.com/private-infrastructure
60,Are Night Shifts Killing Me?,cmsefton,http://www.bbc.co.uk/news/magazine-33638905
81,Thoughts Evoked by CircleCI's July 2015 Outage,d23,http://blog.mihasya.com/2015/07/19/thoughts-evoked-by-circleci-outage.html?hn
46,Performance Testing Results of Adaptive Media Streaming Over HTTP/2,anomie,http://www.bbc.co.uk/rd/blog/2015/07/performance-testing-results-of-adaptive-media-streaming-over-http
90,Nike Missile Sites of the San Francisco Bay Area,stevewilhelm,http://acme.com/jef/nike/#HN
32,Orisi – An open-source framework for Bitcoin smart contracts,cdvonstinkpot,http://orisi.org/about
82,TextSecure response to Stagefright Android vulnerability,mfincham,https://github.com/WhisperSystems/TextSecure/issues/3817
38,An Overview of Curcumin in Neurological Disorders,mrfusion,http://www.ncbi.nlm.nih.gov/pmc/articles/PMC2929771/
6,A Renegade Trawler Hunted for 10000 Miles by Vigilantes,elemeno,http://www.nytimes.com/2015/07/28/world/a-renegade-trawler-hunted-for-10000-miles-by-vigilantes.html
34,Using the System Font in Web Content,ingve,https://www.webkit.org/blog/3709/using-the-system-font-in-web-content/
107,Kids in India Are Sparking Urban Planning Changes by Mapping Slums,lermontov,http://www.citylab.com/tech/2015/02/kids-are-sparking-urban-planning-changes-by-mapping-their-slums/385636/
3,Why Jet Can Raise $140M and You Can't,maderalabs,http://justindavis.co/2015/07/27/the-important-of-track-record/
18,Long and short scales,networked,https://en.wikipedia.org/wiki/Long_and_short_scales
235,‘Sea Slaves’: The human misery that feeds pets and livestock,lkurtz,http://www.nytimes.com/2015/07/27/world/outlaw-ocean-thailand-fishing-sea-slaves-pets.html?hp&action=click&pgtype=Homepage&module=second-column-region&region=top-news&WT.nav=top-news
72,Open Astrophysics Bookshelf,antognini,http://open-astrophysics-bookshelf.github.io/
17,The World According to China (Visualization),cjdulberger,http://www.nytimes.com/interactive/2015/07/24/business/international/the-world-according-to-china-investment-maps.html?_r=0
30,Importing a Modeled Mesh from Blender to Three.js,jpetitcolas,http://www.jonathan-petitcolas.com/2015/07/27/importing-blender-modelized-mesh-in-threejs.html
31,History of largest strongly connected component in Debian bootstrap,chei0aiV,http://bootstrap.debian.net/history.html
189,Debops (2014),chei0aiV,http://enricozini.org/2014/debian/debops/
359,Deep learning,joeyespo,http://neuralnetworksanddeeplearning.com/chap6.html
8,Show HN: Tabd – Send chrome tabs straight to a friend's browser,aviaviavi,http://tabdextension.com/
60,Think women in tech is just a pipeline problem?,mystique,https://medium.com/@racheltho/if-you-think-women-in-tech-is-just-a-pipeline-problem-you-haven-t-been-paying-attention-cb7a2073b996
54,Space and Time,rndn,http://thegreatatuin.blogspot.com/2015/07/space-and-time.html
23,Rowhammer.js – A Remote Software-Induced Fault Attack in JavaScript,kolarski,https://github.com/IAIK/rowhammerjs
18,Apollo – A modern CISC CPU design compatible with the Motorola M68K,doener,http://www.apollo-core.com/?
28,Emulating USB DFU to Capture Firmware,jcr,http://travisgoodspeed.blogspot.com/2012/10/emulating-usb-dfu-to-capture-firmware.html
59,J-Bob – The proof assistant from “The Little Prover”,ayberkt,https://github.com/the-little-prover/j-bob
3,Rising to the climate challenge,cleverjake,http://googleblog.blogspot.com/2015/07/rising-to-climate-challenge.html
80,Razer Acquires Ouya’s Software Tech and Dev Teams in All-Cash Deal ,winterismute,http://techcrunch.com/2015/07/27/razer-confirms-ouya-acquisition/
5,How to use old GSM protocols to know if a user is Online on the GSM Network,daw___,http://www.evilsocket.net/2015/07/27/how-to-use-old-gsm-protocolsencodings-know-if-a-user-is-online-on-the-gsm-network-aka-pingsms-2-0/
7,Why you should wait on upgrading to .Net 4.6,sakopov,http://nickcraver.com/blog/2015/07/27/why-you-should-wait-on-dotnet-46
53,The Evolution of V8 and the Challenges of Research in a Billion User VM [video],gsg,https://www.youtube.com/watch?v=z92Xm9VlPjM
15,A Clinton Story Fraught with Inaccuracies: How It Happened and What Next?,davidf18,http://publiceditor.blogs.nytimes.com/2015/07/27/a-clinton-story-fraught-with-inaccuracies-how-it-happened-and-what-next/?_r=0
44,Body Ritual Among the Nacirema (1956) [pdf],vkb,http://www.sfu.ca/~palys/Miner-1956-BodyRitualAmongTheNacirema.pdf
6,Show HN: Stool – a client-based alternative to jsPerf,axg,https://github.com/albertxing/stool
63,Show HN: Meadow Education: A beginner's guide to medical marijuana,rickharrison,https://getmeadow.com/education/how-is-marijuana-medicine
32,React Context – Helpful Context Like AdBlock and OS,casesandberg,http://casesandberg.github.io/react-context/
9,Why the most popular rule of weight loss is completely wrong,dlo,http://www.washingtonpost.com/news/wonkblog/wp/2015/07/28/why-the-most-popular-rule-of-weight-loss-is-completely-wrong/?tid=sm_fb
4,The Greek Warrior (portrait of Y. Varoufakis),cossatot,http://www.newyorker.com/magazine/2015/08/03/the-greek-warrior
5,Graffiti transforms your existing models into a GraphQL schema,gabornagy,https://blog.risingstack.com/start-using-graphql-with-graffiti/
104,The 'impossible' EmDrive could reach Pluto in 18 months?,jonbaer,http://www.wired.co.uk/news/archive/2015-07/24/emdrive-space-drive-pluto-mission
44,Micro-Talespin: A Story Generator in Common Lisp (1992),32bitkid,http://eliterature.org/images/microtalespin.txt
114,Why you should wait on upgrading to .Net 4.6,Nick-Craver,http://nickcraver.com/blog/2015/07/27/why-you-should-wait-on-dotnet-46/
