SCORE,TITLE,BY,URL
50,Nexus 6,myko,http://www.google.com/nexus/6/
43,Android Lollipop announced,koesie10,http://googleblog.blogspot.com/2014/10/android-be-together-not-same.html
190,Lockheed says made breakthrough on fusion energy project,geophile,http://www.reuters.com/article/2014/10/15/us-lockheed-fusion-idUSKCN0I41EM20141015
214,Docker and Microsoft partner to drive adoption of distributed applications,julien421,https://blog.docker.com/2014/10/docker-microsoft-partner-distributed-applications/
25,Wit.ai (YC W14) raises $3M seed round from Andreessen Horowitz,ar7hur,https://wit.ai/blog/2014/10/15/wit-ai-raises-seed-round-from-andreessen-horowitz
132,Passwordless authentication: Secure simple and fast to deploy,bpierre,https://hacks.mozilla.org/2014/10/passwordless-authentication-secure-simple-and-fast-to-deploy/
34,From 60 Frames per Second to 500 in Haskell,coolsunglasses,http://keera.co.uk/blog/2014/10/15/from-60-fps-to-500/
8,Nexus Player,gulbrandr,http://www.google.com/nexus/player/
84,OpenSSL Security Advisory,laumars,https://www.openssl.org/news/secadv_20141015.txt
1,Redefine the $8.3 trillion global logistics market at Flexport,thedogeye,http://flexport.com/careers
35,Show HN: Incoin.io – Bitcoin and Distributed Payroll,codelitt,https://www.incoin.io/
37,Show HN: Get coached by developers for free,ab_thomas,http://www.askadev.com
12,Rustful – A RESTful web framework for Rust,aethertap,https://github.com/Ogeon/rustful
136,Cryptic genetic variation in software: hunting a buffered 41-year-old bug,mineo,https://cryptogenomicon.wordpress.com/2014/10/13/cryptic-genetic-variation-in-software-hunting-a-buffered-41-year-old-bug/
78,The German Operation Eikonal as Part of NSA's RAMPART-A Program,omnibrain,http://electrospaces.blogspot.com/2014/10/the-german-operation-eikonal-as-part-of.html
5,Facebook's AsyncDisplayKit framework for moving UI off the main thread,robert-boehnke,http://asyncdisplaykit.org/
368,This POODLE bites: exploiting the SSL 3.0 fallback,ch0wn,http://googleonlinesecurity.blogspot.com/2014/10/this-poodle-bites-exploiting-ssl-30.html
209,My story of applying getting in and being a mom in Y Combinator,nnnnnn,https://medium.com/@susanjohnson/hi-im-a-mom-and-a-start-up-founder-my-yc-story-3b8c8650ae95
481,Humble Mozilla Bundle,Osmose,https://www.humblebundle.com/
23,Amazon EC2 POODLE (CVE-2014-3566) Advisory,dsugarman,http://aws.amazon.com/security/security-bulletins/CVE-2014-3566-advisory/
163,French soldier’s room unchanged 96 years after his death in the first world war,benbreen,http://www.theguardian.com/world/2014/oct/14/french-soldier-room-unchanged-first-world-war
104,Feminist video-games talk pulled after massacre threat,InternetGiant,http://www.bbc.com/news/technology-29626809
213,American scientists unearth lost 1960s polar satellite images,trauco,http://barentsobserver.com/en/2014/10/american-scientists-unearth-lost-1960s-polar-satellite-images-worth-billions-14-10#.VD1bCUcp6oU.twitter
488,The Great Robocoin Rip-off: How We Lost $25000 Buying a Robocoin ATM,metalab,https://docs.google.com/a/metalabdesign.com/document/d/1aL_b_Eq6WKv_u_ZKiPNPBXz5UbuMhi2Xm1AjdsgVER4/pub
59,Curry-Howard the Ontological Ultimate,kryptiskt,http://psnively.github.io/blog/2014/10/14/Curry-Howard-the-Ontological-Ultimate/
144,How POODLE Happened,dfranke,https://www.dfranke.us/posts/2014-10-14-how-poodle-happened.html
168,How to Start a Startup Lecture 7: How to Build Products Users Love Part I,stasy,http://startupclass.samaltman.com/courses/lec07/
3,The Old Guard,filament,http://randsinrepose.com/archives/the-old-guard/
88,Anti-burn: How bootstrapped Zoho survived two tech bubbles,rajuvegesna,http://pando.com/2014/10/14/anti-burn-how-bootstrapped-zoho-survived-two-tech-bubbles-and-became-a-massive-success/
86,How Amazon Prime delivery hurts Google’s ad business,rpm4321,http://www.slate.com/articles/business/moneybox/2014/10/google_amazon_competition_how_amazon_prime_delivery_hurts_google_s_ad_business.html
42,HBO is finally going to let you watch its shows without cable,Deinos,http://www.theverge.com/2014/10/15/6982049/hbo-go-will-offer-standalone-subscription-2015
92,What’s New in Emacs 24.4,signa11,http://www.masteringemacs.org/article/whats-new-in-emacs-24-4
1,Lead a web dev team changing the face of business intelligence at Mattermark,kevin_morrill,https://jobs.lever.co/mattermark/e8c7532b-fe5b-4de8-9b65-15b3ddcf2898
112,Decision to drop ext support from ChromeOS Files.app reversed due to outcry,soundsop,https://code.google.com/p/chromium/issues/detail?id=315401#c124
211,Holy War on Sites That Demand Pinboard Passwords,anu_gupta,https://blog.pinboard.in/2014/10/holy_war_on_sites_that_demand_pinboard_passwords/
208,Startup School 2014 Recap and Videos,katm,http://blog.ycombinator.com/startup-school-2014-recap-and-videos
170,GopherJS – A compiler from Go to JavaScript,primroot,https://github.com/gopherjs/gopherjs
50,Sketch of the Analytical Engine with Notes by Ada Lovelace (1842),thursdayb,http://www.fourmilab.ch/babbage/sketch.html
90,Kicking the Bukkit: Anatomy of an open source meltdown,avandeursen,http://www.slideshare.net/RyanMichela/kicking-the-bukkit-anatomy-of-an-open-source-meltdown
552,My Philosophy on Alerting: Observations of a Site Reliability Engineer at Google,ismavis,https://docs.google.com/a/gravitant.com/document/d/199PqyG3UsyXlwieHaqbGiWVa8eMWi8zzAn0YfcApr8Q/preview?sle=true
61,A Math Model Is Predicting the Ebola Outbreak,mikeleeorg,http://motherboard.vice.com/read/this-math-model-is-predicting-the-ebola-outbreak-with-incredible-accuracy
136,Homebrew CPU (2004),akandiah,http://www.homebrewcpu.com/
239,Brad Fitzpatrick on the future of Go,sylvinus,http://dotgo.sourcegraph.com/post/99652962343/brad-fitzpatrick-on-the-future-of-the-go-programming
176,FormatJS – Internationalize your web apps on the client and server,juandopazo,http://formatjs.io/
6,After 3 years and 9 startups built here is what we’ve learned,efounders,https://medium.com/startup-studio/birth-of-a-startup-studio-b514be405574
36,Sidecar to operate at San Francisco airport beats Lyft and Uber to it,prateekj,http://venturebeat.com/2014/10/14/sidecar-gets-green-light-to-operate-at-san-francisco-airport-beats-lyft-and-uber-to-it/
5,Show HN: Mastering Modern Payments: Using Stripe with Rails,itengelhardt,https://www.masteringmodernpayments.com/
95,An App That Lets You Converse with the Deaf No Sign Language Necessary,facorreia,http://techcrunch.com/2014/10/14/an-app-that-lets-you-converse-with-the-deaf-no-sign-language-necessary/
337,Always bet on text,walrus,http://graydon2.dreamwidth.org/193447.html
6,HBO Says It’s Going to Start Selling on the Web Next Year,tcoppi,http://recode.net/2014/10/15/hbo-says-its-going-to-start-selling-on-the-web-next-year/
79,A Module System for C++ (Revision 2) [pdf],lelf,http://isocpp.org/files/papers/n4214.pdf
3,Two new particles detected by LHC,ccozan,http://www.newscientist.com/article/dn26345-two-new-strange-and-charming-particles-appear-at-lhc.html#
118,Show HN: Dating Ring (YC W14) – We do the work you do the dating,laurenkay,https://www.datingring.com
1,ZeroCater (YC W11) is looking for a full-stack engineer to help feed the world,arram,
88,How Bayes Impact is reducing fraud for microfinance nonprofit Zidisha,pyduan,http://www.bayesimpact.org/blog/defending-microfinance-with-data-science.html
58,A Fantasy Sports Wizard's Winning Formula,sabon,http://online.wsj.com/articles/a-fantasy-sports-wizards-winning-formula-wsj-money-june-2014-1401893587
320,Firefox 33,digitalcreate,https://www.mozilla.org/en-US/firefox/33.0/releasenotes/
50,The Alice and Bob After Dinner Speech (1984),nwalfield,http://downlode.org/Etext/alicebob.html
274,On Getting Wasted,dnetesn,http://harpers.org/blog/2014/10/on-getting-wasted/
75,Unity Games in WebGL: Owlchemy Labs’ Conversion of Aaaaa to Asm.js,rnyman,https://hacks.mozilla.org/2014/10/unity-games-in-webgl-owlchemy-labs-conversion-of-aaaaa-to-asm-js/
3,Why Inequality Matters by Bill Gates,cryptoz,https://www.linkedin.com/pulse/article/20141015002149-251749025-why-inequality-matters
54,Tsū: A social network that shares its advertising revenue with its users,xdmnl,http://www.tsu.co/
41,Simple System Could Transform American Medicine,sundancekid,http://www.wired.com/2014/10/number-needed-to-treat/?mbid=social_fb
78,How to Reapply to YC,mpenn,https://medium.com/@msjpenn/how-to-reapply-to-yc-f5aa6713e8ea
72,JavaScript Performance in Windows 10 Technical Preview,Flenser,http://blogs.msdn.com/b/ie/archive/2014/10/09/announcing-key-advances-to-javascript-performance-in-windows-10-technical-preview.aspx
88,Analysis of the Linux backdoor used in Freenode IRC network compromise,noinsight,https://www.nccgroup.com/en/blog/2014/10/analysis-of-the-linux-backdoor-used-in-freenode-irc-network-compromise/
23,Manufacturing Depression: A journey into the economy of melancholy (2007),Mandatum,http://harpers.org/archive/2007/05/manufacturing-depression/
3,Who Killed the Nokia Phone?,jmngomes,http://www.project-syndicate.org/commentary/nokia-lessons-for-apple-and-google-by-pekka-nyk-nen-and-merina-salminen-2014-10
3,Startup devises a simple code to solve India’s complex address problem,denzil_correa,http://qz.com/280494
54,The risks of cheap water,whyenot,http://www.nytimes.com/2014/10/15/business/economy/the-price-of-water-is-too-low.html
9,Ask HN: I never received $13200 a company claims to have paid. What do I do?,uhoh_throwaway,
76,Ruby Objects in the deep C underworld,montanalow,https://www.omniref.com/ruby/2.2.0.preview1/symbols/Object#annotation=4032415&line=1
328,Mac App Store: The Subtle Exodus,milen,http://blog.helftone.com/mac-app-store-the-subtle-exodus/
141,XOS: Build your own operating system,gphilip,http://xosnitc.github.io/index.html
39,Observing Ultra-High Energy Cosmic Rays with Smartphones [pdf],mhb,http://crayfis.ps.uci.edu/paper.pdf
53,Photographing the Guillotine,omnibrain,http://theappendix.net/issues/2014/10/photographing-the-guillotine
61,The Great Tomb in Amphipolis Greece,chillax,http://www.theamphipolistomb.com/
159,Google May Lead $500M Round in Magic Leap Virtual Reality Tech,ebabchick,http://recode.net/2014/10/13/google-is-set-to-lead-a-huge-investment-in-magic-leap-a-company-that-says-it-can-deliver-cinematic-reality/
40,Infectious Texts: Modeling Text Reuse in Nineteenth-Century Newspapers [pdf],dasmiq,http://viraltexts.org/infect-bighum-2013.pdf
4,Winklevoss Bitcoin Index App Launches,tinkerrr,http://www.coinsetter.com/bitcoin-news/2014/10/15/winkdex-app-launches-iphone-1679
154,Disney’s New Production Renderer ‘Hyperion’,mineral_or_veg,http://www.fxguide.com/featured/disneys-new-production-renderer-hyperion-yes-disney/
83,Priscilla Chan and Mark Zuckerberg Donating $25M to the CDC Foundation,geetee,https://www.facebook.com/zuck/posts/10101696761533081
3,A few tips on how to work better with Arrays in JS,roshiro,http://www.frontendjournal.com/a-few-tips-on-how-to-work-better-with-arrays-in-js/
6,2nd Dallas worker tests positive for Ebola,mrb,http://www.cnn.com/2014/10/15/health/texas-ebola-outbreak/
56,Me and my 'useless' gall bladder,dnetesn,http://www.bbc.com/news/magazine-29594479
43,Creating an LLVM Back End for the Cpu0 Architecture,ksherlock,http://jonathan2251.github.io/lbd/llvmstructure.html
9,Ebola Test Is Positive in Second Texas Health Worker,spikels,http://www.nytimes.com/2014/10/16/us/ebola-outbreak-texas.html
15,Easily Automate the Provisioning of Your DigitalOcean Droplets,Artemis2,https://www.digitalocean.com/company/blog/easily-automate-the-provisioning-of-your-droplets/
67,Ask HN: What is your daily rate?,xpto123,
1,Build our content marketing strategy from the ground up – 42Floors,malomalo,https://42floors.com/jobs?gh_jid=26139
172,The Future of Emacs Guile and Emacs Lisp,signa11,http://lwn.net/SubscriberLink/615220/45105d9668fe1eb1/
79,Show HN: Meadow – Medical cannabis delivered to your door,sgarman,https://getmeadow.com/
62,What would happen in the ocean if we went quiet?,pepys,http://aeon.co/magazine/science/what-would-happen-in-the-ocean-if-we-went-quiet/
96,Setback: A $58000 lesson in mid-volume manufacturing,schappim,https://www.kickstarter.com/projects/1516846343/microview-chip-sized-arduino-with-built-in-oled-di/posts/959475
62,The world's largest library of historical European martial arts books,Tomte,http://wiktenauer.com/wiki/Main_Page
62,Show HN: Closing Call – Hacker News for Sales,ryangum,http://www.closingcall.co/
208,Show HN: Snapception – Intercept all snapchats received over the network,thebradbain,https://github.com/thebradbain/snapception
185,Following a Select Statement Through Postgres Internals,craigkerstiens,http://patshaughnessy.net/2014/10/13/following-a-select-statement-through-postgres-internals
5,Show HN: Taskfort – A hostable kanban solution at www.taskfort.com,timnuwin,
4,How Ebola Kills You: It's Not the Virus,bra-ket,http://www.npr.org/blogs/goatsandsoda/2014/08/26/342451672/how-ebola-kills-you-its-not-the-virus
