SCORE,TITLE,BY,URL
12,Brain stimulation for treatment and enhancement in children: an ethical analysis,Thevet,http://journal.frontiersin.org/article/10.3389/fnhum.2014.00953/full
3,Radio Interview with Stephanie Shirley,DanBC,http://www.bbc.co.uk/programmes/b05pmvl8
4,10 People Who Don't Matter (2006),dfine,http://money.cnn.com/popups/2006/biz2/peoplewhodontmatter/frameset.exclude.html
4,Are you using RSpec+Cucumber+FactoryGirl right now? Read this,ariejan,https://ariejan.net/2015/04/07/testing-with-minitest/
80,SMSSecure – SMS Encryption for Android,psykovsky,https://smssecure.org/
7,The Dead Files: Rock Art Artifacts and Psychedelic Office Supplies Up for Grabs,lermontov,http://www.collectorsweekly.com/articles/the-dead-files-rock-art-artifacts-and-psychedelic-office-supplies-up-for-grabs/
9,The Surprising History of Poetical Misprints,benbreen,http://thedabbler.co.uk/2015/04/the-surprising-history-of-poetical-misprints-2/
6,The Weird Money-Making World of Parody Twitter Accounts,prostoalex,http://www.vice.com/read/medievalreacts-and-the-weird-world-of-parody-twitter-accounts-909
7,Ken Knowlton,mgunes,http://www.kenknowlton.com/
12,Rebuilding Boost Date-Time for C++11 [video],adamnemecek,https://www.youtube.com/watch?v=VBHXmqB4i_s
25,Face It: You Can't Predict the Future,koblenski,http://sam-koblenski.blogspot.com/2015/04/face-it-you-cant-predict-future.html
8,Katex-elements – Web components for rendering TeX math,spankalee,https://github.com/justinfagnani/katex-elements
6,Colorado 'Right to Record' bill addresses citizens' right to film law enforcemnt,jonah,http://www.thedenverchannel.com/news/politics/right-to-record-bill-addresses-citizens-right-to-film-law-enforcement
20,Anatomy of a Program in Memory (2009),altern8,http://duartes.org/gustavo/blog/post/anatomy-of-a-program-in-memory/
12,Superslim Liquid Loop Will Keep Future Smartphones Cool,nkurz,http://spectrum.ieee.org/tech-talk/computing/hardware/superslim-liquid-loop-will-keep-future-smartphones-cool
1,ClearTax (YC S14) Is Hiring Engineer #4 in New Delhi India,architgupta,
18,Show HN: Product Hunt real or fake?,gkoberger,http://realorfake.ph
11,Samsung attacks Galaxy S6 Edge bend-and-break tests,ram535ii,http://www.bbc.co.uk/news/technology-32201614
12,Salman Rushdie pans authors on Goodreads forgets to check privacy settings,Libertatea,http://www.washingtonpost.com/news/the-intersect/wp/2015/04/07/salman-rushdie-pans-other-authors-on-goodreads-forgets-to-check-privacy-settings/
4,Building a raspberry pi into a laptop,azeirah,
122,More scientists doubt salt is as bad for you as the government says,learc83,http://www.washingtonpost.com/blogs/wonkblog/wp/2015/04/06/more-scientists-doubt-salt-is-as-bad-for-you-as-the-government-says/
5,The qanat/karez irrigation system in Turpan,gwern,https://plus.google.com/103530621949492999968/posts/SQqh7PRWVnD
187,The Whitehouse’s New Executive Order on Cyber Crime Is (Unfortunately) No Joke,DiabloD3,https://www.eff.org/deeplinks/2015/04/whitehouses-new-executive-order-cyber-crime-unfortunately-no-joke
53,A Comprehensive Guide to Moving from SQL to RethinkDB,TheMissingPiece,https://www.airpair.com/rethinkdb/posts/moving-from-sql-to-rethinkdb
7,Why We Don’t Believe in Visual Programming,tiago_simoes,http://www.outsystems.com/blog/2015/03/visual-programming-is-unbelievable.html
37,Ask HN: What are your unused domain names?,macca321,
3,APIembed – Embeddable API Code Snippets by Mashape,Artemis2,https://apiembed.com/
6,A free and open 3D game engine written in D,gnocchi,http://dash.circularstudios.com/
10,Introducing the Bitcoin Hackathon v2,jorde,https://blog.coinbase.com/2015/04/07/introducing-bitcoin-hackathon-v2/
4,Stanford University CS224d: Deep Learning for Natural Language Processing,etiam,https://cs224d.stanford.edu/syllabus.html
5,Three-Strikes Anti-Piracy scheme launched in Australia,PebblesHD,http://www.smh.com.au/business/media-and-marketing/three-strikes-antipiracy-scheme-launched-20150408-1mgjyd.html
3,Backtesting Detour's “Progressive Equity” Against the Facebook IPO,cyrusradfar,http://kapuno.com/conversation/bblc6nqbe6qte
5,An Introduction to HTTP with Unix Sockets,eatonphil,http://blog.eatonphil.com/2015/03/01/an-introduction-to-the-http-protocol/
4,What Did Billion Dollar Companies Look Like at the Series A?,kornish,https://medium.com/@todfrancis/what-did-billion-dollar-companies-look-like-at-the-series-a-e53ea8043a85
4,Akamai: State of the Internet Report,tosh,http://www.akamai.com/stateoftheinternet/
5,Show HN: Ncurses multifile IDE-style code editor,marssaxman,http://www.github.com/marssaxman/ozette/
686,Massive Illicit Bust of Edward Snowden Stuck to a War Monument in Brooklyn,jdi626,http://animalnewyork.com/2015/theres-a-massive-illicit-bust-of-edward-snowden-stuck-to-a-war-monument-in-brooklyn/
4,Data Retention Law Passes in Australia but the Fight Isn’t Over,CapitalistCartr,https://www.eff.org/deeplinks/2015/04/data-retention-law-passes-australia-fight-isnt-over
9,Ask HN: Is it possible to delete HN comments or profile?,austenallred,
19,Show HN: Startup resources,bevenky,http://startupstash.com/
1,Aptible (YC S14) is hiring experienced Ember engineers,chasb,
6,Show HN: ExternalTesters – simple registration for Apple's TestFlight,qzervaas,http://externaltesters.com
5,Ask HN: What's the actual trends in research for AI?,TheLem,
106,Learning Haskell as a non-programmer (2014),sridca,https://superginbaby.wordpress.com/2014/11/18/learning-haskell-as-a-nonprogrammer/
3,Indian police to use pepper-spraying drones on unruly protesters,eplanit,http://news.yahoo.com/indian-police-pepper-spraying-drones-unruly-protesters-155750698.html
71,AwSnap – This link crashes Chrome,jlblatt,https://github.com/jlblatt/AwSnap
195,If a Caller Says 'I Am with the IRS' He's Not,adamnemecek,http://www.npr.org/blogs/thetwo-way/2015/04/03/397092679/if-a-caller-says-i-am-with-the-irs-hes-not
3,Why I donated $359.88 to Inkscape,taivare,https://medium.com/@ianschuler/why-i-donated-359-88-to-inkscape-ab9f007ae024
16,Ask HN: Why do HN users avoid humor?,dataker,
22,Show HN: Roboto build and deliver your iOS and Android apps,phillipcaudell,http://roboto.build
6,This is the real composite output of an IBM CGA card and 4.77MHz 8088 PC,SwellJoe,https://www.youtube.com/watch?t=301&v=yHXx3orN35Y
3,Monty Python’s Killer Rabbit in Medieval Manuscripts,aaronbrethorst,http://sexycodicology.net/blog/medieval-killer-bunny/
3,CommonMark editor for Mac,textnut,
7,1M WordPress Sites at Risk – Persistent XSS in WP-Super-Cache,artdecotech,http://blog.sucuri.net/2015/04/security-advisory-persistent-xss-in-wp-super-cache.html
389,Mathematics for Computer Science,moks,http://ocw.mit.edu/courses/electrical-engineering-and-computer-science/6-042j-mathematics-for-computer-science-fall-2010/video-lectures/
5,The Maker of the Trollface Meme Is Counting His Money,hoopism,http://kotaku.com/the-maker-of-the-trollface-meme-is-counting-his-money-1696228810
47,JSON vs. YAML – try it yourself,lfender6445,http://www.json2yaml.com
4,Can They See My Dick?,antr,https://cantheyseemydick.com/
56,A Java 8 Parallel Calamity,ssijak,http://coopsoft.com/ar/Calamity2Article.html
15,Jolly Ranchers Sage and Breath Mints (A closer look at drug field tests),lotsofmangos,https://www.themarshallproject.org/2015/04/02/jolly-ranchers-sage-and-breath-mints
4,Soylent 1.4 formula changes taste ditches oils swizzles nutrients,eurg,http://arstechnica.com/gadgets/2015/04/soylent-1-4-formula-changes-taste-shifts-macronutrients-ditches-oils/
5,10 Lessons Learned from Recovering $85M in Failed Payments on Stripe,rfelix2121,http://blog.bestunning.net/lessons-learned-from-recovering-over-85-million-in-failed-payments-for-stripe-customers/
6,Ask HN: The world of research is broken how can we fix it?,lettergram,
3,The logical guide to winning at your own life in 19 super difficult steps,DiabloD3,https://medium.com/i-dont-know-a-thing/the-complete-and-logical-guide-to-winning-at-your-own-life-in-19-super-difficult-steps-135a17b3c5c6
8,What do you think of services like Parse and Treeline?,mhsivitz,
17,Aluminum Battery Charges in 1 Minute,popper189,http://mfgtalkradio.com/aluminum-battery-charges-in-1-minute/
3,Richard Branson on why you should stand up in meetings,burntcaramel,http://www.virgin.com/richard-branson/why-you-should-stand-up-in-meetings
62,A Visual Introduction to Abstract Geometrical Computation,based2,http://www.univ-orleans.fr/lifo/Members/Jerome.Durand-Lose/Recherche/AGC/intro_AGC.html
6,How I hacked WarFace (a Crytek FPS),mmozeiko,https://stackedit.io/viewer#!provider=gist&gistId=b9a1852a0a17e334f041&filename=wfre
3,The Unix family tree,Qwl,http://upload.wikimedia.org/wikipedia/commons/5/50/Unix_history-simple.png
57,What’s the most we can remember?,CapitalistCartr,http://www.bbc.com/future/story/20150401-whats-the-most-we-can-remember
4,Tl;dr generator,dolftax,http://smmry.com/
9,How the U.S. thinks Russians hacked the White House,swamp40,http://www.cnn.com/2015/04/07/politics/how-russians-hacked-the-wh/index.html
108,C++ Streams,zyngaro,http://jscheiny.github.io/Streams/
4,Ask HN: Voice Controlled Programming?,WoodenChair,
5,Ask HN: Separating searching for problems from work and life,NovaS1X,
85,A history of the Amiga – The demo scene (2013),bane,http://arstechnica.com/gadgets/2013/04/a-history-of-the-amiga-part-9-the-demo-scene/
4,Why Millennials Are Less Urban Than You Think,ryan_j_naughton,http://fivethirtyeight.com/features/why-millennials-are-less-urban-than-you-think/
61,Out with the Caraway in with the Ginger: 50 Years of American Spice Consumption,ryan_j_naughton,http://fivethirtyeight.com/features/out-with-the-caraway-in-with-the-ginger-50-years-of-american-spice-consumption/
5,This Battery Has Lasted 175 Years and No One Knows How,walterbell,http://motherboard.vice.com/read/this-battery-has-lasted-175-years-and-no-one-knows-how
125,More Rust compared to C++,rnestler,https://rnestler.github.io/more-rust-compared-to-c.html
6,As many as 1M sites imperiled by dangerous bug in WordPress plugin,smacktoward,http://arstechnica.com/security/2015/04/as-many-as-1-million-sites-imperiled-by-dangerous-bug-in-wordpress-plugin/
484,Last Week Tonight with John Oliver: Government Surveillance [ft. Edward Snowden],XioNoX,https://www.youtube.com/watch?v=XEVlyP4_11M
7,Ask HN: What tools do you use for SEO?,marioluigi,
4,JavaScript experts: Microsoft's new Spartan browser rocks,dolftax,http://www.infoworld.com/article/2906318/web-browsers/javascript-experts-microsofts-new-spartan-browser-rocks.html
13,Ghost Public Revenue Dashboard,paukiatwee,http://blog.ghost.org/april-2015-update/
18,Ask HN: Which developers/programmers do you closely follow?,lewisjoe,
13,Show HN: I wrote a book teaching web app development for non-programmers,limedaring,
241,IPFS is a new peer-to-peer hypermedia protocol,tambourine_man,http://ipfs.io/
3,Tesla Model S sales reached a new record in Q1 2015,ph0rque,http://bgr.com/2015/04/06/tesla-model-s-sales-record-q1-2015/
276,How I cracked NQ Vault's “encryption”,ninjadoge24,https://ninjadoge24.github.io/#002-how-i-cracked-nq-vaults-encryption
114,Steven Weinberg: Science books for the general reader,Hooke,http://www.theguardian.com/books/2015/apr/03/steven-weinberg-13-best-science-books-general-reader
144,Hashpipe – Pipe iff the hash matches,_prometheus,http://jbenet.github.io/hashpipe/
9,My week-long fast (2013),prostoalex,http://aeon.co/magazine/health/s-abbas-raza-fasting/
3,2.5 Years Later Verizon Finally Lets People Opt Out of Its Stealth Zombie Cookie,drussell,https://www.techdirt.com/blog/wireless/articles/20150402/06110930520/two-half-years-later-verizon-finally-lets-people-opt-out-stealth-zombie-cookie.shtml
5,CoffeeScript Is Dead. Long Live CoffeeScript,erokar,http://www.developwithpurpose.com/coffeescript-is-dead-long-live-coffeescript/
10,Meld: precision temperature control for your stove,mingfli,https://www.kickstarter.com/projects/meld/meld-a-perfect-meal-every-time?ref=hero_thanks
76,Why we don’t use a CDN: A story about SPDY and SSL (2014),flipchart,https://thethemefoundry.com/blog/why-we-dont-use-a-cdn-spdy-ssl/
3,Online Test-Takers Feel Anti-Cheating Software’s Uneasy Glare,carlchenet,http://www.nytimes.com/2015/04/06/technology/online-test-takers-feel-anti-cheating-softwares-uneasy-glare.html
148,Earth receiving mysterious radio signals,q7,http://www.ibtimes.co.uk/earth-receiving-mysterious-radio-signals-outer-space-alien-life-source-possibility-believe-1494686
5,Twitter Officially Launches Its “Retweet with Comment” Feature,djug,http://techcrunch.com/2015/04/06/retweetception/
67,The Lisp Machine: Noble Experiment or Fabulous Failure? (1991) [pdf],lelf,http://pt.withy.org/publications/LispM.pdf
324,Pigeon.ly a Startup Focused on Serving the U.S. Prison Population Joins YC,doppp,http://techcrunch.com/2015/03/24/pigeon-ly
9,Clojure at a Real Estate Portal,swannodette,http://www.pitheringabout.com/?p=1069
7,The Dystopian Lake Filled by the World's Tech Lust,sp332,http://www.bbc.com/future/story/20150402-the-worst-place-on-earth
11,8 Considerations on Choosing a Programming Language,david04,http://www.scala-academy.com/blog/8-considerations-on-choosing-a-programming-language
4,How India is pulling off one of its biggest rescue missions abroad,swatkat,http://qz.com/377118/by-sea-by-air-by-rail-how-india-is-pulling-off-one-of-its-biggest-international-rescue-missions/
252,My Interviews with Airbnb Dropbox Posterous Reddit Weebly and Wufoo,wasd,http://foundersatwork.posthaven.com/my-interviews-with-airbnb-dropbox-posterous-reddit-weebly-and-wufoo-circa-2010
7,Court mulls revealing secret government plan to cut cell phone service,doctorshady,http://arstechnica.com/tech-policy/2015/04/court-mulls-revealing-secret-government-plan-to-cut-cell-phone-service/
5,The Credit Card Obsessives Who Game the System–and Share Their Secrets Online,tinkerrr,http://www.racked.com/2015/4/1/8320731/credit-card-points-miles
33,Facebook disabled users' accounts for violating WhatsApp TOS 3 years ago,hubail,
82,Born Red: Profile of Xi Jinping,fitzwatermellow,http://www.newyorker.com/magazine/2015/04/06/born-red
60,First look at Project Spartan Microsoft's take on the modern browser,shawndumas,http://arstechnica.com/information-technology/2015/03/first-look-at-project-spartan-microsofts-take-on-the-modern-browser/
633,I Am Sam Altman President of Y Combinator.  AMA,sama,
9,Gmail’s SSL certificate for SMTP appears to have expired,fhinson,http://venturebeat.com/2015/04/04/gmails-ssl-certificate-for-smtp-appears-to-have-expired/
5,How MOOC Video Production Affects Student Engagement,sergeant3,https://www.edx.org/blog/how-mooc-video-production-affects
13,The Secret Life of the Aluminum Can,deegles,http://www.wired.com/2015/03/secret-life-aluminum-can-true-modern-marvel/
136,FriendFeed is shutting down,Mithrandir,http://blog.friendfeed.com/2015/03/dear-friendfeed-community-were.html
17,Using TouchID for Authentication in Your React Native App,jfroma,https://auth0.com/blog/2015/04/03/using-touchid-for-authentication-in-your-react-native-app/
141,Dear Data,revorad,http://www.dear-data.com/
152,Microsoft: An Open Source Windows Is 'Definitely Possible',Libertatea,http://www.wired.com/2015/04/microsoft-open-source-windows-definitely-possible/
3,Mathematicians Chase Moonhshine's Shadow,jeffreyrogers,https://www.quantamagazine.org/20150312-mathematicians-chase-moonshines-shadow/
16,Codes That Changed the World,leephillips,http://www.bbc.co.uk/programmes/b05qqhqp
491,“What happens when you type Google.com into your browser and press enter?”,xvirk,https://github.com/alex/what-happens-when
5,The Science of Why You Should Spend Your Money on Experiences Not Things,walterbell,http://www.fastcoexist.com/3043858/world-changing-ideas/the-science-of-why-you-should-spend-your-money-on-experiences-not-thing
58,Unorthodocs: Abandon Your DVCS and Return to Sanity,gecko,http://bitquabit.com/post/unorthodocs-abandon-your-dvcs-and-return-to-sanity/
39,On the Case at Mount Sinai It’s Dr. Data,shakes,http://www.nytimes.com/2015/03/08/technology/on-the-case-at-mount-sinai-its-dr-data.html?
16,Four ways Ubiquiti Networks is creatively violating the GPL,drussell,http://libertybsd.net/ubiquiti/
6,Coursera: From nand to tetris,signa11,https://www.coursera.org/course/nand2tetris1
81,Ask HN: What are the most useful Chrome extensions?,beforelight,
12,Heroku changing up dyno pricing,erjiang,http://notes.ericjiang.com/posts/881
66,The Unreasonable Effectiveness of Mathematics in the Natural Sciences (1960),ColinWright,https://www.dartmouth.edu/~matc/MathDrama/reading/Wigner.html
49,JQuery,lisper,https://jquery.com/
11,Ask HN: What happened to the average karma,dorfsmay,
4,The Cult of Done Manifesto,31reasons,http://www.brepettis.com/blog/2009/3/3/the-cult-of-done-manifesto.html
36,You should be amazed,ghosh,http://oliveremberton.com/2014/you-should-be-amazed/
7,South Carolina Officer Is Charged with Murder in Black Man’s Death,herbig,http://www.nytimes.com/2015/04/08/us/south-carolina-officer-is-charged-with-murder-in-black-mans-death.html
8,Microsoft Announces Pilot Program to Poach Linux/BSD Developers,joshuapants,http://blogs.microsoft.com/on-the-issues/2015/04/03/microsoft-announces-pilot-program-to-hire-people-with-autism/
7,20 Years in Prison for Having a Miscarriage – Is Our Country Going Nuts?,altern8,http://www.alternet.org/gender/20-years-prison-having-miscarriage-our-country-going-nuts
12,The first POC of project “Multi-screen on FxOS”,dolftax,https://www.mail-archive.com/dev-b2g@lists.mozilla.org/msg13120.html
42,The future of the postdoc,denzil_correa,http://www.nature.com/news/the-future-of-the-postdoc-1.17253?WT.mc_id=TWT_NatureNews
34,A New Internet Domain: Extortion Or Free Speech?,dynofuz,http://www.npr.org/blogs/alltechconsidered/2015/04/07/397886748/a-new-internet-domain-extortion-or-free-speech
8,What's Changed about the Standard of Living? It's Complicated. But Hopeful,gwern,http://www.cato-unbound.org/2015/03/04/megan-mcardle/its-complicated-hopeful
7,Starbucks to Shell Out $250M on Free 4-Year College for Every Employee,funkyy,http://www.forbes.com/sites/micahsolomon/2015/04/06/starbucks-commits-250-million-to-give-free-4-year-college-to-every-employee/
6,Ask HN: Existing Civil Fee/Fine Payments Need Innovation,bbissoon,
10,Rust – memcpy is backwards (silent breaking change),rcconf,http://internals.rust-lang.org/t/memcpy-is-backwards/1797
11,The Ruby Type Checker [pdf],tosh,http://www.cs.umd.edu/~jfoster/papers/oops13.pdf
6,Hologram replaces Edward Snowden statue in Brooklyn park,TeMPOraL,http://mashable.com/2015/04/07/edward-snowden-hologram-statue-brooklyn/
3,What a Fool Believes,Mz,http://micheleincalifornia.blogspot.com/2015/04/what-fool-believes.html
12,Eight thousand years of natural selection in Europe [pdf],gwern,http://biorxiv.org/content/early/2015/03/13/016477.full.pdf
19,Engines of our Ingenuity,walterbell,http://www.uh.edu/engines/
6,I got my Facebook Ad in front of 8k people with 0 sales. Why?,carlosagguilar,http://www.conversionsurge.com/facebook-ads-how-i-got-zero-sales-from-8k-people/
7,A ReQL Command Line Interface Written in ES6,tilt,https://github.com/Workshape/reql-cli
13,Show HN: Talk to Google Spreadsheets with JavaScript,PindakaasMan,https://github.com/RamonGebben/data-drive
13,Differential dataflow in Rust,mrry,http://www.frankmcsherry.org/differential/dataflow/2015/04/07/differential.html
5,HBO to Netflix: Bring It On,kposehn,http://www.fastcompany.com/3044284/bring-it-on
18,AmA: I am the CTO of Joyent the father of DTrace and an OS kernel developer,LaSombra,http://www.reddit.com/r/IAmA/comments/31ny87/i_am_the_cto_of_joyent_the_father_of_dtrace_and/
4,Should we interrogate the 'Diversity in Tech' narrative?,bevacqua,http://www.breitbart.com/london/2015/04/04/thankyouellenpao-now-we-can-interrogate-the-diversity-in-tech-narrative/
402,WebGL Fundamentals,unusximmortalis,http://webglfundamentals.org/
3,The original jQuery annotated by John Resig,duck,http://genius.it/ejohn.org/files/jquery-original.html
63,Promoting Health and Longevity Through Diet,forloop,http://www.cell.com/cell/fulltext/S0092-8674(15)00186-5
26,What could you do with 100 days of making?,bemmu,https://thegreatdiscontent.com/100days
11,Unparticles may provide a new path to superconductivity,lelf,http://phys.org/news/2015-04-unparticles-path-superconductivity.html
17,Back to Brontosaurus? The Dinosaur Might Deserve Its Own Genus After All,sethbannon,http://www.smithsonianmag.com/science-nature/back-brontosaurus-dinosaur-just-might-deserve-its-own-genus-species-science-180954892/?no-ist
6,Ask HN: Like Slack but encrypted?,webappsecperson,
5,Stanford Scientists Demo Promising Aluminum-Ion Battery,ryan_j_naughton,http://techcrunch.com/2015/04/07/aluminum-ion/
5,Custora (YC W11) Raises Series A from Foundation Capital,jonathanehrlich,http://blogs.wsj.com/venturecapital/2015/04/07/custora-emerges-with-6-5m-to-help-brands-influence-customers-spending/
81,As Demand for Welders Resurges Community Colleges Offer Classes,imjk,http://www.nytimes.com/2015/03/11/business/economy/as-demand-for-welders-resurges-community-colleges-offer-classes.html?_r=0
25,Ask HN: Where can a hacker find news?,chrisdotcode,
66,Peter Thiel on the Future of Innovation,davidw,https://medium.com/conversations-with-tyler/peter-thiel-on-the-future-of-innovation-77628a43c0dd
4,Show HN: Python implementation of MinHash and HyperLogLog,ekzhu,https://github.com/ekzhu/datasketch
34,Communities experimenting with mesh networks,carybeta,http://technical.ly/2015/04/06/12-communities-experimenting-mesh-networks/
4,The Real Reason Why 80%+ of Funded Startups Fail,tacon,http://www.erica.biz/2015/funded-startups-fail/
12,Android Creator Andy Rubin Launching Playground Global,what_ever,http://www.wsj.com/articles/android-creator-andy-rubin-launching-playground-global-1428353398
6,Uber Co-Founder’s Startup ‘Operator’ Will Get You What You Want,coloneltcb,http://techcrunch.com/2015/04/07/operator/
3,Tracking Feeds by Superfeedr,650REDHAIR,http://blog.superfeedr.com/tracking-feeds
12,Comparison of compression efficiency between HEVC/H.265 and VP9 [pdf],joubert,http://infoscience.epfl.ch/record/200925/files/article-vp9-submited-v2.pdf
3,New Brad Feld Course on Work and Life Harmony,nhamel,http://www.changecollective.com/work-life-harmony?utm_medium=ycomb&utm_source=hackernews
113,Markov Chain Monte Carlo Without Jargon,diego898,http://jeremykun.com/2015/04/06/markov-chain-monte-carlo-without-all-the-bullshit/
73,Aluminum battery from Stanford offers safe alternative to conventional batteries,msoad,https://news.stanford.edu/news/2015/march/aluminum-ion-battery-033115.html
10,Stock trading algorithm generates 224.7% return with news NLP sentiment analysis,theandycamps,https://www.quantopian.com/posts/accern-news-and-blog-backtest-results-using-quantopian-link-to-pdf-report-attached?utm_source=hn&utm_medium=web&utm_campaign=nlp
56,Man Prosecuted for Price Fixing on Amazon Marketplace,prostoalex,http://recode.net/2015/04/06/u-s-announces-first-antitrust-e-commerce-prosecution/
150,Experimenting with HHVM at Etsy,jazzdan,https://codeascraft.com/2015/04/06/experimenting-with-hhvm-at-etsy/
70,VCs bet on ‘indoor farming’ lasers that monitor crops and Soylent drinks,drussell,http://www.wsj.com/articles/silicon-valley-firms-plant-roots-in-farm-belt-1428348765
6,WebGL: Shader Editor for Chrome DevTools,spite,https://github.com/spite/ShaderEditorExtension
7,Eugenics in the United States,dunstad,http://en.wikipedia.org/wiki/Eugenics_in_the_United_States#Unfit_vs._Fit_Individuals
38,The Snake That’s Eating Florida,antr,http://www.nytimes.com/2015/04/06/us/the-burmese-python-snake-thats-eating-florida.html?hp&action=click&pgtype=Homepage&module=mini-moth&region=top-stories-below&WT.nav=top-stories-below&_r=0
150,Coursify: A Free Open-Source Online Course Platform,Felix21,http://www.trycoursify.com
77,Anonabox Analysis,wila,https://reclaim-your-privacy.com/wiki/Anonabox_Analysis
140,Buttercoin is shutting down,dzhao,https://buttercoin.com/#/goodbye
16,What Language Is Today's Python as Described by Paul Graham in 'Python Paradox'?,akashtndn,
31,Public Defender Uses Video to Become Cops' Worst Nightmare,adventured,http://ratter.com/public-defender-uses-video-to-become-cops-worst-nightma-1694600909
9,I3 – improved tiling wm,agonzalezro,http://i3wm.org/
5,Ask HN: Accepting Bitcoin Payments?,cauterized,
73,Show HN: Quant News – Quantitative trading research news blogs and comments,Commodore,http://www.quantnews.com
116,Gradberry Spamming GitHub Users,JoshTriplett,
5,Rand Paul Is First Presidential Candidate to Take Bitcoin,WoodenChair,http://money.cnn.com/2015/04/07/technology/rand-paul-bitcoin/index.html
4,And Then You Have No Taste,jessaustin,http://zedshaw.com/2015/04/05/and-then-you-have-no-taste/
6,Scaling Everest,mthoms,http://www.washingtonpost.com/graphics/world/scaling-everest/
1,Yhat (YC W15) Is Hiring a Front-End Developer in NYC,glamp,https://yhathq.com/about/jobs
10,Seven Molecules’ Claim to Fame,dnetesn,http://nautil.us/issue/5/fame/seven-molecules-claim-to-fame
226,The Trader Who Donates Half His Pay,anonu,http://www.nytimes.com/2015/04/05/opinion/sunday/nicholas-kristof-the-trader-who-donates-half-his-pay.html
10,The Internet's Clearly Not Ready to Stream Big TV Events,ghosh,http://www.wired.com/2015/04/internets-clearly-not-ready-stream-big-tv-events/
3,Terminated .gov Domain Names,morisy,https://www.muckrock.com/foi/united-states-of-america-10/terminated-gov-domain-names-14875/#files
43,Exploring the ClojureScript REPL,macco,http://www.alexeberts.com/exploring-the-clojurescript-repl/
7,Benchmarking doesn't hurt,tombruijn,https://tomdebruijn.com/posts/benchmarking-doesnt-hurt/
3,Show HN: Chrome extension to Pause/Play music using a keyboard shortcut,josepcn,http://github.com/josepcn/caesura
