SCORE,TITLE,BY,URL
199,Show HN: Kaiwa a Modern Open-Source XMPP Web Client,emixam,http://getkaiwa.com
20,Stellar Consensus Protocol: Proof and Code,joyce,https://www.stellar.org/blog/stellar-consensus-protocol-proof-code/
39,Programmer Competency Matrix,kjhughes,http://sijinjoseph.com/programmer-competency-matrix/
96,Google purges bad extensions from Chrome,angeNoble,http://www.bbc.com/news/technology-32206511
124,Get a prediction of how other people perceive your face,dhsb,http://face.cbs.dtu.dk/
703,The 500-mile email,folz,http://web.mit.edu/jemorris/humor/500-miles
16,Continuation-passing style in JavaScript,codecurve,http://matt.might.net/articles/by-example-continuation-passing-style/
24,Introducing Vector: Netflix's On-Host Performance Monitoring Tool,r4um,http://techblog.netflix.com/2015/04/introducing-vector-netflixs-on-host.html
352,Ask HN: How do you deal with professional jealousy and getting older?,tastyface,
32,Ruby-like string interpolation in Python,est,https://github.com/syrusakbary/interpy
243,8088 MPH: We Break All Your Emulators,drv,http://trixter.oldskool.org/2015/04/07/8088-mph-we-break-all-your-emulators/
59,The Solar System and Beyond Is Awash in Water,dodders,http://www.jpl.nasa.gov/news/news.php?release=2015-119
39,Show HN: Redis-pipe – Use Redis lists like Unix pipes,morgenkaffee,https://github.com/lukasmartinelli/redis-pipe
8,The Full History of Board Games,attiapete,https://diceygoblin.com/blog/the-full-history-of-board-games/
119,A mysterious connection between number theory algebra and string theory?,Billesper,https://www.quantamagazine.org/20150312-mathematicians-chase-moonshines-shadow/
106,Human Rights Watch Sues DEA Over Bulk Collection of Americans’ Telephone Records,DiabloD3,https://www.eff.org/press/releases/human-rights-watch-sues-dea-over-bulk-collection-americans-telephone-records
58,Rise of the Machines: The Future Has Lots of Robots Few Jobs for Humans,mark_l_watson,http://www.wired.com/2015/04/rise-machines-future-lots-robots-jobs-humans/
84,The Apple Watch,orteipid,http://daringfireball.net/2015/04/the_apple_watch
22,What part of “No Totally” don't you understand?,moopling,http://www.newyorker.com/books/page-turner/what-part-of-no-totally-dont-you-understand
19,Apple Watch Review: You’ll Want One but You Don’t Need One,yawz,http://www.bloomberg.com/news/features/2015-04-08/apple-watch-review-you-ll-want-one-but-you-don-t-need-one
7,James Hoff’s music goes viral,erikschoster,http://www.frieze.com/issue/article/music31/
16,The RADStack: Open Source Lambda Architecture for Interactive Analytics [pdf],infie,http://static.druid.io/docs/radstack.pdf
8,Understanding Tech Penetration in Latin America,kellyf2,http://techcrunch.com/2015/04/07/understanding-tech-penetration-in-latam/?hc_location=ufi
273,Unit tests fail when run in Australia,luu,https://github.com/angular/angular.js/issues/5017
62,The 'Netflix for Books' Just Invaded Amazon's Turf,robgibbons,http://www.wired.com/2015/04/netflix-books-just-invaded-amazons-turf/
7,Vivisect / Vdb / Vtrace,albertzeyer,https://github.com/vivisect/vivisect
61,Ask HN: Anyone using a “no hands” setup for programming?,lazyjones,
1,Heap is hiring engineers to build large-scale analytics infrastructure,matm,https://heapanalytics.com/jobs
49,Ask HN: How do I test that I'm improving as a software developer?,tathagatadg,
8,Database Concurrency Control – Scheduling Problems,sandcrain,http://blog.dancrisan.com/intro-to-database-systems-concurrency-control-scheduling-problems
73,Paris’ $160M Plan to Boost Cycling,prattbhatt,http://www.wired.com/2015/04/us-cities-follow-paris-160m-plan-boost-cycling/
51,Bitcoin Lightning Networks Part I: Revocable Transactions,RustyRussell,http://rusty.ozlabs.org/?p=450
46,Gestalt Principles for Data Visualization,bayonetz,http://emeeks.github.io/gestaltdataviz/section1.html
6,Rhythm’s the Thing: A master class in the science of rhythm,dnetesn,http://nautil.us/issue/18/genius/genius-is-in-the-groove
56,Mars has belts of glaciers consisting of frozen water,cryptoz,http://phys.org/news/2015-04-mars-belts-glaciers-frozen.html
56,Show HN: CLI for executing code in many different languages with Docker,andystanton,https://docker-exec.github.io/
49,Armstrap: Open ARM development board,sigjuice,http://armstrap.org
115,BeOS Demo Video (1998) [video],NaOH,https://www.youtube.com/watch?v=BsVydyC8ZGQ
205,The daily stand-up is an anti-pattern,ignoramous,http://kristopherwilson.com/2015/03/09/the-daily-stand-up-is-an-antipattern/
6,Notes on Scalable Blockchain Protocols – Public Review,elmar,https://docs.google.com/document/d/1IxZqTQFhyhUDe8peeSEmjVVb32hzzQ_53bgs98yOTKA/edit
49,Tor: Illegal Weapons,skazka16,http://kukuruku.co/hub/infosec/tor-illegal-weapons
70,Dell XPS 13 Developer Edition,Synroc,http://www.dell.com/us/business/p/xps-13-linux/pd
35,Apple Watch Review: Bliss but Only After a Steep Learning Curve,tysone,http://www.nytimes.com/2015/04/09/technology/personaltech/apple-watch-bliss-but-only-after-a-steep-learning-curve.html
509,John Resig annotates original jQuery source code,tomlemon,http://genius.com/5088475
836,What I'd tell myself about startups if I could go back 5 years,vinnyglennon,http://www.talkingquickly.co.uk/2015/04/what-id-tell-myself-about-startups/
1,Airware (YC W13) Is Hiring: Code and Fly,jbdowney,
18,Rider on the Storm (2011),js2,http://www.damninteresting.com/rider-on-the-storm/?
44,Uber's popularity surges; business travelers avoiding taxis,adventured,http://hosted.ap.org/dynamic/stories/U/US_UBER_POPULAR_BUSINESS_TRAVELERS?SITE=AP&SECTION=HOME&TEMPLATE=DEFAULT&CTIME=2015-04-07-08-44-46
354,Introducing Progressive Equity – Increase employee ownership as company grows,andrew,http://blog.detour.com/introducing-progressive-equity/
15,Show HN: Breaktime – A CLI timer forcing you to take breaks by locking your Mac,lunarcave,https://github.com/ncthis/breaktime
7,Entanglement Clone with D3.js and TypeScript,fidraj,http://cacodaemon.de/index.php?id=67http://www.cacodaemon.de/demos/EntangledClone/
5,A new syntax definition format for Sublime,benesch,http://www.sublimetext.com/docs/3/syntax.html
19,Let's Develop an Entanglement Clone Using D3.js and TypeScript,bayonetz,http://cacodaemon.de/index.php?id=67
19,Indian Payments Startup MobiKwik Nabs $25M from Tree Line Cisco AmEx,robgibbons,http://techcrunch.com/2015/04/07/mobikwik-series-b/
204,NY Cops Used ‘Stingray’ Spy Tool 46 Times Without Warrant,Red_,http://www.wired.com/2015/04/ny-cops-used-stingray-spy-tool-46-times-without-warrant/
187,A few spy tools for your operating system (other than strace),Audiophilip,http://jvns.ca/blog/2015/04/06/a-few-spy-tools-for-your-operating-system-other-than-strace/
59,Microsoft seeks to recruit autistic workers,yitchelle,http://www.bbc.com/news/technology-32204999
23,Venus Spinning Slower Than Thought,curtis,http://news.nationalgeographic.com/news/2012/02/120214-venus-planets-slower-spin-esa-space-science/
323,I'll Accept Anything – Accepting every pull request submitted,mrkrstphr,https://github.com/mrkrstphr/illacceptanything
6,I work from home and I am productive. Yes it is possible and this is how,moit,http://thenuschool.com/stay-productive-remote-worker/
3,Introducing the All-Wheel Drive Model S 70D,dave1619,http://www.teslamotors.com/blog/introducing-all-wheel-drive-model-s-70d
8,Ask HN: Native Android development in 2015? Worth the effort?,hikz,
3,Can the world economy survive without fossil fuels?,sasvari,http://www.theguardian.com/news/2015/apr/08/can-world-economy-survive-without-fossil-fuels
3,Stanford University's First Pranksters,ryan_j_naughton,http://priceonomics.com/stanford-universitys-first-pranksters/
4,Athame – Full vim for bash and readline,blux,https://github.com/ardagnir/athame
46,The Smallest Eigenvalues of a Graph Laplacian,shriphani,http://blog.shriphani.com/2015/04/06/the-smallest-eigenvalues-of-a-graph-laplacian/
1,Kamcord is looking for a lead back-end engineer,vecter,https://jobs.lever.co/kamcord/412020c3-9c06-449d-bf10-653890ef262f?lever-source=hackernews
32,Private Companies Will Take Money Public Companies Don't Want,brunooo,http://www.bloombergview.com/articles/2015-03-24/private-companies-will-take-money-public-companies-don-t-want
44,Most Published Research Findings Are False–But Little Replication Goes Long Way,gwern,http://journals.plos.org/plosmedicine/article?id=10.1371/journal.pmed.0040028#close
53,Apple Watch Review – A Day in the Life,mnkypete,http://www.theverge.com/a/apple-watch-review
3,Recruiter Sniping,thinkbohemian,http://www.schneems.com/2015/04/08/recruiter-sniping.html
3,Approaching Zero Driver Overhead in OpenGL (2014) [video],orbifold,http://gdcvault.com/play/1020791/
3,Vibreoffice – vi(m) keybindings for Libreoffice and OpenOffice,Schiphol,https://github.com/seanyeh/vibreoffice
281,How Google Hires,Libertatea,http://www.wired.com/2015/04/hire-like-google/
48,Rethinking the Origins of the Lock,emhart,http://schuylertowne.com/research/rethinking-the-origins-of-the-lock
5,How Russians hackers breached the White House unclassified network,paganinip,http://securityaffairs.co/wordpress/35795/cyber-crime/russians-hacked-whitehouse.html
5,Obamacare Penalty Soars Nearly 250%,drussell,http://www.msn.com/en-us/money/insurance/the-penalty-for-going-without-obamacare-soars-nearly-250percent-over-2014-fee/ar-AAazVPp
8,Philosophy’s Great Minds Problem,stochast1k,http://upnight.com/2015/04/07/philosophys-great-minds-problem/
8,Apple Watch Review: A Day in the Life,orteipid,http://www.theverge.com/a/apple-watch-review
4,Tesla's New Model S 70D Adds All-Wheel Drive and 240 Mile Range,robgibbons,http://techcrunch.com/2015/04/08/teslas-new-entry-level-model-s-70d-adds-all-wheel-drive-and-240-mile-range/
255,Silicon Valley: Perks for Some Workers Struggles for Parents,aaronbrethorst,http://www.nytimes.com/2015/04/08/upshot/silicon-valley-perks-for-some-workers-struggles-for-parents.html
6,Show HN: Smalisca – Static Code Analysis for Smali,cyneox,https://github.com/dorneanu/smalisca
4,Teaching Haskell to a 10 year old: Day 1,lelf,https://superginbaby.wordpress.com/2015/04/08/teaching-haskell-to-a-10-year-old-day-1/
3,Bugs. Bugs Never Change,AndreyKarpov,http://www.viva64.com/en/b/0314/
6,F#ck it. Send,bradleyjoyce,http://launchdfw.com/editorial/fck-it-send/
45,Eclipse Common Lisp,phabian,https://github.com/blakemcbride/eclipse-lisp
7,Amethyst – a tiling window manager for Mac OS X,wanda,https://github.com/ianyh/Amethyst
120,Absolute Beginner's Guide to Emacs (2012),sea6ear,http://www.jesshamrick.com/2012/09/10/absolute-beginners-guide-to-emacs/
5,5 Productivity Myths You Should Stop Believing,ottjogi,https://blog.weekdone.com/5-productivity-myths-you-should-stop-believing/
102,Mailman 3.0 to modernize mailing lists,jordigh,http://lwn.net/SubscriberLink/638090/0229275ea355532b/
19,The Carpentry Way – Japanese Gateway,ciconia,http://thecarpentryway.blogspot.com/2015/04/gateway-84.html
193,JIT-compilation using GCC 5,Tsiolkovsky,http://developerblog.redhat.com/2015/04/07/jit-compilation-using-gcc-5-2/
47,Mockbin: generate custom endpoints to test mock and track HTTP requests,robinhowlett,http://mockbin.com/
26,Certificate verification bypass through the HTTP/2 Alt-Svc header,taylorbuley,https://www.mozilla.org/en-US/security/advisories/mfsa2015-44/
221,HPC is dying and MPI is killing it,ljdursi,http://www.dursi.ca/hpc-is-dying-and-mpi-is-killing-it/
8,Suohpanterror: Propaganda posters from Sápmi,unhammer,http://we-make-money-not-art.com/archives/2015/04/suohpanterror.php
248,DHS to Launch Nationwide License Plate Reader Program,conorgil145,https://cdt.org/blog/government-keeps-its-eyes-on-the-road-with-invasive-license-plate-reader-program/
8,You can see the milky way,anacleto,http://www.youcanseethemilkyway.com/light-pollution/
73,Germany's trade surplus is a problem,Thimothy,http://www.brookings.edu/blogs/ben-bernanke/posts/2015/04/03-germany-trade-surplus-problem
185,Arduino-Org: “Rename this fork and use less confusing versioning”,abstractbeliefs,https://github.com/arduino-org/Arduino/issues/2
13,It’s OK for your open source library to be a bit shitty,GarethX,http://www.drmaciver.com/2015/04/its-ok-for-your-open-source-library-to-be-a-bit-shitty/
5,Ask HN: [Google Rankings] You've got $5k to spend where do you put it?,dnevogt12,
142,Arch Linux – Do it yourself,dolftax,http://dolftax.com/2014/05/Arch-Linux-Do-It-Yourself/
45,Show HN: StatisticalAtlas.com: demographic charts and maps down to the city block,jacobn,http://statisticalatlas.com/place/California/San-Francisco/Race-and-Ethnicity
280,How I Start: Clojure,gigasquid,https://howistart.org/posts/clojure/1
13,A MILLION Chrome users' data was sent to ONE dodgy IP address,Usu,http://www.theregister.co.uk/2015/04/08/one_million_chrome_users_data_stolen_browser_extension/
269,A repository of modern C++ code samples curated by the community,edran,http://www.cppsamples.com/
7,Show HN: Kaleidocycle Simulator,algrant,http://algrant.github.io/kaleidocycle-js/
83,How we organize GitHub issues: A simple styleguide for tagging,zachdunn,https://robinpowered.com/blog/best-practice-system-for-organizing-and-tagging-github-issues/
177,A man who was accidentally released from prison 88 years early,danso,https://www.themarshallproject.org/2015/04/07/unfreed
3,Little-known real-time standard impacts broad span of Java applications,pron,http://www.javaworld.com/article/2906981/java-app-dev/little-known-real-time-standard-impacts-broad-span-of-java-applications.html
67,Scaling lessons from the CEO of Zenefits,charlierguo,https://medium.com/@charlierguo/scaling-lessons-from-the-fastest-growing-saas-company-ever-a6e077653d21
36,Hands-free Kafka Replication: A lesson in operational simplicity,nehanarkhede,http://blog.confluent.io/2015/04/07/hands-free-kafka-replication-a-lesson-in-operational-simplicity/
248,WebGL: 80.000 particles,_ZeD_,http://minimal.be/lab/fluGL/index80000.html
32,Using Netty as a generic library,pvorb,http://netty.io/wiki/using-as-a-generic-library.html
1,ZeroCater (YC W11) is looking for a full-stack engineer,arram,
3,Beyond Chance? The Persistence of Performance in Online Poker,thret,http://journals.plos.org/plosone/article?id=10.1371%2Fjournal.pone.0115479
49,The Problem of Publication-Pollution Denialism,denzil_correa,http://www.mayoclinicproceedings.org/article/S0025-6196(15)00190-1/pdf
197,Next Chrome Update Will Block SHA-1 Certificates,Mojah,https://ma.ttias.be/chrome-version-42-starts-blocking-sha-1-ssl-certificates/
18,A Legendary Redesign of Helvetica Reborn After 30 Years,nikunjk,http://www.wired.com/2015/04/legendary-redesign-helvetica-reborn-30-years/
3,A JavaScript Optional Argument Hazard,cycomachead,http://www.wirfs-brock.com/allen/posts/166
54,Why people hate PHP a book from hell,Iqth,http://blog.neattutorials.com/why-people-hate-php-a-book-from-hell/
5,Apple Watch Review Roundup: Future of the Wrist but 'Not for Everyone',robgibbons,http://www.macrumors.com/2015/04/08/apple-watch-review-roundup/
6,Show HN: NJ Transit REST API,ankurpatel,https://njtransitrestapi.herokuapp.com/
9,In Stillness Movement,michaelsbradley,http://swannodette.github.io/2015/04/07/in-stillness-movement/
450,HN Cheaters: Catch me if you can,adieu,https://porter.io/blog/hackernews-cheaters-catch-me-if-you-can/
70,Yi – Text editor written in Haskell,gnocchi,http://yi-editor.github.io/
4,The Geek of Chic,walterbell,http://www.newyorker.com/magazine/2012/09/10/the-geek-of-chic
15,Obits Became My Muse: The unusual lives of a physicist and an aviator,dnetesn,http://nautil.us/issue/20/creativity/how-the-obits-became-my-muse
102,Stop Trying to Catch Me,jlongster,http://jlongster.com/Stop-Trying-to-Catch-Me
93,Why do we have allergies?,Hooke,http://mosaicscience.com/story/why-do-we-have-allergies
63,Paper Now: Create edit and display a journal article entirely in GitHub,bpierre,https://github.com/PeerJ/paper-now
9,Tesla banned in West Virginia whose Senate president is also an auto dealer,jitbit,https://www.theverge.com/2015/4/3/8340433/west-virginia-ban-block-tesla-sales
9,WordPress Tips: Common WordPress Errors and How to Fix Them,jcvangent,http://inboundrocket.co/blog/wordpress-tips-common-wordpress-errors-and-how-to-fix-them-part-2/
50,Is It O.K. To Be A Luddite? (1984),colinprince,https://www.nytimes.com/books/97/05/18/reviews/pynchon-luddite.html#m01
18,Open Source Clone of Theme Hospital in Lua,gnocchi,https://github.com/CorsixTH/CorsixTH
7,Ahead of its time: The history of Looking Glass,velik_m,http://www.polygon.com/2015/4/6/8285529/looking-glass-history
20,Report: Russians Hacked White House,kirubakaran,http://www.newsweek.com/report-russians-hacked-white-house-320522
5,Uber Co-Founder’s Startup ‘Operator’ Will Get You What You Want,icpmacdo,http://techcrunch.com/2015/04/07/operator/#.auxoxl:ciV3
15,Hat Backup – Back-end-agnostic snapshotting backup system written in Rust,adamnemecek,https://github.com/google/hat-backup
4,An aluminum graphite battery that could charge your smartphone in 60 seconds,DiabloD3,http://www.extremetech.com/electronics/202778-an-aluminum-graphite-battery-that-could-charge-your-smartphone-in-60-seconds#.VSPd7MWTXws.twitter
9,Anko for Android,hhariri,http://blog.jetbrains.com/kotlin/2015/04/announcing-anko-for-android/
22,Hitting the Memory Wall: Implications of the Obvious (1994) [pdf],hyperpape,http://www.di.unisa.it/~vitsca/SC-2011/DesignPrinciplesMulticoreProcessors/Wulf1995.pdf
19,EuroPython Podcast Questions: the polemic “DjangoGirls DjangoGays ha ha ha”,agonzalezro,http://blog.europython.eu/post/115838231717/europython-podcast-questions
267,Ubiquiti Networks is creatively violating the GPL,futurerabbit,http://libertybsd.net/ubiquiti
505,Ten Years of Git: An Interview with Linus Torvalds,lclark,http://www.linux.com/news/featured-blogs/185-jennifer-cloer/821541-10-years-of-git-an-interview-with-git-creator-linus-torvalds
5,Google 'looking at buying Twitter',MarcScott,http://www.telegraph.co.uk/technology/google/11520819/Google-looking-at-buying-Twitter.html
7,Ask HN: How to protect our service against fake requests/trolls?,sgb_QQ,
5,Developers who work remotely earn 40 percent more than those who don't,yarapavan,http://www.businessinsider.in/Developers-who-work-remotely-earn-40-percent-more-than-those-who-dont/articleshow/46844507.cms
232,New South Wales Attacks Researchers Who Found Internet Voting Vulnerabilities,spenvo,https://www.eff.org/deeplinks/2015/04/new-south-wales-attacks-researchers-who-warned-internet-voting-vulnerabilities
5,Frequensea: an open source EM spectrum visualizer,dplarson,https://github.com/fdb/frequensea
1,StatusPage.io (YC S13) is hiring Rails engineers in Denver and San Francisco,scootklein,https://jobs.lever.co/statuspageio/0a8a9e28-79e9-40f0-ab0a-69c6afa8a2d5
135,Why I Love Haskell: An Example,apaprocki,http://thenewsh.blogspot.com/2015/04/why-i-love-haskell-example.html
25,Lossy’s Uncharted Waters,stenson,http://tonal.goodhertz.co/uncharted-waters/
100,NSA Spy Cam Blocker,humbyvaldes,https://store.randpaul.com/index.php/nsa-spy-cam-blocker.html
12,Slate – A Hacker’s Window Manager,drt,https://usepanda.com/blog/slate-review/
3,C11 function overloading,edward,http://grep.be/blog//en/computer/code/C11_function_overloading/
6,Snapdeal buys Freecharge in biggest startup M&A in India,Brajeshwar,http://economictimes.indiatimes.com/news/emerging-businesses/startups/snapdeal-buys-freecharge-in-biggest-startup-ma/articleshow/46848466.cms
78,Three.js – JavaScript 3D library,lisper,http://threejs.org/
4,The DEA collected call metadata way before the NSA did,robgibbons,http://www.engadget.com/2015/04/08/dea-track-international-phone-calls/
3,Russian hackers gained access to President Obama’s private schedule,robgibbons,http://thenextweb.com/us/2015/04/08/russian-hackers-gained-access-to-president-obamas-private-schedule/
3,Scrum Backlogs Lead to Bad Product Decisions,GarethX,https://medium.com/product-love/why-scrum-backlogs-lead-to-bad-product-decisions-461fcf339c63
83,Stack Overflow Developer Survey 2015,aalear,http://stackoverflow.com/research/developer-survey-2015
7,John Resig – Annotated Version of the Original JQuery Release,shawndumas,http://ejohn.org/blog/annotated-version-of-the-original-jquery-release/
7,Want More Women Working in Tech? Let Them Stay Home,dataker,http://www.wired.com/2015/04/powertofly/
6,Awesome C/C++,adamnemecek,http://fffaraz.github.io/awesome-cpp/
18,U.S. secretly tracked billions of calls for decades,knowtheory,http://www.usatoday.com/story/news/2015/04/07/dea-bulk-telephone-surveillance-operation/70808616/
65,Google Moderator is shutting down on June 30 2015,daw___,https://www.google.com/moderator/
4,Ask HN: Review my startup landing page flyoso.com,flyoso,
23,What should first time managers know?,joedunn,
86,A Guide to Thesis-Writing and a Guide to Life,stillsut,http://www.newyorker.com/books/page-turner/a-guide-to-thesis-writing-that-is-a-guide-to-life?intcid=mod-latest
3,If you called anyone overseas from 1992-2013 the DEA probably knew about it,dbcooper,http://arstechnica.com/tech-policy/2015/04/if-you-called-anyone-overseas-from-1992-2013-the-dea-probably-knew-about-it/
953,Myself – v1.0.3,mmastrac,http://codepen.io/jakealbaugh/full/PwLXXP/
62,New XPS 13 Developer Edition from Dell,nighthawk24,http://www.dell.com/us/business/p/xps-13-linux/pd.aspx
83,Numeric JavaScript,shawndumas,http://numericjs.com/
66,Why 'zero rating' is the new battleground in net neutrality debate,fraqed,http://www.cbc.ca/news/business/why-zero-rating-is-the-new-battleground-in-net-neutrality-debate-1.3015070?cmp=rss
48,The failed promise of deep links,steven,https://medium.com/backchannel/the-failed-promise-of-deep-links-aa307b3abaa5
22,Redesigning MySQL – AWS Tech Talk on the Aurora Database [video],philip1209,https://engineering.opendns.com/2015/04/07/redesigning-mysql-aws-tech-talk-on-the-aurora-database/
64,OneBit – Mastercard PayPass Integrated Bitcoin Wallet,tobyai,http://www.getonebit.com
143,How Heartbleed could've been found,hannob,https://blog.hboeck.de/archives/868-How-Heartbleed-couldve-been-found.html
28,The Assistant Economy,sergeant3,http://www.dissentmagazine.org/article/the-assistant-economy
94,Keybase.io,holodigm,https://www.tbray.org/ongoing/When/201x/2014/03/19/Keybase
6,Excited About D,naryad,http://hawkins.io/2015/04/excited-about-d/
12,9-year-old destroys Florida’s new standardized test in front of school board,guiambros,http://www.washingtonpost.com/blogs/answer-sheet/wp/2015/04/07/9-year-old-destroys-floridas-new-standardized-test-in-front-of-school-board
49,Ask HN: Should I use K&R to learn C?,__revrs__,
17,Why empirical calibration is needed to correct p-values (2013) [pdf],gwern,http://www.dcscience.net/Schuemie-Madigan-2012.pdf
5,High performance Aluminium-ion batteries much quicker charging than Lithium Ion,jonobird1,https://www.youtube.com/watch?v=ZKIcYk7E9lU&feature=youtu.be
224,Facebook use linked to depressive symptoms,alexcasalboni,http://www.sciencedaily.com/releases/2015/04/150406144600.htm
199,Show HN: Get pinged when standards hit 90% browser support,AlexMuir,http://frontendhq.com/pinger
4,Exposing the Murky World of Online Ads Aimed at Kids,ghosh,http://www.wired.com/2015/04/exposing-murky-world-online-ads-aimed-kids/
67,Beep.js – toolkit for building browser-based synthesizers,elnn,http://beepjs.com
1,JavaScript aficionado wanted for front-end role at Homejoy,mlinsey,http://grnh.se/84fb1t
81,The Internet of Kafkaesque Things,CapitalistCartr,https://www.aclu.org/blog/technology-and-liberty/internet-kafkaesque-things
33,BabylonJS – A JavaScript framework for building 3D games with HTML 5 and WebGL,fenomas,https://github.com/BabylonJS/Babylon.js
22,Gogo plane Wi-Fi blocks YouTube (and can read your email),kdazzle,http://money.cnn.com/2015/01/06/technology/security/gogo-wifi/
9,Number of groundstations needed to cover LEO: An optimization approach,elkos,http://papachristoumarios.blogspot.com/2015/04/number-of-groundstations-needed-to.html
11,One Instruction Set Computer,quadrature,http://en.wikipedia.org/wiki/One_instruction_set_computer
69,WSU statistician sues seeking Kansas voting machine paper tapes,kldavis4,http://www.kansas.com/news/politics-government/article17139890.html
3,Saving Game History Forever – Or Dooming It to Oblivion? [video],bane,http://www.gdcvault.com/play/1022240/Saving-Game-History-Forever-Or
217,Neovim Newsletter #5 – Out of the Box,davis,http://neovim.org/news/2015/april/
14,The Experience and Perception of Time,infinity,http://plato.stanford.edu/entries/time-experience/
11,Passphrases via shell pipeline,jessaustin,http://leancrew.com/all-this/2015/04/passphrases-via-shell-pipeline/
7,Ultra Large Scale Systems: The Software Challenge of the Future (2006) [pdf],brudgers,http://resources.sei.cmu.edu/asset_files/Book/2006_014_001_30542.pdf
16,Current Status of IA.BAK – A backup of the Internet Archive,edward,http://iabackup.archiveteam.org/ia.bak/
95,Consistency and discipline over motivation,dwltz,http://blog.donnywals.com/consistency-and-discipline-over-motivation/
18,The Potential Upside to a Technology Bubble,brandonlipman,http://techcrunch.com/2015/04/07/the-potential-upside-to-a-technology-bubble/
4,Cybercrime Is Now More Profitable Than the Drug Trade,infosecbuzz,http://www.tripwire.com/state-of-security/regulatory-compliance/pci/cybercrime-is-now-more-profitable-than-the-drug-trade/#.VSTc_tepZDR.hackernews
9,The Industrial Revolution and the Industrious Revolution (1994) [pdf],benbreen,http://old.econ.ucdavis.edu/faculty/gclark/210a/readings/de%20Vries%20industrious.pdf
8,Edge detect ad nauseam,mafuyu,http://www.boldport.com/blog/2015/4/3/edge-detect-ad-nauseam
112,Xmonad – A dynamically tiling X11 window manager,pykello,http://xmonad.org/
