SCORE,TITLE,BY,URL
11,Facebook Launches Messenger for Web,techaddict009,https://www.messenger.com/
43,Black-hole.js,MrBra,http://cliffcrosland.tumblr.com/post/115981256393/black-hole-js
49,A list of SaaS PaaS and IaaS tools with free tiers,ignoramous,https://github.com/ripienaar/free-for-dev
126,Lyft allowed unauthorised access to my account,dayanajabif,
37,Police chief: “Paying the Bitcoin ransom was the last resort”,edward,http://www.msn.com/en-us/news/technology/police-chief-%E2%80%9Cpaying-the-bitcoin-ransom-was-the-last-resort%E2%80%9D/ar-AAaBz50
33,Do Artifacts Have Politics? (1980) [pdf],hownottowrite,http://innovate.ucsb.edu/wp-content/uploads/2010/02/Winner-Do-Artifacts-Have-Politics-1980.pdf
13,One year later the homeless coder is still living on the streets,Sandman,http://mashable.com/2015/04/05/homeless-coder-still-homeless/
5,Crowdsourcing Mental Health Therapy,fibonacciwolf,http://www.wired.com/2015/04/social-network-designed-combat-depression/
27,Ask HN: Why USB drives are still using the FAT32 format?,touristtam,
5,Let's Encrypt: A Free and Open Cert Authority,happyman,https://letsencrypt.org/
4,A response to George R. R. Martin from the author who started Sad Puppies,jarsin,http://monsterhunternation.com/2015/04/09/a-response-to-george-r-r-martin-from-the-author-who-started-sad-puppies/
188,Calculus with pics and gifs,archibaldJ,http://0a.io/0a-explains-calculus
106,This project won China 2014 State Science and Technology Prize,claymore_sun,https://github.com/iiordanov/remote-desktop-clients/issues/39
432,Trends that will create demand for an Unconditional Basic Income,nkoren,http://simulacrum.cc/2013/07/10/three-trends-that-push-us-towards-an-unconditional-basic-income/
316,How 'DevOps' Is Killing The Developer,jknupp,http://jeffknupp.com/blog/2014/04/15/how-devops-is-killing-the-developer/
8,Still Wanted: HTML/Front end programmer for a small project/task,ColinWright,
107,The State of Probabilistic Programming,superfx,https://moalquraishi.wordpress.com/2015/03/29/the-state-of-probabilistic-programming/
16,SpaceX CRS-6 Launch,costent,http://livestream.com/spacex/events/3959775
121,Varoufakis and Stiglitz [video],MaysonL,https://www.youtube.com/watch?v=OY3Qxm6BoUI
6,The global economy’s problem: Too much money,prostoalex,http://qz.com/380342/the-global-economys-bizarre-problem-too-much-money/
9,The oldest trick in the ASCII book,jgrahamc,https://blog.cloudflare.com/the-oldest-trick-in-the-ascii-book/
346,Math for eight-year-olds: graph theory for kids,AllTalk,http://jdh.hamkins.org/math-for-eight-year-olds
320,One line you should add to every makefile,jgrahamc,http://blog.jgc.org/2015/04/the-one-line-you-should-add-to-every.html
6,It’s the Weekend. Why Are You Working?,riqbal,https://hbr.org/2015/04/its-the-weekend-why-are-you-working
4,This Was Not Looting,davisclark,http://www.slate.com/articles/news_and_politics/fighting_words/2005/03/this_was_not_looting.html
5,The Power of The Plain Old Website,robertbruce,http://inessential.com/2014/08/27/waffle_on_social_media
4,Eduardo Galeano Open Veins of Latin America Writer Dies,iamcurious,http://www.theguardian.com/books/2015/apr/13/eduardo-galeano-open-veins-of-latin-america-writer-dies
3,Yes ocp-memprof (s)can(f),cago,http://www.ocamlpro.com/blog/2015/04/13/ocp-memprof-memory-leaks-scanf.html
37,The IRS guide to debugging XML errors in your rejected tax return,jpatokal,http://www.irs.gov/uac/Rejected-Return-Help-for-Free-File-Fillable-Forms
4,Scientists just found the first evidence for liquid water on Mars,uptown,http://www.vox.com/2015/4/13/8384337/mars-water-liquid-curiosity
200,John Carmack's First Game,santaclaus,http://crpgaddict.blogspot.com/2015/04/game-183-shadowforge-1989.html
17,Amazon Google and More Are Drawn to Home Services Market,aaronbrethorst,http://www.nytimes.com/2015/04/13/technology/amazon-google-and-more-are-drawn-to-home-services-market.html
3,Response to Raising Money in London Almost Killed Our Startup,jackgavigan,https://medium.com/@doug_scott/response-to-raising-money-in-london-almost-killed-our-startup-71d83db6479b
4,Articles Predicting That the Apple Watch Will Fail,secondfret,https://medium.com/@secondfret/articles-predicting-that-the-apple-watch-will-fail-127be27984ee
24,Manjaro Blames GlobalSign for SSL Cert expiry after not receiving “extension”,andygambles,http://manjaro.github.io/expired_SSL_certificate_update/
7,Why Google's Robot Personality Patent Is Not Good for Robotics,spectruman,http://spectrum.ieee.org/automaton/robotics/robotics-software/why-googles-robot-personality-patent-is-not-good-for-robotics
3,The Anti-Mac User Interface [1996],Symmetry,http://www.nngroup.com/articles/anti-mac-interface/
129,Erlang the movie II: The Sequel,jfaucett,http://www.gar1t.com/blog/erlang-the-movie-ii-the-sequel.html
10,How the Hottest Biotech Sprouted in Iowa,drsilberman,http://www.wsj.com/articles/how-the-hottest-biotech-sprouted-in-iowa-1428866927?mod=WSJ_hp_LEFTWhatsNewsCollection
7,Running Ansible Programmatically,fideloper,https://serversforhackers.com/running-ansible-programmatically?source=hn
4,React.js: Mistakes made in my first Flux application,jetupper,https://medium.com/@jetupper/hello-react-js-b87c63526e3a
5,A Call for More Tech Leadership: A Critical Discipline We Need to Cultivate,caseywest,http://caseywest.com/a-call-for-more-tech-leadership/
71,Sophia: A modern embeddable key-value database – v1.2.2 released,pmwkaa,http://sphia.org/index.html
1,Drchrono is looking for iOS and Django Hackers take our hacker challenge,d8niel,https://www.hackerrank.com/tests/527036edb11ff/0ca5532381fbebad9fffaa28dc90475f
13,What’s Holding Tech M&A Back?,prostoalex,http://a16z.com/2015/04/10/whats-holding-tech-ma-back/
127,Solaris adopting OpenBSD's pf,mfincham,http://bsdly.blogspot.com/2015/04/solaris-admins-for-glimpse-of-your.html
8,Why did I wake up just before my alarm clock went off?,JetSpiegel,https://joearms.github.io/2015/03/02/Waking-Up.html
347,DEA Orchestrates Disinformation Campaign to Conceal Surveillance Powers,greenyoda,http://popehat.com/2015/04/09/dea-orchestrates-disinformation-campaign-to-conceal-surveillance-powers
43,More Sex Talk from the Love Scientist,dnetesn,http://nautil.us/blog/more-sex-talk-from-the-love-scientist
5,Negotiating HTTP/2: ALPN and the TLS Handshake,mparr4,http://matthewparrilla.com/post/negotiation-http2-alpn-tls-handshake/
4,The Costly NY Startup Program That Created 76 Jobs,SunTzu55,http://news.dice.com/2015/04/13/costly-ny-startup-program-created-76-jobs/
13,Introduction to Networked Physics,signa11,http://gafferongames.com/networked-physics/introduction-to-networked-physics/
4,JsPDF is now available as a Meteor package,chipcastle,https://atmospherejs.com/chipcastledotcom/jspdf
125,UW scientists biotech firm may have cure for colorblindness,mdturnerphys,http://www.seattletimes.com/seattle-news/health/uw-scientists-biotech-firm-may-have-cure-for-colorblindness/
8,How to build a constraint propagator in a weekend,deepaksurti,https://ianhorswill.wordpress.com/2013/03/26/how-to-build-a-constraint-propagator-in-a-weekend/
7,How to Save a Dying Language,Tomte,http://www.smithsonianmag.com/innovation/how-to-save-a-dying-language-4143017/?all
6,Implications of the Copernican principle for our future prospects (1993) [pdf],tokai,http://www-psych.stanford.edu/~jbt/224/Gott_93.pdf
40,Machine learning in navigation: detect maneuvers using accelerometer gyroscope,alexander996,https://blindmotion.github.io/2015/04/11/ml-in-navigation/
15,An Introduction to Design by Contract,brudgers,https://archive.eiffel.com/doc/manuals/technology/contract/
6,Data modeling with Redis and Ohm,soveran,http://www.sitepoint.com/semi-relational-data-modeling-redis-ohm/
5,Show HN: “Add a License Please” – GitHub Bot,karangoeluw,https://github.com/karan/add-a-license-please
4,Measure Twice Code Once [pdf],feld,https://files.pfsense.org/papers/netperf-talk.pdf
26,Pre-Inca canals may solve Lima's water crisis,happyscrappy,http://www.newscientist.com/article/dn27311-preinca-canals-may-solve-limas-water-crisis.html#.VSpXzxj3arV
351,Updating Our Open Source Patent Grant,spicyj,https://code.facebook.com/posts/1639473982937255/updating-our-open-source-patent-grant/
78,The Mystery of the Millionaire Metaphysician (2001),ForHackernews,http://www.slate.com/articles/life/culturebox/2012/02/the_mystery_of_the_millionaire_metaphysician_slate_republishes_one_of_the_greatest_magazine_stories_ever_written_.single.html
5,World's first head transplant patient could experience a fate 'worse than death',fmax30,http://www.businessinsider.com/valery-spiridonov-head-transplant-2015-4?utm_content=bufferb921f&utm_medium=social&utm_source=facebook.com&utm_campaign=buffer
5,Behind Time Warner CEO Jeff Bewkes’s ‘Cord-Cutter’ Pitch,prostoalex,http://www.wsj.com/article_email/behind-time-warner-ceo-jeff-bewkess-cord-cutter-pitch-1428870356-lMyQjAxMTE1NDEzMjkxMTI2Wj
78,On the Great Filter existential threats and griefers,cstross,http://www.antipope.org/charlie/blog-static/2015/04/on-the-great-filter-existentia.html
8,We need open models not just open data,hemapani,http://radar.oreilly.com/2014/11/we-need-open-models-not-just-open-data.html
25,Ask HN: Young devs vs. Older devs salaries,Nemant,
9,Twitter Is Pushing Celebrities and Publishers to Stop Using Meerkat,simas,http://techcrunch.com/2015/04/12/this-stream-aint-big-enough-for-the-both-of-us/
10,Difficult puzzle game created using JavaScript,coderu,http://coderbyte.com/github/reverse/
6,French surveillance bill draws criticism,antouank,http://www.theguardian.com/world/2015/apr/13/french-surveillance-civil-liberty-criticisms
65,“So …” What?,wglb,https://www.tbray.org/ongoing/When/201x/2015/04/11/So-What
3,The Minimum Viable Product: A Primer,chwolfe,https://medium.com/galleys/the-minimum-viable-product-a-primer-3d9a76dd5213
4,Steam Trains Were 19th-Century Super-Weapons,vinnyglennon,https://medium.com/war-is-boring/steam-trains-were-19th-century-super-weapons-f4899564ee6d
36,Docear – The Academic Literature Suite,jestinjoy1,http://www.docear.org/
26,My brain on electricity: A 130-day tDCS experiment,i4i,http://www.adifferentdrum.org/my-brain-on-electricity-a-130-day-tdcs-experiment/
1,Underground Cellar (YC W15) Seeks VP of Customer Acquisition,jeffreybarrett,
141,Twitter Cuts Off DataSift To Step Up Its Own Big Data Business,nailer,http://techcrunch.com/2015/04/11/twitter-cuts-off-datasift-to-step-up-its-own-b2b-big-data-analytics-business/#.acq8mm:kcu0
37,Dependency Injection Inversion of Control and the Dependency Inversion Principle,kasey_junk,http://kc.my-junk.info/di-ioc-dip/
14,Nethack is not dead,mgregory22,http://nethack.org/
7,Ask HN: Do you ever want to work on something greater than your job?,taigeair,
49,Linux kernel initialization part 5,0xAX,https://github.com/0xAX/linux-insides/blob/master/Initialization/linux-initialization-5.md
3,Microsoft and Miele team up to cook up an IoT revolution,mtuncer,http://betanews.com/2015/04/12/microsoft-and-miele-team-up-to-cook-up-an-iot-revolution/
9,Zach Holman on Photos.app,sethvargo,https://github.com/holman/feedback/issues/679
101,The Essence of Peopling,ivank,http://www.ribbonfarm.com/2015/04/08/the-essence-of-peopling/
78,Intel DDIO LLC cache buffer alignment prefetching and packet rates,eadler,http://adrianchadd.blogspot.com/2015/04/intel-ddio-llc-cache-buffer-alignment.html
48,A look beyond x86: OpenPOWER and AArch64,fcambus,http://lvalsan.web.cern.ch/lvalsan/processor_benchmarking/presentation/
21,Confetti – Tumblr for events,titanas,http://confetti.events
