SCORE,TITLE,BY,URL
44,The Puzzling Rise in Nearsighted Children,Kortaggio,http://www.wsj.com/articles/the-mysterious-spike-in-nearsighted-children-1429543997?mod=WSJ_article_EditorsPicks_1
150,The Effect of Physical Exercise on the Concentration of Individuals with ADHD,romefort,http://www.ncbi.nlm.nih.gov/pmc/articles/PMC4372555/
403,Why We Are No Longer Developing for the iPad,mason240,http://spiderwebforums.ipbhost.com/index.php?/topic/21512-why-we-are-no-longer-developing-for-the-ipad/
8,Finding Every Vulnerable App in the App Store,NateLawson,http://sourcedna.com/blog/20150420/afnetworking-vulnerability.html
7,Show HN: Didit.io a place to track what you do,mfsmillie,http://didit.io
142,How Doomed is NetApp?,PaulHoule,http://storagemojo.com/2015/04/13/how-doomed-is-netapp/
53,Of Debt and Decisions,spooneybarger,http://www.monkeysnatchbanana.com/2015/04/19/of-debt-and-decisions/
7,Show HN: Genius Annotations Button – Inspired by GitHubButtons,joshmn,https://www.geniusbtn.com
48,Taking Netflix’s Vector Performance Monitoring Tool for a Spin,Mojah,https://ma.ttias.be/taking-netflixs-vector-performance-monitoring-tool-for-a-spin/?hn
106,Google Cloud sucks,rap,https://yourbunnywrote.org/2015/04/19/google-cloud/
3,Security Flaw Affects 1500 iOS Apps While OS X 'Rootpipe' Fix Proves Incomplete,lladnar,http://www.macrumors.com/2015/04/21/security-flaws-1500-ios-apps-rootpipe/
7,AVC: The Rich Get Richer,timdaub,http://avc.com/2015/04/the-rich-get-richer/
5,Ask HN: Can We Identify Patterns in Source Code?,mukgupta,
4,Simple SVG drawing app using Backbone.js and Snap.svg,sallar,https://github.com/sallar/SVGDraw
193,Python 2 Python 3 Debian and Porting,neokya,https://lists.debian.org/debian-devel-announce/2015/04/msg00005.html
69,Go Challenge 3: write a photo-mosaic generating web application,JoeAcchino,http://golang-challenge.com/go-challenge3/
83,The lawyer taking on Uber and the rest of the on-demand economy,ph0rque,http://fusion.net/story/118401/meet-the-lawyer-taking-on-uber-and-the-on-demand-economy/
3,Why Develop Open-Source Software? (2007) [pdf],sp8,https://pure.royalholloway.ac.uk/portal/files/24481774/Sauer_OXREP.pdf
5,How successful people work less–and get more done,ub,http://qz.com/386166/how-successful-people-work-less-and-get-more-done/?utm_source=atlanticFB
34,Show HN: Varnishtuner.py,jjoe,https://github.com/unixy/varnishtuner.py
189,Elon Musk Had a Deal to Sell Tesla to Google in 2013,r0h1n,http://www.bloomberg.com/news/articles/2015-04-20/elon-musk-had-a-deal-to-sell-tesla-to-google-in-2013
43,Last Week Tonight with John Oliver: Patents [video],antileet,https://www.youtube.com/watch?v=3bxcc3SM_KA
8,7 python libraries you should know about,ghshephard,http://doda.co/7-python-libraries-you-should-know-about/
248,PizzaHut still serves its first homepage,narfz,http://www.pizzahut.com/assets/pizzanet/home.html
184,Reverse Engineering Wipeout,Donzo,http://phoboslab.org/log/2015/04/reverse-engineering-wipeout-psx
258,The Code Is Just the Symptom,gvb,https://medium.com/@rubyghetto/the-code-is-just-the-symptom-c77f43b29320
4,I'm giving up on business. Here's why,bradcypert,http://www.bradcypert.com/today-im-giving-up-business/
8,XSS Vulnerability Affecting Multiple WordPress Plugins,artdecotech,https://blog.sucuri.net/2015/04/security-advisory-xss-vulnerability-affecting-multiple-wordpress-plugins.html
108,I was interviewed by Fog Creek,janvdberg,http://www.catonmat.net/blog/fogcreek-interview/
20,Million Dollar Cat Billboard,elsewheretop,https://catbillboard.wordpress.com/
39,Ask HN: How did you meet your co-founder(s)?,rblion,
70,Optimizing TLS for High–Bandwidth Applications in FreeBSD [pdf],wglb,https://people.freebsd.org/~rrs/asiabsd_2015_tls.pdf
37,Myers-Briggs types for developers compared to US population,benburwell,http://developermedia.com/developer-personalities-audience-brief-report/
964,Myself – v1.0.3,mmastrac,http://codepen.io/jakealbaugh/full/PwLXXP/
166,Distraction is a kind of obesity of the mind,bootload,http://www.theguardian.com/media/2015/apr/12/matthew-crawford-distraction-is-a-kind-of-obesity-of-the-mind-the-world-beyond-your-head
158,CloudFlare Is Now a Google Cloud Platform Technology Partner,jgrahamc,https://blog.cloudflare.com/cloudflare-is-now-a-google-cloud-platform-technology-partner/
7,Code Inflation [pdf],pmarin,http://www.computer.org/cms/Computer.org/ComputingNow/issues/2015/04/mso2015020010.pdf
65,Cheese from the same proteins as milk but from genetically modified yeast,asciimo,http://www.wired.com/2015/04/diy-biotech-vegan-cheese/
43,Workers Seeking Productivity in a Pill Are Abusing A.D.H.D. Drugs,romefort,http://www.nytimes.com/2015/04/19/us/workers-seeking-productivity-in-a-pill-are-abusing-adhd-drugs.html
155,Show HN: Bot accepts every pull request for its own code,mappum,https://github.com/botwillacceptanything/botwillacceptanything
10,Show HN: Bootstrap Form Builder,cjy,https://formden.com/form-builder/
6,Brainstorming Does Not Work,danielalmeida,https://medium.com/galleys/brainstorming-does-not-work-6ad7b1448dcf?section=suggested
31,An actual guy named “Null” messes up people's databases,thepumpkin1979,http://stackoverflow.com/questions/4456438/how-do-i-correctly-pass-the-string-null-an-employees-proper-surname-to-a-so
32,Protecting infrastructure secrets with Keywhiz from Square,strzalek,https://corner.squareup.com/2015/04/keywhiz.html
69,The easiest way to use Docker on your Mac,juanriaza,https://kitematic.com/
478,Secure Secure Shell,padraic7a,https://stribika.github.io/2015/01/04/secure-secure-shell.html
26,Why Smart People Have Bad Ideas,transburgh,http://www.paulgraham.com/bronze.html
7,Married men work harder smarter and make more money,Errorcod3,http://www.washingtonpost.com/news/inspired-life/wp/2015/04/02/dont-be-a-bachelor-why-married-men-work-harder-and-smarter-and-make-more-money/
24,How Facebook’s React Native Will Change Mobile Apps,xngzng,http://techcrunch.com/2015/04/20/how-facebooks-react-native-will-change-mobile-apps/#.htuatc:kNq6
6,Where does money for research come from in the US?,ub,http://www.themadscienceblog.com/2013/11/where-does-money-for-research-come-from.html
8,Ask HN: SaaS vs. build it yourself when launching a startup,Drei01Matt,
22,Building apps for passive income,snez,https://medium.com/@christosconst/building-apps-for-passive-income-c96144185e5f
115,SX – Stack Exchange mode for Emacs,brudgers,https://github.com/vermiculus/sx.el/blob/master/README.org
206,Pokemon Yellow Total Control Hack,hobs,http://aurellem.org/vba-clojure/html/total-control.html
17,A list of great podcasts about Data Science and Machine Learning,mattfogel,https://medium.com/@mattfogel/the-7-best-data-science-and-machine-learning-podcasts-e8f0d5a4a419
3,‘Free-range’ flap fans the flames of a national debate on parenting,user_235711,http://www.washingtonpost.com/local/education/free-range-flap-in-maryland-fans-flames-of-national-debate-on-parenting/2015/04/18/ebc10248-e47e-11e4-81ea-0649268f729e_story.html
23,Ubuntu 15.04: Desktop Phone and IoT; towards a converged future,reddotX,https://insights.ubuntu.com/2015/04/21/ubuntu-15-04-desktop-phone-and-iot-towards-a-converged-future/
154,Grafana 2.0 Released,eloycoto,http://grafana.org/blog/2015/04/20/Grafana-2-Released.html
3,How to become President of the United States without getting elected,pinwale,https://medium.com/@pinwale/how-to-become-president-of-the-united-states-without-being-elected-93835a6c8891
3,Aereo will pay $950000 to the TV broadcasters that put it out of business,leklund,http://www.theverge.com/2015/4/21/8461381/aereo-reaches-950000-settlement-broadcasters
8,Study of 95K children finds no link between MMR vaccines and autism,alexcasalboni,http://www.vocativ.com/culture/science/no-link-autism-and-vaccines-mmr/
22,MOSH,cjr,http://getmosh.io/
336,FBI overstated forensic hair matches in nearly all trials before 2000,protomyth,http://www.washingtonpost.com/local/crime/fbi-overstated-forensic-hair-matches-in-nearly-all-criminal-trials-for-decades/2015/04/18/39c8d8c6-e515-11e4-b510-962fcfabc310_story.html
8,The power of DNS rebinding: stealing WiFi passwords with a website,moonlander,https://miki.it/blog/2015/4/20/the-power-of-dns-rebinding-stealing-wifi-passwords-with-a-website/
24,Mistaking Authentication for Identification,gmalette,https://medium.com/@gmalette/mistaking-authentication-for-identification-983447739eee
35,Google.com is still SHA-1 but they green-light their domains,pmccarren,https://tls.so/results/saved.googlecom.1429596106.6f228b1cd37213931aef2193311d990a.html
5,WHY CAN'T AMERICA HAVE GREAT TRAINS?,dnetesn,http://www.nationaljournal.com/magazine/amtrak-acela-high-speed-trains-20150417
4,Analyzing the Magento vulnerability,gwillem,http://blog.checkpoint.com/2015/04/20/analyzing-magento-vulnerability/
8,BrightRoll Head of Talent Engineering Shares Advanced Recruiting Lessons,podbaydoors,http://blog.entelo.com/yahoo-talent-engineer-discusses-recruiting-lessons
193,Lol my thesis – Summing up years of work in one sentence,anigbrowl,http://lolmythesis.com/
6,Developers' Lack of Diversity Still an Issue,SunTzu55,http://news.dice.com/2015/04/21/developers-lack-of-diversity-still-an-issue/
79,VMware just created its first Linux OS and it's rubbish,mkesper,https://lwn.net/Articles/641141/#Comments
113,Intel's 14nm technology in detail (2014),craigjb,http://www.anandtech.com/show/8367/intels-14nm-technology-in-detail
13,The Spandrels of San Marco Revisited: An Interview with Richard C. Lewontin,andyjohnson0,https://evolution-institute.org/article/the-spandrels-of-san-marco-revisited-an-interview-with-richard-c-lewontin/
10,P2pkit: nabling you to accurately discover and directly message users nearby,yawniek,http://p2pkit.io/
82,How Nicaraguan Villagers Built Their Own Electric Grid,jonbaer,http://spectrum.ieee.org/energy/renewables/how-nicaraguan-villagers-built-their-own-electric-grid
142,A proof of concept MongoDB clone built on Postgres,pablobaz,https://github.com/JerrySievert/mongolike
93,Turning Ethiopia's desert green,ghosh,http://www.bbc.com/news/magazine-32348749
6,1500 iOS apps have HTTPS-crippling bug,simas,http://arstechnica.com/security/2015/04/1500-ios-apps-have-https-crippling-bug-is-one-of-them-on-your-device
121,Elm 0.15: Asynchrony with Tasks,jwmerrill,http://elm-lang.org/blog/announce/0.15.elm
19,Utilizing LLVM TableGen to Generate SSH Configs,2510c39011c5,http://www.embecosm.com/2015/04/14/utilizing-tablegen-for-non-compiling-processes/
79,Null Pointer Dereferencing Causes Undefined Behavior,DmitryNovikov,https://software.intel.com/en-us/blogs/2015/04/20/null-pointer-dereferencing-causes-undefined-behavior
21,Justine Musk Answers How Can I Be as Great as Bill Gates Steve Jobs Elon Musk?,pjvds,http://www.quora.com/How-can-I-be-as-great-as-Bill-Gates-Steve-Jobs-Elon-Musk-Richard-Branson/answer/Justine-Musk?share=1
24,Ub-canaries: Programs that try to make compilers exploit undefined behavior,jsnell,https://github.com/regehr/ub-canaries
11,The Wolf of Wall Tweet,Ashan,http://www.slate.com/articles/business/moneybox/2015/04/bot_makes_2_4_million_reading_twitter_meet_the_guy_it_cost_a_fortune.html
318,WikiLeaks publishes 30000 leaked Sony documents,ryan_j_naughton,https://wikileaks.org/sony
4,Startup Solves ‘Star Wars’ Droid Puzzle,donohoe,http://www.nytimes.com/2015/04/20/business/media/start-up-solves-star-wars-droid-puzzle.html?&moduleDetail=section-news-3&action=click&contentCollection=Media&region=Footer&module=MoreInSection&pgtype=article
6,Ask HN: Have you upvoted by mistake?,0xdeadbeefbabe,
71,Suicide Linux (2011),josephmx,http://qntm.org/suicide
47,Hacker News written with Angular 2.0,hswolff,http://hswolff.github.io/hn-ng2/
619,Announcing Git Large File Storage,dewski,https://github.com/blog/1986-announcing-git-large-file-storage-lfs
197,Run your own high-end cloud gaming service on EC2,arcticbull,http://lg.io/2015/04/12/run-your-own-high-end-cloud-gaming-service-on-ec2.html
5,Ask HN: When to pay it forward vs. focusing on your startup,schappim,
19,Winners of the 2015 Pulitzer Prize,samclemens,http://www.pulitzer.org/awards/2015
151,A Tale Of Two Latino Areas In Miami And San Francisco,yummyfajitas,http://marketurbanism.com/2015/04/20/travel-update-a-tale-of-two-latino-areas-in-miami-and-san-francisco/
69,New Theory Leads to Gigahertz Antenna on a Chip,jonbaer,http://spectrum.ieee.org/tech-talk/telecom/wireless/gigahertz-antenna-on-a-chip
1,Bannerman (YC S14) is hiring sales development reps,voska,http://bannerman.breezy.hr/p/7c65cd97cfa2-sales-development-rep
11,Next Generation Cloud Storage: Unlimited End-To-End Encrypted Open Source,denma,https://www.indiegogo.com/projects/disk42-next-generation-cloud-storage/x/10218462
81,Photon – Minimal Linux Container Host,frostmatthew,https://vmware.github.io/photon/
162,Homeless Millennials Are Transforming Hobo Culture,petethomas,http://www.newsweek.com/homeless-millennials-are-transforming-hobo-culture-323151
28,Interview with Chris Hartjes,GarethX,http://blog.fogcreek.com/dev-life-interview-with-chris-hartjes/
