SCORE,TITLE,BY,URL
4,Artificial Intelligence and the Future of Coding,poshaughnessy,http://www.peteroshaughnessy.com/post/115768091834/artificial-intelligence-and-the-future-of-coding
303,Responsive Tables in Pure CSS,tvalent2,https://techblog.livingsocial.com/blog/2015/04/06/responsive-tables-in-pure-css/
50,Difficult Dated Frustrating Prophetic – Teaching Thomas Pynchon,elemeno,http://www.themillions.com/2015/04/difficult-dated-frustrating-prophetic-teaching-thomas-pynchon.html
64,Burn rate says little about whether a startup is on track,vjvj,http://techcrunch.com/2015/04/05/burn-rate-doesnt-matter/#.v8qwt9:mjbl
4,Day 12: Stop at the Time,PurpleRose,http://www.nicolewoo.ca/2015/04/day-12-stop-at-the-time/
38,Bamboo: Lua web framework based on Mongrel2 ZeroMQ and NoSQL,areski,https://github.com/daogangtang/bamboo
6,A synthetic theory of monitoring,zdw,http://sysadmin1138.net/mt/blog/2015/04/a-synthetic-theory-of-monitoring.shtml
7,Popcorn Time Releases iOS App Tomorrow No Jailbreak Needed,jakobdabo,https://torrentfreak.com/popcorn-time-releases-jailbreak-free-ios-app-150407/
6,You've been cutting cakes wrong your entire life,anacleto,http://digg.com/video/youve-been-cutting-cakes-wrong-your-entire-life
201,CoreOS (YC S13) Raises $12M to Bring Kubernetes to the Enterprise,craneca0,http://techcrunch.com/2015/04/06/coreos-raises-12m-funding-round-led-by-google-ventures-to-bring-kubernetes-to-the-enterprise/
4,Simpson's Paradox,lukas,http://en.wikipedia.org/wiki/Simpson%27s_paradox
11,Opbeat Integration with Gondor,paltman,https://gondor.io/blog/2015/04/07/announcing-integration-opbeat/
8,Radar that sees through walls built in garage,szczys,http://hackaday.com/2015/04/07/build-a-phased-array-radar-in-your-garage-that-sees-through-walls/
45,In praise of the mechanical keyboard,jgrahamc,http://fusion.net/story/113869/in-praise-of-the-mechanical-keyboard/
9,“The World's Most Dangerous Trail” Reopens This Week,Mz,http://www.smithsonianmag.com/travel/worlds-most-dangerous-trail-reopens-week-180954747/?no-ist/
59,Minimalist Living: When a Lot Less Is More,snadahalli,http://time.com/3738202/minimalism-clutter-too-much-stuff/
89,Turkey blocks Twitter YouTube over hostage photo,gokhan,http://www.hurriyetdailynews.com/turkey-blocks-twitter-youtube-facebook-over-hostage-photo.aspx?pageID=238&nid=80638&NewsCatID=339
5,Why buying Provisioned IOPS on RDS may be a mistake,nicpottier,http://blog.textit.in/why-buying-provisioned-iops-on-rds-may-be-a-mistake
6,The incredible shrinking megacity: How Los Angeles engineered a housing crisis,sutro,http://www.salon.com/2015/04/05/the_incredible_shrinking_megacity_how_los_angeles_enginereed_a_housing_crisis/
11,Heat your home for free with heating provided by a computer server,gmays,http://news.eneco.com/heat-your-home-for-free-with-heating-provided-by-a-computer-server/
10,Uber fight to dismiss rape lawsuit shows it wont take responsibility for drivers,grej,http://thenextweb.com/insider/2015/04/07/ubers-fight-to-dismiss-a-lawsuit-over-an-alleged-rape-shows-it-wont-take-responsibility-for-its-drivers/
6,Show HN: Elasticsearch for the GPG keyserver pool,diafygi,https://github.com/diafygi/keyserver-elasticsearch
9,Netflix changes terms to terminate accounts that use a VPN,rossiben,http://www.information-age.com/industry/services/123459269/netflix-changes-terms-terminate-accounts-use-vpn
12,purescript-halogen – A declarative type-safe UI library for PureScript,purescript,https://github.com/slamdata/purescript-halogen
6,Show HN: Lisense – Sensible repository licensing for Humans,pravj,https://github.com/pravj/lisense
10,Netflix's new terms allows the termination of accounts using a VPN,alexcasalboni,https://www.netflix.com/TermsOfUse
9,Monica Lewinsky: The price of shame,analyst74,https://www.ted.com/talks/monica_lewinsky_the_price_of_shame?language=en#t-480233
29,In Afghanistan a Yearbook Takes on Special Significance,pmcpinto,http://proof.nationalgeographic.com/2015/04/06/in-afghanistan-a-yearbook-takes-on-special-significance/
6,Facebook: End-To-end Performance Analysis of Large-Scale Internet Services,franze,http://muratbuffalo.blogspot.com/2015/03/the-mystery-machine-end-to-end.html
24,Announcing the First Netflix Recommended TVs,cleverjake,http://blog.netflix.com/2015/04/announcing-first-netflix-recommended-tvs.html
4,Chrome has an option to remember self-signed certs,tcgarvin,
478,VP9: Faster better buffer-free YouTube videos,jplevine,http://youtube-eng.blogspot.com/2015/04/vp9-faster-better-buffer-free-youtube.html
8,Ask HN: As a freelancer should I incorporate into an LLC S-corp or C-corp?,hauget,
3,Washington Post Clearly Rips Off Designer's Game of Thrones Infographic Site,robertwalsh0,
65,Planes Without Pilots,carlchenet,http://www.nytimes.com/2015/04/07/science/planes-without-pilots.html
71,The arrival of man-made earthquakes,igonvalue,http://www.newyorker.com/magazine/2015/04/13/weather-underground
9,Building a static email client app using React,eudox,http://blog.tryolabs.com/2015/04/07/react-examples-mailbox/
13,Why 'Cultural Diversity' in the Workplace Needs to Die,SparkyRobinson,https://medium.com/@markrobinson_18774/what-happened-to-finding-the-best-person-for-the-job-yes-i-m-mad-f14c3b05b97e
11,TrueCrypt passes audit,BestVPNposts,https://www.bestvpn.com/blog/16477/truecrypt-passes-audit/?nabe=6412130213429248:1
70,The Fastest VM Bytecode Interpreter (2010),wtbob,http://byteworm.com/2010/11/21/the-fastest-vm-bytecode-interpreter/
391,Automakers Say You Don’t Really Own Your Car,nthitz,https://www.eff.org/deeplinks/2015/04/automakers-say-you-dont-really-own-your-car
6,The Quest to Save Crowdfunding from Scammers and Flakes,ogcricket,http://www.wired.com/2015/04/one-companys-quest-save-crowdfunding-scammers-flakes/
288,Tesla Stockholders Can't Take a Joke,dsri,http://www.bloombergview.com/articles/2015-04-02/tesla-stockholders-can-t-take-a-joke
230,I won't be using Angular for my next project,hippich,https://javascriptkicks.com/articles/2657
123,Cheese changed the course of Western civilization,edward,http://qz.com/371839/cheese-changed-the-course-of-western-civilization/
3,If Algorithms Know All How Much Should Humans Help?,jonbaer,http://www.nytimes.com/2015/04/07/upshot/if-algorithms-know-all-how-much-should-humans-help.html
7,Stolen discussions,diminish,
58,13 principles of next generation Enterprise Software Technology,niznikpawel,https://medium.com/@pawel_niznik/13-principles-of-next-generation-enterprise-software-technology-b8a3a324ee32
25,Ask HN: Is value based pricing always better than hourly billing?,aarkfeld,
24,Towards Heroku for Unikernels: Part 2 – Self Scaling Systems,amirmc,http://amirchaudhry.com/heroku-for-unikernels-pt2/
99,The Digital Music Industry Is Inept (2012),Audiophilip,http://www.bennjordan.com/blog/?p=499
22,Gary Dahl Inventor of the Pet Rock Has Died,ohaikbai,https://www.bostonglobe.com/metro/obituaries/2015/04/05/gary-dahl-inventor-pet-rock-dies/Nja94bB0cAk3jblIFmdpUO/story.html
9,Google kicks malware off Firefox result pages,AlexMuir,http://alexmuir.com/google-vs-malware-adwords
22,Stack Overflow Developer Survey 2015: The Results,mediumdeviation,http://blog.stackoverflow.com/2015/04/stack-overflow-developer-survey-2015-the-results/
1,YourMechanic (YC W12) is hiring full stack engineers,artag,https://jobs.lever.co/yourmechanic/7cfd7fa4-735c-460e-bfec-19bbc2f5f4a4
5,TI-89 Bitcoin Diceware Tool,jgrahamc,http://qntra.net/2015/04/ti-89-bitcoin-diceware-tool-released/
272,Ten Commandments of Sushi,signor_bosco,https://medium.com/gone/the-ten-commandments-of-sushi-4eac45192c7d/
205,Programming competitions correlate negatively with being good on the job,luu,http://www.catonmat.net/blog/programming-competitions-work-performance/
10,Fall of the Designer Part I: Fashionable Nonsense,milen,http://www.elischiff.com/blog/2015/4/7/fall-of-the-designer-part-i-fashionable-nonsense
3,'HBO NOW' Now Available for Apple TV iPhone and iPad,Osiris,http://www.macrumors.com/2015/04/07/hbo-now-goes-live-apple-tv/
3,Show HN: Offline flashcard webapp that syncs via CouchDB,pixelcort,https://github.com/pixelcort/mrflashcard
5,Firefox disables “opportunistic encryption” to fix HTTPS-crippling bug,theandrewbailey,http://arstechnica.com/security/2015/04/firefox-disables-opportunistic-encryption-to-fix-https-crippling-bug/
521,Get your own USB PID,oxplot,http://pid.codes/
5,Firefox issues brand new update to fix https security hole in new update,ghosh,https://nakedsecurity.sophos.com/2015/04/07/firefox-issues-brand-new-update-to-fix-https-security-hole-in-new-update/
5,Amazon Spent Big Bucks on Crytek's Engine,andreasley,http://kotaku.com/sources-amazon-spent-big-bucks-on-cryteks-engine-1696008878
34,A Mathematical Atlas,imranq,http://www.math.niu.edu/~rusin/known-math/welcome.html
131,P-Values are not Error Probabilities (2003) [pdf],gwern,http://www.uv.es/sestio/TechRep/tr14-03.pdf
92,Turning the Arduino Uno into an Apple II,avinassh,http://dpeckett.com/turning-the-arduino-uno-into-an-apple
69,Building a high performance SSD SAN part 1,runarb,http://smcleod.net/building-a-high-performance-ssd-san/
4,Getting Started Developing with OpenStreetMap Data,SunTzu55,http://news.dice.com/2015/04/07/getting-started-with-openstreetmap-data/
15,Microsoft announces pilot program to hire people with autism,Artemis2,http://blogs.microsoft.com/on-the-issues/2015/04/03/microsoft-announces-pilot-program-to-hire-people-with-autism
11,Google Analytics Down for Majority of Users,jchavannes,http://www.google.com/appsstatus#hl=en&v=issue&sid=18&iid=810ebb4277ca0fdf9bc14b387b485dc3
170,Mono 4.0.0 Release Notes,tizoc,http://www.mono-project.com/docs/about-mono/releases/4.0.0/
104,Lambda Nights: Learn Functional Programming by writing a simple compiler,adamnemecek,http://lambda-nights.com/
43,Show HN: An AVR based 8-bit Microcomputer,reidrac,http://www.usebox.net/jjm/dan64/
347,Why the name?,xai3luGi,https://wiki.debian.org/WhyTheName
4,Show HN: HackerNews Unofficial app made with ionic,mobinni,https://play.google.com/store/apps/details?id=com.ionicframework.hackernewsapp778257
14,The Work-Family Imbalance,anandiyer,http://techcrunch.com/2015/04/04/the-work-family-imbalance/
79,Creating a PHP extension in Rust,jaredonline,http://jaredonline.svbtle.com/creating-a-php-extension-in-rust
15,Reflex: Practical Functional Reactive Programming (part 1),mightybyte,https://www.youtube.com/watch?v=mYvkcskJbc4
3,Ares – Finally a drone everyone can fly,ssaul,
180,The Real Reason College Tuition Costs So Much,colincsl,http://www.nytimes.com/2015/04/05/opinion/sunday/the-real-reason-college-tuition-costs-so-much.html
191,Some thoughts after (almost) a year of real Xamarin use,xngzng,http://www.estaun.net/blog/some-thoughts-after-almost-a-year-of-real-xamarin-use/
