SCORE,TITLE,BY,URL
47,Real-Time Expression Transfer for Facial Reenactment,herendin,http://graphics.stanford.edu/~niessner/thies2015realtime.html
22,A short history of the USSR through its food,century19,http://www.theguardian.com/world/2015/oct/15/cccp-cookbook-short-history-of-the-ussr-through-its-food
13,Subscriptions in GraphQL and Relay,dschafer,http://graphql.org/blog/subscriptions-in-graphql-and-relay/
10,Building a voice-activated light switch at home,arunpn123,http://arunpn.com/projects/voice-activated-light-switch/
11,The Deep Sweep,grey-area,https://criticalengineering.org/projects/deep-sweep/
70,MIPS in Space: Inside NASA’s New Horizons Mission to Pluto,alexvoica,http://blog.imgtec.com/mips-processors/mips-in-space-inside-nasa-new-horizons-mission-to-pluto
7,A fun image-processing project marginally related to my learning theory research,NarcolepticFrog,https://github.com/TravisBarryDick/VoronoiImageTiles
1,Next Caller (YC W14) Is Hiring Its First Head of Product (NYC),gmartire,
47,Show HN: `diff arc0 arc3.1`,laarc,https://cdn.rawgit.com/laarc/notebook/757f7eff5cb26d2ae98dc732252d66fd0e6507c6/arc0-3.1.html
7,Steve Ballmer Says He Has a 4% Stake in Twitter,doppp,http://techcrunch.com/2015/10/16/steve-ballmer-says-he-has-a-4-stake-in-twitter/
9,Currency Wars: Is a Weaker Currency Good or Bad?,tmlee,http://www.schwab.com/public/schwab/nn/articles/Currency-Wars-Is-a-Weaker-Currency-Good-or-Bad
34,Jack in a Box: Can Twitter Be Saved?,donohoe,http://www.newyorker.com/business/currency/jack-in-a-box-can-twitter-be-saved?intcid=mod-hn
48,Photos of sunset with the sun replaced by other stars,MaysonL,http://www.halcyonmaps.com/sun-replaced-with-other-stars/
50,Intel has 1000 people working on chips for the iPhone,happyscrappy,http://venturebeat.com/2015/10/16/intel-has-1000-people-working-on-chips-for-the-iphone/
62,Adobe confirms major Flash vulnerability,happyscrappy,http://bgr.com/2015/10/15/adobe-flash-player-security-vulnerability-warning/
8,I Built a Botnet That Could Destroy Spotify with Fake Listens,janvdberg,http://motherboard.vice.com/read/i-built-a-botnet-that-could-destroy-spotify-with-fake-listens
6,The Effects of Seeing Asian-Americans as a ‘Model Minority’,Futurebot,http://www.nytimes.com/roomfordebate/2015/10/16/the-effects-of-seeing-asian-americans-as-a-model-minority
4,Norway Is a Model for Encouraging Electric Car Sales,jasoncartwright,http://www.nytimes.com/2015/10/17/business/international/norway-is-global-model-for-encouraging-sales-of-electric-cars.html
21,Torture by another name: CIA used 'water dousing' on detainees,cryoshon,http://www.theguardian.com/law/2015/oct/16/cia-torture-water-dousing-waterboard-like-technique
3,Tinder Owner Match Group Files to Go Public (S-1 link included),jasonwilk,http://techcrunch.com/2015/10/16/tinder-owner-match-group-files-to-go-public/
1,Paribus (YC S15) is hiring developers in NYC,ericglyman,https://paribus.co/careers
15,World Programming Responds to $80m SAS Lawsuit,strongai,http://www.teamwpc.co.uk/press/world_programming_us_litigation
7,Target stores attacked by pornographic pranksters,mormegil,http://www.bbc.com/news/technology-34556644
3,Strippers Go Undercover on Snapchat,kareemm,http://www.nytimes.com/2015/02/26/style/strippers-go-undercover-on-snapchat.html?_r=0
3,FSFE convinces 1125 public administrations to remove proprietary software advert,edward,https://lwn.net/Articles/660693/
8,The Goldilocks Approach to Responsive Web Design (2011),Doches,http://goldilocksapproach.com
24,Turris Omnia–an open-source open-hardware router by the Czech Internet registry,throwaway000002,https://omnia.turris.cz/en/
4,Five Things Old Programmers Should Remember,mark_l_watson,https://medium.com/@garywiz/five-things-old-programmers-need-to-remember-e78caf0b0973
25,Fourier visualised,ColinWright,https://84c67cd8f568acc648fb74bc321df20db70c2600.googledrive.com/host/0B3p9nx7jwyf9MjFtY3d1aXVBMjA/fourier.gif
78,The Way We Use Social Security Numbers Is Absurd,nols,http://fivethirtyeight.com/datalab/the-way-we-use-social-security-numbers-is-absurd/
18,The effort to make war less inhumane dates back centuries,danboarder,http://gizmodo.com/is-war-becoming-more-humane-1735636987
3,Researchers at NIST had breakthrough 'teleporting' photon 63 miles,espeed,http://techcrunch.com/2015/10/14/quantum-teleportation-beyond-the-starship-enterprise/
7,U.S. Will Require Drones to Be Registered,shill,http://www.nbcnews.com/news/us-news/u-s-will-require-drones-be-registered-n446266
6,Show HN: Davine – An open-data social analytics site for Vine,AustinDizzy,https://davine.co
4,The Capitalist Case for Leaner Finance,barisser,https://medium.com/@abarisser/the-capitalist-case-for-leaner-finance-7d6d7477464b
8,Amazon files suit against 1000 Fiverr users over fake product reviews,ljk,http://www.geekwire.com/2015/after-conducting-undercover-sting-amazon-files-suit-against-1000-fiverr-users-over-fake-product-reviews/
45,Windows 10 upgrade installing automatically on some Windows 7 8 systems,v4n4d1s,http://arstechnica.com/information-technology/2015/10/windows-10-upgrade-installing-automatically-on-some-windows-7-8-systems/
8,Ask HN: What's the one thing you've always wanted to learn?,alexgpark,
35,Ask HN: Any advice for a programmer who has hit rock bottom?,desp_programmer,
4,When there are too many administrators which ones do *you* fire?,jseliger,http://jakeseliger.com/2015/10/16/when-there-are-too-many-administrators-which-ones-do-you-fire/
3,Dragonlock Lets You Print Your Own RPG Dungeons,confiscate,http://techcrunch.com/2015/10/16/dragonlock-lets-you-print-your-own-rpg-dungeons/
79,Why do we need modules at all? (2011),norswap,http://erlang.org/pipermail/erlang-questions/2011-May/058768
7,US government will require all drone purchases to be registered,techbullets,http://www.theverge.com/2015/10/16/9558383/us-government-will-create-drone-registry
4,RARE Vintage Computer Symbolics XL1201 Lisp Machine,lladnar,http://www.ebay.com/itm/-/221915599560
7,ResourceD – Toolkit for helping DevOps to write automation tools,didip,
10,Astronomers may have found giant alien 'megastructures' near the Milky Way,snez,http://www.independent.co.uk/news/world/forget-water-on-mars-astronomers-may-have-just-found-giant-alien-megastructures-orbiting-a-star-near-a6693886.html
7,Elon Musk and Sam Altman on Thinking for the Future [Video],niico,https://www.youtube.com/watch?v=SqEo107j-uw
3,Taking the Recruiter Out of Tech Recruiting,vail130,https://medium.com/@tailspin/taking-the-recruiter-out-of-tech-recruiting-f9f1eda413ca
84,Hacking Servo for Noobs,ash,https://gist.github.com/paulrouget/2f00941e6e82aeecad23
11,Human evolution was shaped by interbreeding,nikolasavic,http://www.bbc.com/earth/story/20151013-how-interbreeding-shaped-us
30,Mixing Khoisan Knowledge with Drone Technology,tefo-mohapi,http://www.iafrikan.com/2015/10/15/what-happens-when-you-mix-ancient-bushmen-knowledge-with-the-latest-in-drone-technology/
12,Evaluating the Rescue of Fannie Mae and Freddie Mac,bpolania,http://libertystreeteconomics.newyorkfed.org/2015/10/evaluating-the-rescue-of-fannie-mae-and-freddie-mac.html#.Vh_RsRNViko
315,YC Continuity,dshankar,http://blog.ycombinator.com/yc-continuity-fund
25,First thoughts on the decision invalidating Safe Harbor,thibaut_barrere,http://www.europe-v-facebook.org/EN/Complaints/PRISM/Response/response.html
6,Why Twitter’s Dying (And What You Can Learn from It),jrs235,https://medium.com/bad-words/why-twitter-s-dying-and-what-you-can-learn-from-it-9ed233e37974
15,Is the universe getting bigger or am I getting smaller?,dnetesn,http://www.symmetrymagazine.org/article/october-2015/is-the-universe-getting-bigger-or-am-i-getting-smaller
125,The porn industry is in a bind,nkurz,http://www.wired.com/2015/10/the-porn-business-isnt-anything-like-you-think-it-is/
7,Your Relative’s DNA Could Turn You into a Suspect,martey,http://www.wired.com/2015/10/familial-dna-evidence-turns-innocent-people-into-crime-suspects/
81,Babun: a Windows shell,znpy,http://babun.github.io/
27,GalaXQL – Interactive SQL tutorial,colinprince,http://sol.gfxile.net/galaxql.html
136,Theranos Has Struggled with Blood Tests,OopsCriticality,http://www.wsj.com/articles/theranos-has-struggled-with-blood-tests-1444881901
121,To save on weight a detour to the moon is the best route to Mars,jimsojim,http://news.mit.edu/2015/mars-mission-save-weight-fuel-on-moon-1015
22,Unmanned aircraft flies in UK civil airspace,maxbaines,http://www.nats.aero/news/unmanned-aircraft-flies-in-uk-civil-airspace/
16,Amazon Redshift’s User Defined Functions,underyx,https://medium.com/@bfaludi/amazon-redshift-s-udf-b3d4205ae732
12,The Stanford Endowment Experiment,akg_67,http://www.ai-cio.com/channels/widescreenstory.aspx?id=2147493424
19,Fossil find suggests humans spread to Asia long before they got to Europe,curtis,https://theconversation.com/our-fossil-find-suggests-humans-spread-to-asia-way-before-they-got-to-europe-49163
16,US drone rules hamper firms hoping machines can take over dangerous jobs,danboarder,http://www.theguardian.com/technology/2015/oct/10/us-drone-rules-faa-safety-mining-industry
9,Learn more about the Vulkan API from five new (and free) webinars,alexvoica,http://blog.imgtec.com/powervr/5-new-webinars-on-the-vulkan-api
147,The Danger of E-Books,tomkwok,http://www.gnu.org/philosophy/the-danger-of-ebooks.html
16,Uncoiling the spiral: Maths and hallucinations (2009),davvid,https://plus.maths.org/content/uncoiling-spiral-maths-and-hallucinations
7,The New Arduino 101 Has an Intel Curie Inside,calebkraft,http://makezine.com/2015/10/16/30-gets-you-the-sensor-packed-curie-powered-arduino-101/
10,Sequoia's Michael Moritz just eviscerated the 'subprime unicorn' boom in tech,mdariani,http://uk.businessinsider.com/sequoia-capitals-michael-moritz-on-subprime-unicorns-2015-10
16,Common sense violation in airline pricing,jsc123,http://arxiv.org/abs/1509.05382
3,Theranos Is Made-For-Hollywood Silicon Valley Scandal,yueq,http://www.forbes.com/sites/petercohan/2015/10/16/theranos-is-made-for-hollywood-silicon-valley-scandal/
11,Docker names generator guards against ever returning “boring_wozniak”,baxter001,https://github.com/docker/docker/blob/master/pkg/namesgenerator/names-generator.go#L484
4,Everything You Need to Know About AWS Free Tier,hackmyway,http://www.hackpundit.com/aws-free-tier-usage-facts/
13,This Is What Happens to Your Body When You Stop Exercising,philberesford,http://io9.com/this-is-what-happens-to-your-body-when-you-stop-exercis-1724581507
6,Solu: the Finnish pocket computer that wants to take over the world,sampo,http://www.theguardian.com/technology/2015/oct/16/solu-the-finnish-pocket-computer-that-wants-to-take-over-the-world
32,Analyzing the 2013 Bitcoin fork: centralized decision-making saved the day,jimsojim,https://freedom-to-tinker.com/blog/randomwalker/analyzing-the-2013-bitcoin-fork-centralized-decision-making-saved-the-day/
98,Chattanooga to offer 10 gigabit internet service starting today,soccerdave,http://www.timesfreepress.com/news/local/story/2015/oct/15/chattanooga-becomes-first-10-gigabit-city-world/330691/
24,Cybersecurity Research: Addressing the Legal Barriers and Disincentives [pdf],jimsojim,http://www.ischool.berkeley.edu/files/cybersec-research-nsf-workshop.pdf
36,Is The Hot Hand Fallacy A Fallacy?,dmvaldman,https://rjlipton.wordpress.com/2015/10/12/is-the-hot-hand-fallacy-a-fallacy/
12,Ask HN: What books will stay relevant for many years to come?,shubhamjain,
162,Open Source Photography Workflow,macco,http://www.rileybrandt.com/2015/10/15/foss-photo-flow-2015/
25,Neural Implementation of Probabilistic Models of Cognition,mindcrime,http://arxiv.org/abs/1501.03209
34,How Oldschool Sound/Music worked [video],Audiophilip,https://www.youtube.com/watch?v=q_3d1x2VPxk
8,Aphrodisiacs Elixirs and Dr. Brodum’s Restorative Nervous Cordial,Avawelles,http://mimimatthews.com/2015/10/12/aphrodisiacs-elixirs-and-dr-brodums-restorative-nervous-cordial/
192,Data Infrastructure at IFTTT,devinfoley,http://engineering.ifttt.com/data/2015/10/14/data-infrastructure/
10,An African money-transfer firm with big ambitions,edward,http://www.economist.com/news/finance-and-economics/21674798-african-money-transfer-firm-big-ambitions-transfer-window
10,Coconuts in Medieval England,pepys,http://www.themarysue.com/monty-python-holy-grail-coconuts/
11,Six Degrees of Francis Bacon,Schiphol,https://www.cmu.edu/news/stories/archives/2015/october/francis-bacon-launch.html
64,The Galaxy That Got Too Big,DarkContinent,http://nautil.us/issue/29/scaling/the-galaxy-that-got-too-big
179,Kawkab Monospaced Arabic Font,specifictso,http://makkuk.com/kawkab-mono/
11,Can making seawater drinkable quench the world's thirst?,SimplyUseless,http://www.bbc.co.uk/news/business-34478052
179,Paper is Dropbox's new vision for how teams can work together,slackpad,http://www.engadget.com/2015/10/15/dropbox-paper-team-collaboration-tools/
17,Ask HN: Can I ask about burnout?,LifeQuestioner,
6,Microsoft now uses Windows 10's Start menu to display ads,doppp,http://betanews.com/2015/10/15/microsoft-now-uses-windows-10s-start-menu-to-display-ads/
168,Medical Breakthrough in Spinal Cord Injuries Was Made by a Computer Program,fahimulhaq,http://www.fastcoexist.com/3052282/the-latest-medical-breakthrough-in-spinal-cord-injuries-was-made-by-a-computer-program
65,Researchers Find ‘Impossible to Trace’ Spyware in 32 Countries,geezsundries,http://motherboard.vice.com/read/researchers-find-impossible-to-trace-spyware-in-32-countries
27,Show HN: Avsc – a pure JavaScript Avro implementation,mtth,https://github.com/mtth/avsc
12,87.7% of Android devices vulnerable to hackers,alexwoodcreates,http://www.thememo.com/2015/10/16/android-security-hacking-apple-motorola-lg-google-nexus/
196,Decentralized Reddit using a DHT to store content and a blockchain to rank it,sktrdie,http://www.slideshare.net/lmatteis/kudos-a-peertopeer-discussion-system-based-on-social-voting
6,Writing Hamlet with a Genetic Algorithm,GarethX,http://www.glthr.com/20monkeys/help/
40,Show HN: Golang statistics package with 100% code coverage,anonfunction,https://github.com/montanaflynn/stats
4,Richard Spruce and the Trials of Victorian Bryology,hownottowrite,http://publicdomainreview.org/2015/10/14/richard-spruce-and-the-trials-of-victorian-bryology/
11,Hacking for Security and Getting Paid for It,BobbyVsTheDevil,http://bits.blogs.nytimes.com/2015/10/14/hacking-for-security-and-getting-paid-for-it/
9,Virtue Signalling: Saying things violently on Twitter is easier than kindness,epaga,http://new.spectator.co.uk/2015/04/hating-the-daily-mail-is-a-substitute-for-doing-good/
26,Enjoying Parenscript (Mostly),raphaelss,http://laheadle.github.io/hat-tippin/#/posts/0?_k=q40gtw
