SCORE,TITLE,BY,URL
11,YC's Geoff Ralston on Learning as You Go,jdkanani,http://blog.ycombinator.com/startup-school-radio-ycs-geoff-ralston-on-learning-as-you-go
7,How Can We Really Measure the ROI of Optimization?,iamalexbirkett,http://conversionxl.com/roi-of-optimization/
40,Find potential bugs in your services with Diffy,hiby007,https://github.com/twitter/diffy
18,Leisure Suit Larry in the Land of the Lounge Lizards,ksherlock,http://www.filfre.net/2015/08/leisure-suit-larry-in-the-land-of-the-lounge-lizards/
27,The British Perfected the Art of Brewing Tea Inside an Armored Vehicle,edward,https://medium.com/war-is-boring/the-british-perfected-the-art-of-brewing-tea-inside-an-armored-vehicle-1cc012f3ee54
45,Sleepy Puppy: XSS detection tool,pm24601,http://techblog.netflix.com/2015/08/announcing-sleepy-puppy-cross-site.html
14,Ask HN: Where do you look for work if you need experience?,coroutines,
7,Show HN: Fakettp – Command line http debugging proxy,sethammons,https://github.com/sethgrid/fakettp
48,Pioneer announces MEMS-based LIDAR for self driving cars [pdf],Animats,http://pioneer.jp/en/news/press/2015/pdf/0901-1.pdf
10,The Neural Basis of Multitasking,snake117,http://neurosciencenews.com/multitasking-frontal-cortex-2550/
35,What RSA key size to use for an SSL certificate,ck2,https://certsimple.com/blog/measuring-ssl-rsa-keys
3,Lawrence Lessig Enters the Presidential Race,wcunning,http://reason.com/blog/2015/09/06/lawrence-lessig-enters-the-presidential
43,Anderson.vim: Dark vim colorscheme based on colors from Wes Anderson films,tambourine_man,https://github.com/gilgigilgil/anderson.vim
5,Blockchain with 100k transactions/second borrowing lessons from LMAX,joeyspn,https://bitshares.org/technology/industrial-performance-and-scalability/
10,The Pixel Factory,bpierre,http://acko.net/files/gltalks/pixelfactory/online.html
69,Google self-driving car pioneer wants to teach people how to face the future,w1ntermute,http://www.economist.com/news/technology-quarterly/21662654-sebastian-thrun-pioneer-googles-autonomous-cars-wants-teach-people-how
9,A Visit to Amsterdam’s Microbe Museum,XYEaQMZJvS,http://www.newyorker.com/tech/elements/a-visit-to-micropia-amsterdams-microbe-museum
72,E-Book Sales Fall After New Amazon Contracts,msh,http://www.wsj.com/article_email/e-book-sales-weaken-amid-higher-prices-1441307826-lMyQjAxMTE1MzAxNDUwMjQ2Wj?utm_content=buffere3d81&utm_medium=social&utm_source=facebook.com&utm_campaign=buffer
12,Rosatom invites Google and Facebook to store data near nuclear power plant,Sami_Lehtinen,http://rbth.co.uk/business/2015/09/01/rosatom_invites_google_and_facebook_to_store_russians_data_next_to_a_48891.html
8,Strata: Open Source Library for Efficient MongoDB Backups,canadi,http://blog.parse.com/learn/engineering/strata-open-source-library-for-efficient-mongodb-backups/
104,Really Random Number Generator,aburan28,http://makezine.com/projects/really-really-random-number-generator/
6,Introduction to Matrix – Free and Open Source IM as Skype/Viber/Slack Alternative,mister_bluer,https://tlhp.cf/matrix-free-skype-alternative/
70,Legion of Tech Volunteers Lead a Charge for Bernie Sanders,bootload,http://www.nytimes.com/2015/09/04/us/politics/bernie-sanders-presidential-campaign-tech-supporters.html?ref=technology
236,Why drivers in China intentionally kill the pedestrians they hit,fhinson,http://www.slate.com/articles/news_and_politics/foreigners/2015/09/why_drivers_in_china_intentionally_kill_the_pedestrians_they_hit_china_s.single.html
9,Distributed code review system for Git repos,bashtian,https://github.com/google/git-appraise
10,Modelling the Effect of Your Super Users with Netlogo Simulation,zuluwill,http://blog.loyaltybay.co.uk/modelling-the-effect-of-your-super-users-with-netlogo-simulation
8,Twitter DM with OTR,situationista,https://gist.github.com/colinmahns/e3c38c5eae6c4bf6441d
34,Adobe CEO avoids a question about why its priced $1400 more in Australia,thewarrior,https://www.youtube.com/watch?v=PaR2jR-RpYo&feature=youtu.be
7,Nuff – The Network Universal Frame Forge,weavie,http://www.hcsw.org/nuff/
8,Migrants and Mobiles,edent,https://shkspr.mobi/blog/2015/09/migrants-and-mobiles/
8,How to Catch Spoofers Who Manipulate Markets,minimax,http://www.bloomberg.com/graphics/2015-spoofing/
20,The last audio cassette factory [video],DanBlake,https://www.youtube.com/watch?v=UJ4BcZ8ZTjc?
7,Facebook Mentions,Navarr,https://www.facebook.com/about/mentions/?ref=mentions_bookmark
4,Use getAwesomeness() to retrieve all amazing awesomeness from GitHub,lucajulian,http://getawesomeness.com
6,Why women entrepreneurs fail,3stripe,https://unicornfree.com/2015/women-entrepreneurs-fail
9,Nanomachines: a tale of nanoscale motors rotors switches and pumps,cryoshon,http://www.nature.com/news/the-tiniest-lego-a-tale-of-nanoscale-motors-rotors-switches-and-pumps-1.18262
8,Show HN: JellyChip – social networking for a cause,Leafmew,https://jellychip.com/
7,Google’s Latest Chrome Update Emphasizes Speed and Lower Memory Usage,zhuxuefeng1994,http://techcrunch.com/2015/09/03/googles-latest-chrome-update-emphasizes-speed-and-lower-memory-usage/
76,No One to Rescue Me from My Drinking,kareemm,http://www.nytimes.com/2015/08/30/fashion/alcoholism-no-one-to-rescue-me-from-my-drinking.html?WT.mc_id=2015-SEPTEMBER-FB-INT-LIVING_PROP-AUD_DEV-0901-0930&WT.mc_ev=click&ad-keywords=IntlAudDev&_r=0
6,Wikipedia founder backs site's systems after extortion scam,serengeti,http://www.theguardian.com/technology/2015/sep/06/wikipedia-founder-backs-sites-systems-after-extortion-scam
6,Man takes to the skies in world-first pentacontakaitetracopter (54-rotors),pm24601,http://www.theguardian.com/technology/2015/sep/04/man-takes-to-the-skies-in-world-first-pentacontakaitetracopter?CMP=ema_565
18,A Git Horror Story: Repository Integrity with Signed Commits,alexis-d,http://mikegerwitz.com/papers/git-horror-story
55,Adobe CEO desperately tries to avoid answering a simple question (2013),romefort,https://www.youtube.com/watch?v=PaR2jR-RpYo
4,Microsoft considering open floorplans as part of multibillion-dollar hq revamp,harryh,http://www.bloomberg.com/news/articles/2015-09-04/microsoft-said-to-weigh-multibillion-dollar-headquarters-revamp
3,Announcing Oculus Connect 2 Schedule Talks and Speakers,Impossible,https://www.oculus.com/en-us/blog/announcing-oculus-connect-2-schedule-talks-and-speakers/
12,Facebook group and page analytics,madratman,http://sociograph.io
5,John Carmack Will Demo His ‘VrScript’ Environment at Oculus Connect,frostmatthew,http://www.roadtovr.com/oculus-cto-john-carmack-will-demo-his-vrscript-language-at-connect/
7,The Home Information Terminal (1970) [pdf],unimpressive,http://www-formal.stanford.edu/jmc/hoter2.pdf
9,Orange is the new $15 Raspberry Pi,ck2,http://hackaday.com/2015/09/05/orange-is-the-new-15-pi/
4,Who needs numbers if you have structures,enqk,http://fronx.github.io/2015-09-04--structures-not-numbers/
5,Show HN: A text adventure game in Haskell,waldohatesyou,https://github.com/WaldoHatesYou/adventura
6,Audio of all your OK Google searches,SoulMan,https://history.google.com/history/audio
10,Remember mid 90's RAM prices? Suddenly prices dropped. What happened?,port6667,
5,Show HN: Navi: An Open-Source VR Input Innovation Using Your Smartphone,Fuseman,https://github.com/vmohan7/Navi
3,Facebook Takes a Step into Education Software,tucif,http://www.nytimes.com/2015/09/04/technology/facebook-education-initiative-aims-to-help-children-learn-at-their-own-pace.html
3,Introducing the “fedora-tools” Image for Fedora Atomic Host,jeremyeder,http://www.projectatomic.io/blog/2015/09/introducing-the-fedora-tools-image-for-fedora-atomic-host/
5,The bizarre history of cellphone towers disguised as trees,haksudol,http://www.vox.com/2015/4/19/8445213/cell-phone-towers-trees
79,Who Will Suffer Most from Climate Change? (Hint: Not You),us0r,http://www.gatesnotes.com/Energy/Who-Will-Suffer-Most-From-Climate-Change
27,Oracle may have let their Java Evangelists go,richem,https://twitter.com/kcpeppe/status/639787715563769856
5,SmoothieMap: Low-latency Java map implementation,c-rack,https://github.com/OpenHFT/SmoothieMap
3,Node.js Foundation Elects Board of Directors,antouank,https://nodejs.org/en/blog/announcements/foundation-elects-board/
18,We are listening,oal,http://blog.jetbrains.com/blog/2015/09/04/we-are-listening/
75,How Google's new Logo is just 305 bytes,nksonfire,http://www.quora.com/How-could-Googles-new-logo-be-only-305-bytes-while-its-old-logo-is-14-000-bytes/answers/15246728?srid=3a0v&share=1
5,Desperate Crossing,pmcpinto,http://www.nytimes.com/interactive/2015/09/03/magazine/migrants.html
4,The Common Lisp language in bioinformatics,informatimago,
11,What Goes On – How Sterling Morrison left VU for UT,crivabene,https://medium.com/@TheAlcalde/what-goes-on-524982f49915
8,KATARA: Reliable Data Cleaning with Knowledge Bases and Crowdsourcing [pdf],jcr,http://www.vldb.org/pvldb/vol8/p1952-chu.pdf
9,Google OnHub ships without IPv6 support,devinus,
8,Ask HN: It is difficult to find a company to sponsor a visa for a junior dev?,hecontreraso,
24,Ask HN: What is the best recommended domain name registration site?,ceasos,
45,Can the Appalachian Trail Survive ‘A Walk in the Woods?’,trevin,http://www.outsideonline.com/2011851/can-appalachian-trail-survive-walk-woods
5,Show HN: Git Town a high-level command-line interface for Git,kevingoslar,http://www.git-town.com
4,PHP 7.0 Is Showing Very Promising Performance Over PHP 5 Closing Gap with HHVM,tomkwok,http://www.phoronix.com/scan.php?page=article&item=php-70-rc2&num=1
5,Using MultiPath TCP to enhance home networks,rmoriz,http://www.sajalkayan.com/post/fun-with-mptcp.html
7,Why You Hate Google’s New Logo,aaronbrethorst,http://www.newyorker.com/culture/cultural-comment/why-you-hate-googles-new-logo
5,I watched Star Trek: The Original Series in order and so can you,shawndumas,http://arstechnica.com/the-multiverse/2015/09/i-watched-star-trek-the-original-series-in-order-and-so-can-you/
8,What It Looks Like to Leave Our Solar System at the Speed of Light,AliCollins,http://digg.com/video/light-speed-solar-system-travel
7,Coca cola and butane (not mentos),officialjunk,https://youtube.com/watch?v=VxvJcPToXb0
15,YotaPhone 2 the world's first dual-screen always-on smartphone,kcart,http://yotaphone.com/gb-en/
5,Why We Killed a $150000 Feature,gorachel007,http://blog.trak.io/why-we-killed-a-150000-feature/
31,Hans Rosling: Don't use news media to understand the world (english subtitles),cjblomqvist,https://www.youtube.com/watch?v=xYnpJGaMiXo
5,Tinder isn’t the only reason the dating scene is terrible for women right now,aceperry,http://www.businessinsider.com/why-the-dating-scene-favors-men-2015-9
8,Why did Myspace fail? (Reddit),AustinG08,https://www.reddit.com/r/explainlikeimfive/comments/3jna7y/eli5_why_did_myspace_fail/cuqwky8
28,Ask HN: Are 4K monitors worth it?,dennybritz,
7,Getty Images Forces Blog to Pay $868 Fee for Using ‘Socially Awkward Penguin’,AshFurrow,http://petapixel.com/2015/09/05/getty-images-forces-blog-to-pay-868-fee-for-using-socially-awkward-penguin/
7,60000 Antelope Died in Four Days and No One Knows Why,antimora,http://www.nbcnews.com/science/environment/60-000-antelope-died-four-days-no-one-knows-why-n421056
10,Show HN: The Kano HD Screen Kit for Raspberry Pi,hunglee2,http://www.kano.me/screen
9,Why Safari Content Blockers beat standard adblocking,lukezli,http://blog.appgrounds.com/content-blockers-beat-adblocking/
9,Docstoc will be closing down effective December 1 2015,doctorshady,http://www.docstoc.com/
5,SAT Scores Continue Downward Slide but No One Knows Why,snake117,http://www.slate.com/blogs/schooled/2015/09/04/sat_scores_more_diverse_group_of_kids_taking_the_college_board_test_but.html
3,Why Writing Children's Books Isn't as Easy as You Thought: Classic Mistakes,jctanner,http://blog.bookroo.com/4-tips-for-writing-a-good-childrens-book/
