SCORE,TITLE,BY,URL
18,A Beginner’s Guide to Recurrent Networks and LSTMs,vonnik,http://deeplearning4j.org/lstm.html
281,Raspberry Pi touch display,benn_88,https://www.raspberrypi.org/blog/the-eagerly-awaited-raspberry-pi-display/
15,Show HN: Encrypted Communication via GitHub Using Node.js and SSH Keys,jlank,https://github.com/sadasystems/private-message
44,Httpbin – HTTP Client Testing Service,pandog,http://httpbin.org/
119,Sslip.io: A Valid SSL Certificate for Every IP Address,arianvanp,http://blog.pivotal.io/labs/labs/sslip-io-a-valid-ssl-certificate-for-every-ip-address
43,Why I'm walking away from one of the best jobs in academia,jhonovich,http://www.vox.com/2015/9/8/9261531/professor-quitting-job
370,Immersive Linear Algebra – A free interactive online book,samlittlewood,http://immersivemath.com/ila/index.html
55,Show HN: Light Bootstrap Dashboard,axelut,http://demos.creative-tim.com/light-bootstrap-dashboard
187,TSA Master Keys,privong,https://www.schneier.com/blog/archives/2015/09/tsa_master_keys.html
84,Patent Law Shouldn’t Block the Sale of Used Tech Products,walterbell,http://www.nytimes.com/2015/09/07/opinion/patent-law-shouldnt-block-the-sale-of-used-tech-products.html?_r=0
47,DIY control pedal on Linux,Rogach,http://blog.rogach.org/2015/09/diy-control-pedal-on-linux.html
21,Inside Popcorn Time – the world's fastest growing piracy site,sleepyhead,http://www.dn.no/magasinet/2015/09/07/1606/Popcorn-Time/inside-popcorn-time--the-worlds-fastest-growing-piracy-site
1,VP of Sales – EasyPost (YC S13) Hiring,jstreebin,https://www.easypost.com/jobs
5,Miscomputation: Learning to live with errors,srsamarthyam,http://tomasp.net/blog/2015/failures/index.html
68,Data Structure Visualizations (2011),vinchuco,http://www.cs.usfca.edu/~galles/visualization/Algorithms.html
43,A 1985 Essay from a Bulletin Board System Admin Foretold Our Future,buserror,http://motherboard.vice.com/read/a-1985-essay-from-a-bulletin-board-system-admin-eerily-foretold-our-future
19,Show HN: KafkaLite – A simple message broker inspired by Kafka,flashgordon,https://github.com/panyam/KafkaLite
39,'Hedgehog' Robots Hop Tumble in Microgravity,herendin,http://www.jpl.nasa.gov/news/news.php?feature=4712&again
29,All Combinations of Six 2x4 Lego Bricks,mattmalin,http://c-mt.dk/counting/?view=paper
7,Technical report: Nix package manager on Windows,iElectric2,http://ternaris.com/lab/nix-on-windows.html
6,In the blink of an eye,tomkwok,http://mosaicscience.com/story/severe-eye-pain
16,Out of the Fire Swamp – Part I ‘The Data Crisis’,timclark,http://blog.acolyer.org/2015/09/08/out-of-the-fire-swamp-part-i-the-data-crisis/
23,The Tiles of Infinity (2009),walterbell,http://www.aramcoworld.com/issue/200905/the.tiles.of.infinity.htm
57,One checkbox equals non-UTC fun,dantiberian,http://rachelbythebay.com/w/2015/09/07/noleap/
46,Apple and Other Tech Companies Tangle with U.S. Over Data Access,jeo1234,http://www.nytimes.com/2015/09/08/us/politics/apple-and-other-tech-companies-tangle-with-us-over-access-to-data.html
17,Contentless SQLite FTS4 Tables for Large Immutable Documents,ingve,http://cocoamine.net/blog/2015/09/07/contentless-fts4-for-large-immutable-documents/
18,WhatsApp Security Vulnerability,rsobers,http://www.telegraph.co.uk/technology/internet-security/11850817/WhatsApp-security-breach-lets-hackers-target-web-app-users.html
62,Oliver Sacks,akbarnama,http://www.newyorker.com/magazine/2015/09/14/oliver-sacks
84,The Visual 6502,sebkomianos,http://www.visual6502.org/JSSim/index.html
54,India’s civil servant exam,kareemm,https://www.thestar.com/news/world/2015/09/07/are-you-smart-enough-to-pass-indias-civil-servant-exam-no.html
32,Homotopy Type Theory for Dummies (2013) [pdf],kushti,http://www.cs.nott.ac.uk/~txa/talks/edinburgh-13.pdf
1,Memebox (YC W14) Is Hiring a Front-End Engineer,memebox,https://jobs.lever.co/memebox/4707f54f-82a5-4c5d-a81b-ec2397a22ee2
4,The Role of Clouds in Global Warming,dnetesn,http://nautil.us/issue/25/water/the-hidden-importance-of-clouds
14,Show HN: QuickHPC – Hardware Performance Counters Made Easy,mardurhack,https://github.com/mardurhack/quickhpc
51,What Are the Most Disappointing Albums?,ryan_j_naughton,http://priceonomics.com/what-are-the-most-disappointing-albums/
27,Introducing Versioning Poems,nicolagreco,http://nicola.io/versioning-poems/2015/
11,I Mr. Robot: Software Dystopia and the View from 2005,jonstokes,https://medium.com/@jonst0kes/i-mr-robot-c132820ee56d
26,A History of Modern 64-bit Computing (2007) [pdf],Aloha,http://courses.cs.washington.edu/courses/csep590/06au/projects/history-64-bit.pdf
311,Operating Systems: Three Easy Pieces,acdanger,http://pages.cs.wisc.edu/~remzi/OSTEP/
16,Comparing Python Command-Line Parsing Libraries – Argparse Docopt and Click,mjhea0,https://realpython.com/blog/python/comparing-python-command-line-parsing-libraries-argparse-docopt-click#.Ve7WMmFITPM.hackernews
44,What are a hospital's costs?,zabramow,http://nytimes.com/2015/09/08/health/what-are-a-hospitals-costs-utah-system-is-trying-to-learn.html
9,Parallel Machine Learning with Hogwild,hemapani,http://blog.dato.com/parallel-ml-with-hogwild
698,The Pixel Factory,bpierre,http://acko.net/files/gltalks/pixelfactory/online.html#0
3,Service Discovery: Zookeeper vs. Etcd vs. Consul,vfarcic,http://technologyconversations.com/2015/09/08/service-discovery-zookeeper-vs-etcd-vs-consul/
7,The mathematical biophysics of Nicolas Rashevsky (2006) [pdf],poindontcare,http://web.cs.iastate.edu/~honavar/rashevsky.pdf
1,Checkr (YC S14) is hiring Full Stack Hackers to build the future of online trust,jperichon,https://boards.greenhouse.io/checkr/jobs/78417?t=m0spnl
13,Addressing human needs at the base of the economic pyramid,jacobsimon,http://harvardmagazine.com/2015/08/business-for-the-other-billions
13,More Titillated Than Thou: How Amish Conquered the Evangelical Romance Market,Petiver,http://thebaffler.com/salvos/titillated-thou
11,The Case for Free Online Books,jimsojim,http://from-a-to-remzi.blogspot.com/2014/01/the-case-for-free-online-books-fobs.html
155,Reverse-Engineering iOS Apps: Hacking on Lyft,timanglade,https://realm.io/news/conrad-kramer-reverse-engineering-ios-apps-lyft/
120,Notation as a Tool of Thought (1980),vonnik,http://www.jsoftware.com/papers/tot.htm
379,The Internet of Way Too Many Things,prostoalex,http://www.nytimes.com/2015/09/06/opinion/sunday/allison-arieff-the-internet-of-way-too-many-things.html
4,Blot're Plays Atari,ingve,http://blog.mattbierner.com/blotre-plays-atari/
12,Show HN: Listen to a playlist of bands coming to your town,ninetax,http://bandsoftheweek.com/
152,Why Some Security Experts Use Mutt,secfirstmd,http://motherboard.vice.com/read/why-security-experts-are-using-an-ancient-email-format-in-2015
41,BMW’s sector-defining 3 Series has turned 40,shawndumas,http://arstechnica.com/cars/2015/08/bmw-3-series-40-years-old-and-still-the-ultimate-driving-machine/
3,“These Are the Gothic Cathedrals of the 21st Century”-Lawrence Krauss on the LHC,welanes,https://www.youtube.com/watch?v=7cIbfbl8124
136,Malware Found Pre-Installed on Xiaomi Huawei Lenovo Phones [pdf],howaboutit,https://public.gdatasoftware.com/Presse/Publikationen/Malware_Reports/G_DATA_MobileMWR_Q2_2015_EN.pdf
57,High Frequency Trading Defined,fixxer,http://www.nanex.net/aqck2/4691.html
5,XRay the LLVM\Clang source code,cppdesign,http://www.codergears.com/Blog/?p=1069
153,Walking Every Street in San Francisco,wormold,http://www.sfwalkingman.com/
13,Amoeba Net – Networking with Hayes Modems,jimnutt,http://jim.nuttz.org/?p=325
89,Show HN: My father's letters as a diplomatic courier from 1960-66,will_brown,http://billbrowndearmom.weebly.com
1,Clerky Is Hiring a Lead Front-End Engineer,swampthing,https://jobs.lever.co/clerky/b011db4e-d5e7-4ede-9a66-9aacd0fd2605
11,Light Bootstrap Dashboard – useful freebie for web developers,alexcasalboni,http://ct-freebies.herokuapp.com/light-bootstrap-dashboard
141,Dear Dad Send Money – Letters from Students in the Middle Ages,diodorus,http://www.medievalists.net/2015/09/05/dear-dad-send-money-letters-from-students-in-the-middle-ages/
77,How to multiply polynomials in Θ(n log n) time,rray,http://agarri.ga/post/multiply-polynomials-n-log-n-time/
243,Better and worse ways to spot a liar,williamhpark,http://www.bbc.com/future/story/20150906-the-best-and-worst-ways-to-spot-a-liar?ocid=fbfut
12,Encryption for files in Git repositories,hachiya,http://blog.fraggod.net/2015/09/01/transparent-and-easy-encryption-for-files-in-git-repositories.html
68,I found the AirBnB logo in Trademarks and Symbols of the World published in 1988,tylermauthe,https://www.reddit.com/r/Design/comments/3jz4qq/i_found_the_airbnb_logo_in_trademarks_symbols_of/
55,How to Avoid Work: A 1949 Guide to Doing What You Love (2012),jsc123,http://www.brainpickings.org/2012/12/14/how-to-avoid-work/
34,GraphDB: Explore StackOverflow with Neo4j,amirouche,http://neo4j.com/blog/import-10m-stack-overflow-questions/
301,Show HN: HTML5 version of StarCraft,gloomyson,https://github.com/gloomyson/StarCraft
80,Software: Immaculate fetid and grimy,WestCoastJustin,http://dtrace.org/blogs/bmc/2015/09/03/software-immaculate-fetid-and-grimy
88,Can Programming Be Liberated from the von Neumann Style? (1978) [pdf],beefman,https://web.stanford.edu/class/cs242/readings/backus.pdf
11,What's in a necronym?,prismatic,http://www.believermag.com/issues/201508/?read=article_vanasco
172,Bypassing the Linux kernel for high-performance packet filtering,jgrahamc,https://blog.cloudflare.com/kernel-bypass/
6,What We Know About the Voynich Manuscript (2011) [pdf],apsec112,http://www.aclweb.org/anthology/W11-1511
82,Poison-Injecting Robot Submarine Kills Sea Stars to Save Coral Reefs,ivank,http://spectrum.ieee.org/automaton/robotics/industrial-robots/poison-robot-submarine?
153,Geotrust/Symantec has revoked all SSL certificates for .pw domains,afreak,http://colin.keigher.ca/2015/09/geotrustsymantec-has-revoked-all-ssl.html
18,The Sound of Code [video],BobbyVsTheDevil,https://www.youtube.com/watch?v=sEI0wBkgf1w
67,Ancestry.com can use your DNA to target ads,randomwalker,https://freedom-to-tinker.com/blog/paulellenbogen/ancestry-com-can-use-your-dna-to-target-ads/
11,Will software that writes code alter tech’s script?,jeo1234,http://www.ft.com/intl/cms/s/0/6c6ccace-521d-11e5-b029-b9d50a74fd14.html
37,Cisco advisory: Ethernet cable may press factory reset switch,JoshTriplett,http://thenextweb.com/insider/2015/09/07/this-hilarious-cisco-fail-is-a-network-engineers-worst-nightmare/
11,FIPS PUB 202: SHA-3 Standard is now out [pdf],todd8,http://nvlpubs.nist.gov/nistpubs/FIPS/NIST.FIPS.202.pdf
72,Diagnosing Memory “Leaks” in Python,todd8,http://chase-seibert.github.io/blog/2013/08/03/diagnosing-memory-leaks-python.html
28,Researcher discloses zero-day vulnerability in FireEye,wglb,http://www.csoonline.com/article/2980937/vulnerabilities/researcher-discloses-zero-day-vulnerability-in-fireeye.html
138,The 21-year-old building India's largest hotel network,retube,http://www.bbc.co.uk/news/business-34078529
217,The Founder of Firefox Wrote His Own Screenplay for HBO’s Silicon Valley,bobajeff,http://techcrunch.com/2015/09/04/the-founder-of-firefox-wrote-his-own-screenplay-for-hbos-silicon-valley-and-its-hilarious/?ncid=rss&utm_source=dlvr.it&utm_medium=twitter&utm_campaign=techglance
58,Programming with distributed functional futures,zeckalpha,http://www.macs.hw.ac.uk/~rs46/posts/2015-09-07-distributed-functional-futures.html
15,How to write a great error message,tomkwok,https://medium.com/@thomasfuchs/how-to-write-an-error-message-883718173322
291,India's Forgotten Stepwells,juanplusjuan,http://www.archdaily.com/395363/india-s-forgotten-stepwells
52,Writing an Operating System with Modula-3 (1995) [pdf],vezzy-fnord,http://cseweb.ucsd.edu/~savage/papers/Wcsss96m3os.pdf
154,Lisp is still a secret weapon,kepzorz,http://kep.io/is-lisp-still-a-secret-weapon/
48,The Nitty Gritty of In-Memory Computing,nkurz,http://www.theplatform.net/2015/09/07/the-nitty-gritty-of-in-memory-computing/
102,Sshmuxd: SSH proxy to replace jump hosts,Spiritus,https://github.com/joushou/sshmuxd
97,The true size of a country or state,callum85,http://thetruesize.com/
14,A Startup That Gives You Free WiFi Whenever You Throw Garbage in a Bin,dhimant,http://www.thebetterindia.com/33430/wifi-trash-bin-by-raj-desai-and-pratik-agarwal/
21,Conshelf experiments,pierre,http://www.cousteau.org/technology/conshelf-i-ii-iii/
62,Literate Devops with Emacs [video],wtbob,https://www.youtube.com/watch?v=dljNabciEGg
19,Speculations about the Rise of Polyphonic Music (1976),ctchocula,http://www.the-rathouse.com/Popper-papers/Popper-Music.html
3,Musical Solar System based on orbital frequencies,sr_banksy,http://www.whitevinyldesign.com/solarbeat/
20,HaskellR: Programming R in Haskell,dil8,https://tweag.github.io/HaskellR/
626,The Website That Got Me Expelled,Rudism,http://www.codeword.xyz/2015/09/05/the-website-that-got-me-expelled/
33,Apple's financial dependence on the smartphone is increasing,jeo1234,http://www.bloomberg.com/news/articles/2015-09-03/the-iphone-company
241,SICP Distilled: An idiosyncratic tour of SICP in Clojure,jboynyc,http://www.sicpdistilled.com/
39,How many errors?,ingve,http://nedbatchelder.com//blog/201509/how_many_errors.html
33,An audio format for creative DJing,ahq,http://www.stems-music.com/
22,KeyChair: Extract RSA private keys out of .keychain files,rgawdzik,https://github.com/indutny/keychair
154,The Myth of Quality Time,kareemm,http://www.nytimes.com/2015/09/06/opinion/sunday/frank-bruni-the-myth-of-quality-time.html
79,Huge ritual arena discovered near Stonehenge,situationista,http://www.theguardian.com/uk-news/2015/sep/07/stonehenge-archaeology-ritual-arena-neolithic-monument
173,Slipping Away: Jo Aubin Has  Alzheimer's. He's 38,benbreen,http://site.macleans.ca/longform/alzheimers/index.html
86,Reproducible builds in Debian: preventing compiler backdoors,Tsiolkovsky,http://motherboard.vice.com/read/how-debian-is-trying-to-shut-down-the-cia-and-make-software-trustworthy-again
32,Should the first in a queue be served last?,andrewl,http://www.bbc.com/news/magazine-34153628
268,Alda: A music programming language,daveyarwood,http://daveyarwood.github.io/alda/2015/09/05/alda-a-manifesto-and-gentle-introduction/
9,Ask HN: Where and how do you look for jobs?,e19293001,
31,Interdisciplinary and physics challenges of Network Theory,mathgenius,http://arxiv.org/abs/1509.00345
37,The selling of the Krays: how two mediocre criminals created their own legend,pepys,http://www.theguardian.com/uk-news/2015/sep/03/the-selling-of-the-krays-how-two-mediocre-criminals-created-their-own-legendlegends
4,The Refugee Project: Interactive map of Refugee migrations since 1975,Nutomic,http://www.therefugeeproject.org/
36,Teaching taste,akkartik,http://akkartik.name/post/teaching-taste
13,Evaluation of Splittable Pseudo-Random Generators [pdf],jcr,http://www.hg.schaathun.net/research/Papers/hgs2015jfp.pdf
13,Bill Gates' Idea for a History Class (2014),zabramow,http://www.nytimes.com/2014/09/07/magazine/so-bill-gates-has-this-idea-for-a-history-class.html
269,Microservices without the Servers,alexbilbie,https://aws.amazon.com/blogs/compute/microservices-without-the-servers/
45,Show HN: Libcox – A C Library for Cross-Platform System Calls,symisc_devel,http://libcox.net
16,Generating Good Syntax Errors (2010),luu,http://research.swtch.com/yyerror
31,An Analysis of the Distribution of Birthdays in a Calendar Year (2001),sabon,http://www.panix.com/~murphy/bday.html
53,Asia's smartphone addiction,SimplyUseless,http://www.bbc.com/news/world-asia-33130567
18,Moore’s law may be running out of steam but chip costs will continue to fall,tdaltonc,http://www.economist.com/news/technology-quarterly/21662644-chipmaking-moores-law-may-be-running-out-steam-chip-costs-will-continue
113,Proposal for a Go Interpreter,mhfs,https://docs.google.com/document/d/1Hvxf6NMPaCUd-1iqm_968SuHN1Vf8dLZQyHjvPyVE0Q/edit?usp=sharing
43,NTT Internet BGP Visualization,TranceMan,http://as2914.net/#/
27,Narcissistic Number,onion2k,https://en.wikipedia.org/wiki/Narcissistic_number
51,Great MIPS chips of the past 30 years,alexvoica,http://www.alexvoica.com/great-mips-chips-of-the-past-30-years/
9,RAET (Reliable Asynchronous Event Transport) Protocol,wslh,https://github.com/RaetProtocol/raet
15,Show HN: Combo the Simple Python Package Manager,wkcamp,https://github.com/wkcamp/Combo
21,Scaling Clearbit to 2M API requests per day,sergiotapia,http://stackshare.io/clearbit/scaling-clearbit-to-2m-api-requests-per-day/?utm_medium=social&utm_campaign=stackshare_weekly_962015
7,Show HN: (Weighted) PageRank implementation in Go,alixaxel,https://github.com/alixaxel/pagerank
60,NTT Internet BGP Visualization,job,http://as2914.net/
30,Topic Modeling of Twitter Followers,alexperrier,http://alexperrier.github.io/jekyll/update/2015/09/04/topic-modeling-of-twitter-followers.html
166,Open-source Playstation 4 SDK,SchizoDuckie,https://github.com/CTurt/PS4-SDK
6,This Ethiopian prince was kidnapped by Britain,ghosh,http://www.theguardian.com/commentisfree/2015/sep/07/britain-kidnapped-ethiopian-prince
19,Spacemacs - The best editor is neither Emacs nor Vim it's Emacs *and* Vim!,macco,https://github.com/syl20bnr/spacemacs
85,tiDB – Scalable RDBMS Inspired by Google F1 with Support for MySQL Protocol,haisumbhatti,https://github.com/pingcap/tidb
5,Abortion foes target UW in a battle that could dramatically affect research,Bud,http://host.madison.com/ct/news/local/education/focus-on-fetal-tissue-abortion-foes-target-uw-in-a/article_07b43140-e1d9-5271-889e-e042d4ad29dc.html
18,Data modeling with multi-model databases,amirouche,http://radar.oreilly.com/2015/07/data-modeling-with-multi-model-databases.html
29,Steve Wozniak On Education Engineering and Apple,arcanus,http://www.i-programmer.info/news/99-professional/8963-steve-wozniak-on-education-engineering-a-apple.html
47,Skoar – A musical programming language,cidermonkey,https://github.com/sofakid/Skoarcery
15,Oracle cuts Java execs,finance-geek,http://fortune.com/2015/09/07/oracle-cuts-java-execs/
3,Expected number of 3s,shagunsodhani,http://math.stackexchange.com/questions/1424497/i-roll-a-die-repeatedly-until-i-get-6-and-then-count-the-number-of-3s-i-got-wh
9,Theft Lies and Facebook Video,koolhead17,https://medium.com/@hankgreen/theft-lies-and-facebook-video-656b0ffed369
8,Show HN: gls a graphical “ls” for iTerm2,poitrus,https://github.com/rs/gls
26,Show HN: Mimic – class-fied inline CSS,peterchon,http://peterchon.github.io/mimic/
70,It’s expensive to be poor,dlubarov,http://www.economist.com/news/united-states/21663262-why-low-income-americans-often-have-pay-more-its-expensive-be-poor
34,After selling his company to Google this man now wants to block ad-blockers,stoev,http://venturebeat.com/2015/09/07/after-selling-his-company-to-google-this-man-now-wants-to-block-the-ad-blockers/
167,All Websites Look the Same,brownie,http://www.novolume.co.uk/blog/all-websites-look-the-same/
34,An act of extraordinary underwater DIY,Turukawa,http://www.bbc.co.uk/news/magazine-34139309
142,Random Valid US Address,jayess,https://fakena.me/random-real-address/
18,HTTP/2 – 115 Days with the RFC,sajal83,http://daniel.haxx.se/blog/2015/09/07/http2-115-days-with-the-rfc/
38,A Sharing Economy Where Teachers Win,kareemm,http://www.nytimes.com/2015/09/06/technology/a-sharing-economy-where-teachers-win.html?_r=0
71,MIT 6.001 Spellbook (1992),jstoja,http://hacks.mit.edu/Hacks/by_year/1992/spellbook/
59,Machines replace migrants as Maine blueberry harvest blooms,prostoalex,http://www.miamiherald.com/news/nation-world/national/article34266051.html
18,Inductive Power on the Cheap – Philips Imageo Teatlight Teardown,luu,http://wp.josh.com/2015/09/06/inductive-power-on-the-cheap-philips-imageo-teatlight-teardown/
20,Show HN: Beginning a work-in-progress init system,Somasis,https://github.com/Somasis/beginning
216,Academics are being hoodwinked into writing books nobody can buy,samclemens,http://www.theguardian.com/higher-education-network/2015/sep/04/academics-are-being-hoodwinked-into-writing-books-nobody-can-buy
322,Death to Bullshit,spking,http://deathtobullshit.com
10, Composing Programs a free online introduction to programming,joeclef,http://www.composingprograms.com/
22,Developing Effective Bioinformatics Programming Skills (2009),snake117,http://journals.plos.org/ploscompbiol/article?id=10.1371/journal.pcbi.1000589
3,Isle of Man Tax Haven with Tailless Cats Becomes Bitcoin Hub,eplanit,http://www.bloomberg.com/news/features/2015-09-07/isle-of-man-tax-haven-with-tailless-cats-becomes-bitcoin-hub
8,What Functional Programming Is and Why It Makes You Better,joshuaFW,http://blog.functionalworks.com/2015/08/04/whatfpisandwhymakesbetter/
298,Fixing Twitter,rkudeshi,http://dcurt.is/twitter
57,Suicide on Campus and the Pressure of Perfection,DrScump,http://www.nytimes.com/2015/08/02/education/edlife/stress-social-media-and-suicide-on-campus.html
115,Kubernetes from the ground up: the API server,luu,http://kamalmarhubi.com/blog/2015/09/06/kubernetes-from-the-ground-up-the-api-server/
147,How Germany abolished tuition fees,HarryHirsch,http://www.bbc.com/news/education-34132664
33,How Google Could Rig the 2016 Election,grej,http://www.politico.com/magazine/story/2015/08/how-google-could-rig-the-2016-election-121548_full.html
55,CAP Twelve Years Later: How the “Rules” Have Changed (2012),gabbo,http://www.infoq.com/articles/cap-twelve-years-later-how-the-rules-have-changed
120,The Hardest Places in the World to Visit,antigizmo,http://www.theatlantic.com/international/archive/2015/09/countries-difficult-visas-travel/403267?single_page=true
170,Tell HN: Paywalls with workarounds are OK; paywall complaints are off topic,dang,
45,OMN: Scripting the whole language of traditional staff notation,geoffroy,http://opusmodus.com/omn.html
94,When the Unix load average was added to Unix,sciurus,https://utcc.utoronto.ca/~cks/space/blog/unix/LoadAverageOrigin
9,Antique Typewriters: The Underwood 1,shawndumas,http://www.antiquetypewriters.com/collection/typewriter.asp?Underwood%201#.Ve0B6nRHaK1
45,Silicon Valley's 91-year-old designer,elemeno,http://www.bbc.co.uk/news/magazine-33626980
34,Show HN: Chemozart – molecule editor and visualizer with mechanics calculators,mohebifar,https://github.com/mohebifar/chemozart
19,Premium Android hits the wall,bdcravens,https://theoverspill.wordpress.com/2015/09/01/premium-android-hits-the-wall-the-q2-2015-smartphone-scorecard/
63,A history of modern init systems (1992-2015),vezzy-fnord,http://blog.darknedgy.net/technology/2015/09/05/0/
190,Vega: A Visualization Grammar,hemapani,http://vega.github.io
5,Solving Coupled Boundary Value Problems for EEG/MEG (2013) [pdf],cinquemb,http://science.iit.edu/sites/science/files/field_uploads/events/files/talk_20131106_greg.pdf
26,Structure of Tumor Suppressing Protein Identified,snake117,http://neurosciencenews.com/pten-structure-tumor-suppressant-2476/
13,San Francisco from space this morning,gw5815,https://twitter.com/StationCDRKelly/status/640173950979313665
214,Black Screen: A modern terminal emulator based on Electron,SalGnt,https://github.com/shockone/black-screen
79,Downsides of Caching,arkenflame,https://msol.io/blog/tech/2015/09/05/youre-probably-wrong-about-caching/
92,More young Indians are choosing their own spouses,jimsojim,http://www.economist.com/news/asia/21663246-more-and-more-young-indians-are-choosing-their-own-spouses-love-and-money-conquer-caste
72,The Effects of Computer Programming on the Brain (2012),bl00djack,http://virtuecenter.com/blog/the_effects_of_computer_programming_on_the_brain.html
131,Xbox 360 Emulator Research Project,striking,https://github.com/benvanik/xenia/
28,Internals of a lightweight multithreading task scheduler,dougbinks,http://www.enkisoftware.com/devlogpost-20150905-1-Internals_of_a_lightweight_task_scheduler.html
57,Rosalind a platform for learning bioinformatics and programming,aarestad,http://rosalind.info/
15,The Center for Open Science,jcr,http://centerforopenscience.org/
5,Show HN: I'm building an AR/VR glove (inertial tracking no cameras),mburkon,https://www.youtube.com/watch?v=xxeAgxs409A
403,CS Unplugged: Computer Science Without a Computer,avinassh,http://csunplugged.org/activities/
113,Inferring Algorithmic Patterns with Stack,antman,https://research.facebook.com/blog/1642778845966521/inferring-algorithmic-patterns-with-stack/
11,Dead-End Jobs: Are You Suffering from Stockholm Syndrome?,singold,https://medium.com/@chadfowler/dead-end-jobs-are-you-suffering-from-stockholm-syndrome-41d37bd0ae60
197,Procedural Dungeon Generation Algorithm,ingve,http://www.gamasutra.com/blogs/AAdonaac/20150903/252889/Procedural_Dungeon_Generation_Algorithm.php
72,Linux-insides: System calls in the Linux kernel Part 3,0xAX,https://github.com/0xAX/linux-insides/blob/master/SysCall/syscall-3.md
220,Maybe it’s time to talk about a new Linux Display Driver Model,epsylon,http://www.yosoygames.com.ar/wp/2015/09/maybe-its-time-to-talk-about-a-new-linux-display-driver-model/
17,Show HN: Popularity scoring for arXiv publications,nebw,https://gist.github.com/nebw/5504697c118744677c2d
41,The Magical Island of Kanren – Core.logic Intro (2011),jasim,http://objectcommando.com/blog/2011/11/04/the-magical-island-of-kanren-core-logic-intro-part-1/
7,Stop Working for Free: Time Is Running Out,MichaelAO,http://thoughtcatalog.com/ryan-holiday/2015/09/stop-working-for-free-time-is-running-out/
277,“This week I resigned from my position at Duke University”,Fede_V,https://www.facebook.com/jfgariepyneuro/posts/466442776860755
19,Caltech astronomers detect the farthest galaxy yet with Keck telescope,srikar,http://www.caltech.edu/news/farthest-galaxy-detected-47761
42,America’s once magical now mundane love affair with cars,DLay,http://www.washingtonpost.com/sf/style/2015/09/02/americas-fading-car-culture/?tid=sm_tw
