SCORE,TITLE,BY,URL
17,Are You in It for the Long Haul?,nathanbarry,http://recode.net/2015/07/21/are-you-in-it-for-the-long-haul/
81,America’s national vacation problem,m-i-l,http://www.bbc.co.uk/news/world-us-canada-34123906
117,Cow Magnets,corndoge,http://www.magnetsource.com/Solutions_Pages/cowmags.html
18,Europe’s Distorted View of US High Tech,chmars,http://www.mondaynote.com/2015/09/07/europes-distorted-view-of-us-high-tech/
145,Notes on a tour of an Amazon distribution facility (2014),scmoore,https://docs.google.com/document/d/1F12fyVF0PO2fSmkOI2_R1IFigTaznaertxiVXlEbas4/edit
38,Can Mommy Bloggers Still Make a Living?,prostoalex,http://www.theatlantic.com/business/archive/2015/09/mommy-bloggers-money/402535/?single_page=true
68,What F. Scott Fitzgerald’s tax returns reveal about his life and times (2009),danso,https://theamericanscholar.org/living-on-500000-a-year/
48,Breaking 6502 apart,userbinator,http://forum.6502.org/viewtopic.php?f=8&t=2208
16,Garage Biology in Silicon Valley (2010),MCRed,http://www.synthesis.cc/2010/03/garage-biology-in-silicon-valley.html
70,Intel Architecture Code Analyzer,jcr,https://software.intel.com/en-us/articles/intel-architecture-code-analyzer/
29,Curators of Sweden,bvanvugt,http://curatorsofsweden.com/
57,The Synthesis of Reliable Organisms from Unreliable Parts (1956) [pdf],rndn,http://www.dna.caltech.edu/courses/cs191/paperscs191/VonNeumann56.pdf
35,Surprisingly few tips for traveling have changed since medieval times,Thevet,https://www.washingtonpost.com/lifestyle/travel/what-tips-for-traveling-have-changed-since-medieval-times-surprisingly-few/2015/09/03/39fa7194-482d-11e5-846d-02792f854297_story.html
65,Thomas Kuhn changed the way the world looked at science (2012),jimsojim,http://www.theguardian.com/science/2012/aug/19/thomas-kuhn-structure-scientific-revolutions
12,Your Next Computer Should Be a Desktop,wslh,http://www.wsj.com/articles/your-next-computer-should-be-a-desktop-1439316558
59,Dr. J. Donald Millar 81 Dies; Led CDC Mission That Helped Eradicate Smallpox,danso,http://www.nytimes.com/2015/09/04/health/dr-j-donald-millar-who-led-cdc-mission-that-helped-eradicate-smallpox-dies-at-81.html
11,New Apple TV Is Said to Focus on Games Challenging Traditional Consoles,adventured,http://www.nytimes.com/2015/09/07/technology/personaltech/new-apple-tv-is-said-to-focus-on-games-challenging-traditional-consoles.html
27,Law for the Commons,walterbell,http://wiki.commonstransition.org/wiki/Law_for_the_Commons
18,Show HN: MockTheClock – A tiny JavaScript library for spoofing time in browser,zb3,https://github.com/zb3/MockTheClock
10,Intro to CSS 3D transforms,selvan,https://desandro.github.io/3dtransforms/
6,Fast Memory Copy (1996),userbinator,http://now.cs.berkeley.edu/Td/bcopy.html
15,The Seeds That Sowed a Revolution,dnetesn,http://nautil.us/issue/21/information/the-seeds-that-sowed-a-revolution-rp
37,Show HN: Tipping culture for developers on the Web,60devs,https://tips.60devs.com
122,Practical Python for Astronomers,blondie9x,https://python4astronomers.github.io/index.html
42,Zeigarnik Effect,2a0c40,http://www.psychwiki.com/wiki/Zeigarnik_Effect
31,Are We a Step Closer to Nuclear Fusion?,Sami_Lehtinen,http://www.xprize.org/news/are-we-step-closer-nuclear-fusion
46,Slow Ideas (2013),Tomte,http://www.newyorker.com/magazine/2013/07/29/slow-ideas
71,“Thank You For Playing” film review,mjohn,http://arstechnica.com/the-multiverse/2015/09/thank-you-for-playing-film-review-a-beautiful-tragic-attempt-to-press-pause/
65,Support for indexes that use deterministic expressions,mingodad,https://www.sqlite.org/src/info/2131a5ca53f0e9b0
80,Five years building a culture and handing it off,tamersalama,http://laughingmeme.org/2015/08/31/five-years-building-a-culture-and-handing-it-off/
48,Free Software Building and Packaging for Windows,T-A,http://win-builds.org/
58,NATS – An open-source high-performance lightweight messaging system,stargrave,http://nats.io/
10,Whatever It Would Cost to Eliminate Mobile Ads Consumers Don't Want to Pay It,prawn,https://blog.applovin.com/data-desk-6-whatever-it-would-cost-to-eliminate-mobile-ads-consumers-dont-want-to-pay-it/
52,Simple web server using bash and nc,ColinWright,https://gist.github.com/dfletcher/4763be3295bd5638b797
54,From Imperative to Pure-Functional and Back: Monads vs. Scoped Continuations,pron,http://blog.paralleluniverse.co/2015/08/07/scoped-continuations/
19,Privacy issue? Chromium always connecting to Google,motge,https://www.reddit.com/r/Chromium/comments/3fgabt/privacy_issue_chromium_always_connecting_to_google/
10,Unreliable Failure Detectors for Reliable Distributed Systems (1996) [pdf],misframer,http://zoo.cs.yale.edu/classes/cs426/2013/bib/chandra96unreliable.pdf
83,How JavaScript closures work under the hood,dimonomid,http://dmitryfrank.com/articles/js_closures
11,Is my file properly sync’ed on disk? (2013),zdw,http://blog.httrack.com/blog/2013/11/15/everything-you-always-wanted-to-know-about-fsync/
79,Movim: A social network on XMPP,Moyamo,https://movim.eu/en/how
10,Why coffee drinkers generally live longer,fezz,http://www.mnn.com/food/beverages/stories/why-coffee-drinkers-generally-live-longer
45,Streaming Anomaly Detection Using Randomized Matrix Sketching [pdf],luu,http://www.cse.psu.edu/~kasivisw/randsketch.pdf
40,Monster Pumps,mhb,http://www.overcomingbias.com/2015/09/monster-pumps.html
148,The mystery of the fifteen-millisecond breakpoint instruction,jsnell,http://blog.jwhitham.org/2015/04/the-mystery-of-fifteen-millisecond.html
8,Adult Autistic and Ignored,selimthegrim,http://www.nytimes.com/2015/09/06/opinion/sunday/adult-autistic-and-ignored.html
293,Call Me Maybe: MariaDB Galera Cluster,akerl_,https://aphyr.com/posts/327-call-me-maybe-mariadb-galera-cluster
84,Guess my word,ColinWright,http://simbase.org/gmw/gmw.html?HN_20150905
39,Mapping Immigrant America,ingve,http://personal.tcu.edu/kylewalker/immigrant-america/
30,The First Animated Feature Film: The Adventures of Prince Achmed (1926),benbreen,http://www.openculture.com/2015/09/the-first-animated-feature-film-the-adventures-of-prince-achmed.html
20,Banking on Radical Honesty,ggillas,http://www.inkworthy.com/s/55e9e5b9b092c75e002a7ddc/cd278894-1585-4fd2-85e1-468818211e86
231,Public defender: it’s impossible for me to do a good job representing my clients,ikeboy,https://www.washingtonpost.com/opinions/our-public-defender-system-isnt-just-broken--its-unconstitutional/2015/09/03/aadf2b6c-519b-11e5-9812-92d5948a40f8_story.html
6,New Antarctic Research Ups Sea Level Rise Estimates,cryptoz,http://www.climatecentral.org/news/west-antarctica-sea-level-estimates-19345?utm_content=bufferb8e46&utm_medium=social&utm_source=twitter.com&utm_campaign=buffer
15,Keyboardio – a keyboard for uncompromising typists,talles,http://keyboard.io
58,Ada Lovelace: Enchantress of abstraction,mkempe,http://www.nature.com/nature/journal/v525/n7567/full/525030a.html
15,Google Chrome reportedly bypassing Adblock,walterclifford,http://www.neowin.net/news/google-chrome-reportedly-bypassing-adblock-forces-users-to-watch-full-length-video-ads
119,OpenSSL's implementation of DSA appears to be broken,e12e,https://j.ludost.net/blog/archives/2015/09/05/rfc-2631_fips_186-3_and_openssls_implementation_of_dsa_appear_broken_and_possibly_backdoored/index.html
266,Happy Birthday Monkey Island,alblue,http://grumpygamer.com/monkey25
5,Desktop PCs aren’t going anywhere because they’re cheap (2011),jseliger,http://jakeseliger.com/2011/10/09/desktop-pcs-arent-going-anywhere-despite-the-growth-of-phones-and-tablets-because-theyre-cheap/
31,Did Lawrence doubt the bomb?,caf,http://blog.nuclearsecrecy.com/2015/09/04/did-lawrence-doubt-the-bomb/
64,Parkinsons-Like Neurodegenerative Disease Linked to Prion,cryoshon,http://cen.acs.org/articles/93/i35/Another-Neurodegenerative-Disease-Linked-Prion.html
3,iPad Pro: ‘Monster screen’ runs full-sized side-by-side apps LTE models,rbanffy,http://9to5mac.com/2015/09/07/ipad-pro-specs/
67,Algorithm can create new Van Gogh or Picasso in an hour,JohnHammersley,http://www.washingtonpost.com/news/innovations/wp/2015/08/31/this-algorithm-can-create-a-new-van-gogh-or-picasso-in-just-an-hour/?postshare=9081441069630944
8,Making Full Use of ‘Dig’ in Linux,vinnyglennon,https://ma.ttias.be/making-full-use-of-dig-in-linux/
77,The Debate Around “Do We Even Need CSS Anymore?”,logn,https://css-tricks.com/the-debate-around-do-we-even-need-css-anymore/
57,Learn by Implementation: K-Nearest Neighbor,vonnik,https://depiesml.wordpress.com/2015/09/03/learn-by-implementation-k-nearest-neighbor/
14,Attention and awareness in stage magic: turning tricks into research (2008) [pdf],stakent,http://people.cs.uchicago.edu/~luitien/nrn2473.pdf
26,The Curious Case of the Greek Final Sigma,knight666,http://knight666.com/blog/the-curious-case-of-the-greek-final-sigma/
38,“The History of Cartography” Now Free Online,ingve,http://www.openculture.com/2015/09/the-history-of-cartography-the-most-ambitious-overview-of-map-making-ever-now-free-online.html
18,Evil Google Waiting on Line One,rfreytag,http://www.cringely.com/2015/09/07/evil-google-waiting-on-line-one/
46,Saul Bass Pitch Video for Bell System Logo Redesign (1969) [video],danboarder,https://www.youtube.com/watch?t=156&v=xKu2de0yCJI
71,Let's Build dispatch_queue,ingve,https://www.mikeash.com/pyblog/friday-qa-2015-09-04-lets-build-dispatch_queue.html
109,How I Write Invoices in Vim,yakshaving_jgt,http://jezenthomas.com/how-i-write-invoices-in-vim/
10,Are JavaScript comments useless?,zsolt777,http://www.zsoltnagy.eu/are-javascript-comments-useless/
47,DPDK: Data Plane Development Kit,pjf,http://www.dpdk.org/
6,Credentials Found in the Ashley Madison Sources,ophelia,https://blog.gaborszathmari.me/2015/09/07/credentials-in-the-ashley-madison-sources/
252,How Secure Channels Attempted to Intimidate a Critic and Failed Spectacularly,tptacek,http://popehat.com/2015/09/04/how-secure-channels-attempted-to-intimidate-a-critic-and-failed-spectacularly/?utm_source=feedburner&utm_medium=feed&utm_campaign=Feed%3A+Popehat+%28Popehat%29
6,Woz: Aaron Sorkin's Steve Jobs movie gets it right,melling,http://www.cnet.com/news/woz-aaron-sorkins-steve-jobs-movie-gets-it-right/#ftag=CAD590a51e
5,Programming Coordinated Behavior in Java (2010) [pdf],pron,http://www.wisdom.weizmann.ac.il/~amarron/BPJ%20ECOOP%20FINAL.pdf
20,Show HN: Immutable and type-checked state and actions for Redux,gcanti,https://github.com/gcanti/redux-tcomb
71,Flexx – Python UI tookit based on web technology,jmduke,https://github.com/zoofIO/flexx
12,PowerLine: Status Line for Vim Zsh Bash Tmux,singold,https://github.com/powerline/powerline
34,Why we aren't tempted to use ACLs on our Unix machines,mjn,https://utcc.utoronto.ca/~cks/space/blog/sysadmin/NoACLTemptation
40,Klarna launches in US,Sami_Lehtinen,https://www.klarna.com/us
46,Hawaii First to Harness Deep-Ocean Temperatures for Power,deegles,http://www.scientificamerican.com/article/hawaii-first-to-harness-deep-ocean-temperatures-for-power/#b09g04f20b15
43,OOSMOS – The Object-Oriented State Machine Operating System,zzglenm,http://oosmos.com/
57,Swift Protocols and Generics,milen,http://milen.me/writings/swift-generic-protocols/
33,Show HN: Zen Timer – Mac app using Bézier paths to draw a tree,binaryapparatus,http://www.smartcodehq.com/zentimer/
14,Metal-Mouths: America’s obsession with perfecting its teeth,prostoalex,http://nymag.com/scienceofus/2015/06/why-is-america-obsessed-perfect-teeth.html
21,How Google ‘Tricks’ Users into Sharing Location Data,cybernot,https://www.sherbit.io/how-google-tricks-users-into-sharing-location-data/
177,Lost C64 Games: Daffy Duck – 1992 Hi-Tec,ingve,http://www.gamesthatwerent.com/gtw64/daffy-duck/
47,Zippers and Type Magic,signa11,https://keb.theoremsfor.me/zippers-and-type-magic/
3,1934 West Coast waterfront strike,kickingvegas,https://en.wikipedia.org/wiki/1934_West_Coast_waterfront_strike
25,A TinyGPS upgrade adding NMEA v3.0 and GLONASS support,florind,http://blog.newsplore.com/2015/09/03/a-tinygps-upgrade-adding-nmea-v3-0-and-glonass-support
40,Generate command-line completions using a simple DSL,dmmalam,https://github.com/mbrubeck/compleat
5,Show HN: Your GitHub feed as notifications in your desktop,ikessler,https://github.com/kessler/node-octofications
7,Snapchat's video push clicks with users,prostoalex,http://www.latimes.com/business/la-fi-snapchat-video-20150904-story.html
26,Hacked Jeep USB update criticised,daledavies,http://www.bbc.co.uk/news/technology-34156598
4,How Welfare Reform Ruined Public Assistance for the Very Poor,tim333,http://www.theatlantic.com/business/archive/2015/09/welfare-reform-americas-poorest/403960/?single_page=true
10,Food Industry Enlisted Academics in G.M.O. Lobbying War Emails Show,m_haggar,http://www.nytimes.com/2015/09/06/us/food-industry-enlisted-academics-in-gmo-lobbying-war-emails-show.html?_r=0
26,Literate: A Modern Literate Programming System,jsyedidia,http://literate.zbyedidia.webfactional.com/
55,Improving Security for Bugzilla,haytjes,https://blog.mozilla.org/security/2015/09/04/improving-security-for-bugzilla/
73,Quebec doctors can now prescribe exercise,the_duck,http://www.cbc.ca/news/canada/montreal/quebec-doctors-can-now-prescribe-exercise-1.3215821
84,C# 7 Proposal: Nullable reference types and nullability checking,Permit,https://github.com/dotnet/roslyn/issues/5032
4,Why Security Experts Are Using an Ancient Email Format in 2015,aburan28,http://motherboard.vice.com/read/why-security-experts-are-using-an-ancient-email-format-in-2015?trk_source=recommended
88,How a Boeing Sales Flop Became the World's Hottest Secondhand Jetliner,jwegan,http://www.bloomberg.com/news/articles/2015-09-04/how-boeing-sales-flop-became-world-s-hottest-secondhand-jetliner
30,ZeroNet: Decentralized websites using Bitcoin crypto and the BitTorrent network,sphinxo,http://zeronet.io/
144,St. Petersburg paradox,gmac,https://en.wikipedia.org/wiki/St._Petersburg_paradox
14,In Hyperspace: Fredric Jameson on Science Fiction,fitzwatermellow,http://www.lrb.co.uk/v37/n17/fredric-jameson/in-hyperspace
38,NASA's 1975 Graphics Standards Manual,ForHackernews,http://www.slate.com/blogs/the_eye/2015/09/03/nasa_s_1975_graphics_standards_manual_is_reissued_via_kickstarter_by_jesse.html
9,Show HN: BashScanner – Script to list Outdated Software on your server + cronjob,dolfje,https://github.com/PatrolServer/bash-scanner
17,Beware of Open Source Software Zombies,mhausenblas,https://medium.com/@mhausenblas/beware-of-open-source-software-zombies-26a56f38a4f4
106,W^X policy violation affects Windows drivers compiled in VS 2013 and previous,mmastrac,https://codeinsecurity.wordpress.com/2015/09/03/wx-policy-violation-affecting-all-windows-drivers-compiled-in-visual-studio-2013-and-previous/
14,Ask HN: Am I the only one lost interest applying YC?,brokenhope,
113,The Alternate Universe of Soviet Arcade Games,lermontov,http://www.atlasobscura.com/articles/the-alternate-universe-of-soviet-arcade-games
42,Show HN: PyFuzz2 – A little fuzzing framework in Python,susperius,https://github.com/susperius/PyFuzz2
145,The Weight,pmcpinto,http://www.theplayerstribune.com/mardy-fish-us-open
75,The “Hitler at Home” stories of the pre-WWII American press,aaronbrethorst,http://www.atlasobscura.com/articles/the-american-medias-awkward-fawning-over-hitlers-taste-in-home-decor
8,IoT: How a Major US Utility Collects Power Data from Over 5.5M Meters,Hoff,http://highscalability.com/blog/2015/9/7/want-iot-heres-how-a-major-us-utility-collects-power-data-fr.html
8,The Point of Pattern Matching in Scala (2009),mortimerwax,https://www.artima.com/scalazine/articles/pattern_matching.html
96,From Kafka to ZeroMQ for real-time log aggregation,azaras,http://tomasz.janczuk.org/2015/09/from-kafka-to-zeromq-for-log-aggregation.html
71,Ask HN: What are the latest and greatest books on your favorite language?,djent,
75,The Simons Foundation and Open Source Software,williamstein,http://sagemath.blogspot.com/2015/09/the-simons-foundation-and-open-source.html
165,The Mystery of Devil's Kettle Falls,oskenso,http://www.mnn.com/lifestyle/eco-tourism/stories/the-mystery-of-devils-kettle-falls
138,Dead Code Should Be Buried – Why I Didn't Contribute to NLTK,Smerity,http://spacy.io/blog/dead-code-should-be-buried/
11,Public Transit Should Be Uber’s New Best Friend,gordon_freeman,http://fivethirtyeight.com/features/public-transit-should-be-ubers-new-best-friend/
31,The return of nature,hmsln,http://thebreakthrough.org/index.php/journal/issue-5/the-return-of-nature
97,An Analysis of China’s “Great Cannon”,sasvari,https://www.usenix.org/conference/foci15/workshop-program/presentation/marczak
155,Responsive CSS grid reordered with native HTML5 drag and drop,seer,https://clippings.github.io/layout-grid/
90,Under the Hood of the Amazon EC2 Container Service,signaler,http://www.allthingsdistributed.com/2015/07/under-the-hood-of-the-amazon-ec2-container-service.html
7,What Can We Learn from Elon Musk?,rahulshiv7,http://www.quora.com/What-can-we-learn-from-Elon-Musk/?share=1
5,Can a company innovate without working its employees to death?,marvin,http://www.washingtonpost.com/news/innovations/wp/2015/08/28/can-a-company-innovate-without-working-its-employees-to-death/
12,Cars newspapers and permissionless innovation,aaronbrethorst,http://ben-evans.com/benedictevans/2015/9/1/permissionless-innovation
58,GM crops created superweed say scientists (2005),x5n1,http://www.theguardian.com/science/2005/jul/25/gm.food
96,Detecting an asymmetric Curve25519 backdoor in RSA key generation algorithms,mukyu,http://samvartaka.github.io/backdoors/2015/09/03/rsa-curve25519-backdoor/
143,My Keyboard,efnx,http://zyghost.com/articles/My-Keyboard.html
43,Tom Duff on Duff's Device (1988),dv_says,http://www.lysator.liu.se/(nobg)/c/duffs-device.html
7,An approach to systems verification (1989) [pdf],luu,http://www.cs.utexas.edu/ftp/boyer/cli-reports/041.pdf
11,You cannot have at-least-once broadcast,rumcajz,http://250bpm.com/blog:61
27,Typed Arrays in ECMAScript 6,madflame991,http://www.2ality.com/2015/09/typed-arrays.html
17,Sticky tape generates X-rays (2008),bootload,http://www.nature.com/news/2008/081022/full/news.2008.1185.html
10,Backboard – A motion-driven animation framework for Android,Jahak,https://github.com/tumblr/Backboard
30,Sony Sees Next Big Hit at 1000 Photos a Second,cm2187,http://www.bloomberg.com/news/articles/2015-09-04/why-sony-sees-its-next-big-hit-at-1-000-photos-a-second
12,AirBnB logo found in Trademarks and Symbols of the World published 1988,sweetcakes_2600,http://i.imgur.com/IbmcCgH.jpg
12,1st NixOS conference in Berlin,iElectric2,http://conf.nixos.org/
11,Make a connected barometer shield for the Arduino uno – using an ESP8266,digitaljunky,http://digitaljunky.io/make-a-connected-barometer-shield-for-arduino-uno/
117,Implementing a Neural Network from Scratch – An Introduction,dennybritz,http://www.wildml.com/2015/09/implementing-a-neural-network-from-scratch/
141,Tarsnap email confirmation bypass,mcobrien,http://www.daemonology.net/blog/2015-09-04-tarsnap-email-confirmation-bypass.html
150,AirConsole – Your browser is the game console your smartphone is the gamepad,morgam,http://www.airconsole.com
36,Making of Musicoacher,luxbock,http://wilkerlucio.github.io/clojure/2015/09/04/marking-of-musicoacher/
91,Ceaser – CSS easing animation tool,dazpaz,http://matthewlein.com/ceaser/
42,Show HN: WebGL-powered oscilloscope emulator,m1el,http://m1el.github.io/woscope/
55,Ask HN: I have a mental block designing software. Time to quit?,porker,
35,A new approach to property based testing,luu,http://www.drmaciver.com/2015/09/a-new-approach-to-property-based-testing/
129,Show HN: Libsoundio 1.0.0 – cross-platform audio input and output,AndyKelley,http://libsound.io/
102,Linguistic Harbingers of Betrayal,gcv,http://vene.ro/betrayal/
105,The Cheap Phones Quietly Winning the U.S,adventured,http://www.bloomberg.com/news/articles/2015-09-03/zte-s-cheap-phones-quietly-winning-the-u-s-
27,Chebfun – Numerical Computing with Functions,jcr,http://www.chebfun.org/
103,Monads in Scheme,amirouche,http://okmij.org/ftp/Scheme/monad-in-Scheme.html
14,In-Stream Big Data Processing,lucajulian,https://highlyscalable.wordpress.com/2013/08/20/in-stream-big-data-processing/
16,Victorian-Era Portraits of Black British Citizens Revealed in a New Exhibiton,Thevet,http://www.okayafrica.com/news/black-chronicles-ii-ethelbert-cooper-gallery-for-african-african-american-art-harvard/
80,Picoc: A very small C interpreter for scripting,alecco,https://github.com/zsaleeba/picoc
473,Don’t Build a Billion-Dollar Business,discreditable,https://www.backblaze.com/blog/dont-build-a-billion-dollar-business-really/
25,Saying Goodbye to Google Services,danielmiessler,https://danielmiessler.com/blog/saying-goodbye-to-google-services/?fb_ref=e0550e3ecdec470994a4fca81ee9c009-Hackernews
429,How JetBrains Lost Years of Customer Loyalty in Just a Few Hours,rograndom,http://bytecrafter.blogspot.com/2015/09/how-jetbrains-lost-years-of-customer.html
32,Let's stop with the Silicon Valley comparisons,weston,http://michiganradio.org/post/lets-stop-silicon-valley-comparisons
27,Is Nuance Overrated?,benbreen,http://chronicle.com/article/Is-Nuance-Overrated-/232771/
47,iVe – Infotainment and Vehicle System Forensics,tlack,https://berla.co/ive.html
27,How much is Reddit making from Reddit gold?,bemmu,http://gold.reddit-stream.com/?fb_share=1
11,Annotated Realtime Raytracing,Polytonic,https://www.tinycranes.com/blog/2015/05/annotated-realtime-raytracing/
7,C++ encapsulation for Data-Oriented Design: performance,joaquintides,http://bannalia.blogspot.com/2015/09/c-encapsulation-for-data-oriented.html
10,Your well-funded startup is already dead,thom,https://medium.com/@paul_a_smith/your-well-funded-startup-is-already-dead-fcd8976487c1
4,A Life in Games: The Playful Genius of John Conway,ghosh,http://www.wired.com/2015/09/life-games-playful-genius-john-conway/
37,Clarifying NextBSD's Near Term Expectations,protomyth,http://www.nextbsd.org/clarifying-near-term-expectations/
5,Researcher Hacks Self-Driving Car Sensors,mtuncer,http://spectrum.ieee.org/cars-that-think/transportation/self-driving/researcher-hacks-selfdriving-car-sensors
11,Geophony Biophony and Anthrophony,brianclements,http://www.eoearth.org/view/article/179209/
73,Make it Rain – Animated gif notifications whenever you get paid through Stripe,joeyspn,https://github.com/fitztrev/make-it-rain
48,Judge’s Ruling Offers Peek into Private Equity’s Secret World,Ankaios,http://www.nytimes.com/2015/09/06/business/judges-ruling-offers-peek-into-private-equitys-secret-world.html
55,Ask HN: What's your favorite CLI or ncurses program?,wkoszek,
9,Snowden criticises Russia for approach to internet and homosexuality,jeo1234,http://www.theguardian.com/us-news/2015/sep/05/snowden-criticises-russia-internet-homosexuality
33,Vulcan: A JavaScript Automated Proof System,beefman,http://rmarcus.info/blog/2015/09/02/vulcan.html
67,The Ur Programming Language Family,dmmalam,http://www.impredicative.com/ur/
31,Bitcoin and Cryptocurrency Technologies – Princeton University,jyunderwood,https://www.coursera.org/course/bitcointech
18,The Witches of Salem,pmcpinto,http://www.newyorker.com/magazine/2015/09/07/the-witches-of-salem
10,Stripe CEO Patrick Collison on the Limitless Potential of Payments,prostoalex,http://www.forbes.com/sites/roberthof/2015/08/18/in-conversation-stripe-ceo-patrick-collison-on-the-limitless-potential-of-payments/
72,SystemBSD: Custom D-Bus daemons emulating systemd behavior on OpenBSD [pdf],vezzy-fnord,http://darknedgy.net/files/systembsd.pdf
68,Friends at Work? Not So Much,prostoalex,http://www.nytimes.com/2015/09/06/opinion/sunday/adam-grant-friends-at-work-not-so-much.html?smid=fb-nytimes&smtyp=cur&_r=0
19,Ride hustle kill repeat: the underground cycle gangs of Los Angeles,Graham24,http://www.theguardian.com/cities/2015/sep/04/ride-hustle-kill-repeat-the-underground-cycle-gangs-of-los-angeles
50,ReScience is a peer-reviewed journal that targets computational research,phreeza,https://github.com/ReScience/ReScience/wiki
9,Self-driving golf carts,csom,http://news.mit.edu/2015/autonomous-self-driving-golf-carts-0901
23,Google's new logo was created by Russian designer in 2008,usaphp,http://www.dailytech.com/Exclusive+Googles+New+Search+Icon+Was+Created+in+2008+by+Russian+Designer/article37480.htm
23,Video Poker “Hackers” Cleared of Federal Charges,trengrj,http://www.wired.com/2013/11/video--poker-case/
6,Writing a DSL with Groovy,mindcrime,http://szimano.org/writing-a-dsl-with-groovy/
8,A New Design for Cryptography’s Black Box,cschmidt,https://www.quantamagazine.org/20150902-indistinguishability-obfuscation-cryptographys-black-box
8,US egg lobby paid food blogs and targeted chef to crush Hampton Creek Foods,shalmanese,http://www.theguardian.com/business/2015/sep/06/usda-american-egg-board-paid-bloggers-hampton-creek
45,High-Speed Pool and Billiards Video Clips,Tomte,http://billiards.colostate.edu/high_speed_videos/index.html
11,How we're spending $55930.08 a year on SaaS products,dlcmh,http://blog.sawhorsemedia.com/post/104076088572/how-were-spending-5593008-a-year-on-saas
6,A Threat Analysis of RFID Passports (2009),snake117,https://queue.acm.org/detail.cfm?id=1626175
44,V8 JavaScript Engine: Digging into the TurboFan JIT,dmmalam,http://v8project.blogspot.com/2015/07/digging-into-turbofan-jit.html
8,How Twitter improves communication across distributed teams internally,ChrisArchitect,https://blog.twitter.com/2015/improving-communication-across-distributed-teams
30,Cofactor Genomics (YC S15) plans to analyze cRNA for consumer diagnostics,qasar,http://www.wired.com/2015/09/cofactor-genomics/
23,Help Us Save Wifi,ekianjo,https://jxself.org/savewifi.shtml
