SCORE,TITLE,BY,URL
14,Ask HN: What market demands can I solve with machine learning?,curiously,
5,Uber CFO is stepping down after less than two years,mjhoyer,http://www.wsj.com/articles/uber-cfo-brent-callinicos-steps-down-memo-says-1426539354
457,Microsoft's new foldable keyboard,tegeek,http://blogs.microsoft.com/firehose/2015/03/02/get-more-done-anywhere-anytime-on-virtually-any-device-with-the-new-universal-foldable-keyboard/
7,Please Review our startup – Venux.com,Venux,
27,Ask HN: What do you think the biggest trends will be in 2015-2018?,thinkingkong,
159,Sirius: An Open Intelligent Personal Assistant,tectonic,https://github.com/jhauswald/sirius
5,BBC gives single board computer to every single 12-year-old in the UK,igravious,http://www.theregister.co.uk/2015/03/16/naked_computers_bbc_micro_coding_cc/
37,How “../sms” Could Bypass Authy 2-Factor Authentication,dsacco,http://sakurity.com/blog/2015/03/15/authy_bypass.html/
785,SQLite developer must have received a lot of phone calls,DaGardner,https://github.com/mackyle/sqlite/blob/3cf493d4018042c70a4db733dd38f96896cd825f/src/os.h#L52
5,A look at Android 5.1: speed security tweaks,antouank,http://arstechnica.com/gadgets/2015/03/a-look-at-android-5-1-speed-security-tweaks/
488,“Your monthly rent .. shall increase from $2145 to $8900”,aestetix,https://www.facebook.com/photo.php?fbid=10153190864139878
161,The most important API you’ve never heard of,gdeglin,http://rockhealth.com/2015/03/important-api-youve-never-heard/
4,Parsyncfp – a parallel rsync wrapper for large data transfers,zdw,http://moo.nac.uci.edu/~hjm/parsync/
6,Uber 911,minch,https://medium.com/invisible-balloons/uber-911-5d28d7428de6
69,On Secretly Terrible (Old) Engineers,leothekim,http://techcrunch.com/2015/03/15/gray-beards/
9,Are coder/IT volunteers needed in places coder/IT “types” don't know about?,CookieMon,
6,Instead of Dropping Bombs Can Drones Locate Unexploded Ones?,spectruman,http://spectrum.ieee.org/tech-talk/robotics/aerial-robots/instead-of-dropping-bombs-can-drones-locate-unexploded-ones/#.VQcdA_Dy23k.hackernews
3,Kubernetes,vectorbunny,http://bruzer.net/2015/03/16/kubernetes/
9,The Inventor of Underwear with Pockets,ryan_j_naughton,http://priceonomics.com/the-inventor-of-underwear-with-pockets/
10,Forthcoming OpenSSL releases March 19th,DiabloD3,http://www.mail-archive.com/openssl-users@openssl.org/msg76551.html
6,Happy St. Patrick's Day from BitBucket,geekrax,http://i.imgur.com/PjvTNtS.png
4,Code your March Madness bracket,Kamogo,https://www.codersbracket.com/
3,Mozilla peers into processes with student-built forensics probe,jvehent,http://www.theregister.co.uk/2015/03/16/mozilla_masche/
74,Chrome team planning to block all access from browser to localhost wss,jorangreef,https://code.google.com/p/chromium/issues/detail?id=378566
6,Tesla CEO Elon Musk vows end to 'range anxiety',adventured,http://www.usatoday.com/story/money/cars/2015/03/15/elon-musk-tesla-range-anxiety/24812353/
5,30 days with swift – Day 10 – Finally programming,akiokio,https://medium.com/@akiokio/30-days-with-swift-day-10-finally-programming-9b6f51ed790d
24,How Windows 10 achieves its compact footprint,amitmittal1993,http://blogs.windows.com/bloggingwindows/2015/03/16/how-windows-10-achieves-its-compact-footprint/#.VQctgXoSlgw.twitter
404,CSS Sans – A pure CSS font,snyp,http://yusugomori.com/projects/css-sans/fonts
6,Ask HN: How much (technical) debt does your team owe?,andrewstuart,
59,Britain's housing crisis is a human disaster,design-of-homes,http://www.theguardian.com/society/2015/mar/14/britain-housing-crisis-10-ways-solve-rowan-moore-general-election
7,Make typing special characters stupid easy: meet the compose key,smacktoward,http://jasonlefkowitz.net/2015/03/make-typing-special-characters-drop-dead-easy-with-the-compose-key/
270,Dad and The Ten Commandments of Egoless Programming (2012),dodders,http://blog.stephenwyattbush.com/2012/04/07/dad-and-the-ten-commandments-of-egoless-programming
272,Jvm.go: A JVM written in Go,tombenner,https://github.com/zxh0/jvm.go
37,Show HN: The remaining unregistered one-word .com domains,xh208,http://www.randomdotcom.com
9,White House office to delete its FOIA regulations,MrZongle2,http://www.usatoday.com/story/news/politics/2015/03/16/white-house-foia-regulations-deleted/24844253/
3,AeroMobil Says It Will Put Its Flying Car on the Maket in 2017,evo_9,http://www.popsci.com/sxsw-2015-forget-self-driving-cars-future-self-flying-cars
6,You Kids Stay Off of Mark Zuckerberg's Lawn,davepell,https://medium.com/p/you-kids-get-off-mark-zuckerberg-s-lawn-25a32a4c37ca
189,Developer productivity: The art of saying no,cj,https://localizejs.com/blog/startup/developer-productivity-saying-no
6,High school dropout built a $1B business selling phones nobody wanted,tehrania,http://uk.businessinsider.com/pcs-wireless-ben-nash-built-a-billion-dollar-company-2015-3?r=US
439,Former Nvidia Dev's Thoughts on Vulkan/Mantle,phoboslab,http://www.gamedev.net/topic/666419-what-are-your-opinions-on-dx12vulkanmantle/?view=findpost&p=5215019
17,Bye Bye HipChat Hello Slack,juanriaza,http://blog.scrapinghub.com/2015/03/16/bye-bye-hipchat-hello-slack/
643,2015 Chromebook Pixel,dannyr,http://www.google.com/chromebook/pixel/
263,Harry Potter and the Methods of Rationality finished today,Eliezer,https://www.fanfiction.net/s/5782108/1/Harry-Potter-and-the-Methods-of-Rationality
6,The true cost of maintaining a product database,netvarun,https://medium.com/@Semantics3/the-true-cost-of-maintaining-an-updated-product-database-77a1a10f4f
648,Welcome Peter,katm,http://blog.ycombinator.com/welcome-peter
4,Etsy’s Success Raises Problems of Credibility and Scale,kanamekun,http://www.nytimes.com/2015/03/16/business/media/etsys-success-raises-problems-of-credibility-and-scale.html
320,Fake Amazon Tech Book Reviews Are Hurting My Book,Ovid,http://blogs.perl.org/users/ovid/2015/03/fake-amazon-book-reviews-are-hurting-my-book.html
21,Is Apple the new Microsoft?,rdlecler1,
114,We Tried Building a Remote Team and It Sucked,stevenklein,http://blog.statuspage.io/we-tried-building-a-remote-team-and-it-sucked
8,One Year of DynamoDB at Timehop – Building Timehop,shenoybr,https://medium.com/building-timehop/one-year-of-dynamodb-at-timehop-f761d9fe5fa1
98,A concise JavaScript tutorial for beginners,concise,https://slides.com/concise/js/fullscreen
44,Ask HN: I just got my Stackoverflow Python gold badge - is it worth anything?,aaronchall,
254,Open source USB Type-C to HDMI Adapter,mmastrac,http://www.chromium.org/chromium-os/hoho
594,Reasons not to use Facebook,jestinjoy1,https://stallman.org/facebook.html
1019,Sir Terry Pratchett has died,robin_reala,http://www.bbc.com/news/entertainment-arts-31858156
23,Show HN: Neural network optical character recognition,megalodon,https://github.com/mateogianolio/mlp-character-recognition
7,Can Spark Streaming Survive Chaos Monkey?,cinbun8,http://techblog.netflix.com/2015/03/can-spark-streaming-survive-chaos-monkey.html
12,Brick by Brick: A free guide to building awesome communities,AntoinePlu,http://www.communitybuildingguide.com/
295,Show HN: Ghostnote – Contextual notes and todo app,ThomPete,http://www.ghostnoteapp.com/
339,Strengthening JavaScript,jashkenas,https://developers.google.com/v8/experiments
177,Adopting Microservices at Netflix,pnommensen,http://nginx.com/blog/adopting-microservices-at-netflix-lessons-for-team-and-process-design/
585,Wikimedia v. NSA: Wikimedia Foundation files suit against NSA,davidgerard,https://blog.wikimedia.org/2015/03/10/wikimedia-v-nsa/
6,Isomorphic Apps Done Right with React Nexus,elierotenberg,https://blog.rotenberg.io/isomorphic-apps-done-right-with-react-nexus/
59,Company hit with $1.1M penalty under Canadian anti-spam rules,wellokthen,http://www.canadianlawyermag.com/5499/Quebec-company-hit-with-$1.1-million-penalty-under-CASL.html
112,Baobab: A JavaScript data tree supporting Om-style cursors with React mixins,lewisl9029,https://github.com/Yomguithereal/baobab
224,Dropwizard 0.8.0: Java framework for ops-friendly high-performance web services,koevet,http://dropwizard.io
17,Show HN: React+D3.js an ebook that teaches you dataviz with React,Swizec,https://leanpub.com/reactd3js
6,Only on Kickstarter: The Leader’s Guide by Eric Ries,sprice,https://www.kickstarter.com/projects/881308232/only-on-kickstarter-the-leaders-guide-by-eric-ries
332,Algorithms Every Programmer Should Know: Reservoir Sampling,timr,https://www.omniref.com/ruby/gems/stream_sampler/0.0.1/symbols/StreamSampler?#annotation=4094626&line=2
78,Ask HN: What should I do if I feel depressed in my job?,nojvek,
154,Boiling React Down to Few Lines in JQuery,Suor,http://hackflow.com/blog/2015/03/08/boiling-react-down-to-few-lines-in-jquery/
43,Reddit: can anyone clean up the mess behind 'the front page of the internet'?,prostoalex,http://www.theguardian.com/technology/2015/mar/12/reddit-can-ceo-ellen-pao-clean-up-the-mess
3,Fossil Fuels Will Save the World (Really),T-A,http://www.wsj.com/articles/fossil-fuels-will-save-the-world-really-1426282420
11,Is Mozilla being forced to buy Adwords to protect their users from malware?,anon1385,
107,Death Is Optional: A Conversation with Yuval Noah Harari and Daniel Kahneman,sergeant3,http://edge.org/conversation/yuval_noah_harari-daniel_kahneman-death-is-optional
106,Understanding Variance Co-Variance and Correlation,CountBayesie,http://www.countbayesie.com/blog/2015/2/21/variance-co-variance-and-correlation
205,ECMAScript 6,dshankar,http://rauchg.com/2015/ecmascript-6/
3,Ask HN: Is it legal to attack your own honeypot if it's hosted on AWS?,TempaTaccount,
6,Photoshop experts try to use Photoshop 1.0,kevinchau,https://www.youtube.com/watch?v=TtA46JT2q_0
15,2014 Berkshire Hathaway Shareholder Letter [pdf],antr,http://www.berkshirehathaway.com/letters/2014ltr.pdf
53,Never Use Glassdoor from Work,logn,https://lustforge.com/2014/11/02/never-user-glassdoor-from-work/
10,Tragedies of the remote worker,bootload,http://www.hanselman.com/blog/TragediesOfTheRemoteWorkerLooksLikeYoureTheOnlyOneOnTheCall.aspx
5,Dropping a column in SQLite is a blood bath,bgia,https://medium.com/@baudoui/dropping-a-column-in-sqlite-9d7613e73ae5
9,Uber Investor: The Bay Area Bubble Will Pop This Year,pound,http://sfist.com/2015/03/16/uber_investor_the_bay_area_bubble_w.php
4,Uber CFO Steps Down,thisjustinm,http://mashable.com/2015/03/16/uber-cfo-steps-down/
9,User experience is more than just usability,abinav_t,http://easilyeasy.com/ux-is-more-than-just-usability.html
22,Senator Hatch: It's Time to Kill Patent Trolls for Good,iNate2000,http://www.wired.com/2015/03/opinion-must-finally-legislate-patent-trolls-existence/
17,A Police Gadget Tracks Phones? Shhh It’s Secret,carlchenet,http://www.nytimes.com/2015/03/16/business/a-police-gadget-tracks-phones-shhh-its-secret.html
3,Understanding Spatial Mean – Or Where to Put a Bachelor Party,meterplech,http://jkatzur.tumblr.com/day/2015/03/16
18,Javascript-Style Objects in Python,eatonphil,https://gist.github.com/eatonphil/4fc6d081f53eedb9a4c4
7,Callbacks are now part of remodel the RethinkDB Python ODM,linkyndy,https://github.com/linkyndy/remodel/releases/tag/v0.4.0
12,Patreon purchases competitor Subbable,oddevan,https://subbable.com/
9,Submarine Cable Map,DiabloD3,https://www.telegeography.com/telecom-maps/submarine-cable-map/index.html
9,Functional Programming at Bloomberg,mightybyte,https://www.youtube.com/watch?v=r6mYb2w_6po
9,Why Stallman is wrong,simonebrunozzi,http://brunozzi.com/2015/03/16/why-stallman-is-wrong/
69,GoogleFeud,frostmatthew,http://googlefeud.com/
17,Show HN: CommonJS Based OCaml Development,jordwalke,https://github.com/jordwalke/CommonML
5,C# 6.0 Exception Filters and How they are much more than Syntactic Sugar,newhnuser,http://volatileread.com/Wiki/Index?id=1087
10,Computing the optimal road trip across the U.S,rograndom,http://www.randalolson.com/2015/03/08/computing-the-optimal-road-trip-across-the-u-s/
100,Show HN: A daily aggregator of all remote jobs out there,pieterhg,http://remoteok.io
79,Inbox by Gmail: now in more places,blackskad,http://gmailblog.blogspot.com/2015/02/inbox-by-gmail-now-in-more-places.html
4,Handling five billion sessions a day – in real time,jdkanani,https://blog.twitter.com/2015/handling-five-billion-sessions-a-day-in-real-time
9,Why Are Geospatial Databases So Hard to Build?,jandrewrogers,http://www.jandrewrogers.com/2015/03/02/geospatial-databases-are-hard/
164,Facebook Rooms,jamesjyu,http://www.rooms.me/
12,Show HN: API for generating invoices on the fly,jaredtking,https://github.com/Invoiced/invoice-generator-api
7,Google Feud,whbk,http://www.googlefeud.com/
228,You Weren't Meant to Have a Boss,helwr,http://www.paulgraham.com/boss.html
4,The Lemon Market of Programming Language Adoption,nfriedly,http://outspeaking.com/words-of-technology/the-lemon-market-of-programming-language-adoption.html
249,The Ocean Cleanup,gigaroby,http://www.theoceancleanup.com/
5,Pixel Shaders An Interactive Introduction to Graphics Programming,GuiA,http://pixelshaders.com/
27,Does money make you mean?,m-i-l,http://www.bbc.com/news/magazine-31761576
5,Terry Crews the Feminist: “Millions Have Died Because of Male Pride”,zdw,http://www.damemagazine.com/2015/03/06/terry-crews-feminist-millions-have-died-because-male-pride
8,Google executive Eric Schmidt man makes total ass of himself at SXSW,cooperpellaton,http://www.theverge.com/tldr/2015/3/16/8227625/eric-schmidt-load-foot-in-mouth-dot-exe
68,The melting of Antarctica,Libertatea,http://www.washingtonpost.com/news/energy-environment/wp/2015/03/16/the-melting-of-antarctica-was-already-really-bad-it-just-got-worse/
30,Does this patent mean I'm not allowed to do adaptive mesh subdivision?,irascible,http://www.google.com/patents/US6356263
14,OpenBSD sucks least – AsiaBSDCon 2015,tbirdz,http://quigon.bsws.de/papers/2015/asiabsdcon/mgp00001.html
16,Oregon man spends 900 days in jail without charges,briandear,http://www.oregonlive.com/portland/index.ssf/2015/03/oregon_man_commits_no_crime_bu.html
124,Internet Cafe Refugees – Japan's Disposable Workers,doppp,http://disposableworkers.com/?page_id=37
38,Ask HN: Review my startup www.getmustapp.com,TheMustApp,
134,Deploy based on the planet alignments,edofic,https://github.com/lhartikk/AstroBuild
34,Brazil: hundreds of thousands of protesters call for Rouseff impeachment,bruna597,http://www.theguardian.com/world/2015/mar/15/brazil-protesters-rouseff-impeachment-petrobas
4,Koch Industries refuses to comply with US senators' climate investigation,dredmorbius,http://www.theguardian.com/us-news/2015/mar/13/koch-industries-refuses-senators-climate-investigation
109,Inside the Mad Mad World of TripAdvisor,khc,http://www.outsideonline.com/adventure-travel/diy-trips/Loudsourcing-How-TripAdvisor-Is-Changing-the-Way-We-Travel.html
10,Pachyderm v0.5: Single Node Mode,jaz46,https://medium.com/pachyderm-data/pachyderm-v0-5-release-a-more-tightly-pached-derm-25023bc51f8e
65,How to generate a double-precision floating-point number in [0 1] uniformly,danieldk,http://mumble.net/~campbell/2014/04/28/uniform-random-float?
4,Google Domains Already #1 in Google for “Domains”,ESBoston,http://www.domaininvesting.com/google-domains-already-1-in-google-for-domains/
81,How not to advertise for a job in London,vonmoltke,http://programmingisterrible.com/post/113428268598/how-not-to-advertise-for-a-job-in-london
3,NSCAL – new pseudo-language to code and analyse novels,aerlinn,https://thinkdanke.wordpress.com/2015/03/15/novel-structural-content-analytical-language-nscal/
131,Mysterious government spy cameras collecting data at post offices,electic,http://kdvr.com/2015/03/11/mysterious-spy-cameras-collecting-data-at-post-offices/
6,The new Jobs documentary is an unforgiving look  tech's most complicated man,tuxguy,http://www.theverge.com/2015/3/16/8219073/steve-jobs-man-in-the-machine-movie-review-sxsw-2015
6,The Ultimate Guide to Writing and Publishing with Markdown,grflynn,http://blog.ghost.org/markdown/
3,T-Mobile is stealing from me they know it and won't do anything about it,alexcasalboni,http://www.reddit.com/r/technology/comments/2z930g/tmobile_is_stealing_from_me_they_know_it_and_wont/
3,Building a Macroscope for a More Transparent World,ptbrodie,https://medium.com/@orbital_insight/building-a-macroscope-for-a-more-transparent-world-cd4d5cc94432
4,Water saving tap,knowbody,https://www.behance.net/gallery/22614295/Swirl
52,How the CIA Might Target Apple's XCode,mikegerwitz,https://www.schneier.com/blog/archives/2015/03/how_the_cia_mig.html
4,Rand Paul's Disruptive SXSW Adventure,randomname2,http://www.bloomberg.com/politics/articles/2015-03-16/rand-paul-s-disruptive-sxsw-adventure
3,Will Internet forums become obsolete?,shubhamjain,http://www.quora.com/Will-internet-forums-become-obsolete-or-evolve?share=1
5,Bill Gurley predicts 'dead unicorns' in startup-land this year,prostoalex,http://fortune.com/2015/03/15/bill-gurley-predicts-dead-unicorns-in-startup-land-this-year/
6,Redesigning the Login Screen,BryanB55,https://www.gosquared.com/blog/login-screen-design-flow
13,Google will kill Microsoft Silverlight in Chrome by disabling NPAPI plug-in,bedroomfireflys,http://www.theinquirer.net/inquirer/news/2383624/google-will-kill-microsoft-silverlight-in-chrome-by-disabling-npapi-plug-in
9,Graphene breakthrough heralds ‘million-fold improvement’ in hard drive storage,twoshedsmcginty,http://thestack.com/graphene-naval-research-million-times-hard-disk-storage-160315
11,How “../sms” could bypass Authy everywhere,homakov,http://sakurity.com/blog/2015/03/15/authy_bypass.html?2
3,Talk of a Clojure Debugger for Cider,escherize,https://github.com/clojure-emacs/cider-nrepl/pull/170
132,The importance of user interface illustrated by the Go flag package,zdw,http://utcc.utoronto.ca/~cks/space/blog/programming/GoFlagUIImportance
6,Ask HN: How to get freelance work in academic projects?,AndriusSutas,
3,Show HN: Share your plans. If you've checked in it's too late,jscw,
3,Ask HN: Did Chrome install Google Wallet app witho permission and witho notifying me?,systemtheory,
12,CultureBit – use data to build company culture,ianthiel,http://www.goculturebit.com
47,Yahoo wants to let you forget your Yahoo password,cpeterso,http://www.cnet.com/news/yahoo-wants-to-let-you-forget-your-yahoo-password/
183,Why Are Geospatial Databases So Hard to Build?,chippy,http://www.jandrewrogers.com/2015/03/02/geospatial-databases-are-hard?h
6,Yahoo Introduces Password-Free Login – Just Don’t Lose Your Phone,riaface,http://techcrunch.com/2015/03/16/yahoo-introduces-password-free-login-just-dont-lose-your-phone/
191,Valve's SteamVR solves big problems and poses bigger questions,jsnell,http://www.eurogamer.net/articles/2015-03-15-valves-astounding-steamvr-solves-big-problems-and-poses-bigger-questions
4,“ behind bars because he walked to school instead of taking the bus.”,Balgair,http://www.politico.com/magazine/story/2015/03/criminal-kids-juvenile-justice-sentencing-reform-incarceration-116065.html
3,7.5M people in United States left religion since 2012,tokenadult,http://tobingrant.religionnews.com/2015/03/12/7-5-million-people-left-religion-since-2012-three-graphs-latest-general-social-survey/
4,The Nordics: 2% of Europe's population 9% of global billion dollar exits,lleims,http://www.arcticstartup.com/2015/03/16/creandum-9-of-global-billion-dollar-exits-come-from-the-nordics
10,Pirate Bay and other torrent sites inadvertently unblocked by CloudFlare,twoshedsmcginty,http://thestack.com/pirate-bay-https-unblocked-uk-cloudflare-160315
404,Tunneling Internet traffic over FB chat,franze,https://github.com/matiasinsaurralde/facebook-tunnel
3,Name This New VC – Get 50K,zabramow,http://fortune.com/2015/03/16/vc-50k-name-atlas-fka/
4,Only on Kickstarter: THE LEADER'S GUIDE by ERIC RIES,Impossible,https://www.kickstarter.com/projects/881308232/only-on-kickstarter-the-leaders-guide-by-eric-ries?ref=friends_backed
7,Has anything interesting ever come out of a claimed proof that P=NP or P ≠ NP?,albertzeyer,http://blog.computationalcomplexity.org/2015/03/has-anything-interesting-every-come-out.html
121,A Fast Minimal Memory Consistent Hash Algorithm,brandonb,http://arxiv.org/abs/1406.2294v1
102,Data Structures for Text Sequences (1998) [pdf],fabriceleal,https://www.cs.unm.edu/~crowley/papers/sds.pdf
108,Why Are Carrots Orange? It Is Political (2009),edward,http://www.nextnature.net/2009/08/why-are-carrots-orange-it-is-political/?hn
46,Ask HN: Which problems can we build an MVP for in a week?,mrborgen,
105,Searching 20 GB/sec: Systems Engineering Before Algorithms (2014),misframer,http://blog.scalyr.com/2014/05/searching-20-gbsec-systems-engineering-before-algorithms/?1
171,Lucene: The Good Parts,pixelmonkey,http://blog.parsely.com/post/1691/lucene/
47,Lookback 1.0. Record bugs and feedback now on Android Mac and iOS,littke,http://lookback.io
3,The Nordics made half of Europe's billion dollar exits with 3% of its population,regandersong,http://arcticstartup.com/2015/03/16/creandum-9-of-global-billion-dollar-exits-come-from-the-nordics
99,MatLisp: A library for scientific computation in Common Lisp,chesterfield,https://github.com/matlisp/matlisp
5,How much money do meetings cost?,ottjogi,https://blog.weekdone.com/how-big-is-the-economic-impact-of-unproductive-meetings/
103,Ancient Rome’s Hexagonal Port City,mkempe,http://earthobservatory.nasa.gov/IOTD/view.php?id=85488
68,Procedural Altar Generation,norswap,http://www.ultimaratioregum.co.uk/game/2015/03/14/procedural-altar-generation/
222,Drop millions of allocations by using a linked list,jcn,https://github.com/rubygems/rubygems/pull/1188
144,Ask HN: What is wrong with Reserve Bank of India?,superasn,
62,Ask HN: How Do You Maintain Security When Working Remotely?,heyalexej,
25,Ask HN: Best Linux ultrabook?,humility,
382,The Mighty Named Pipe,vsbuffalo,http://vincebuffalo.com/2013/08/08/the-mighty-named-pipe.html
160,Endurance experiment kills six consumer SSDs over 18 months,geoffgasior,http://techreport.com/review/27909/the-ssd-endurance-experiment-theyre-all-dead
21,Show HN: Meta API for Google Drive Dropbox OneDrive and Box,cloudrail,http://cloudrail.com
16,Bypass 2 factor authentication on any website using Authy,dsr12,http://sakurity.com/blog/2015/03/15/authy_bypass.html
40,Show HN: Fast and simple way to get EV SSL certificates,nailer,https://certsimple.com/?code=hacker-news
61,Reagent 0.5.0 – Minimalistic ClojureScript interface to React.js,escherize,https://github.com/reagent-project/reagent
126,Scrum seems to be mostly about having better alibis,RalfR,http://agileoverflow.com/t/scrum-seems-to-be-mostly-about-having-better-alibis/47
18,How History Forgot Its Role in Public Debate,acsillag,http://aeon.co/magazine/society/how-history-forgot-its-role-in-public-debate
5,1 BILLION records of personally identifiable information were leaked in 2014,rossiben,http://www.information-age.com/technology/security/123459175/1-billion-records-personally-identifiable-information-were-leaked-2014-android-blame
12,Show HN: Hadouken – a cross-platform extensible BitTorrent daemon,viktorelofsson,https://github.com/hadouken/hadouken
64,Science Fairs Aren't So Fair,klunger,http://www.theatlantic.com/education/archive/2015/03/why-science-fairs-arent-so-fair/387547?single_page=true
71,What Satoshi Didn't Know [video],xsb,https://www.youtube.com/watch?v=rQ3e1Pzu7iI
16,How “../sms” could bypass Authy 2FA,homakov,http://sakurity.com/blog/2015/03/15/authy_bypass.html?
22,Congress may impose license plate reader limits,zmanian,http://arstechnica.com/tech-policy/2015/03/cops-are-freaked-out-that-congress-may-impose-license-plate-reader-limits/
58,Algorithm Clones Facial Expressions and Pastes Them onto Other Faces,tim_sw,https://medium.com/the-physics-arxiv-blog/algorithm-clones-facial-expressions-and-pastes-them-onto-other-faces-fc7ce49a4a4
59,Cospaia: For nearly four hundred years the smallest republic in the world,monort,http://www.umbriatouring.it/en/lincredibile-storia-di-cospaia/
6,High levels of vitamin D is suspected of increasing mortality rates,alexcasalboni,http://www.sciencedaily.com/releases/2015/03/150310105222.htm
3,Facebook Clarifies Rules on What It Bans and Why,kanamekun,http://www.nytimes.com/blogs/bits/2015/03/16/facebook-explains-what-it-bans-and-why/
9,Glove transmits ‘touch’ over the internet,mikenyc,http://www.bbc.com/future/story/20150312-how-to-talk-online-with-only-touch
83,Exponential Backoff and Jitter,alexbilbie,http://www.awsarchitectureblog.com/2015/03/backoff.html
7,Managers Turn to Computer Games Aiming for More Efficient Employees,digisth,http://www.nytimes.com/2015/03/16/technology/managers-turn-to-computer-games-aiming-for-more-efficient-employees.html?ref=business
32,Lookback.io: capture feedback user experiences and bug reports,picks_at_nits,https://lookback.io
13,YouTube 10th Anniversary: Competition Puts Site on the Defensive,prostoalex,http://variety.com/2015/digital/news/youtube-10th-anniversary-competitors-hulu-facebook-vimeo-1201448925/
6,A Breakthrough Battery Is Backed by Dyson,kungfudoi,http://www.technologyreview.com/news/535811/a-breakthrough-battery-is-backed-by-dyson/
79,The Best of Material Design Daily,rohan1024,http://www.materialup.com
4,Managing Node.js Dependencies with Shrinkwrap,tilt,http://blog.nodejs.org/2012/02/27/managing-node-js-dependencies-with-shrinkwrap/
174,A Scholarly Markdown,droque,http://www.scholarlymarkdown.com
5,Audvisor: Actionable insights for startups on the go,njays,http://www.audvisor.com/
116,Pruning and Polishing: Keeping OpenBSD Modern,protomyth,http://www.openbsd.org/papers/pruning.html
3,Snowden Leaks Have Changed How Americans See Their Privacy,Libertatea,http://recode.net/2015/03/16/snowden-leaks-have-changed-how-americans-see-their-privacy/
12,First Impression of MakerBot Replicator Mini,timoslav,http://all3dp.com/first-look-makerbot-mini/?hvid=3kq25l
