SCORE,TITLE,BY,URL
5,Ask HN: Cool Arduino projects,nbenita,
12,Nancy Drew and the Case of the Slow Program,luu,http://jvns.ca/blog/2015/03/15/nancy-drew-and-the-case-of-the-slow-program/
130,CoreCLR on Linux,gokhan,https://github.com/aspnet/DNX/pull/1406
4,The Middle of Things: Advice for Young Writers,pepys,http://www.newyorker.com/books/page-turner/the-middle-of-things-advice-for-young-writers
384,Balanced payments is shutting down,dynabros,https://www.balancedpayments.com/stripe
6,People Who Use Firefox or Chrome Are Better Employees,Libertatea,http://www.theatlantic.com/business/archive/2015/03/people-who-use-firefox-or-chrome-are-better-employees/387781/?single_page=true
25,Code_swarm: An experiment in organic software visualization,drawkbox,http://vis.cs.ucdavis.edu/~ogawa/codeswarm/
196,Introducing OpenBSD's new httpd [pdf],fcambus,http://www.openbsd.org/papers/httpd-asiabsdcon2015.pdf
31,Solving Open Source Discovery,andrewnez,https://medium.com/@teabass/solving-open-source-discovery-db43a04cd9e7
7,Why apple did this why single port?,girishnayak,
78,Petition Against Felony Charge for WiFi Prank,pearjuice,https://www.change.org/p/save-a-nerd-petition-against-felony-charge-for-harmless-retaliatory-wifi-prank-in-hacker-dojo-programming-club
22,Break-In at Y-12 – the vulnerability of America’s nuclear-weapons sites,prostoalex,http://www.newyorker.com/magazine/2015/03/09/break-in-at-y-12
75,John Gray: Steven Pinker is wrong about violence and war,benbreen,http://www.theguardian.com/books/2015/mar/13/john-gray-steven-pinker-wrong-violence-war-declining
6,The electromagnetic fortification of the suburbs,nkoff,http://bldgblog.blogspot.com/2015/01/the-electromagnetic-fortification-of.html
289,Things I've learned about writing software after 12 years,landongn,https://medium.com/@landongn/12-years-later-what-i-ve-learned-about-being-a-software-engineer-d6e334d6e8a3
98,Any good open-source self-hosted evernote alternatives?,Immortalin,
83,Tracking Device Teardown,aburan28,https://www.ifixit.com/Teardown/Tracking+Device+Teardown/5250
3,Writing the first draft of your science paper – some dos and don’ts,sakuntala,http://blog.editeon.com/writing-the-first-draft-of-your-science-paper-some-dos-and-donts/
6,Augmented Reality in a Contact Lens (2009),lobo_tuerto,http://spectrum.ieee.org/biomedical/bionics/augmented-reality-in-a-contact-lens?hn
6,Why Oil Production Isn't Going Down,techdog,http://asserttrue.blogspot.com/2015/03/why-oil-production-isnt-going-down.html
64,ReText – Markdown Editor with Live Preview,redthrow,http://sourceforge.net/p/retext/home/ReText/
5,Princeton boffins sniff Tor users' IDs from TCP ACKs and server sweat,funkylexoo,http://www.theregister.co.uk/2015/03/16/raptor_another_way_to_snoop_on_tor_users/
10,Programming language uses JPEGs as code,esolanger,http://killscreendaily.com/articles/kaleidoscopic-coding-programming-language-light-pattern/
6,Reddit is now ranked by traffic in the top 25 in the world and top 10 in US,alexcasalboni,http://www.alexa.com/siteinfo/reddit.com
194,Show HN: GraphQL for Postgres,solidsnack9000,https://github.com/solidsnack/GraphpostgresQL
16,Ask HN: What to learn to become employable starting from zero?,testtestq,
4,Is Science Broken? Let’s Ask Karl Popper,DanielBMarkham,http://blogs.discovermagazine.com/neuroskeptic/2015/03/15/is-science-broken-lets-ask-karl-popper/#.VQaw-3vD_MJ
86,Why Our Brains Love High Ceilings,prostoalex,http://fastcodesign.com/3043041/evidence/why-our-brains-love-high-ceilings
69,Lain the Whom of the Verb World,samclemens,http://chronicle.com/blogs/linguafranca/2015/03/09/lain-the-whom-of-the-verb-world/
71,Please stop breaking the build,luu,http://danluu.com/broken-builds/
26,The Brief Extraordinary Life of Cody Spafford,pepys,http://www.seattlemet.com/news-and-profiles/articles/the-brief-extraordinary-life-of-cody-spafford-march-2015
21,Saharan 'carpet of tools' is earliest known human-made landscape,curtis,http://www.sciencedaily.com/releases/2015/03/150311160254.htm
357,Paul Kalanithi writer and neurosurgeon dies at 37,milkcircle,http://med.stanford.edu/news/all-news/2015/03/stanford-neurosurgeon-writer-paul-kalanithi-dies-at-37.html
103,Is the Mill CPU real? (2014),luu,http://blog.kevmod.com/2014/07/the-mill-cpu/
35,The decline of journalism and the rise of public relations,samsolomon,http://www.washingtonpost.com/blogs/monkey-cage/wp/2015/03/11/the-decline-of-journalism-and-the-rise-of-public-relations/
13,Let's Make a Song in SunVox [video],pmoriarty,https://www.youtube.com/watch?v=Pi8O1K5wCY0
27,Rethinking the Classic ‘Obedience’ Studies (2012),mr_golyadkin,http://www.psmag.com/business-economics/rethinking-obedience-stanford-prison-experiment-49677
112,Analog Memory Desk,damian2000,http://kcamara.com/analog-memory-desk
21,Tricks with the Floating Point Format (2012),brudgers,https://randomascii.wordpress.com/2012/01/11/tricks-with-the-floating-point-format/
227,Tardigrades are so tough they can survive outer space,wasi0013,http://www.bbc.com/earth/story/20150313-the-toughest-animals-on-earth
51,Build and Customize Your Own Hacker News Reddit or Product Hunt,mkaroumi,http://www.telescopeapp.org
14,Show HN: I made a Twitch floating player with floating chat (for Chrome),romaincointepas,https://chrome.google.com/webstore/detail/twitch-mini-player/fjeahcfaibacboijpccppebdpihhbflk
39,U.S. Net Neutrality Has a Massive Copyright Loophole,bruna597,http://torrentfreak.com/u-s-net-neutrality-has-a-massive-copyright-loophole-150315/
25,Gem Updater: Update gems in your Gemfile and fetch their changelogs,m4xim3d,https://github.com/MaximeD/gem_updater
6,New Cloud-Ready Workflow Engine – Effektif (Apache License),peter_hilton,http://www.effektif.com/news/open-sourcing-new-type-of-bpm-system/
64,Superpowers – The extensible collaborative HTML5 2D+3D game maker,elisee,https://sparklinlabs.com/?superpowers
142,The Sad Truth About Developing Executives,tandavas,http://recode.net/2015/03/11/the-sad-truth-about-developing-executives/
7,For Tech Titans Sharing Has Its Limits,japhyr,http://www.nytimes.com/2015/03/15/technology/for-tech-titans-sharing-has-its-limits.html?_r=0
12,Ask HN: Where to donate two Dell servers?,java-man,
5,How I a designer learned to code and released an app in 4 months,danso,https://medium.com/ios-os-x-development/how-i-a-designer-learned-to-code-and-released-an-app-in-4-months-219d7c1b8df1
3,“Rules of business”,bhaumik,https://medium.com/@stewart/rules-of-business-e71353753e11
7,Towards practicing differential privacy,Cynddl,http://blog.mrtz.org/2015/03/13/practicing-differential-privacy.html
23,Show HN: Whimsical – Get anything done via SMS,jameshk,https://whimsical.io/index.html
4,40 years and counting: the team behind Voyager’s space odyssey,philbo,http://www.theguardian.com/science/2015/mar/15/voyager-1-and-2-space-journey-nasa
64,Online gambling firm Bet365 has swapped Java for Erlang,brucify_,http://www.techworld.com/apps/how-bet365-solved-reliability-scalability-by-swapping-java-for-erlang-3600737/
3,Pydgin: Using RPython/PyPy to Generate Fast Instruction-Set Simulators,fijal,http://morepypy.blogspot.com/2015/03/pydgin-using-rpython-to-generate-fast.html
204,Why blocks make Ruby methods slower,chippy,https://www.omniref.com/ruby/2.2.0/symbols/Proc/yield?#annotation=4087638&line=711&hn=1
6,The huge implications of Google’s idea to rank sites based on their accuracy,alexcasalboni,http://www.washingtonpost.com/news/energy-environment/wp/2015/03/11/the-huge-implications-of-googles-idea-to-rank-sites-based-on-their-accuracy/
3,Is your degree worth it? It depends what you study not where,martincmartin,http://www.economist.com/news/united-states/21646220-it-depends-what-you-study-not-where
220,GRPC: A high performance open source general RPC framework,chuhnk,http://www.grpc.io/
17,A Very Fast Bounded-Concurrency Hash Table,sbahra,http://backtrace.io/blog/blog/2015/03/13/workload-specialization/
7,Why We Removed the Word ‘Hacker’ from Buffer Job Descriptions,shovel,https://open.bufferapp.com/job-descriptions-diversity/
6,Video Games Are Better Without Characters,jboynyc,http://www.theatlantic.com/technology/archive/2015/03/video-games-are-better-without-characters/387556/?single_page=true
3,A map of the underwater cables that connect the internet,carlosgg,http://www.vox.com/2015/3/13/8204655/submarine-cables-internet
3,What would happen if an 800-kiloton nuclear warhead detonated above Manhattan?,sergeant3,http://thebulletin.org/what-would-happen-if-800-kiloton-nuclear-warhead-detonated-above-midtown-manhattan8023
70,Interest rates on some European government bonds have gone negative,cwal37,http://www.vox.com/2015/2/5/7981461/negative-interest-rates-europe
166,How to get actionable leads from Twitter in real time,farhadhf,http://blog.taskulu.com/post/how-get-actionable-leads-twitter-real-time?utm_source=HN&utm_medium=social&utm_campaign=techblog
10,Euro ministers ditch plan to ban roaming charges,juanriaza,http://www.theregister.co.uk/2015/03/05/eu_plan_to_ban_roaming_charges_dropped_youll_just_have_to_pay_that_whopping_great_bill_after_your_hols/
357,Parable of the Polygons – a playable post on the shape of society,pyduan,http://ncase.me/polygons/
5,The Artificial Intelligence Revolution,primitivesuave,http://waitbutwhy.com/2015/01/artificial-intelligence-revolution-1.html
67,Ex'Tax – The big idea,namenotrequired,http://www.ex-tax.com/big-idea/
22,Ask HN: Who is your go-to web hosting company?,pft,
15,Requiem for a Dream: Aaron Swartz was brilliant and beloved. But … [2013],byoogle,http://www.newyorker.com/magazine/2013/03/11/requiem-for-a-dream
7,Google Feud: Family Feud Against Google Autocomplete Results,ryanwhitney,http://www.googlefeud.com
3,Five Essential Phone-Screen Questions,rfreytag,https://sites.google.com/site/steveyegge2/five-essential-phone-screen-questions
72,Firefox search app silently logs Firefox address bar searches,arcfor,https://www.sccs.swarthmore.edu/org/SwatDigitalFreedom/google-search.html
4,Autism as a disorder of prediction,omnibrain,http://www.pnas.org/content/111/42/15220.full
83,Train doors require GPS signal to open despite stations being underground (2014),ColinWright,http://www.ciras.org.uk/report-library/train-operations/52131-issue-with-opening-class-377-doors-on-the-thameslink-route/
54,Why Children Need Chores,prostoalex,http://wsj.com/articles/why-children-need-chores-1426262655
200,Suddenly It Seems Water Is Everywhere in Solar System,brkumar,http://www.nytimes.com/2015/03/13/science/space/suddenly-it-seems-water-is-everywhere-in-solar-system.html
4,There Is No ‘Proper English’,archena,http://www.wsj.com/articles/there-is-no-proper-english-1426258286
152,A success story for Haxe,curtis,http://nadako.tumblr.com/post/113390739725/a-success-story-for-haxe
171,Zero,makmanalp,http://mathworld.wolfram.com/Zero.html?
5,Knowledge-Based Trust: Estimating the Trustworthiness of Web Sources [pdf],dataminer,http://arxiv.org/pdf/1502.03519v1.pdf
37,The Importance of Utilizing Extroverts and Introverts in Team Meetings,mooreds,http://www.katiealbee.com/blog/2015/3/2/the-importance-of-utilizing-extroverts-and-introverts-in-team-meetings
17,Realtempo – online rehearsal rooms to make music together in real time,720kb,http://realtempo.com
5,Ask HN: Tools for Archiving Web Research? Zotero Mendeley EndNote OneNote,xt11111,
