SCORE,TITLE,BY,URL
109,The GNU Manifesto Turns Thirty,Tloewald,http://www.newyorker.com/business/currency/the-gnu-manifesto-turns-thirty?intcid=mod-latest
93,The Fuzzy Math That's Creating So Many Billion-Dollar Tech Companies,bko,http://www.bloomberg.com/news/articles/2015-03-17/the-fuzzy-insane-math-that-s-creating-so-many-billion-dollar-tech-companies
50,Florida and the Science Who Must Not Be Named,cryptoz,http://www.wired.com/2015/03/florida-science-must-not-named/
41,UMG claims rights to a song and hijacks the artist's YouTube revenue,slipstream-,https://www.facebook.com/permalink.php?story_fbid=10152750149271868&id=41670261867
40,App Submissions on Google Play Now Reviewed by Staff,kshatrea,http://techcrunch.com/2015/03/17/app-submissions-on-google-play-now-reviewed-by-staff-will-include-age-based-ratings/
81,Things Every Kid Should Master,wallflower,http://www.bostonglobe.com/magazine/2015/02/26/things-every-kid-should-master/uM72LGr63zeaStOp9zGyrJ/story.html
31,Scala: Where it came from Where it's going,youroub,http://www.slideshare.net/Odersky/scala-days-san-francisco-45917092
38,Andrew S. Tanenbaum's FAQ,MatthiasP,http://www.cs.vu.nl/~ast/home/faq.html
7,Why parking spaces shouldn't always be wasted on cars,edward,http://www.washingtonpost.com/blogs/wonkblog/wp/2015/03/17/when-parking-spaces-shouldnt-be-wasted-on-cars/
434,Carbon3D – 3D Printing via Continuous Liquid Interface Production,JoelSutherland,http://carbon3d.com
81,Why Accidentally Quadratic?,davidgerard,http://accidentallyquadratic.tumblr.com/post/113840433022/why-accidentally-quadratic
56,The sad state of browser matrix transforms,codefather,http://atirip.com/2015/03/17/sorry-sad-state-of-matrix-transforms-in-browsers/
45,Golang Internals Part 2: Diving into the Go Compiler,signa11,http://blog.altoros.com/golang-internals-part-2-diving-into-the-go-compiler.html
217,Resume in C,brudgers,https://gist.github.com/klange/4042963
79,An open Google now is about to make Android super smart,bootload,http://www.wired.com/2015/03/open-google-now-make-android-super-smart/
135,Your wifi shows me where you live work and travel,viraptor,http://blog.viraptor.info/post/your-wifi-shows-me-where-you-live-work-and-travel
177,Theo de Raadt on OpenSSL vulnerabilities coming on the 19th,bootload,http://marc.info/?l=openbsd-misc&m=142654095813320&w=2
90,LibreSSL 2.1.5 released,fcambus,http://marc.info/?l=openbsd-tech&m=142655686417434
14,Solving Exercism Problems – Learn with Peers,jineshpaloor,http://exercism.io/
63,Nintendo Opens Door to Smartphone Games,antr,http://www.wsj.com/articles/nintendo-opens-door-to-smartphone-games-1426579567
11,Creating Better User Experiences on Google Play,fpgeek,http://android-developers.blogspot.com/2015/03/creating-better-user-experiences-on.html
207,The Book of Shaders,ingve,http://patriciogonzalezvivo.com/2015/thebookofshaders/
128,MIT students open up about stress,danso,http://www.bostonglobe.com/metro/2015/03/16/mit-students-open-about-stress/dS61oA5tiKqjvVsJ5VZRAL/story.html
48,Submarine Cable Map,leonvonblut,http://www.submarinecablemap.com/
83,Thomas Edison's 146 question interview for prospective employees,miket,http://www.openculture.com/2015/03/thomas-edisons-146-question-knowledge-test-for-prospective-employees.html
52,Show HN: WIP C compiler in Go inspired by 8cc,andrewchambers,https://github.com/andrewchambers/cc
1,Disqus Is Looking for SRE UI Eng Ads Infrastructure Eng in SF,danielha,
139,Housing markets: The spectre haunting San Francisco,mblakele,http://www.economist.com/blogs/freeexchange/2014/04/housing-markets
57,Show HN: JedLang my first attempt at a language,jhedwards,https://github.com/incrediblesound/JedLang
59,Network theory suggests consciousness is global in the brain,jonbaer,http://www.kurzweilai.net/etwork-theory-suggests-consciousness-is-global-in-the-brain
47,Telehack – Relive the usenet/arpa culture from the 80's,ChuckMcM,http://telehack.com
37,Hearing Sappho,diodorus,http://www.newyorker.com/books/page-turner/hearing-sappho
56,Y Combinator partners tell MIT students to steer clear of big-name companies,mohanrajn84,http://tech.mit.edu/V135/N7/startup.html
38,3D printing titanium and the bin of broken dreams,prostoalex,http://pencerw.com/feed/2015/3/15/3d-printing-titanium-and-the-bin-of-broken-dreams
5,Ask HN: Should I leave my Job for Ippon USA?,helpmewithjobs,
470,High quality GIF with FFmpeg,ux,http://blog.pkh.me/p/21-high-quality-gif-with-ffmpeg.html
23,Staring into the Abyss: Concurrency Control with One Thousand Cores [pdf],luu,http://www.vldb.org/pvldb/vol8/p209-yu.pdf
66,iMicrobes (YC W15) Builds Bacteria to Produce Chemicals from Natural Gas,dgreenf,http://techcrunch.com/2015/03/16/industrial-microbes/
4,The moderator problem: How Reddit and related news sites decline,blfr,http://jakeseliger.com/2015/03/16/the-moderator-problem-how-reddit-and-related-news-sites-decline/
20,You're hiring the wrong people: 10 tips to hire better developers,mwadams,https://blogs.endjin.com/2015/03/youre-hiring-the-wrong-people-10-tips-to-find-great-developers/
5,Dell’s Linux PC sequel still “just works”–but it adds 4K screen and rough edges,jseliger,http://arstechnica.com/gadgets/2015/03/review-dell-m3800-developer-edition-is-a-great-linux-pc-with-a-few-rough-edges/1/
86,I code like a girl,sixty4bit,http://volumelabs.net/i-code-like-a-girl/
1,Octopart (YC W07) Is Hiring Salespeople in NYC,sam,https://octopart.com/jobs
21,Augmented Reality in a Contact Lens (2009),lobo_tuerto,http://spectrum.ieee.org/biomedical/bionics/augmented-reality-in-a-contact-lens?hn2
8,AMDARMImaginationSamsung alliance publish official shared GPU-CPU blueprints,fla,http://www.theregister.co.uk/2015/03/16/hsa_foundation_spec_published/
418,Gogs an alternative to Gitlab,apertoire,http://www.apertoire.net/gogs-an-alternative-to-gitlab/
10,San Francisco tenant outraged by landlord raising rent fourfold,Varcht,http://blog.sfgate.com/ontheblock/2015/03/16/san-francisco-rent-control-tenant-outraged-by-landlord-raising-rent-four-fold/
236,Hertz puts cameras in its rental cars says it has no plans to use them,eplanit,http://fusion.net/story/61741/hertz-cameras-in-rental-cars/
12,JVM debugging: Defanging the OutOfMemoryError,dk790,http://blog.delphix.com/dkimmel/2015/03/17/defanging-the-outofmemoryerror/
3,Google Play Now Has Localized Age Ratings,priteshjain,http://thenextweb.com/insider/2015/03/17/google-play-now-has-country-sensitive-age-ratings-introduces-human-app-review-process/
332,The Hating Game,luu,http://rachelnabors.com/2015/03/13/the-hating-game
15,BitHound Announces Support for Bitbucket,gitdude,https://www.bithound.io/blog/post/bithound-announces-support-for-bitbucket
102,HTML as a programming language – unifying HTML with Erlang,rubiquity,http://joearms.github.io/2015/03/16/HTML-As-A-Programming-Language.html
4,The Adafruit Guide to Excellent Soldering,ck2,https://learn.adafruit.com/adafruit-guide-excellent-soldering/tools
20,Classifying plankton with deep neural networks,benanne,http://benanne.github.io/2015/03/17/plankton.html
98,MuJS: an embeddable JavaScript interpreter,Fenume,http://mujs.com/
150,Can a city really ban cars from its streets? (2014),antr,http://www.bbc.com/future/story/20140204-can-a-city-really-go-car-free?
5,4 Ways to Achieve Higher ROI Using the Crowd,raycloyd,http://blog.experimentengine.com/2015/03/17/4-ways-to-achieve-high-roi-using-the-crowd/
1,Kamcord is looking for iOS Engineers who love mobile games,vecter,https://jobs.lever.co/kamcord/8480c014-d88c-4d2a-8286-2b99c9923905?lever-source=hackernews
6,Journey to the center of the earth,growthape,http://www.bbc.com/future/bespoke/story/20150306-journey-to-the-centre-of-earth/index.html
27,Ask HN: How much to put in a resignation letter,outthedoor,
10,The Concatenative Language XY (2004),marcopolis,http://www.nsl.com/k/xy/xy.htm
90,Freedom of the Press: Orwell's Proposed Preface to Animal Farm (1945),primroot,http://home.iprimus.com.au/korob/Orwell.html
109,Show HN: Moltin – eCommerce Back End as a Service,AJSturrock,https://moltin.com/
7,What Do We Know about Software Development in Startups?,jschulenklopper,http://www.infoq.com/articles/what-do-we-know-about-software-development-in-startups
6,Hans in the Land of Bards,jodooshi,https://thelandofbards.com/
45,Show HN: Online journal that encrypts entries with a cipher,dylanbfox,https://www.bitjournal.io
25,Show HN: Camera2 API Support on Galaxy S6 and HTC One M9,supercurio,http://spectrastudy.com/camera2-api-on-mwc-2015-devices/
166,Rent Control Creates Higher Rents in SF,nickstefan12,http://www.nickstefan.net/blog/view/sf-rent-control
109,Pinterest Raises $367M at $11B valuation,ravenkat,http://techcrunch.com/2015/03/16/pinterest-raises-367-million-pushing-it-past-1-billion-raised-in-all/
79,OpenSSL release announced for Mar 19.  Fixes “high” severity security defects.,btucker,https://mta.openssl.org/pipermail/openssl-announce/2015-March/000020.html
38,RAPTOR: Routing Attacks on Privacy in Tor,aburan28,http://arxiv.org/abs/1503.03940
9,Microsoft is killing off the Internet Explorer brand,bgarbiak,http://www.theverge.com/2015/3/17/8230631/microsoft-is-killing-off-the-internet-explorer-brand
4,The Smartphone Society,Tsiolkovsky,https://www.jacobinmag.com/2015/03/smartphone-usage-technology-aschoff/
4,Zerver-A simple scalable pure restful web framework for Go,cosiner,https://github.com/cosiner/zerver
42,Pointing Fingers in Apple Pay Fraud,zt,http://www.nytimes.com/2015/03/17/business/banks-find-fraud-abounds-in-apple-pay.html
6,Show HN: Fast Video Obfuscation Against Machines,john_saxon,https://github.com/dgcrouse/VideoObfuscate
97,Pakible (YC W15) Makes It Dead Simple for Businesses to Design Ship Packaging,Skrypt,http://techcrunch.com/2015/03/16/yc-backed-pakible-makes-it-dead-simple-for-businesses-to-design-ship-packaging/
8,Neptune – Start of a new computer era (watch phone tablet all-in-one),ivanbozic,http://getneptune.com/
17,An Evaluation of Concurrency Control with One Thousand Cores [pdf],arjn,http://www.vldb.org/pvldb/vol8/p209-yu.pdf
72,OCaml: Objects,haifeng,https://haifengl.wordpress.com/2014/07/16/ocaml-objects/
41,Coca-Cola pays nutritionists to suggest cola as healthy snack,mikenyc,http://www.startribune.com/lifestyle/health/296404461.html
25,MoonGen a scriptable high-speed packet generator,jsnell,https://github.com/emmericp/MoonGen
74,Shift Labs (YC W15) Makes Medical Devices for Healthcare’s Future,koji,http://techcrunch.com/2015/03/16/shift-labs-medical-devices-dripassist/
24,Purple Reign – The unmaking of a Yahoo,uptown,http://www.thebaffler.com/salvos/purple-reign
5,Ask HN: Review my startup www.inair.tv,longnguyen,
37,A Richter scale for outages,smcgivern,http://interconnected.org/home/2015/03/12/richter_scale_for_outages
3,Machine Learning Startup Finds Investment Cues in Satellite Images,jonbaer,http://www.technologyreview.com/news/535866/startup-promises-business-insights-from-satellite-images/
6,Nintendo is finally going to start making games for smartphones,BaptisteGreve,http://uk.businessinsider.com/nintendo-dena-smartphone-games-mario-zelda-3ds-2015-3
31,From Fastmail back to Gmail,pvinis,http://theinterstitial.net/2015/03/from-fastmail-back-to-googles-gmail/
6,Apple in Talks to Launch Online TV Service,uptown,http://www.wsj.com/articles/apple-in-talks-to-launch-online-tv-service-1426555611
12,Show HN: What Happened Last Week – Weekly News Digest,onassar,http://www.whathappenedlastweek.com/
7,Algorithmic/Automatic Differentiation – Part 1: Forward Mode,signa11,http://blog.tombowles.me.uk/2014/09/10/ad-algorithmicautomatic-differentiation/
4,Nintendo Brings Games to Smartphones,dmanlian,http://techcrunch.com/2015/03/17/nintendo-partners-with-dena-to-brings-its-games-and-ip-to-smartphones/
99,Was 2015 Boston's worst winter yet?,brk,http://web.mit.edu/bletham/www/winter2015.html
7,First Photo From Space (2006),chl,http://www.airspacemag.com/space/the-first-photo-from-space-13721411/
242,How and Why Swiftype Moved from EC2 to Real Hardware,quicksilver03,http://highscalability.com/blog/2015/3/16/how-and-why-swiftype-moved-from-ec2-to-real-hardware.html
71,Stopping expensive queries before they start,adamnemecek,http://adpgtech.blogspot.com/2015/02/stopping-expensive-queries-before-they.html
148,PHP7 Gains Scalar Type Hints,pbowyer,https://wiki.php.net/rfc/scalar_type_hints_v5#vote
5,Frictionless Design Choices,rinesh,http://blog.learningbyshipping.com/2015/03/16/frictionless-design-choices/
85,An Economic Model of the Rise in Premarital Sex and Its De-Stigmatization [pdf],nkurz,http://www.jeremygreenwood.net/papers/fgg14.pdf
7,The destructuring algorithm in ECMAScript 6,bootload,http://www.2ality.com/2015/03/destructuring-algorithm.html
110,ReadMe (YC W15) Creates Crisp Documentation for Developers Using Your APIs,gkoberger,http://techcrunch.com/2015/03/13/readme-creates-crisp-documentation-for-developers-using-your-apis/
79,Using DNS to solve the mobile deep linking problem,danielrhodes,http://drhod.es/dns-deep-linking
60,Etsy’s Success Raises Problems of Credibility and Scale,BobbyVsTheDevil,http://www.nytimes.com/2015/03/16/business/media/etsys-success-raises-problems-of-credibility-and-scale.html
342,Adventures in message queues,fcambus,http://antirez.com/news/88
1,Listia is hiring mobile developers to build the largest cashless marketplace,modsearch,http://www.listia.com/jobs
10,Memories Become Weaker Without Reinforcement,kaa2102,http://www.nytimes.com/2015/03/17/science/memories-become-weaker-without-reinforcement-study-finds.html?src=twr&smid=tw-nytimes&_r=0
27,Early modern eyebrow interpretation or what it means to have a unibrow,benbreen,http://collation.folger.edu/2015/03/early-modern-eyebrow-interpretation-or-what-it-means-to-have-a-unibrow/
86,Semaphores are surprisingly versatile,nkurz,http://preshing.com/20150316/semaphores-are-surprisingly-versatile/
249,Portland Man: I was tortured in UAE for refusing to become an informant,beardless_sysad,http://www.theguardian.com/us-news/2015/mar/16/portland-man-tortured-uae-behest-of-fbi
14,Replacing the Military's Most Toxic Technology,danso,http://motherboard.vice.com/read/replacing-the-militarys-most-toxic-technology
4,The evolution of Java build systems,luu,http://shanemcintosh.org/2012/08/01/the-evolution-of-java-build-systems.html
224,Programming is terrible – Lessons learned from a life wasted (2013) [video],pmoriarty,https://www.youtube.com/watch?v=csyL9EC0S0c
30,Ask HN: Your lead developer get bored. What to do?,tablet,
27,Show HN: Seldon – Open Predictive AI released on GitHub under Apache 2.0,ahousley,http://www.seldon.io/open-source/
133,Libraries.io – Open-Source Discovery Service,dhendo,http://libraries.io/
48,A Police Gadget Tracks Phones? Shhh It’s Secret,mattee,http://www.nytimes.com/2015/03/16/business/a-police-gadget-tracks-phones-shhh-its-secret.html
60,Gigaom: The Life and Death of a Venture-Funded Media Startup,sayemm,https://medium.com/@michaelwolf/gigaom-the-life-and-death-of-a-venture-funded-media-startup-eb3fbdc4e732
150,Best Linux server backup system?,drKarl,https://gist.github.com/drkarl/739a864b3275e901d317
155,What you wanted to know about AI,chriskanan,http://fastml.com/what-you-wanted-to-know-about-ai/
6,Why Icicles Look the Way They Do,dnetesn,http://www.nytimes.com/2015/03/17/science/why-icicles-look-the-way-they-do.html?ref=science
22,NRL Researchers Pattern Magnetic Graphene,shawnee_,http://www.nrl.navy.mil/media/news-releases/2015/nrl-researchers-pattern-magnetic-graphine
75,F# Units of Measure – A Worked Example,numo16,http://stevenpemberton.net/blog/2015/03/11/FSharp-Units-Of-Measure/
36,Obamacare: America's Third-Fastest Expansion of Health Insurance,nikunjk,http://www.bloomberg.com/news/articles/2015-03-16/obamacare-america-s-third-fastest-expansion-of-health-insurance?hootPostID=ffed08a18863d6f6f8c25ad2e11c4cd0
92,Incuriosity Will Kill Your Infrastructure,luu,http://yellerapp.com/posts/2015-03-16-incuriosity-killed-the-infrastructure.html
30,Brian Wilson Bonnie McKee and Others React to 'Blurred Lines' Verdict,gdubs,http://www.latimes.com/entertainment/music/la-et-ms-blurred-lines-reaction-brian-wilson-bonnie-mckee-20150314-story.html#page=1
6,Nintendo is making smartphone games with Japanese mobile giant DeNA,hkmurakami,http://www.theverge.com/2015/3/17/8230477/nintendo-dena-mobile-games-announcement
78,Ring brings Viking Islamic civilizations closer together,Vigier,https://www.sciencenews.org/article/ring-brings-ancient-viking-islamic-civilizations-closer-together
5,The Public Voice of Women,bootload,http://www.lrb.co.uk/v36/n06/mary-beard/the-public-voice-of-women
16,Colour Picking by Simulation,MJSplot_author,http://xqt2.com/p/colours_sim.html
5,Awakening (2013),prostoalex,http://www.theatlantic.com/magazine/archive/2013/01/awakening/309188/?single_page=true
1,ZeroCater (YC W11) Is Looking for a Product Manager,arram,
54,An Infinite Regress. Of Dumb: More Reflections on “Market Efficiency”,nkurz,https://medium.com/bull-market/the-last-time-i-saw-richard-thaler-speak-he-talked-about-the-beauty-contest-game-in-the-beauty-2e0b767d9098/
13,What Goes Around Comes Around: 35 years of data model proposals (2005) [pdf],luu,http://people.cs.umass.edu/~yanlei/courses/CS691LL-f06/papers/SH05.pdf
153,Stanford study shows success of different programming styles in CS class,kornish,https://ed.stanford.edu/news/stanford-study-shows-success-different-learning-styles-computer-science-class
59,How Robots and Algorithms Are Taking Over,jonathansizz,http://www.nybooks.com/articles/archives/2015/apr/02/how-robots-algorithms-are-taking-over/?insrc=toc
5,Twitter trends gives a json file instead of a web page,1234567890123,https://twitter.com/trends
5,Startup Stock Photos. Free. Make Something,titanas,http://startupstockphotos.com/
57,Tracking Joy at Work,begriffs,http://begriffs.com/posts/2015-03-15-tracking-joy-at-work.html
38,Show HN: OS X menu bar app for managing your boot2docker VM,nickgartmann,http://boot2docker-status.nickgartmann.com/
30,Can Tony Haile save journalism by changing the metric?,ericjust,http://www.cjr.org/innovations/tony_haile_chartbeat.php
55,Robert Putnam on the gap between rich kids and poor kids,jeffreyrogers,http://chronicle.com/article/Can-Robert-Putnam-Save-the/228443/
78,Machine Learning and Computer Vision Resources,zerry,http://zhengrui.github.io/zerryland/ML-CV-Resource.html
224,The web of names hashes and UUIDs,lelf,https://joearms.github.io/2015/03/12/The_web_of_names.html
27,Inventor of Aerobie also invented the Aeropress,steven,https://medium.com/backchannel/first-alan-adler-invented-the-aerobie-now-he-s-created-the-perfect-cup-of-coffee-c5e94ccc538e
4,Recommended explicit padding bytes used in Internet related protocols,robin_reala,http://www.me.uk/draft-kennard-padding.txt
7,The New Optimism of Al Gore,jsc123,http://www.nytimes.com/2015/03/17/science/the-new-optimism-of-al-gore.html
106,Man In The Moonbase (Part 1): Death and Life of the Best Game You Never Played,danso,http://www.gamasutra.com/blogs/DarbyMcDevitt/20150223/234684/Man_In_The_Moonbase_Part_1.php
10,Bootstrap 3.3.4 released,anorborg,http://blog.getbootstrap.com/2015/03/16/bootstrap-3-3-4-released/
15,Ask HN: Moved from Windows to Macbook Pro – How can I get up to speed quickly?,jxm262,
4,I for one welcome our new newsletter and podcast overlord,Hagelin,http://sixcolors.com/post/2015/03/i-for-one-welcome-our-new-newsletter-and-podcast-overlords/
5,What It's Like to Fly the $23000 Singapore Airlines Suites Class,adamnemecek,http://dereklow.co/what-its-like-to-fly-the-23000-singapore-airlines-suites-class/
4,Flying Cars Are Closer Than You Think,guiambros,https://wrgms.com/flying-cars-are-closer-than-you-think/
65,Back End Apps with Webpack: Part I,jlongster,http://jlongster.com/Backend-Apps-with-Webpack--Part-I
52,Attacks Only Get Better: Password Recovery Attacks Against RC4 in TLS,ctz,http://www.isg.rhul.ac.uk/tls/RC4mustdie.html
355,Khan Academy: Algorithms,lobo_tuerto,https://www.khanacademy.org/computing/computer-science/algorithms
174,Twitter Gave Meerkat Two Hours’ Notice before Cutting Access,byoogle,http://www.fastcompany.com/3043716/sxsw/twitter-only-gave-meerkat-2-hours-notice-before-cutting-access-to-the-social-graph
3,PVS-Studio: 25 Suspicious Code Fragments in CoreCLR,AndreyKarpov,http://www.viva64.com/en/b/0310/
47,How Warren Robinett Invented the Console Adventure Game,ghosh,http://www.wired.com/2015/03/warren-robinett-adventure/
215,Programmer Passion Considered Harmful,jamescostian,https://medium.com/on-coding/programmer-passion-considered-harmful-5c5d4e3a9b28
197,Antiwork – a radical shift in how we view “jobs”,tdaltonc,https://contributoria.com/issue/2014-12/543d1c2487628e9a6500001b
5,Gogs: a self-hosted Git service written in Go,bpierre,http://gogs.io
231,The Church of TED,dcre,http://www.nytimes.com/2015/03/15/opinion/sunday/the-church-of-ted.html
325,“Sierra… well it was the poor victim of a hostile takeover by criminals”,kevbin,http://www.nodontdie.com/al-lowe/
215,Ask HN: Favorite podcasts?,adilmajid,
5,Rakuten Starts Accepting Bitcoin,teemonasty,http://www.wsj.com/articles/rakuten-starts-accepting-bitcoin-1426555942
1,Asseta (YC S13) is hiring to grow its B2B spare parts marketplace,Asseta,https://asseta.recruiterbox.com/
11,That's Funny,wglb,http://www.americanscientist.org/issues/pub/thats-funny
10,Scientific Expertise and Craft Practice in Molecular Gastronomy (2013) [pdf],samclemens,http://www.fas.harvard.edu/~hsdept/bios/docs/roosth_foams_formalisms.pdf
91,Why Some Bankers Are Leaving Finance for Fintech Startups,peterkrieg,http://www.bloomberg.com/news/articles/2015-03-15/bankers-embracing-zero-salary-in-tech-may-make-peers-obsolete
8,Masterpiece Engineering by T. H. Simpson (1968),tomaskazemekas,http://homepages.cs.ncl.ac.uk/brian.randell/NATO//NATOReports/index.html#Appendix
119,Life Lessons from Machine Learning,nkurz,https://outlookzen.wordpress.com/2015/03/15/life-lessons-from-machine-learning/
240,Xonsh a Python-ish Bash-compatible shell language and command prompt,ngoldbaum,http://xonsh.org/
14,On compromising app developers to go after their users,chopin,https://freedom-to-tinker.com/blog/dwallach/on-compromising-app-developers-to-go-after-their-users/
39,The Logic of Failure (2011),timdaub,http://tersesystems.com/2011/06/10/the-logic-of-failure/
227,End-to-End Encryption Plugin for Yahoo Mail,danielweber,http://yahoo.tumblr.com/post/113708033335/user-focused-security-end-to-end-encryption
8,Show HN: An OS that installs in less than 2 seconds,denniskane,https://www.urdesk.net/
12,11 year old gets suspended for not Marijuana,ZanyProgrammer,http://www.washingtonpost.com/blogs/wonkblog/wp/2015/03/16/virginia-school-suspends-an-11-year-old-for-one-year-over-a-leaf-that-wasnt-marijuana/
6,Show HN: Legalize.js – object validation for node and the browser,scravy,https://github.com/paypal/legalize.js
38,We Live in an Age of Irrational Parenting,DanielBMarkham,http://nymag.com/scienceofus/2015/03/we-live-in-an-age-of-irrational-parenting.html
10,Mars One Finalist Explains Exactly How It‘s Ripping Off Supporters,steveridout,https://medium.com/matter/mars-one-insider-quits-dangerously-flawed-project-2dfef95217d3
41,The new MacBook's single port comes with a security risk,kenperkins,http://www.theverge.com/2015/3/16/8226193/new-apple-macbook-usb-type-c-security-risk-badusb
241,Ask HN: The rising “Hackathon Hackers” culture,haskellvilain,
15,Show HN: Awesome rating widget,sedzia,https://github.com/bandraszyk/awesome-rating
8,Ask HN: How can one make good money without a career?,shire,
8,SiriusXM to Launch “Startup School Radio” with YC Partner Aaron Harris,protomyth,http://investor.siriusxm.com/releasedetail.cfm?ReleaseID=898305
9,I fired half my team,SteliE,http://blog.close.io/i-fired-half-my-team
5,New WhiteBoard – Beta Version – Try It and Comment Please,lioravr,http://www.thelearnia.com
5,Pinterest raises $367M at $11B valuation,nanoGeek,http://www.businessinsider.com/pinterest-raises-367-million-at-11-billion-2015-3
23,Flyway 3.2 Released – Database Migrations Made Easy,axelfontaine,http://flywaydb.org/blog/flyway-3.2.html
169,GitBook: A modern publishing toolchain,lobo_tuerto,https://www.gitbook.com/
6,Pew Survey: Americans' Privacy Strategies Post-Snowden,hackuser,http://www.pewinternet.org/2015/03/16/Americans-Privacy-Strategies-Post-Snowden/
20,Embargoed OpenSSL Vulnerabilities,feld,https://mta.openssl.org/pipermail/openssl-users/2015-March/000778.html
8,The Making of P0 Snake – Part 2: It Talks,ot,http://brokenbytes.blogspot.com/2015/03/the-making-of-p0-snake-part-2-it-talks.html
93,Nevada marijuana legalization gets official OK for 2016 ballot,remotorboater,http://www.thecannabist.co/2014/12/08/nevada-marijuana-legalization-2016-ballot/24954/
97,The Sting: How the FBI Created a Terrorist,etiam,https://firstlook.org/theintercept/2015/03/16/howthefbicreatedaterrorist/
8,Show HN: Scribesend – Stripe for accounting,fjw,http://scribesend.com/
6,Turn your new tab screen in Chrome into an art exhibit,wolfman1,http://tabstract.io/
69,Is your satellite link oscillating? Improving goodput using network coding,gunkaaa,https://blog.apnic.net/2015/03/13/is-your-satellite-link-oscillating/
42,Americans should drink more coffee,ulysses,http://www.washingtonpost.com/blogs/wonkblog/wp/2015/02/21/its-official-americans-should-drink-more-coffee/
95,Making Pinterest HTTPS,cpeterso,http://engineering.pinterest.com/post/113537918179/making-pinterest-https
91,How Many Mutual Funds Routinely Rout the Market? Zero,dcre,http://www.nytimes.com/2015/03/15/your-money/how-many-mutual-funds-routinely-rout-the-market-zero.html
10,LinkedIn decides to focus on Java 8 instead of Scala,winterbe,http://www.quora.com/Is-LinkedIn-getting-rid-of-Scala/answer/Kevin-Scott?share=1
25,Why is it hard to write a compiler for Perl 6?,jsnell,http://perlgeek.de/blog-en/perl-6/2015-why-hard.html
