SCORE,TITLE,BY,URL
119,Bazel – Correct reproducible fast builds for everyone,drivebyubnt,http://bazel.io/
226,Myths of Enterprise Python,rbanffy,https://www.paypal-engineering.com/2014/12/10/10-myths-of-enterprise-python/
95,The hidden tricks of persuasion: study shows how easily we are manipulated,d_a_robson,http://www.bbc.com/future/story/20150324-the-hidden-tricks-of-persuasion
14,Triton: Docker and the “best of all worlds”,thepumpkin1979,https://www.joyent.com/blog/triton-docker-and-the-best-of-all-worlds
46,Pencil code,xiaq,http://pencilcode.net/
233,A Primer for Building Single Page Applications with React,tilt,https://github.com/mikechau/react-primer-draft
59,How to get an A+ on the SSL Labs test in node.js and io.js,nailer,https://certsimple.com/blog/a-plus-node-js-ssl
366,Bug 1202858 – Restarting squid results in deleting all files in hard-drive,geoffbp,https://bugzilla.redhat.com/show_bug.cgi?id=1202858
31,Improbable: enabling the development of large-scale simulated worlds,taylorwc,http://cdixon.org/2015/03/24/improbable-enabling-the-development-of-large-scale-simulated-worlds/
134,Indian Supreme Court Judgement on Freedom of Speech [pdf],msravi,http://supremecourtofindia.nic.in/FileServer/2015-03-24_1427183283.pdf
15,Fighting fires with sound frequencies,oulipian,http://www.washingtonpost.com/local/when-it-comes-to-putting-out-fire-gmu-students-show-its-all-about-that-bass/2015/03/22/47a7f8e8-cf1a-11e4-a2a7-9517a3a70506_story.html
45,Can education change Japan's 'depressed' generation?,druml,http://www.bbc.co.uk/news/business-32013613
41,Fear of Apple,q7,http://www.elischiff.com/blog/2015/3/24/fear-of-apple
14,Realm (YC S11) Announces $20M Series B 100M Devices After 9 Months,astigsen,http://realm.io/news/9-months/
22,Another Flipping Puzzle,ColinWright,http://www.solipsys.co.uk/FlippingPuzzle/AnotherFlippingPuzzle.html
11,Why is it so hard to calculate ROI in Google Analytics?,ryanevans,https://tendinc.com/blog/calculate-roi-google-analytics/
13,Live Migrating QEMU-KVM Virtual Machines,Tsiolkovsky,http://developerblog.redhat.com/2015/03/24/live-migrating-qemu-kvm-virtual-machines/
75,We know where you’ve been: Ars acquires 4.6M license plate scans from the cops,jchrisa,http://arstechnica.com/tech-policy/2015/03/we-know-where-youve-been-ars-acquires-4-6m-license-plate-scans-from-the-cops/
74,Mathematicians solve 60-year-old problem,ghosh,http://phys.org/news/2015-03-mathematicians-year-old-problem.html
8,As programmers why we never finish our projects,alphydan,http://programmer-hek.blogspot.com/2014/11/as-programmers-why-we-never-finish-our.html
113,After Jobs Dry Up What Then?,cryptoz,http://www.nytimes.com/2015/03/11/world/europe/after-jobs-dry-up-what-then.html?_r=0
59,Contributing to Servo,dbaupp,http://bluishcoder.co.nz/2015/03/24/contributing-to-servo.html
81,Landing the Nostromo (1981),kazinator,https://archive.org/stream/creativecomputing-1981-06/Creative_Computing_v07_n06_1981_June?ui=embed#page/n51/mode/2up
102,The Visual Microphone: Passive Recovery of Sound from Video,csom,http://people.csail.mit.edu/mrub/VisualMic/
1,DoorDash (YC S13) is hiring. Come build the future of on-demand delivery,stanleytang,http://www.doordash.com/jobs
35,A MIDI Player on Eight Floppy Drives,signa11,http://kukuruku.co/hub/diy/a-midi-player-on-eight-floppy-drives
103,Companies That Presented at Y Combinator Demo Day 1,eroo,http://techcrunch.com/2015/03/23/here-are-the-companies-that-presented-at-y-combinator-demo-day-day-1/
14,Ordnance Survey releases mapping tool,joosters,http://www.bbc.co.uk/news/technology-32019261
407,Pinterest lets employees exercise options 7 years after leaving,ropiku,http://fortune.com/2015/03/23/pinterest-employee-taxes/
29,Your Uber and Lyft rides visualized,xasos,https://pistats.io/
98,New DNA construct can set off a “mutagenic chain reaction”,ulysses,http://arstechnica.com/science/2015/03/new-dna-construct-can-set-off-a-mutagenic-chain-reaction/
28,Mapping efforts in an unsurveyed land,stultus,http://blog.smc.org.in/mapping-efforts-in-an-unsurveyed-land-koorachundu/
100,$1B TSA Behavioral Screening Program Slammed as Ineffective Junk Science,alexcasalboni,http://www.allgov.com/news/where-is-the-money-going/1-billion-dollar-tsa-behavioral-screening-program-slammed-as-ineffective-junk-science-150323?news=856031
6,How a bee sting saved my life: poison as medicine,ColinWright,http://mosaicscience.com/story/how-bee-sting-saved-my-life-poison-medicine
193,Google warns of unauthorized TLS certificates trusted by almost all OSes,shawndumas,http://arstechnica.com/security/2015/03/google-warns-of-unauthorized-tls-certificates-trusted-by-almost-all-oses/
8,Extreme Programming Revived?,ABS,http://ronjeffries.com/articles/2015-03-21-xp-revived/
13,Marty.js 0.9 – Isomorphism ES6 classes and much more,jfhollingworth,http://martyjs.org/blog/2015/03/24/marty-v0.9.html
106,Purple – Heroku UI Kit,acesubido,http://purple.herokuapp.com/
1,Build the future of business with Mattermark. Looking for full stack engineers,kevin_morrill,https://mattermark.com/jobs/
55,Can Spark Streaming Survive Chaos Monkey?,ddispaltro,http://techblog.netflix.com/2015/03/can-spark-streaming-survive-chaos-monkey.html
239,pg_rewind in PostgreSQL 9.5,willlll,http://hlinnaka.iki.fi/2015/03/23/pg_rewind-in-postgresql-9-5/
193,Sublime Text 3 Build 3080,amima,http://www.sublimetext.com/blog/articles/sublime-text-3-build-3080
86,Global warming is now slowing down the circulation of the oceans,alexcasalboni,http://www.washingtonpost.com/news/energy-environment/wp/2015/03/23/global-warming-is-now-slowing-down-the-circulation-of-the-oceans-with-potentially-dire-consequences/?tid=rssfeed
257,Free Non-Commercial Renderman,ykl,http://renderman.pixar.com/view/non-commercial-renderman
355,Images that fool computer vision raise security concerns,lm60,http://news.cornell.edu/stories/2015/03/images-fool-computer-vision-raise-security-concerns
4,Certificate Transparency: Public verifiable append-only logs,zzzcpan,http://queue.acm.org/detail.cfm?id=2668154
246,Primer – CSS toolkit and guidelines that power GitHub,hswolff,http://primercss.io/
329,Stripe Connect v2,pc,http://stripe.com/connect
40,How computers could change pure mathematics,j2kun,http://www.slate.com/articles/health_and_science/science/2015/03/computers_proving_mathematical_theorems_how_artificial_intelligence_could.html?wpsrc=sh_all_dt_fb_top
20,Never Buy a Phone Again,regnum,http://www.wired.com/?p=1663621&preview_id=1663621%2F
122,Python to Scheme to Assembly (2014),sea6ear,https://davidad.github.io/blog/2014/02/28/python-to-scheme-to-assembly-1/
57,Confabulation in the humanities,diodorus,http://matthewlincoln.net/2015/03/21/confabulation-in-the-humanities.html
114,Manux – A free Linux-compatible OS designed to withstand attacks in userspace,guru_meditation,http://www.manux.info/en/
1,Music Lover? Bop.fm (YC S13) Is Looking for a Lead Android Developer,daredia,https://angel.co/bop-fm/jobs/16609-lead-android-mobile-developer
12,No Need to Run in Hawaii: The Lava Is Coming but Very Slowly,ritchiea,http://www.nytimes.com/2015/03/24/us/as-volcano-erupts-around-them-hawaiians-pledge-to-gamely-go-with-the-flow.html?
56,Random Numbers in Virtual Machines,ruda,http://rhelblog.redhat.com/2015/03/09/red-hat-enterprise-linux-virtual-machines-access-to-random-numbers-made-easy/
4,Fake Empire,TeMPOraL,https://medium.com/@mittermayr/fake-world-7a21ecde82c3
17,Dr Surly's School for Mad Scientists: Unit Testing and Embedded Software Catalysts,mvandervoord,http://throwtheswitch.org/dr-surlys-school
6,The first Apple Tablet… from 1979,fogus,http://www.edibleapple.com/2009/11/23/the-first-apple-tablet-from-1979/
10,How a Lousy Football Game Led to the Greatest Hockey Game,edroche,http://readonlymemory.vg/john-madden-hockey/
138,BYTE Magazine: The C Language (1983),bleakgadfly,https://archive.org/stream/byte-magazine-1983-08/1983_08_BYTE_08-08_The_C_Language#page/n47/mode/2up
4,Peepless in Seattle,washedup,http://www.jeffreifman.com/2015/03/22/peepless-in-seattle-dating-friendship-and-the-seattle-freeze-after-forty/
16,Hacker News broke our site – how Nginx and PageSpeed fixed the problem,rayv,https://www.airport-parking-shop.co.uk/blog/hacker-news-broke-site-nginx-pagespeed-fixed-problem/
8,Self-Organizing Map in JavaScript (Neural Network),chirola,http://synaptic.juancazala.com/#/self-organizing-map
73,The Father of the Digital Synthesizer,ryan_j_naughton,http://priceonomics.com/the-father-of-the-digital-synthesizer/
52,MirageOS Pioneer Projects,zem,https://github.com/mirage/mirage-www/wiki/Pioneer-Projects
78,Analytics on the Cheap,ksri,http://0x74696d.com/posts/analytics-on-the-cheap/
19,Hydrogen Bomb Physicist’s Book Runs Afoul of Energy Department,dnetesn,http://www.nytimes.com/2015/03/24/science/hydrogen-bomb-physicists-book-runs-afoul-of-energy-department.html?ref=science
252,Show HN: Rabbits – Send an email to get any grunt-work programming job completed,brandonhsiao,https://ilikerabbits.com
3,Safe Bitfields in C++,AndreyKarpov,http://preshing.com/20150324/safe-bitfields-in-cpp/
10,Show HN: Scenery – Beautiful and quick mockups,chriseidhof,https://www.getscenery.com
10,Stacks – Tools to work and play better,mseo,https://www.stackshq.com/
11,Ask HN: Should I tell my boss Im looking for other work?,hndecides,
9,Make your OS X finder logo awesome,c54,https://github.com/vsinha/classy_finder
10,Ask HN: Why can I buy a server computer but not in a rack?,andrewstuart,
102,Maintaining Digital Certificate Security,cleverjake,http://googleonlinesecurity.blogspot.com/2015/03/maintaining-digital-certificate-security.html
7,Ask HN: Recommend a recommendation system,muchbetterguy,
5,Google Drive Sync High CPU Usage,wslh,https://productforums.google.com/forum/#!topic/drive/5jAt4KomRU8
28,The Discoveries of Continuations (1993) [pdf],brudgers,http://www.cs.ru.nl/~freek/courses/tt-2011/papers/cps/histcont.pdf
39,The Taming of Tech Criticism,dcre,http://www.thebaffler.com/salvos/taming-tech-criticism
29,TLS Prober – A tool for fingerprint SSL/TLS server implementations,richm44,https://github.com/WestpointLtd/tls_prober
197,Learning Vim while playing a game,erbdex,http://vim-adventures.com/
254,Early Posts From Tech Founders Who Changed The World,carlcheo,http://carlcheo.com/fascinating-posts-from-tech-founders-who-changed-the-world
7,The median household income along Chicago’s L system,kevando,http://youarehere.cc/j/subway/chicago.html
3,Watson Eat Your Heart Out: Here Comes X.ai,dana_red,https://www.mongodb.com/blog/post/watson-eat-your-heart-out-here-comes-xai
63,OpenZFS: Reducing ARC Lock Contention,prakashsurya,http://blog.delphix.com/prakash/2015/03/23/openzfs-reducing-arc-lock-contention/
12,How many million BIOSes would you like to infect [pdf],0x0,http://legbacore.com/Research_files/HowManyMillionBIOSWouldYouLikeToInfect_Full2.pdf
88,How to save datetimes for future events,laut,http://www.creativedeletion.com/2015/03/19/persisting_future_datetimes.html
6,Facebook may host news sites' content,zonotope,http://www.nytimes.com/2015/03/24/business/media/facebook-may-host-news-sites-content.html?hp&action=click&pgtype=Homepage&module=second-column-region&region=top-news&WT.nav=top-news&_r=0
9,What's New in IntelliJ IDEA 14.1?,andrey_cheptsov,https://www.jetbrains.com/idea/whatsnew/?hn
5,Achieving Full Marks on Qualys SSL Labs with Nginx,danpalmer,https://danpalmer.me/blog/ssl-labs-grade-a
134,'Mountaineer' Is a Must-Read of Soviet Sci-Fi,rfreytag,http://www.npr.org/2015/03/19/392634682/mountaineer-is-a-must-read-of-soviet-sci-fi
23,Thermodynamics with Continuous Information Flow,diego898,https://johncarlosbaez.wordpress.com/2015/03/21/19395/
16,How to Make Apps for Firefox OS,IpxqwidxG,https://hacks.mozilla.org/2015/03/how-to-make-a-browser-app-for-firefox-os/
107,Nes emulator written in go,netbun,https://github.com/fogleman/nes
144,F***ing Learn to Code Again (1999),jeffreyrogers,http://blog.kebby.org/?p=47
51,Port Squatting,sciurus,http://queue.acm.org/detail.cfm?id=2674602
72,Y Combinator ups the ante with bio startups for 2015,loopj,http://www.techiatric.com/latest/2015/3/22/ycombinator-ups-the-ante-with-bumper-biotech-batch
11,Airbus A320 crash: German Wings flight 'down in southern France',manucorporat,http://www.independent.co.uk/news/world/europe/airbus-a320-crash-german-wings-flight-down-in-southern-france-10129817.html
9,White Dwarfs and Dyson Spheres,curtis,http://www.centauri-dreams.org/?p=32788
59,Cstore_fdw: A Columnar Store for PostgreSQL,pykello,https://github.com/citusdata/cstore_fdw
273,Ask HN: Does anyone else value the comments more than the link?,pvinis,
3,How quitting my corporate job for my startup dream f*cked my life up,SanderMak,https://medium.com/everything-about-startups-and-entrepreneurship/how-quitting-my-corporate-job-for-my-startup-dream-f-cked-my-life-up-3b6b3e29b318
20,Arduino Internals [pdf],rfreytag,http://arduino-project.net/download/arduino-books/Wheat%20D.%20-%20Arduino%20Internals%20%28Technology%20in%20Action%29%20-%202011.pdf
14,Dealing with the digital afterlife of a hacker,chobo,http://www.dailydot.com/technology/michael-hamelin-legacy-encryption-death/
9,German Airbus A320 Plane Crashes in French Alps,sunilkumarc,http://www.theguardian.com/world/2015/mar/24/german-a320-airbus-plane-crashes-french-alps
23,Ask HN: When should one leave a company based on learning stagnation?,starlord,
65,High performance services using coroutines,gmosx,https://medium.com/software-development-2/high-performance-services-using-coroutines-ac8e9f54d727
6,Why I Love Basic Auth,duncans,http://www.rdegges.com/why-i-love-basic-auth/
1,Kamcord is looking for an iOS Engineer who loves mobile games,vecter,https://jobs.lever.co/kamcord/8480c014-d88c-4d2a-8286-2b99c9923905?lever-source=hackernews
43,Show HN: WakaTime and Slack live demo,welder,https://wakatime.com/slack
96,Suspended animation is becoming a life-saving medical procedure,dnetesn,http://prime.nautil.us/issue/22/slow/how-to-turn-your-dog-off
166,Amtrak police use of passenger data,CapitalistCartr,http://papersplease.org/wp/2015/03/20/amtrak-lies-about-police-use-of-passenger-data/
131,The I-JSON Message Format,pjvds,https://www.tbray.org/ongoing/When/201x/2015/03/23/i-json
72,The history of barbed wire,curtis,http://www.slate.com/blogs/the_eye/2015/03/23/_99_invisible_roman_mars_the_history_of_barbed_wire.html
83,Show HN: Madeon's Adventure Machine,sydlawrence,http://madeon.fr/adventuremachine
63,The Good Project Manager,notadocta,https://teamgantt.com/guide-to-project-management/
70,What Clayton Christensen Got Wrong (2013),gklitt,http://stratechery.com/2013/clayton-christensen-got-wrong/
70,Desertec,mooreds,http://en.wikipedia.org/wiki/Desertec
5,Into the Zombie Underworld (2013),samclemens,http://zombies.epicmagazine.com/story/5937
3,Ask HN: How to leave my current job,ZoroZero,
15,Indian Supreme Court strikes down anti free speech law,nithinr6,http://www.medianama.com/2015/03/223-section-66a-unconstritutional/
3,Scientists hack air-gapped system using heat,thestack_alice,http://thestack.com/scientists-hack-air-gapped-heat-240315
3,Building Two-factor Authentication,Sami_Lehtinen,https://engineering.gosquared.com/building-two-factor-authentication
12,Square Cash opens its door to businesses and introduces $Cashtags,mattstrayer,http://techcrunch.com/2015/03/23/businesstime-for-square-cash/
29,A lot more market-rate construction helps low-income renters more than subsidies,bmmayer1,https://medium.com/@albrgr/a-lot-more-market-rate-construction-might-help-low-income-renters-more-than-increased-subsidies-c4a2a86c9e21
60,From a Farm in Egypt to Building a YC Computer Vision Startup for Fitness,dang,http://techcrunch.com/2015/03/23/smartspot/
3,A Baseline for Front-End [JS] Developers: 2015,orand,http://rmurphey.com/blog/2015/03/23/a-baseline-for-front-end-developers-2015/
9,Show HN: Google Drive app reinvented,terpua,https://www.insynchq.com/
56,A 1-1 network pipe that auto discovers other peers using mDNS,hippich,https://github.com/mafintosh/airpaste
8,Yahoo Is Closing Its Office in China and Laying Off Hundreds of Staff,ot,http://techcrunch.com/2015/03/18/yahoo-exits-china/
16,Computing History at Bell Labs (1997),akerl_,http://research.swtch.com/bell-labs
1,HelloSign is hiring its first API Evangelist,burnout1540,http://grnh.se/ydlbh2
27,Some thoughts on security after ten years of qmail 1.0 (2007) [pdf],tosh,http://cr.yp.to/qmail/qmailsec-20071101.pdf
76,Let Over Lambda (2008),weavie,http://letoverlambda.com/index.cl/toc
17,Announcing Augmented Traffic Control: A tool to simulate network conditions,tilt,https://code.facebook.com/posts/1561127100804165/
66,What Makes an Electric Guitar Sound Like an Electric Guitar,Thevet,http://www.theatlantic.com/technology/archive/2015/03/what-makes-an-electric-guitar-sound-like-an-electric-guitar/386441/?single_page=true
99,Canada's CSE cyberwarfare toolbox revealed,colinprince,http://www.cbc.ca/news/canada/communication-security-establishment-s-cyberwarfare-toolbox-revealed-1.3002978
10,The Waves of the Future May Bend Around Metamaterials,dnetesn,http://www.nytimes.com/2015/03/24/science/the-waves-of-the-future-may-bend-around-metamaterials.html?ref=science&_r=0
22,Equation APT Group Attack Platform – A Study in Stealth,wglb,https://threatpost.com/equation-apt-group-attack-platform-a-study-in-stealth/111550
33,Show HN: Spectra – Python color scales made easy,jsvine,https://github.com/jsvine/spectra
116,How to build a Debian package,eloycoto,http://documentation.thebigrede.net/maintainers/howto-build-package.html
26,Monitoring pf logs with Gource,mben,http://www.echothrust.com/blogs/monitoring-pf-logs-gource
56,USENIX WOOT 2015 Call for Papers,tptacek,https://www.usenix.org/conference/woot15/call-for-papers
19,Coordination Avoidance in Large Database Systems,PaulHoule,http://blog.acolyer.org/2015/03/19/coordination-avoidance-in-database-systems/
23,Cribspot (YC W15) is a search engine for college housing,timjones,http://techcrunch.com/2015/03/23/cribspot/
22,Twitch.tv account information leaked,SG-,
26,Calacanis on Ellen Pao and Fixing the Gender Issue in VC,rsobers,http://calacanis.com/2015/03/23/mansplaining-the-ellen-pao-trial-fixing-the-gender-issue-in-venture-capital/
40,The blackjack vulnerability,jbaiter,http://méric.fr/blog/blackjack.html
3,Anonymous posting on Social Networks,locolapp,http://www.locolapp.com
9,An open letter to banks,zdw,https://blog.agilebits.com/2015/03/23/an-open-letter-to-banks/
1,Teespring (YC W13) Is Hiring a DevOps Lead,estitesc,
20,For an artist with amnesia the world takes place through her pencil,danso,http://www.newyorker.com/magazine/2015/03/30/an-artist-with-amnesia
35,Stealing Data from Computers Using Heat,sergeant3,http://www.wired.com/2015/03/stealing-data-computers-using-heat/
12,Landmark study proves that magnets can control heat and sound,virmundi,http://news.osu.edu/news/2015/03/23/heatmag/
77,Non-Obvious Tips for Your YC Application,tadmilbourn,http://www.tiempoapp.com/blog/3-non-obvious-tips-for-your-yc-application
3,HackerOne's First XSS,dsr12,http://danlec.com/blog/hackerones-first-xss
88,Tails 1.3.1 is out,Sami_Lehtinen,https://tails.boum.org/news/version_1.3.1/index.en.html
6,Sassy – A portable assembler for x86 processors written in R5RS Scheme (2009),sea6ear,http://sassy.sourceforge.net/
78,The Future of Humanity with Elon Musk: Interview by Neil DeGrasse Tyson,eroo,http://www.startalkradio.net/show/the-future-of-humanity-with-elon-musk/
95,Ask HN: Why are Apache projects so Java-centric?,hoodoof,
7,When Private Browsing Isn’t Private on iOS: HTML5 and AirPlay,Mojah,https://ma.ttias.be/when-private-browsing-isnt-private-on-ios-html5-and-airplay/
6,Go-Pry: A Ruby Pry-Esque REPL for Go,mtchavez,https://github.com/d4l3k/go-pry
13,Big Data Analytics: Spark,haifeng,http://haifengl.wordpress.com/2014/08/18/big-data-analytics-spark/
492,Ravens Offensive Lineman Publishes Math Paper,jaynos,http://www.npr.org/blogs/thetwo-way/2015/03/20/394340722/john-urschel-ravens-offensive-lineman-publishes-math-paper
183,Deep Learning vs. Machine Learning vs. Pattern Recognition,platz,http://quantombone.blogspot.com/2015/03/deep-learning-vs-machine-learning-vs.html
10,Apple Opens Up to Praise New Book on Steve Jobs and Criticize an Old One,carlchenet,http://www.nytimes.com/2015/03/23/business/media/apple-opens-up-to-praise-new-book-on-steve-jobs-and-criticize-an-old-one.html
27,Square Cashtags,chlee99,https://squareup.com/news/introducing-cashtags
72,Ask HN: Static site generator with web UI?,rahimnathwani,
16,The oddly beautiful artistic talent of the nation’s drug cops,dmazin,http://www.washingtonpost.com/blogs/wonkblog/wp/2015/03/20/the-oddly-beautiful-and-sometimes-disturbing-artistic-talent-of-the-nations-drug-cops/
86,Sources to Find a Remote Job as a Software Developer,wnm,http://blog.remoteworknewsletter.com/2015/03/23/best-sources-to-find-a-remote-job-as-a-software-developer/
42,A New Kind of Conspicuous Consumption,Red_,http://www.wired.com/2015/03/stuffocation-the-weird-way-facebook-and-instagram-make-us-happier/
4,The Town That's Used to Being Disappointed,kposehn,http://www.bbc.com/news/magazine-31940483
17,Method and system for shockwave attenuation via electromagnetic arc,kjhughes,http://patft.uspto.gov/netacgi/nph-Parser?Sect1=PTO1&Sect2=HITOFF&d=PALL&p=1&u=%2Fnetahtml%2FPTO%2Fsrchnum.htm&r=1&f=G&l=50&s1=8981261.PN.&OS=PN/8981261&RS=PN/8981261
4,Arrests for posting objectionable content online unconstitutional,stokedmartin,http://www.thehindu.com/news/national/supreme-court-strikes-down-section-66-a-of-the-it-act-finds-it-unconstitutional/article7027375.ece
11,Rich vs. King: The Entrepreneur's Dilemma (2006) [pdf],rdcasey,http://www.people.hbs.edu/nwasserman/rich_vs_king-proceedings_with_abstract.pdf
49,Introducing OpenBSD's httpd [pdf],tosh,http://www.openbsd.org/papers/httpd-slides-asiabsdcon2015.pdf
6,The Rise of the Simulation Stack,amckenzie,http://www.deskeng.com/de/the-rise-of-the-simulation-stack/
1,ZeroCater (YC W11) Is Looking for a Product Manager,arram,
12,The Importance of Being Wilde,samclemens,http://laphamsquarterly.org/roundtable/importance-being-wilde
23,The Inhuman Anthropocene,Petiver,http://avidly.lareviewofbooks.org/2015/03/22/the-inhuman-anthropocene/
5,Maintaining digital certificate security,rey12rey,http://googleonlinesecurity.blogspot.com/2015/03/maintaining-digital-certificate-security.html?m=0
81,Rust for Clojurists,panic,https://gist.github.com/oakes/4af1023b6c5162c6f8f0
13,Show HN: XMD – An Extensible Markdown Format,hayeah,https://github.com/hayeah/xmd
10,The story of how Webflow got into YC after two rejections,callmevlad,http://blog.webflow.com/the-story-of-how-webflow-got-into-y-combinator
11,Incidental Data Capture,hxrts,http://avant.org/media/incidental-data-capture
12,Binutils: add znver1 processor,ytch,https://sourceware.org/ml/binutils/2015-03/msg00078.html
80,The spy satellite Lacrosse 5 and its “disappearace trick”,gokhan,http://www.astrophoto.fr/spy_satellites.html#Lacrosse-5
19,Hindu units of time,airavat,http://en.wikipedia.org/wiki/Hindu_units_of_time
9,Firefly – Instant Full-Text Search Engine for Dropbox,ziga,https://blogs.dropbox.com/tech/2015/03/firefly-instant-full-text-search-engine/
5,My Rackspace VPS was compromised thousands charged advice?,gotcompromised,
5,The Myth of High-Protein Diets,streblo,http://www.nytimes.com/2015/03/23/opinion/the-myth-of-high-protein-diets.html?hp&action=click&pgtype=Homepage&module=c-column-top-span-region&region=c-column-top-span-region&WT.nav=c-column-top-span-region&_r=0
43,Announcing Lotus v0.3.0,jodosha,http://lotusrb.org/blog/2015/03/23/announcing-lotus-030.html
145,The Little “Fighter” That Couldn’t: Moral Hazard and the F-35,sergeant3,http://www.jqpublicblog.com/the-little-fighter-that-couldnt-moral-hazard-and-the-f-35/
8,Show HN: Wantrepreneurlist: Abandonia for your ideas,humanarity,https://wantrepreneurlist.appspot.com/l33t-show
4,Show HN: Puntly – Twitter meets pinterest (save share the stuff you like),theianwhiteley,http://punt.ly
7,The war over who Steve Jobs was,steven,https://medium.com/backchannel/the-war-over-who-steve-jobs-was-92bda2cd1e1e
10,Steve Wozniak: The Future of AI Is 'Scary and Very Bad for People',eplanit,https://www.yahoo.com/tech/s/steve-wozniak-future-ai-scary-154700881.html
6,New Nonstick Coating,mhb,http://www.nytimes.com/2015/03/24/science/with-new-nonstick-coating-the-wait-and-waste-is-over.html?ref=science
5,Dear Teacher a Video Game Developer Is a Real Job and Should Be Celebrated,mattmurdog,http://techcrunch.com/2015/03/20/dear-teacher-a-video-game-developer-is-a-real-job-and-should-be-celebrated/#0EXlkW:Rz3e
7,How Platzi bootstrapped its way into YC to build the future of education,unmalnick,http://thenextweb.com/insider/2015/03/23/how-platzi-bootstrapped-its-way-into-y-combinator-to-build-the-future-of-education/
4,Ask HN: Twitch.tv compromised email?,Karunamon,
3,Carmack's challenge,knowbody,http://2015.revision-party.net/compos/120hz_demo_competition
5,ccTLD.uz,cnst,http://uz./
5,Unexpected JS,je42,https://github.com/unexpectedjs/unexpected
81,Mars One Finalist Announces That It's All a Scam,SonicSoul,http://www.iflscience.com/space/whats-going-mars-one
6,You,revx,http://notch.net/2015/03/you/
4,Ask HN: Anyone using Amazon CPM Ads?,rk0567,
15,We need a future where the robots benefit all of us not just the rich,Tsiolkovsky,https://www.nytimes.com/2015/03/22/opinion/sunday/why-not-utopia.html
1,Love Devops? Aptible Is Hiring Senior Platform Engineers,chasb,
12,Show HN: Backdoor – Security CTF Platform,abhikandoi2000,https://backdoor.sdslabs.co/
3,When Science Is Lost in a Legal Maze,dnetesn,http://www.nytimes.com/2015/03/24/science/when-science-is-lost-in-a-legal-maze.html?ref=science
72,Portugal decriminalized drugs a decade ago – what have we learned? (2011),Hooke,http://www.newyorker.com/magazine/2011/10/17/getting-a-fix
