SCORE,TITLE,BY,URL
3,Facebook PHP Source Code from August 2007,avinassh,https://gist.github.com/nikcub/3833406
18,I Beat a Patent Troll and You Can Too,amduser29,http://techcrunch.com/2015/03/23/i-beat-a-patent-troll-and-you-can-too/
51,Important Notice About Your Twitch Account,jkap,http://blog.twitch.tv/2015/03/important-notice-about-your-twitch-account/
148,Why We Should Demand a Shorter Workweek,Tsiolkovsky,http://www.dsausa.org/shorter_work_weeks
60,The new authoritarianism,lkrubner,http://www.voxeu.org/article/new-authoritarianism
109,Pterosaur: Full power of Vim in each Firefox text field,airnomad,https://github.com/ardagnir/pterosaur
4,Twitch suffers security breach resets all passwords,entelechy0,http://www.pcgamer.com/twitch-suffers-security-breach-resets-all-passwords/
41,The Spacing of Binary Floating-Point Numbers,wglb,http://www.exploringbinary.com/the-spacing-of-binary-floating-point-numbers/
229,The decline in unionization has fed the rise in incomes at the top,Tsiolkovsky,http://www.imf.org/external/pubs/ft/fandd/2015/03/jaumotte.htm
5,Slack in Talks with Investors for a $2.5B Valuation,crdr88,http://techcrunch.com/2015/03/23/slacks-in-talks-with-coatu-others-for-another-round-at-a-2-5b-valuation/
10,Why we are moving our startup from Silicon Valley to Seattle,pmcpinto,https://medium.com/@KoriDHandy/why-we-are-moving-our-startup-from-silicon-valley-to-seattle-e5cc8bc6db94
7,Meet Cyanogen the Startup That Wants to Steal Android from Google,ghosh,http://www.forbes.com/sites/miguelhelft/2015/03/23/meet-cyanogen-the-startup-that-wants-to-steal-android-from-google-2/
26,The Apple Watch Is the Perfect Wrist Piece for Dystopia,Tsiolkovsky,http://motherboard.vice.com/read/the-apple-watch-is-the-perfect-wrist-piece-for-dystopia
4,OrientDB?,reconstrukt,
53,Diamonds are Bullshit (2013),karenxcheng,http://blog.priceonomics.com/post/45768546804/diamonds-are-bullshit?utm_source=pocket&utm_medium=email&utm_campaign=pockethits
3,Peak Cable,shawndumas,http://www.asymco.com/2015/03/19/peak-cable/#identifier_0_7041
618,I Am Sam Altman President of Y Combinator.  AMA,sama,
220,“So many people spend their working lives doing jobs they think are unnecessary”,bootload,http://www.theguardian.com/books/2015/mar/21/books-interview-david-graeber-the-utopia-of-rules
3,Large Hadron Collider may confirm existence of parallel universes in a few days,kaiwen1,http://www.express.co.uk/news/world/565315/Scientists-at-Large-Hadron-Collider-hope-to-make-contact-with-PARALLEL-UNIVERSE-in-days
151,Lee Kuan Yew Founding Father and First Premier of Singapore Dies at 91,janineyoong,http://www.nytimes.com/2015/03/23/world/asia/lee-kuan-yew-founding-father-and-first-premier-of-singapore-dies-at-91.html
24,Study Finds 'Corporate Takeover' of First Amendment,hackuser,http://www.nytimes.com/2015/03/24/us/first-amendment-patron-saint-of-protesters-is-embraced-by-corporations.html
5,Announcing embeddable comment threads,cocoflunchy,http://www.redditblog.com/2015/03/announcing-embeddable-comment-threads.html
5,Ask HN: Would you run your startup on Chromebooks?,relaunched,
5,Show HN: Sweetheart.io – Monthly Romantic Postcards,david_shaw,https://sweetheart.io
6,Emails Show Bush Coordinated with Florida Legislature for Favorable Primary Date,etiam,https://firstlook.org/theintercept/2015/03/23/e-mails-show-jeb-bush-coordinating-florida-legislature-set-favorable-primary-election-system/
12,Ask HN: What is the single most impressive item you've seen on a resume?,mojoe,
8,Augmented Traffic Control: A tool to simulate network conditions,chantra,https://code.facebook.com/posts/1561127100804165/augmented-traffic-control-a-tool-to-simulate-network-conditions/
4,Amazon doesn't want you to know how many data demands it gets,tdaltonc,http://www.zdnet.com/article/amazon-dot-com-the-tech-master-of-secrecy/
15,Help the Radare Project Host the Radare Summer of Code,crowell,
6,RMS: Free Software and Your Freedom,lettergram,https://www-s.acm.illinois.edu/stallman-uiuc-2015-03-16.webm
12,How Steve Jobs Trained His Own Brain,denzil_correa,http://www.inc.com/geoffrey-james/how-steve-jobs-trained-his-own-brain.html
10,Valve employee handbook in practice,noname42,http://www.glassdoor.com/Reviews/Valve-Corporation-Reviews-E24849.htm
211,Five Years’ Time,gdillon,https://medium.com/@gkoberger/five-years-time-6a6ae1157a66
3,Ask HN: How do/could you use Mechanical Turk,spdustin,
6,How I hacked India’s biggest startup,crazydiv,http://thenextweb.com/insider/2015/03/23/how-i-hacked-indias-biggest-startup/
210,Your wifi shows me where you live work and travel,viraptor,http://blog.viraptor.info/post/your-wifi-shows-me-where-you-live-work-and-travel
8,Webflow's YC acceptance story [video],purpleturtle,http://thenextweb.com/entrepreneur/2015/03/23/video-sergie-magdalin-of-webflow-explains-his-acceptance-into-y-combinator/
3,Twitch compromised,turshija,http://venturebeat.com/2015/03/23/change-your-twitch-password-company-warns-of-possible-unauthorized-hack/
90,Awesome-C: A curated list of awesome C frameworks libraries resources,adamnemecek,https://notabug.org/koz.ross/awesome-c
4,Partnering with Adobe on new contributions to IE's web platform,cleverjake,http://blogs.msdn.com/b/ie/archive/2015/03/23/partnering-with-adobe-on-new-contributions-to-our-web-platform.aspx
6,Twitch.tv Breached (email from Twitch),endianswap,http://pastebin.com/LJbe5tr1
3,Costa Rica is now running completely on renewable energy,gcoleman,http://qz.com/367985/costa-rica-is-now-running-completely-on-renewable-energy/
8,SecureDrop 0.3 with the results from our third security audit,handsomeransoms,https://freedom.press/blog/2015/03/announcing-securedrop-0.3
3,Learning to program is a loser's game,vdaubry,http://www.cs.uni.edu/~wallingf/blog/archives/monthly/2015-03.html#e2015-03-10T16_45_16.htm
7,Congress Wants to Eliminate Protections for Some of Your Most Sensitive Records,HillRat,http://www.slate.com/blogs/future_tense/2015/03/23/data_security_and_breach_notification_act_would_eliminate_protections_for.html
10,Best Way to Build Tech Skills Without Quitting Your Job?,SunTzu55,http://news.dice.com/2015/03/23/building-your-tech-skills-without-quitting-your-job/
50,A personal account of how call out culture has harmed teaching,platz,http://whitehotharlots.tumblr.com/post/114067452180/a-personal-account-of-how-call-out-culture-has
3,History of Mathematics archive,vimalvnair,http://www-history.mcs.st-and.ac.uk/
4,Back to the Future: The Story of Squeak a Practical Smalltalk Written in Itself,lukego,http://ftp.squeak.org/docs/OOPSLA.Squeak.html
5,Largest-ever meteorite crater found in Australian outback,yuashizuki,http://www.telegraph.co.uk/news/worldnews/australiaandthepacific/australia/11489673/Largest-ever-meteorite-crater-found-in-Australian-outback.html
14,The Share-the-Scraps Economy,edward,http://robertreich.org/post/109894095095
5,FBI lets a criminal walk rather than give details of their phone spying system,alexcasalboni,http://www.ksl.com/?nid=157&sid=33878539
4,Uber users drivers at risk without insurance (Canada),hnnewguy,http://globalnews.ca/news/1898833/uber-users-drivers-at-risk-without-proper-insurance-coverage/
10,Profiling DDL Statements: MySQL versus PostgreSQL,avandeursen,http://blog.minicom.nl/blog/2015/03/08/profiling-ddl-statements/
138,Plugging a 1986 Mac Plus into the Modern Web (2013),franze,http://www.keacher.com/1216/how-i-introduced-a-27-year-old-computer-to-the-web/
471,The GNU Manifesto Turns Thirty,Tloewald,http://www.newyorker.com/business/currency/the-gnu-manifesto-turns-thirty?intcid=mod-latest
218,Java is Pass-by-Value Dammit,xvirk,http://javadude.com/articles/passbyvalue.htm
45,Making Phil Libin style cohort visualizations available to everyone,rywalker,https://www.airpair.com/keen-io/posts/making-phil-libin-style-cohort-visualizations-available-to-everyone
28,Q&A with DJ Patil Chief Data Scientist at the White House,ryan_j_naughton,http://fivethirtyeight.com/datalab/dj-patil-white-house-chief-data-scientist-interview/
3,Stupid Recruiter Trick: “Where Else Are You Interviewing?”,fecak,http://jobtipsforgeeks.com/2015/03/23/srt1/
9,Motivated people don't need to be told what to do,gadr90,http://firstdoit.com/spotify-lessons-autonomy/
3,Twitter is facing a class action lawsuit for gender discrimination,brandonlipman,http://www.theverge.com/2015/3/21/8270585/twitter-gender-discrimination-lawsuit-tina-huang
5,14 Best Python Pandas Features,futuristdata,http://dataconomy.com/14-best-python-pandas-features/
3,The Economics of Busking,ryan_j_naughton,http://priceonomics.com/the-economics-of-busking/
39,Why I stopped selling courses on Udemy (2014),hoodoof,http://osherove.com/blog/2014/5/7/why-i-stopped-selling-courses-on-udemy.html
364,Elon Musk: Tesla cars will have “autopilot mode” by summer,rjshade,http://www.nytimes.com/2015/03/20/business/elon-musk-says-self-driving-tesla-cars-will-be-in-the-us-by-summer.html
7,How terrorism works,igonvalue,http://www.theguardian.com/books/2015/jan/31/terrorism-spectacle-how-states-respond-yuval-noah-harari-sapiens
523,Foreign Linux: Run Linux binaries on Windows without drivers or modification,anacleto,https://github.com/wishstudio/flinux
23,Introducing $Cashtags by Square Cash,chirau,https://cash.me/
932,Announcing Starfighter,jsnell,http://www.kalzumeus.com/2015/03/09/announcing-starfighter/
78,PostgreSQL Data Migration Tips,throughnothing,http://engineering.tilt.com/7-postgresql-data-migration-hacks/
12,Show HN: Over 120 places to promote your software,mypresences,https://www.mypresences.com/services/#Software%20Company_
9,Ask HN: What is the most attractive valuable and learnable skill?,boldpanda,
3,The Last Line Effect [PDF File],AndreyKarpov,http://www.st.ewi.tudelft.nl/~mbeller/publications/2015_beller_zaidman_karpov_the_last_line_effect_preprint.pdf
37,A Declaration of the Independence of Cyberspace,jeremynixon,https://projects.eff.org/~barlow/Declaration-Final.html
10,Show HN: Getting 10x Developers 10x Pay,aakilfernandes,http://develodex.com/
9,Priime (YC W15) – A new way to edit photos on the iPhone,digisth,https://medium.com/@priime/introducing-priime-9e6b0dbd8598
12,Show HN: Coal Mine – An Open-Source Python3 Alternative to Dead Man's Snitch,jik,https://pypi.python.org/pypi/coal_mine
6,Top sites built with PHP,dan_siepen,http://coderfactory.co/posts/top-sites-built-with-php
59,Ask HN: Do you meditate?,mattbettinson,
320,California has about one year of water left,nickgrosvenor,http://www.latimes.com/opinion/op-ed/la-oe-famiglietti-drought-california-20150313-story.html
35,Ask HN: Former freelance client screwed me. Having trouble moving on. Advice?,adtruth,
3,Tron map,drewda,http://www.citylab.com/design/2015/03/a-mesmerizing-futuristic-map-with-animated-traffic-and-glowing-buildings/388285/
8,Ask HN: What's the purpose of the upvote,kolodny,
6,Lattice: Resilient sub-structure for your microservice,makmanalp,http://lattice.cf/index.html
41,Reforming the Mathematical Language of Physics (2002) [pdf],aethertap,http://geocalc.clas.asu.edu/pdf/OerstedMedalLecture.pdf
155,Career-Changing Programming Books,monti004,http://www.nomachetejuggling.com/2014/02/05/top-10-career-changing-programming-books/
125,RuboCop – A Ruby static code analyzer,matugm,http://batsov.com/rubocop/
7,Computer Color is Broken,pdq,https://www.youtube.com/watch?v=LKnqECcg6Gw
205,Why blocks make Ruby methods slower,chippy,https://www.omniref.com/ruby/2.2.0/symbols/Proc/yield?#annotation=4087638&line=711&hn=1
127,My Weird Ruby,adamesque,http://awardwinningfjords.com/2015/03/03/my-weird-ruby.html
109,Why This Tech Bubble is Worse Than the Tech Bubble of 2000,edwinespinosa09,http://blogmaverick.com/2015/03/04/why-this-tech-bubble-is-worse-than-the-tech-bubble-of-2000/
18,Motion sensing using the doppler effect,nreece,http://danielrapp.github.io/doppler/
26,Contracts.ruby – Code contracts for Ruby,imd23,http://egonschiele.github.io/contracts.ruby/
21,The story behind 'Modular Rails',tn6o,http://samurails.com/books/story-behind-modular-rails/
214,The billionaire’s typewriter,Tomte,http://practicaltypography.com/billionaires-typewriter.html
231,Hacker's guide to Neural Networks,eaxitect,http://karpathy.github.io/neuralnets/
69,Ruby 2.2.1 Released,gregmolnar,https://www.ruby-lang.org/en/news/2015/03/03/ruby-2-2-1-released/
7,Goofy: OS X client for Facebook Messenger,uptown,http://www.goofyapp.com/
15,Plugging a 1986 Mac Plus into the Modern Web,tanglesome,http://kernelmag.dailydot.com/issue-sections/features-issue-sections/12228/mac-plus-modern-web/
402,The Matasano Crypto Challenges,sweis,http://cryptopals.com/
508,Employee Equity,dko,http://blog.samaltman.com/employee-equity
7,A blurring view for Android,Renat,http://developers.500px.com/2015/03/17/a-blurring-view-for-android.html
36,The GNU Manifesto (1985),grflynn,https://www.gnu.org/gnu/manifesto.html
17,Large Scale Payments Systems and Ruby on Rails,_harry,http://nerds.airbnb.com/large-scale-payments-systems-ruby-rails/
14,Show HN: Decruft your Rails filters with FilterDecrufter,tvalent2,https://techblog.livingsocial.com/blog/2015/02/27/filter-decrufter/
75,New Sublime Text 3 New Beta,ishansharma,http://www.sublimetext.com/3
132,Fundraising Mistakes Founders Make,rickharrison,http://blog.samaltman.com/fundraising-mistakes-founder-make
4,Ask HN: Why don't most NoSQL DBMSs have “pointers”?,nnq,
13,10+ Years of Rails with DHH,adamstac,http://thechangelog.com/145/
309,TempleOS is applying to Y Combinator. Partners desired send an email,TerryADavis,http://www.templeos.org/TempleOS.html
213,GCC 4.9 is doing “some seriously crazy shit” according to Linus Torvalds,jdoliner,https://lkml.org/lkml/2014/7/24/584
4,What Every Programmer Should Know About Memory,luu,http://www.akkadia.org/drepper/cpumemory.pdf
140,Try Git,Ethan_Mick,https://try.github.io/levels/1/challenges/1
18,The complete story of Paris-8 university going for Krita Blender Natron,mariuz,http://libregraphicsworld.org/blog/entry/the-complete-story-of-paris-8-university-going-for-krita-blender-natron
12,InstaSource: On-demand tech / coding outsourcing service for everyone,yagil,https://www.instasource.co/
36,PfSense 2.2.1,neiesc,https://blog.pfsense.org/?p=1661
5,Square $Cashtags,kapkapkap,https://www.youtube.com/watch?v=16Y4pDr8iZY
5,Reddit comment threads are now embeddable,taivare,http://venturebeat.com/2015/03/23/reddit-comment-threads-are-now-embeddable/
96,The Dangerous Effects of Reading,henrik_w,http://blog.davidtate.org/2011/12/the-dangerous-effects-of-reading/
5,A day in the life of an Apple Watch user,shawndumas,http://www.idownloadblog.com/2015/03/21/a-day-in-the-life-of-an-apple-watch-user/
5,The Four-Russians speedup (1997) [pdf],dhruvbird,http://users-cs.au.dk/cstorm/courses/AiBS_e13/papers/Gusfield97_FourRussians.pdf
21,Numerous security holes in Tails 1.3,Sami_Lehtinen,https://tails.boum.org/security/Numerous_security_holes_in_1.3/index.en.html
7,How to design a REST API,lobo_tuerto,http://blog.octo.com/en/design-a-rest-api/
89,See-Through Solar Is Tomorrow’s Threat to Oil,antr,http://www.bloomberg.com/news/articles/2015-03-23/see-through-solar-is-tomorrow-s-threat-to-oil
9,Introducing Layout from Instagram,ggonweb,http://blog.instagram.com/post/114416360957/layout-from-instagram
1,Heap is looking for our first sales hire,raviparikh,https://heapanalytics.com/jobs#sales
67,Chinua Achebe African Literary Titan Dies at 82 (2013),igonvalue,http://www.nytimes.com/2013/03/23/world/africa/chinua-achebe-nigerian-writer-dies-at-82.html
10,Show HN: Fufox.net – Dropbox without limits and 100% free,fufoxofficial,http://www.fufox.net/
7,An Art Auction for Computer Code,kelvintran,http://www.newyorker.com/magazine/2015/03/30/beautiful-code
10,Play War: Homemade Recreational Battlefields,benbreen,https://placesjournal.org/article/play-war-paintball-battlefields/
4,This string of characters will probably crash your Chrome tab on OS X,ot,http://www.theverge.com/2015/3/20/8267443/crash-google-chrome-mac-os-x-text
3,Ask HN: Why do you think SRTP/ZRTP usage is not more widespread?,newman314,
79,A Comparison of Log-Structured Merge (LSM) and Fractal Tree Indexing,ddorian43,http://highscalability.com/blog/2014/8/6/tokutek-white-paper-a-comparison-of-log-structured-merge-lsm.html
7,Show HN: 24 Kisses – Hack your relationship,scottieb33,https://24kisses.com/
4,The “Sandwich Approach” Undermines Your Feedback (2013),Mz,https://hbr.org/2013/04/the-sandwich-approach-undermin/
6,Learn JavaScript for complete beginners?,andreasholt,
12,Hacker Conferences Database,salar,http://hacker-conferences-database.silk.co/
3,Ted Cruz dot com: A domain name cautionary tale,tanglesome,http://www.zdnet.com/article/ted-cruz-dot-com-a-domain-name-cautionary-tale/
4,The Automatic Violin,mikejdw,https://medium.com/@mike_j_edwards/the-automatic-violin-85e2dad571cd
8,Six Years In. A Few Thoughts on Foursquare,uptown,https://medium.com/@dens/six-years-in-a-few-thoughts-on-foursquare-1ec31cbbe51c
3,Mordechai Vanunu – Paying a libel suit to the israel news paper,th0br0,https://www.indiegogo.com/projects/paying-a-libel-suit-to-the-israel-news-paper--13
3,An end to fake scientific papers,drallison,http://retractionwatch.com/2015/03/23/an-end-to-fake-papers-new-software-to-check-for-scigen-created-manuscripts/
152,Razorpay (YC W15) offers Stripe-style payment experience in India,harshilmathur,http://techcrunch.com/2015/03/22/razorpay-offers-stripe-style-payments-focused-squarely-on-indian-e-commerce-plays/
3,Five Thirty Eight's Totally Subjective Presidential Predictions,crdr88,http://fivethirtyeight.com/datalab/listen-to-our-totally-subjective-presidential-odds-for-march-2015/
75,GitHub Flow Like a Pro with These 13 Git Aliases,NicoJuicy,http://haacked.com/archive/2014/07/28/github-flow-aliases/
60,Linux kernel initialization process part 3,0xAX,https://github.com/0xAX/linux-insides/blob/master/Initialization/linux-initialization-3.md
116,Beating the compiler,snoopybbt,http://www.roguelazer.com/2015/02/beating-the-compiler/
13,Three simple rules for building data products that people will actually use,trefn,http://highscalability.com/blog/2015/3/23/three-simple-rules-for-building-data-products-that-people-wi.html
6,Yik Yak Liberty University and the end of cultural monoliths,ajaymehta,http://fusion.net/story/108086/yik-yak-liberty-university-and-the-end-of-cultural-monoliths/
5,Whisper suffers from critical security flaws,joewee,http://www.xipiter.com/musings/a-confederacy-of-privacy-dunces-what-we-found-under-the-hood-of-an-anonymous-chat-app-used-by-millions
668,Replacing Photoshop with NSString,aaronbrethorst,http://cocoamine.net/blog/2015/03/20/replacing-photoshop-with-nsstring/
468,Make Money Online: Documenting 10 Years of Failure,johnward,http://johnathanward.com/make-money-online-failure/
11,Official SpaceX Photos,tilt,https://www.flickr.com/photos/spacexphotos/
3,Show HN: Square cash launches cashtags & 1.5% payment processing for businesses,kunle,https://cash.me
119,A Double Eclipse of the Sun,vinnyglennon,http://apod.nasa.gov/apod/ap150322.html
10,Augmented Traffic Control: A tool to simulate network conditions,tilt,https://github.com/facebook/augmented-traffic-control
17,The Internet is mostly forms. And they still suck,mmonihan,https://medium.com/@mattmonihan/the-internet-is-still-mostly-forms-e4bf98acffd1
229,AT&T Charging Customers to Not Spy on Them,jeremynixon,https://gigaom.com/2015/02/19/dont-let-att-mislead-you-about-its-29-privacy-fee/
92,Mentors Are the Secret Weapons of Successful Startups,mw67,http://techcrunch.com/2015/03/22/mentors-are-the-secret-weapons-of-successful-startups/
3,Ask HN: Should I offer my app on a daily deal site?,flippyhead,
9,Dell Does a SuperFish: Exploiting Dell Service Tag Detector,orf,http://tomforb.es/dell-system-detect-rce-vulnerability
228,Is Your VirtualBox Reading Your E-Mail? Reconstruction of FrameBuffers from VRAM,brtmr,https://hsmr.cc/palinopsia/
151,Ask HN: What startups are working on hard technically challenging problems?,mtae,
53,“Science as a Vocation” by Max Weber (1918) [pdf],Thevet,http://anthropos-lab.net/wp/wp-content/uploads/2011/12/Weber-Science-as-a-Vocation.pdf
8,The new Stripe Connect,krithix,https://stripe.com/blog/the-new-connect
110,Zigbee light link master key,officialjunk,https://mobile.twitter.com/MayaZigBee/status/579723961661022209
17,SpaceX Puts Its Images in the Public Domain,evo_9,http://www.npr.org/blogs/thetwo-way/2015/03/23/394801108/spacex-puts-its-images-in-the-public-domain
26,China’s Internet Boom Starts to Fade,shahocean,http://www.bloomberg.com/news/articles/2015-03-22/as-nasdaq-soars-china-s-alibaba-led-dot-com-boom-starts-to-fade
8,Why isn't remote work more popular?,jakerella86,http://scottberkun.com/2015/why-isnt-remote-work-more-popular/?utm_content=buffer3b62b&utm_medium=social&utm_source=twitter.com&utm_campaign=buffer
7,The science of why stepping on Legos hurts,zabramow,http://qz.com/366858/legos-are-so-painful-to-step-on-because-of-physics/
171,12-minute Mandelbrot: fractals on a 50 year old IBM 1401 mainframe,dezgeg,http://www.righto.com/2015/03/12-minute-mandelbrot-fractals-on-50.html
9,Interactive infographic on what did developers ask 5000 app users worldwide,zaoudis,https://www.pollfish.com/infographic/developer
5,Show HN: A smart sliding-puzzle game for your terminal built in golang,pravj,https://github.com/pravj/puzzl
1,TerrAvion (YC W14): Hiring Software Engineers to grow our aerial imagery service,cornellwright,http://www.terravion.com/careers.html?hn
126,FinderPath,steeples,http://bahoom.com/finderpath/
138,Ask HN: How do you read Academic Papers?,milesf,
10,Pwn2Own 2015: The year every web browser went down,tanglesome,http://www.zdnet.com/article/pwn2own-2015-the-year-every-browser-went-down/
6,Dizzying Pre-IPO Tech Values Spurred by Rush of Hedge-Fund Money,antr,http://www.bloomberg.com/news/articles/2015-03-23/dizzying-pre-ipo-tech-values-spurred-by-rush-of-hedge-fund-money
126,ImplicitCAD: Powerful Open-Source Programmatic CAD,ics,http://www.implicitcad.org/
94,Joe's Own Editor 4.0 Released,jhallenworld,https://sourceforge.net/p/joe-editor/mercurial/ci/default/tree/NEWS.md
97,On open-sourcing existing code,luu,https://www.snellman.net/blog/archive/2015-03-19-cant-even-throw-code-across-the-wall/
104,Mg: an Emacs-like editor in 160 kb,snoopybbt,http://homepage.boetes.org/software/mg/
166,The Pez Outlaw,CrocodileStreet,http://www.playboy.com/articles/pez-outlaw
13,Building a mini Trello using Firebase in 2 hours!,kshitizshankar,http://blog.stackhive.com/post/114386894969/login-sign-up-and-a-real-time-app-using-firebase
4,LHC restarts this week aiming to disprove Big Bang theory,leoncrutchley,http://www.telegraph.co.uk/news/science/large-hadron-collider/11489442/Big-Bang-theory-could-be-debunked-by-Large-Hadron-Collider.html
3,LibreSSL affected by 6 of 14 errors fixed in openssl update of March 19th 2015,tback,http://ftp.openbsd.org/pub/OpenBSD/LibreSSL/libressl-2.1.6-relnotes.txt
51,The Coming Ice Age: A true scientific detective story (1958),mkempe,http://harpers.org/archive/1958/09/the-coming-ice-age/
130,The Terrible Technical Interview,mtviewdave,http://techcrunch.com/2015/03/21/the-terrible-technical-interview/
4,Grep orientated programming,physicsistic,http://john.freml.in/grep-orientated-programming
8,Ask HN: Is there a place where all developer conferences are listed?,geekam,
54,Funds Run by Robots Now Account for $400B,sergeant3,http://www.bloomberg.com/news/articles/2015-03-16/smart-beta-etfs-attract-billions-with-critics-blaming-dumb-money
177,Solving the Go Challenge 1 in Erlang,davidw,https://medium.com/@jlouis666/solving-the-go-challenge-1-in-erlang-8b1e0a0a5044
59,Frankenimage – Reconstructing images with pieces from an image database,sebkomianos,http://gimlids.github.io/frankenimage/
5,New SecureBoot Concerns Arise with Windows 10,turrini,http://www.phoronix.com/scan.php?page=news_item&px=SecoreBoot-Windows-10
167,Learn Prolog Now,profquail,http://www.learnprolognow.org/lpnpage.php?pageid=online
159,Ten years since Splinter Cell: Chaos Theory shipped,angrow,http://www.clicknothing.typepad.com/click_nothing/2015/03/ten-years-down.html
87,The B-52 Just Keeps on Flying,dnetesn,http://www.airspacemag.com/flight-today/b-52-just-keeps-flying-180953933/
9,BiOS Hacking,CapitalistCartr,https://www.schneier.com/blog/archives/2015/03/bios_hacking.html
5,Show HN: Puzzle game Nerdy Dwarf I have just released for free [Unity],thorn,http://ysmolsky.itch.io/nerdy-dwarf
6,Calling bullshit on the safe spaces panic,breadbox,http://freethoughtblogs.com/hetpat/2015/03/23/calling-bullshit-on-the-safe-spaces-panic/
160,Ask HN: How would you implement a verifiable open-source web application?,gvido,
3,Don’t Invent XML Languages (2006),redthrow,http://www.tbray.org/ongoing/When/200x/2006/01/08/No-New-XML-Languages
5,Java Web App Architecture in Takes Framework,javinpaul,http://www.yegor256.com/2015/03/22/takes-java-web-framework.html
3,The Precise (and Narrow) Limits on U.S. Economic Espionage,foobarqux,http://www.lawfareblog.com/2015/03/the-precise-and-narrow-limits-on-u-s-economic-espionage/
4,BBC News switches PC users to responsive site,return_0e,http://www.bbc.co.uk/news/technology-31966686
4,Announcing Multi-Dimensional Scaling,skjhn,http://blog.couchbase.com/introducing-multi-dimensional-scaling
239,I Gave My Child Autism,anotherevan,http://www.backfromnature.org/2015/03/i-gave-my-child-autism.html
96,Ask HN: RapGenius for code?,fizwhiz,
6,New Zealand Spied on WTO Director Candidates,peterkelly,https://firstlook.org/theintercept/2015/03/22/new-zealand-gcsb-spying-wto-director-general/
9,Ask HN: Career Advice. Grad School vs. Industry?,chuie,
6,Boeing patents 'Star Wars'-style force fields,lettergram,http://www.cnet.com/news/boeing-patents-star-wars-style-force-fields/
6,Show HN: Turn your work into a game but don't tell your boss,itemz,http://itemzapp.com
