SCORE,TITLE,BY,URL
275,Ever wondered how device drivers are reverse engineered?,nkurz,http://www.linuxvoice.com/drive-it-yourself-usb-car-6
839,We are under attack,greatfire,https://en.greatfire.org/blog/2015/mar/we-are-under-attack
84,Ask HN: I'm looking for a Spotify software engineer to speak to,azeirah,
94,Rainwater Harvesting to Replenish Underground Water in Rajasthan India,grok2,http://www.ecotippingpoints.org/our-stories/indepth/india-rajasthan-rainwater-harvest-restoration-groundwater-johad.html
107,Video Streaming with RethinkDB Changefeeds,ndarilek,https://github.com/AtnNn/rethinkdb-stream
381,YouTube puts the final nail in the loudness wars' coffin,anigbrowl,http://productionadvice.co.uk/youtube-loudness/
3,Show HN: HaikunatorPHP – Generate Heroku-like random names,AtroxDev,https://github.com/Atrox/haikunatorphp
5,Show HN: Learn to design 3D printable models by writing code,iamwil,http://www.designingwithopenscad.com/
608,I Can’t Write My Name in Unicode,luu,https://modelviewculture.com/pieces/i-can-text-you-a-pile-of-poo-but-i-cant-write-my-name
18,What is the Sun made of?,DiabloD3,https://medium.com/starts-with-a-bang/throwback-thursday-what-is-the-sun-made-of-d36adf7d0fe4
9,Where can I report an incorrect “exit only” sign on 101 South exit 498B,dhruvbird,http://imgur.com/FhZUOp3
9,Show HN: Translate text through random languages 35 times,dfkoz,http://dfkoz.com/lost-in-translation/
11,An Open Letter to YC Founders on Demo Day Eve,antr,http://startupljackson.com/post/114347589480/open-letter-to-yc-founders-on-fundraising
3,Advanced AngularJS Structure with Gulp Node and Browserify,omarfouad,http://omarfouad.com/blog/2015/03/21/advanced-angularjs-structure-with-gulp-node-and-browserify/
17,A lighter Core,a0,https://blogs.janestreet.com/a-lighter-core/
4,Hex clock,damian2000,http://www.jacopocolo.com/hexclock/
9,Show HN: 99 Haskell,bramgg,http://99haskell.org/
16,Synereo – A decentralized attention economy-based social network,yuvadam,http://www.synereo.com/
41,Ask HN: Feeling pressured to accept startup job offer quickly,yahth,
4,Opinion: Just How Nepotistic Are We (NY Times),rasengan,http://www.nytimes.com/2015/03/22/opinion/sunday/seth-stephens-davidowitz-just-how-nepotistic-are-we.html?_r=0
152,Eloquent JavaScript The Annotated Version,gordonzhu,https://docs.google.com/document/d/1aa2-HtUglQrAps31s4LdTPVsiFb1BxhyjZolxeezzcI/edit
150,Ask HN: Do you take nootropics?,rayalez,
42,The Man Who Conquered Then Warped Silicon Valley,enkiv2,http://www.washingtonpost.com/opinions/how-one-mans-utopian-vision-for-the-internet-conquered-and-then-badly-warped-silicon-valley/2015/03/20/7dbe39f8-cdab-11e4-a2a7-9517a3a70506_story.html
3,Criticism and Ineffective Feedback,luu,https://www.kateheddleston.com/blog/criticism-and-ineffective-feedback
222,I Hate the News (2006),oskarth,http://www.aaronsw.com/weblog/hatethenews
426,The 'SimCity' Empire Has Fallen and 'Skylines' Is Picking Up the Pieces,DiabloD3,http://motherboard.vice.com/read/maxis-is-dead-but-this-game-is-better-than-simcity
21,Building the Facebook News Feed with Relay,TheAceOfHearts,http://facebook.github.io/react/blog/2015/03/19/building-the-facebook-news-feed-with-relay.html
49,Running Apache Kafka at Scale,boredandroid,https://engineering.linkedin.com/kafka/running-kafka-scale
8,How English Ruined Indian Literature,mushiake,http://www.nytimes.com/2015/03/22/opinion/sunday/how-english-ruined-indian-literature.html
81,Hacking BIOS chips isn't just the NSA's domain anymore,mseri,http://www.wired.com/2015/03/researchers-uncover-way-hack-bios-undermine-secure-operating-systems/
9,Problem DFU-flashing the intel edison? Look no further,opless,http://www.simonwaite.com/projects/intel-edison
11,Can 3 coding bootcamp graduates build a product in a week?,gregaubs,https://medium.com/@oslokommuneper/the-one-week-startup-28b5efadc734
3,What a 9000-Year-Old Spruce Tree Taught Me,dnetesn,http://nautil.us/issue/22/slow/what-a-9000_year_old-spruce-tree-taught-me-
7,Tech Money Sends Funds on the Hunt for Unicorns,carlchenet,http://www.nytimes.com/2015/03/23/business/dealbook/tech-money-sends-funds-on-the-hunt-for-unicorns.html
46,DotLisp – A Lisp dialect for .Net,cichli,http://dotlisp.sourceforge.net/dotlisp.htm
4,Hilton Honors Flaw Exposed All Accounts,ca98am79,http://krebsonsecurity.com/2015/03/hilton-honors-flaw-exposed-all-accounts/
301,Goat Simulator Post Mortem,jermo,http://gamasutra.com/blogs/ArminIbrisagic/20150220/236427/Goat_Simulator_Post_Mortem.php
22,The Future is Here,benbreen,http://www.nybooks.com/articles/archives/2015/apr/02/william-gibson-future-is-here/
38,How Plentyoffish Conquered Online Dating (2009),danso,http://www.inc.com/magazine/20090101/and-the-money-comes-rolling-in.html
104,Velocity Raptor – an adventure in 2+1 dimensions,stared,http://www.testtubegames.com/velocityraptor.html
486,All Major Browsers Fall at Pwn2Own Day Two,wglb,https://threatpost.com/all-major-browsers-fall-at-pwn2own-day-2/111731
51,Ponte Tower [video],wglb,https://vimeo.com/51295174
9,What is Rust bad at?,neverminder,https://www.reddit.com/r/rust/comments/2zu3eo/what_is_rust_bad_at/
57,10000-Year-Old Stone Tool Site Discovered in Suburban Seattle,curtis,http://westerndigs.org/10000-year-old-stone-tool-site-discovered-in-suburban-seattle/
20,Full-Text Search in Javascript – Part 1: Relevance Scoring,bkanber,http://burakkanber.com/blog/machine-learning-full-text-search-in-javascript-relevance-scoring/
25,Interview with the trauma surgeon who took care of Dzhokhar Tsarnaev,thanatosmin,https://www.themarshallproject.org/2015/03/11/tending-to-tsarnaev
15,Observium: An auto-discovering network monitoring platform,based2,http://www.observium.org/
1,Pigeonly Is Hiring a Front End PHP Developer,cliffordkeeney,https://docs.google.com/document/d/1gI_Majtlq-n-ySxzXXiILekYKzzldfLZhLP8m8_a00I/edit?usp=sharing
78,Security flaw in New South Wales puts thousands of online votes at risk,DiabloD3,https://freedom-to-tinker.com/blog/teaguehalderman/ivote-vulnerability/
53,Simulating Service Discovery with Docker and Etcd,talwai,http://talwai.github.io/#/blog/post/discovery
48,Hijacking is Buffer Overflow (2001),eropple,http://paulgraham.com/hijack.html
123,Super Fuzzy Searching on PostgreSQL,dhruvbhatia,http://bartlettpublishing.com/site/bartpub/blog/3/entry/350
5,UK child psychotherapist believes smartphones harm youngsters,Pamar,http://www.telegraph.co.uk/news/health/children/11486167/Are-smartphones-making-our-children-mentally-ill.html
17,The Golang UK Conference – 2015,agonzalezro,http://www.golanguk.com/
39,Docker Swarm on Raspberry Pi Cluster,CSDude,http://matthewkwilliams.com/index.php/2015/03/21/swarming-raspberry-pi-part-1/
418,Curl 17 years old today,bagder,http://daniel.haxx.se/blog/2015/03/20/curl-17-years-old-today/
107,Martin Luther Insult Generator,samclemens,http://ergofabulous.org/luther/?
22,Designing great visualizations [pdf],shreyassaxena,http://www.tableau.com/sites/default/files/media/designing-great-visualizations.pdf
46,Show HN: Create a papercraft book from any ISBN – experiment with React and Node,AlexMuir,http://origamihub.com
3,Altering brain chemistry makes us more sensitive to inequality,amelius,http://www.sciencedaily.com/releases/2015/03/150319143414.htm
7,Compiling a kernel module for Android (part 1 of 3),emilianodc,http://www.emilianodellacasa.com/2014/compiling-a-kernel-module-for-android-part-1
221,In College and Hiding from Scary Ideas,jckt,http://www.nytimes.com/2015/03/22/opinion/sunday/judith-shulevitz-hiding-from-scary-ideas.html
3,Known Wikipedia Hoaxes,techdog,http://en.wikipedia.org/wiki/Wikipedia:List_of_hoaxes_on_Wikipedia
50,What’s So Great about Continued Fractions?,jonbaer,http://blogs.scientificamerican.com/roots-of-unity/2015/03/17/how-hard-do-continued-fractions-roc/
12,Three Majority Singularity Schools of Thought,mrdrozdov,http://www.yudkowsky.net/singularity/schools/
31,Efficient Nested React Components,bpierre,https://medium.com/@joshuawcomeau/efficient-nested-react-components-dd9347e9b3f3
58,Show HN: Firesize – On-the-fly image resizing no code required,vanstee,http://firesize.com/
26,No I didn't use the Web Crypto API,jorangreef,http://calvinmetcalf.com/post/103640348393/no-i-didnt-use-the-web-crypto-api
1,StatusPage.io (YC S13) is hiring dev #3 (Denver CO),scootklein,https://jobs.lever.co/statuspageio/0a8a9e28-79e9-40f0-ab0a-69c6afa8a2d5
17,Solitude and Leadership (2010),roarktoohey,https://theamericanscholar.org/solitude-and-leadership/
18,Show HN: A JavaScript console for minimalists with a WYSIWYG editor,ngduc,http://howjs.com
14,Graal Tutorial at CGO 2015 [video],chrisseaton,https://www.youtube.com/watch?v=Af9T9kFk1lM&feature=youtu.be
41,Promises Promises: A History of Debt [video],frrp,http://www.bbc.co.uk/programmes/b054zdp6/episodes/guide
29,Dragscroll – a tiny JS library which enables scrolling via mouse drag,xpostman,https://github.com/asvd/dragscroll
