SCORE,TITLE,BY,URL
10,The ELF Object File Format: Introduction (1995),of,http://www.linuxjournal.com/article/1059
18,Shoplocket is shutting down,patchfx,https://www.shoplocket.com
54,Hedging Against Getting Paid in Stock,barisser,http://barisser.com/2015/06/getting-paid-in-stock-hedging-as-an-individual/
20,Slavery Lasted Until Pearl Harbor,kentbrew,http://weeklysift.com/2014/03/31/slavery-lasted-until-pearl-harbor/
14,Google monitoring all conversations,gnostication,https://www.privateinternetaccess.com/blog/2015/06/google-chrome-listening-in-to-your-room-shows-the-importance-of-privacy-defense-in-depth
6,I'm Thinking of Releasing a TCP-Accelerated NGINX AMI on AWS. Thoughts?,ryno2019,
48,Greg Chesson has died,ChuckMcM,https://plus.google.com/u/0/+LaurenWeinstein/posts/bRdbj1B1qQG
43,Watson's Next Feat: Taking on Cancer,tacon,http://www.washingtonpost.com/sf/national/2015/06/27/watsons-next-feat-taking-on-cancer/
6,Mother Earth Mother Board (1996),signa11,http://archive.wired.com/wired/archive/4.12/ffglass_pr.html
5,No child left un-mined?,franzpeterstein,https://firstlook.org/theintercept/2015/06/27/child-left-un-mined/
93,Porting the Unity Editor to Linux: Stuff I Wish We’d Done Then,mariuz,http://natoshabard.com/post/122670082502/porting-the-unity-editor-to-linux-stuff-i-wish
110,Man shoots downs neighbor’s hexacopter,nkurz,http://arstechnica.com/tech-policy/2015/06/man-shoots-downs-neighbors-hexacopter-in-rural-drone-shotgun-battle/
15,The privacy paradox: The privacy benefits of privacy threats [pdf],csandreasen,http://www.brookings.edu/~/media/research/files/papers/2015/05/21-privacy-paradox-wittes-liu/wittes-and-liu_privacy-paradox_v10.pdf
1,iOS / iPad / iPhone / Apple Watch Hacker Needed – Drchrono,d8niel,https://www.hackerrank.com/tests/527036edb11ff/0ca5532381fbebad9fffaa28dc90475f
86,Letters to the Editor: Misleading Mathematicians [pdf],RhysU,http://www.ams.org/notices/201506/rnoti-p613.pdf
42,Are killer whales persons?,noondip,http://www.salon.com/2015/06/27/are_killer_whales_persons_the_more_we_learn_about_orcas_the_more_our_assumption_of_innate_superiority_looks_like_a_presumption/
124,Comparison of Erlang Runtime System and Java Virtual Machine [pdf],easyd,http://ds.cs.ut.ee/courses/course-files/To303nis%20Pool%20.pdf
26,These guys grow chairs,hxn,http://fullgrown.co.uk/
36,Promoting an open research culture,tokenadult,http://www.sciencemag.org/content/348/6242/1422.full
9,The Linux Kernel (1999),of,http://en.tldp.org/LDP/tlk/tlk.html
8,Linear Hash Functions (1999) [pdf],luu,http://www.tau.ac.il/~nogaa/PDFS/linhash13.pdf
38,Interrupts and Interrupt Handling in the Linux Kernel Part 5,0xAX,https://github.com/0xAX/linux-insides/blob/master/interrupts/interrupts-5.md
9,Ask HN: Any free tools (other than pen/paper) to plan application architectures,Sfi81,
37,Building a High-performance Computing Cluster Using FreeBSD (2003),anand-s,http://people.freebsd.org/~brooks/papers/bsdcon2003/fbsdcluster/
39,OCaml – Compiling Mini-ML to JavaScript,fredyr,http://www.lexicallyscoped.com/2015/06/28/miniml-compiler-to-js.html
21,Chrony – A versatile implementation of the Network Time Protocol ,ingve,http://chrony.tuxfamily.org/index.html
12,Hawaii Wrestles with Vagaries of Solar Power,stefap2,http://www.wsj.com/articles/hawaii-wrestles-with-vagaries-of-solar-power-1435532277
26,Universal Limits on Computation (2004) [pdf],anacleto,http://arxiv.org/abs/astro-ph/0404510
5,Online Lenders Offer New Competition for Banks,softdev12,http://www.wsj.com/articles/new-lenders-seek-to-eat-banks-lunch-1435520056
8,SculptGL gallery – Sculpting application in JavaScript,vmorgulis,http://stephaneginier.com/gallery
132,Understanding the Node.js Event Loop,antouank,https://nodesource.com/blog/understanding-the-nodejs-event-loop
54,When Is “ACID” ACID? Rarely (2013),nstart,http://www.bailis.org/blog/when-is-acid-acid-rarely/
11,Did stackoverflow just include the LGBT flag in the new logo?,yiedyie,http://stackoverflow.com/#hlogo
7,Show HN: Soapbox – Embed your message in any page with this URL shortener,soapbox,http://soapbox.alexsci.com/
88,How Rust Achieves Thread Safety,nxnfufunezn,http://manishearth.github.io/blog/2015/05/30/how-rust-achieves-thread-safety/
42,Why are prices online so unpredictable these days?,ericglyman,https://blog.paribus.co/2015/06/28/why-are-prices-online-so-unpredictable/
9,JCTools – Java Concurrency Tools for the JVM,xvirk,http://jctools.github.io/JCTools/
23,Ken Goldberg: Creative robots Kurzweil fallacy and what it means to be human,dnetesn,http://nautil.us/issue/20/creativity/ingenious-ken-goldberg
1096,Atom 1.0,mrbogle,http://blog.atom.io/2015/06/25/atom-1-0.html
21,Cycle Counting Memory Stalls Prefetch and Other Pitfalls,jpfau,https://endrift.com/mgba/2015/06/27/cycle-counting-prefetch/
4,Ask HN: How will you spend your extra second tomorrow?,mangeletti,
5,Always Be CodingA read every learning engineer should revisit,eliethesaiyan,https://medium.com/@davidbyttow/abc-always-be-coding-d5f8051afce2
11,Map of numeric types in Haskell,potomak,http://engineering.sumall.com/map-of-numeric-types-in-haskell/
23,Treatment of obesity with calorically unrestricted diets (1953) [pdf],DiabloD3,http://ajcn.nutrition.org/content/1/5/343.full.pdf
7,Applied Simplex Method for Deciding Future Coursework,cdaringe,http://cdaringe.com/applied-simplex-method-for-deciding-years-of-coursework/
72,Rate-limiting State: The edge of the Internet is an unruly place,gyre007,https://queue.acm.org/detail.cfm?id=2578510
10,Ask HN: What do you think of the anti-CSS debate?,donjh,
117,Brython – A Python 3 implementation for client-side web programming,delian66,http://www.brython.info/
7,A Better Algorithm for Area Proportional Venn and Euler Diagrams,nkurz,http://www.benfrederickson.com/better-venn-diagrams/
7,Penn Manor: The power of open in education [video],therover,http://summitblog.redhat.com/2015/06/24/open-source-stories-penn-manor-the-power-of-open-in-education/
12,2 Pi or Not 2 Pi?,jonthn,http://blog.wolfram.com/2015/06/28/2-pi-or-not-2-pi/
89,Breakdown of the NSA spying on French leaders,zmanian,http://electrospaces.blogspot.com/2015/06/wikileaks-publishes-some-of-most-secret.html#methods
9,Levitron – Anti-gravity top,mynegation,http://www.levitron.com/index.html
6,How Thync Uses Ultrasonic Waves to Calm You,prostoalex,http://www.digitaltrends.com/sports/thync-vibes-release-news/?utm_source=Sailthru&utm_medium=email&utm_term=DT%20Newsletter&utm_campaign=DT%20Newsletter%202015-06-02
4,A Book Buyer’s Lament,rosser,http://www.newyorker.com/books/page-turner/a-book-buyers-lament
9,Genetics: No more addictive personality,ccvannorman,http://www.nature.com/nature/journal/v522/n7557_supp/full/522S48a.html
4,How I Cured my RSI Pain (2010),dsr12,http://aaroniba.net/articles/tmp/how-i-cured-my-rsi-pain.html?ref
7,The Emily Programming Language,Strikingwolf,
29,What Happened After the North Dakota Oil Boom Went Bust,prostoalex,http://www.theatlantic.com/business/archive/2015/06/north-dakota-oil-boom-bust/396620/?utm_source=SFFB&amp;single_page=true
9,Email reminder 1d@gleym.com gives you a reminder in 1 day ,panon,
7,Typical computer science data structures implemented in Go,andygrunwald,https://github.com/emirpasic/gods
47,Walter Shawn Browne Chess Grandmaster Dies at 66,mark_l_watson,http://www.nytimes.com/2015/06/28/sports/walter-shawn-browne-chess-grandmaster-dies-at-66.html?emc=edit_th_20150628&nl=todaysheadlines&nlid=59761154
11,False Alarms in the Nuclear Age (2001),bendtheblock,http://www.pbs.org/wgbh/nova/military/nuclear-false-alarms.html
113,Increasing Variety on Pluto's Close Approach Hemisphere and a Dark Pole on Charon,benbreen,http://www.nasa.gov/feature/new-from-nasas-new-horizons-increasing-variety-on-plutos-close-approach-hemisphere-and-a/
9,Finite Automata and Their Decision Problems (1959),brudgers,http://www.cse.chalmers.se/~coquand/AUTOMATA/rs.pdf
33,Choosing good names,marcelocure,http://marcelo-cure.blogspot.com/2015/06/choosing-good-names.html?m=1
4,A statistical analysis of Cramer’s stock picking skills,cresusportfolio,https://cresusio.wordpress.com/2015/06/28/a-statistical-analysis-of-cramers-stock-picking-skills/
4,There is no correlation between austerity and debt reduction,MaysonL,http://equitablegrowth.org/2015/06/28/must-read-christian-odendahl-no-correlation/
7,The Tech Industry Is in Denial but the Bubble Is About to Burst,tallatmahmood,http://techcrunch.com/2015/06/26/the-tech-industry-is-in-denial-but-the-bubble-is-about-to-burst/
5,ISIS and the Lonely Young American,kilovoltaire,http://www.nytimes.com/2015/06/28/world/americas/isis-online-recruiting-american.html
74,Pip -t: A simple and transparent alternative to virtualenv in Python,fzumstein,http://blog.zoomeranalytics.com/pip-install-t/
39,Web performance: Cache efficiency exercise,graceofs,https://code.facebook.com/posts/964122680272229/web-performance-cache-efficiency-exercise/
10,The Immutable Stack – Part 1,romefort,http://romefort.net/the-immutable-stack-part-1/
167,Why Google Employees Quit (2009),andrelaszlo,http://techcrunch.com/2009/01/18/why-google-employees-quit/
154,Cancer reproducibility effort faces backlash,tlb,http://news.sciencemag.org/biology/2015/06/feature-cancer-reproducibility-effort-faces-backlash
113,Django Developers Survery Results,neokya,https://docs.google.com/forms/d/1Owv-Y_beohyCm9o2xPamdBnvjreNYoWai3rDloKZxWw/viewanalytics
15,End-To-End Arguments in System Design (1984) [pdf],brudgers,http://web.mit.edu/Saltzer/www/publications/endtoend/endtoend.pdf
276,‘I Don’t Believe in God but I Believe in Lithium’,pepys,http://www.nytimes.com/2015/06/28/magazine/i-dont-believe-in-god-but-i-believe-in-lithium.html
27,Mixtape of the Lost Decade (2011),DiabloD3,http://boingboing.net/2011/10/11/mixtape-of-the-lost-decade.html
146,Show HN: Effort to clone unmaintained SourceForge projects to GitHub,hydragit,https://a-sf-mirror.github.io/
46,Procedural Heightmap Terrain Generation,bemmu,https://www.seedofandromeda.com/blogs/58-procedural-heightmap-terrain-generation
79,How to compile C apps with musl and Clang,Procedural,https://procedural.github.io/How-to-compile-C-apps-with-musl-and-Clang/
