SCORE,TITLE,BY,URL
4,The Full-Time Job Is Dead,daviducolo,https://medium.com/backchannel/the-full-time-job-is-dead-b9528bda1c87
8,Return of the Prodigal Book,pepys,https://uniqueatpenn.wordpress.com/2015/06/29/return-of-the-prodigal-book/
71,Reviewing the Bitcoin Piñata,amirmc,https://mirage.io/blog/bitcoin-pinata-results
5,Amazon launches Prime Now in London - 1 hour delivery,polmolea,http://www.amazon.co.uk/b/ref=pn_uk_surl_lp?node=6584642031
65,The Chirp Distributed Filesystem,blacksqr,http://ccl.cse.nd.edu/software/chirp/
10,Google loses Java patent case against Oracle,puyask,http://www.cnet.com/news/supreme-court-refuses-to-hear-appeal-from-google-in-java-patent-case/
19,Ask HN: What are some podcasts you listen to?,avinassh,
396,Ask HN: How do you familiarize yourself with a new codebase?,roflc0ptic,
4,Can anyone estimate the total number of doors in the world? How?,afar,
22,Greek Bailout Fund,imartin2k,https://www.indiegogo.com/projects/greek-bailout-fund
13,Ask HN: Social anxiety and going to a conference alone,dinosaurs,
8,Google Photos Mislabels 2 Black Americans as Gorillas,somerandomness,https://www.yahoo.com/tech/google-photos-mislabels-two-black-americans-as-122793782784.html
8,Supreme Court won’t weigh in on Oracle-Google API copyright battle,thrwy10,http://arstechnica.com/tech-policy/2015/06/supreme-court-wont-weigh-in-on-oracle-google-api-copyright-battle/
29,Ask HN: My co-founders are trying to get rid of me. What should I do?,dramort,
6,We need to talk about startups,metalab,https://medium.com/@awilkinson/we-need-to-talk-about-startups-de611d6a7373
93,Woman Knocked Unconscious at Parade by Falling Drone,Doubleguitars,http://spdblotter.seattle.gov/2015/06/29/woman-knocked-unconscious-at-parade-by-falling-drone/
9,Windows Kerberos ticket theft and exploitation on other platforms,erglkjahlkh,https://mikkolehtisalo.wordpress.com/2015/06/29/copying-windows-kerberos-tickets-to-linux/
92,DragonFly BSD 4.2 released,ceratopisan,http://www.dragonflybsd.org/release42/
9,Automakers Tackle the Massive Security Challenges of Connected Vehicles,graceofs,http://blogs.wsj.com/cio/2015/06/25/automakers-tackle-the-massive-security-challenges-of-connected-vehicles?utm_source=hackernews
19,Immutable serialisable data structures in C++11,ingve,http://vitiy.info/immutable-data-and-serialisation-in-cpp11/
19,A Retrospective on Paradigms of AI Programming (2002),oskarth,http://www.norvig.com/Lisp-retro.html
4,Buffer and Transparency: salaries equity revenue fundraising etc.,ompemi,https://buffer.com/transparency
4,[libcurl security notice] libidn with bad UTF8 input,galapago,http://curl.haxx.se/mail/lib-2015-06/0143.html
64,Two Uber managers detained in France over 'illicit' low-cost service,edward,http://www.theguardian.com/technology/2015/jun/29/uber-managers-detained-france
6,Sad day for developers: SCOTUS denies Google's appeal on APIs,btilly,http://www.infoworld.com/article/2941103/java/scotus-denies-google-appeal-on-apis.html
27,Minimum salary required in London: £500k?,edward,http://firevlondon.com/2015/05/30/minimum-salary-required-in-london-500k/
175,Do the Simple Thing First: The Engineering Behind Instagram,technologizer,http://www.fastcompany.com/3047642/tech-forecast/do-the-simple-thing-first-the-engineering-behind-instagram
7,The Troubled Waters of Potosí (2014),Mz,http://therotarianmagazine.com/the-troubled-waters-of-potosi/
11,In Defense of Ethnography,Thevet,http://chronicle.com/article/In-Defense-of-Ethnography/231191/
1,EasyPost (YC S13) Is Hiring a VP of Logistics,jstreebin,https://www.easypost.com/jobs
8,Enterprise Cloudworks: One Platform No Code Any Application,Goatmouth,http://enterprisecloudworks.com/
14,Parsing a string as a 64-bit integer somehow,ingve,http://blogs.msdn.com/b/oldnewthing/archive/2015/06/29/10624284.aspx
18,Linux Uprobe: User-Level Dynamic Tracing,helper,http://www.brendangregg.com/blog/2015-06-28/linux-ftrace-uprobe.html
58,Show HN: Speedsums,refrigerator,http://www.speedsums.com
18,Lego to Replace Oil-Based Plastics  ,ranit,http://cen.acs.org/articles/93/i26/Lego-Replace-Oil-Based-Plastics.html
3,Army Ranger has impressive Instagram account – never judge book by cover,apompliano,http://behindthehandle.com/2015/06/22/bdsix-instagram-photographer/
121,When a Company Is Put Up for Sale in Many Cases Your Personal Data Is Too,gk1,http://www.nytimes.com/2015/06/29/technology/when-a-company-goes-up-for-sale-in-many-cases-so-does-your-personal-data.html
158,Project Fi Review: Cell Service from Google,nkurz,http://www.paulkuehnel.com/full-google-project-fi-review-a-multiple-cell-phone-network/
6,Coming in Cassandra 3.0: Materialized Views,tjake,http://www.datastax.com/dev/blog/new-in-cassandra-3-0-materialized-views
8,On Games and Transactional Memory from the May 2015 C++ Standard Meeting,ingve,https://www.ibm.com/developerworks/community/blogs/5894415f-be62-4bc0-81c5-3956e82276f3/entry/The_view_from_the_May_2015_C_Standard_meeting?lang=en
7,Distributed load testing using Kubernetes,crcsmnky,http://googlecloudplatform.blogspot.com/2015/06/Distributed-Load-Testing-Using-Kubernetes.html
52,Printing images in the terminal with 9 lines of Ruby,astro-,http://radek.io/2015/06/29/catpix/
7,Florida Man Accused of Terrorism Based on Book Collection Set Free,bruceb,https://firstlook.org/theintercept/2015/06/29/case-orlando-imam-judge-rules-islamic-books-evidence-terrorism/
124,From Haskell to Hardware [video],begriffs,http://begriffs.com/posts/2015-06-28-haskell-to-hardware.html
395,Running Lisp in Production,f00biebletch,http://tech.grammarly.com/blog/posts/Running-Lisp-in-Production.html
325,How side projects saved our startup,rmason,https://blog.crew.co/how-side-projects-saved-our-startup
4,This referendum is a fight between the Greeks and Europe’s cruel capitalism,Sideloader,http://www.theguardian.com/commentisfree/2015/jun/29/referendum-greeks-europe-capitalism-greece-eurozone-economic-system
6,Performance Testing Firefox OS with Raptor,jonathancreamer,https://hacks.mozilla.org/2015/06/performance-testing-firefox-os-with-raptor/
15,Microsoft Said to Exit Display Ad Business Cut 1200 Jobs,QUFB,http://www.bloomberg.com/news/articles/2015-06-29/microsoft-said-to-exit-display-ad-business-cut-1-200-jobs
7,How Minecraft prepares kids for jobs that don't exist yet,spking,https://www.edsurge.com/n/2015-05-26-how-minecraft-and-duct-tape-wallets-prepare-our-kids-for-jobs-that-don-t-exist-yet?utm_source=Adults&utm_campaign=97c4a2ed46-Preparing_Our_Kids_for_Jobs&utm_medium=email&utm_term=0_881d652251-97c4a2ed46-183200025&mc_cid=97c4a2ed46&mc_eid=ed48bce787
54,Coloring books are suddenly catching on with adults,prostoalex,http://qz.com/437793/coloring-is-now-a-normal-adult-activity/
9,Chasing clouds in the LHC,user_235711,http://home.web.cern.ch/about/updates/2015/06/chasing-clouds-lhc
1,Heap is hiring engineers to build a new approach to analytics,matm,https://heapanalytics.com/jobs#engineer
10,General Caching Is Hard: Even with Small Pages,user_235711,http://arxiv.org/abs/1506.07905
3,AOL Takes Over Majority of Microsoft’s Ad Business,fraqed,http://blogs.wsj.com/cmo/2015/06/29/aol-takes-over-majority-of-microsofts-ad-business-swaps-google-search-for-bing/?mod=mktw
3,First React Native Android App in the Play Store: Adverts Manager,techaddict009,https://twitter.com/reactjs/status/615638361328349185
71,Cisco to Buy Network Security Company OpenDNS for $635M,moritzplassnig,http://www.wsj.com/articles/cisco-to-buy-network-security-company-opendns-1435668508
11,How World War III Became Possible,smacktoward,http://www.vox.com/2015/6/29/8845913/russia-war
24,An emoji-based programming language,orik,https://github.com/FourMan/4
6,NPM 3 beta released,clessg,https://github.com/npm/npm/releases/tag/v3.0.0
8,JavaScript in one picture,doque,https://github.com/coodict/javascript-in-one-pic
60,CodePhage - Automatic bug repair without access to source code,tvvocold,https://newsoffice.mit.edu/2015/automatic-code-bug-repair-0629
9,Show HN: A Minecraft Forge Mod for Writing Mods in Clojure,setupminimal,https://github.com/setupminimal/Cljsh
93,Docker really is the future,mfenniak,http://blog.circleci.com/it-really-is-the-future/
26,The Web After Tomorrow,frankiesardo,http://tonsky.me/blog/the-web-after-tomorrow
4,How Microserfdom Ate the World,ForHackernews,http://grantland.com/hollywood-prospectus/silicon-valley-halt-catch-fire-microserfs-douglas-coupland/
22,Sequence-specific antimicrobials using RNA-guided nucleases,luu,http://www.nature.com/nbt/journal/v32/n11/full/nbt.3011.html
5,Only 3% of Americans Are Legally Allowed to Invest in Start-Ups,kushti,http://qz.com/431198/this-is-not-a-typo-only-3-of-americans-are-legally-allowed-to-invest-in-start-ups/
3,Atom 1.0 Promo Video,snehesht,https://www.youtube.com/watch?v=Y7aEiVwBAdk
11,Show HN: A simple password generator,robinhood,https://simplestpasswordgenerator.com/
86,Nuon the gaming chip that nearly changed the world but didn’t,lermontov,http://arstechnica.com/gaming/2015/06/before-the-ps2-nuon-famously-tried-and-failed-to-combine-dvd-and-game-consoles/
67,CRS-7 Launch Update,chiachun,http://www.spacex.com/news/2015/06/28/crs-7-launch-update
5,The origin of leap seconds and why they should be abolished,jonbaer,http://qz.com/432787/the-origin-of-leap-seconds-and-why-they-should-be-abolished/
99,Git from the inside out,DrinkWater,https://github.com/maryrosecook/essays/blob/master/gitfromtheinsideout/essay.md
4,District Court Judge in Oracle V. Google Learned Java (2012),jasonmp85,http://radar.oreilly.com/2012/05/judge-alsup-codes.html
21,Mercurial at Unity,jordigh,http://natoshabard.com/post/122632480712/mercurial-at-unity
3,Ask HN: Can you compile laws?,danschumann,
4,Patch against OpenSSH 6.8p1 – What does that mean?,hexa-,https://twitter.com/ochsff/status/615544079628288008
4,Helium is leaking from massive earthquake fault in LA,spking,http://www.dailymail.co.uk/sciencetech/article-3143818/Helium-LEAKING-massive-earthquake-fault-LA-raising-fears-big-one-devastating-thought.html
82,OpenBSD from a veteran Linux user perspective,mulander,http://cfenollosa.com/blog/openbsd-from-a-veteran-linux-user-perspective.html
4,Where Europe is growing and shrinking,chrtze,http://interaktiv.morgenpost.de/europakarte/#5/47.651/11.206/en
26,Where the population of Europe is growing – and where it’s declining,mxfh,http://interaktiv.morgenpost.de/europakarte/#5/48.415/11.294/en
8,Robert Burton: What we can–and cannot–learn from brain science (2013),dnetesn,http://nautil.us/issue/5/fame/ingenious-robert-burton
4,I Started Using Evernote Again (And Why You Should Too),WritelyDesigned,https://writelydesigned.com/official-started-using-evernote/
286,Microsoft quietly pushes 18 new trusted root certificates,svenfaw,http://hexatomium.github.io/2015/06/26/ms-very-quietly-adds-18-new-trusted-root-certs/
4,Change Your SSID or Share Wi-Fi Creds with Facebook Friends,jasonmp85,http://www.howtogeek.com/219700/what-is-wi-fi-sense-and-why-does-it-want-your-facebook-account/
150,Tell HN: Commercial VPN service now in open source,v_ivanov,
6,Tearing Apart a Datto,ehouse,http://silentbreaksecurity.com/tearing-apart-a-datto/
791,Inceptionism:  Going Deeper into Neural Networks,neurologic,http://googleresearch.blogspot.com/2015/06/inceptionism-going-deeper-into-neural.html
36,France Launches French Tech Ticket a Startup Visa for Foreign Entrepreneurs,lelf,http://techcrunch.com/2015/06/29/france-launches-french-tech-ticket-a-startup-visa-for-foreign-entrepreneurs/
3,U.S. Top Court Declines to Hear Google Appeal in Oracle Software Fight,jeo1234,http://recode.net/2015/06/29/u-s-top-court-declines-to-hear-google-appeal-in-oracle-software-fight/
4,Monitoring Tools to Prevent Production Doomsday,tkfx,http://blog.takipi.com/7-monitoring-tools-to-prevent-the-next-doomsday/
34,YouTube Map Explorer,bemmu,https://youtubemapexplorer.herokuapp.com/
4,Beyond Containers: Agility and Security in Docker Delivery,zquestz,https://www.youtube.com/watch?v=pcJzU2hxn2k
153,Show HN: Phishing as a service,naftaliharris,https://cuttlephish.com
9,Supreme Court declines to hear Oracle v. Google case over software copyright,jasonmp85,http://www.theverge.com/2015/6/29/8856729/oracle-v-google-supreme-court-declines
59,Headphones are the new walls for people in open-plan offices,wyclif,http://www.zdnet.com/article/headphones-are-the-new-walls-for-people-in-open-plan-offices/
4,Ask HN: Web design a depreciating asset?,boldpanda,
15,Large Scale Deep Neural Net visualizing top level features,mirceasoaica,http://317070.github.io/LSD/
265,Tell HN: Entrepreneurs make sure you are getting guaranteed wins in life,hoodoof,
1372,What Is Code?,1wheel,http://www.bloomberg.com/graphics/2015-paul-ford-what-is-code/
6,Should you write your back end as an  API?,mailanik,http://programmers.stackexchange.com/questions/287819/should-you-write-your-back-end-as-an-api
481,We need to rethink employee compensation,katm,http://www.aaronkharris.com/we-need-to-rethink-employee-compensation
3,Ask HN: What phone do you use?,humility,
9,How World War III became possible: it's likelier than you think,alecco,https://www.vox.com/2015/6/29/8845913/russia-war
10,Streaming Petabytes of Data in Realtime with Kinesis,dialtone,http://tech.adroll.com/blog/data/2015/06/26/kinesis.html
264,Ask HN: Open source OCR library?,whbv,
4,Ask HN: Halfway through school realizing I don't enjoy software engineering,donduckdraper,
4,Ask HN: Do people get a business license for their evening projects in the US?,Someone1234,
12,TinyMCE 4.2 released with Image Tools,andfrob,http://blog.tinymce.com/2015/06/25/tinymce-4-2-with-image-tools/
37,Reading Is Forgetting,prostoalex,http://www.nybooks.com/blogs/nyrblog/2015/jun/26/reading-is-forgetting/?utm_medium=email&utm_campaign=NYR+STEM+frenzy+Boko+Haram+Midsummer+Nights+Dream&utm_content=NYR+STEM+frenzy+Boko+Haram+Midsummer+Nights+Dream+CID_869a7e4df211b9f2091810c10f23c98f&utm_source=Email%20marketing%20software&utm_term=Reading%20Is%20Forgetting
84,Show HN: Self-hosted stack-based programming language,Drahflow,https://github.com/Drahflow/Elymas
4,How a crisis in Estonia could lead to World War III: A flowchart,BerislavLopac,http://www.vox.com/2015/6/29/8858909/russia-war-flowchart
3,Percolate Studio Joins Meteor,pmcpinto,http://blog.percolatestudio.com/design/percolate-studio-joins-meteor/
6,Chimps and the Zen of Falling Water,dnetesn,http://nautil.us/blog/chimps-and-the-zen-of-falling-water
252,Hacking Super Mario World to Warp to the Credits [video],Kortaggio,https://www.youtube.com/watch?v=vAHXK2wut_I
12,Ask Me Anything: Dynamic Memory Networks for Natural Language Processing,evc123,http://arxiv.org/abs/1506.07285
70,Handling Leap Seconds the OpenBSD Way,antonios,http://undeadly.org/cgi?action=article&sid=20150628132834
5,Issue #1: Project claims to be open source but doesn't share the source,fak3r,https://github.com/RestyaPlatform/board/issues/1
11,Show HN: Facebook's “Celebrate Pride” tool recreated with JavaScript and canvas,alexpeattie,https://github.com/alexpeattie/prideify
17,Where are the invisible apps?,zabramow,http://techcrunch.com/2015/06/28/where-are-the-invisible-apps/
9,I used to lead tours at a plantation. You wont believe these slavery questions,NN88,http://www.vox.com/2015/6/29/8847385/what-i-learned-from-leading-tours-about-slavery-at-a-plantation
9,Ask HN: Should I ditch Wordpress for Ghost?,jagermo,
32,Ornette Coleman and a Joyful Funeral,tintinnabula,http://www.newyorker.com/culture/culture-desk/ornette-coleman-and-a-joyful-funeral
4,My Co-Founders Took Away Everything I’d Created. Here’s What I Learned,taylorbuley,https://medium.com/backchannel/my-co-founders-took-away-everything-i-d-created-but-i-made-the-muse-successful-anyway-ece31e0578f6
11,Joseph Stiglitz: how I would vote in the Greek referendum,paublyrne,http://www.theguardian.com/business/2015/jun/29/joseph-stiglitz-how-i-would-vote-in-the-greek-referendum
42,Ask HN: I'm owed 8k by a startup that's going under. What do I do?,gettingstiffed,
4,Ask HN: How to promote an open source project?,harshasrinivas,
267,LLVM merges SafeStack,theraven,https://github.com/llvm-mirror/llvm/commit/7ffec838a2b72e6841d9fb993b5fe6a45f3b2a90
27,GCC and LLVM Collaboration (2014) [pdf],vmorgulis,https://gcc.gnu.org/wiki/cauldron2014?action=AttachFile&do=view&target=GCCandLLVM.pdf
14,The Supreme Court just refused to review a disastrous ruling on API copyrights,_stephan,http://www.vox.com/2014/11/18/7238825/copyright-for-apis-is-going-to-be-a-disaster-and-only-the-supreme
6,Neocities 3.0: An interactive HTML/CSS course for everyone,theandrewbailey,https://www.kickstarter.com/projects/1262953102/neocities-30-an-interactive-html-css-course-for-ev
6,Reddit Founder Speaks at His Old High School Gets Kicked Out for Swearing,bennyluo,http://nextshark.com/reddit-alexis-speech-profanity/
3,How Complex Systems Fail [pdf],ajdecon,http://web.mit.edu/2.75/resources/random/How%20Complex%20Systems%20Fail.pdf
8,Visualizing 25 Years of Music History,gigs_of_figs,http://blog.predpop.com/post/122678180495/introducing-the-music-data-canvas-25-years-of
56,What is a shell and how does it work?,luu,http://experiments.oskarth.com/unix01/
14,Panoramio: The day that we rejected an acquisition offer from Google,lleims,http://novobrief.com/panoramio-google-acquisition/
4,Nvidia  Takes the Lid Off ‘Gameworks VR’ – Technical Deep Dive and Community Q&A,Impossible,http://www.roadtovr.com/nvidia-takes-the-lid-off-gameworks-vr-technical-deep-dive-and-community-qa/
6,OPM: The worst hack of all time,tanglesome,http://www.computerworld.com/article/2941754/data-security/opm-the-worst-hack-of-all-time.html
5,California Man Wins Lawsuit After Neighbor Shotgunned His Drone,davidism,http://motherboard.vice.com/read/the-skys-not-your-lawn-man-wins-lawsuit-after-neighbor-shotgunned-his-drone
94,Can the Bacteria in Your Gut Explain Your Mood?,kareemm,http://www.nytimes.com/2015/06/28/magazine/can-the-bacteria-in-your-gut-explain-your-mood.html
18,SpaceX issue still unknown after several thousand engineering-hours of review,bontoJR,https://twitter.com/elonmusk/status/615431934345216001
12,Wikipedia's robots.txt,redcalx,https://en.wikipedia.org/robots.txt
145,The Three Great Virtues of a Programmer: Laziness Impatience and Hubris,aaronchall,http://c2.com/cgi/wiki?LazinessImpatienceHubris
43,Ask HN: My startup has failed. What comes next?,blinduck,
3,Mudge leaves Google to start “CyberUL” agency at White House's request,bbatsell,https://recode.net/2015/06/29/famed-security-researcher-mudge-leaves-google-for-white-house-gig/
4,Ask HN: Do you meditate?,hrayr,
142,Show HN: Hyperlax.tv – a real-time feed of Instagram's latest Hyperlapse videos,tbird24,http://hyperlax.tv/
42,Growing Pains for Deep Learning,davidiach,http://cacm.acm.org/news/188737-growing-pains-for-deep-learning/fulltext
259,RunC – A lightweight universal runtime container by the Open Container Project,tlrobinson,http://runc.io/
183,Mario running in Unreal Engine 4 [video],latenightcoding,https://www.youtube.com/watch?v=VUKcSiAPJoQ
134,Show HN: A Python with Hindley-Milner-like type annotations compiling to C,alehander42,https://github.com/alehander42/hermetic
4,Working with Large Excel Files in Pandas,mjhea0,https://realpython.com/blog/python/working-with-large-excel-files-in-pandas#.VZFMQiuslCg.hackernews
890,To Apple Love Taylor,milen,http://taylorswift.tumblr.com/post/122071902085/to-apple-love-taylor
24,Artificial Intelligence Machine Gets Testy With Its Programmer,jonwachob91,http://blogs.wsj.com/digits/2015/06/26/artificial-intelligence-machine-gets-testy-with-its-programmers
5,Why Is Modern Art So Bad?,billconan,https://www.youtube.com/watch?v=lNI07egoefc
8,Time series data: the worst and best use case in distributed databases [video],sylvinus,http://www.thedotpost.com/2015/06/paul-dix-time-series-data-the-worst-and-best-use-case-in-distributed-databases
42,Linux IRIX and “Posix Capabilities” (1999),vezzy-fnord,http://www.eros-os.org/pipermail/e-lang/1999-November/003031.html
51,Lmctfy – Let Me Contain That for You,tvvocold,https://github.com/google/lmctfy
135,Why Coke Cost a Nickel for 70 Years (2012),x43b,http://www.npr.org/sections/money/2012/11/15/165143816/why-coke-cost-a-nickel-for-70-years
8,Young Male and Single,diamonis,http://www.unz.com/pfrost/young-male-and-single/
4,The ultimate reading list for finance professionals,npguy,http://www.filll.com/news
3,The Better Architect You Are the Simpler Your Diagrams,yegor256a,http://www.yegor256.com/2015/06/29/simple-diagrams.html?2015-26
5,Tax Implications of Startup Stock Options,Blondebro,https://blog.jixee.me/tax-implications-of-stock-options/
5,Scandinavian Unexceptionalism [pdf],adventured,http://www.iea.org.uk/sites/default/files/publications/files/Sanandajinima-interactive.pdf
164,Alleged $7.5B fraud in online advertising,inthewoods,https://moz.com/blog/online-advertising-fraud
5,Ask HN: When is it too early to raise?,crobertsbmw,
4,WebAssembly is not a bytecode for the web,bcheung,http://www.quora.com/Why-do-people-keep-saying-WebAssembly-is-a-bytecode-for-the-web-when-it-is-not?share=1
16,Google Manipulates Search Results According to Study from Yelp and Tim Wu,dpflan,http://recode.net/2015/06/29/yelp-teams-with-legal-star-tim-wu-to-trounce-google-in-new-study/
96,Jellyfish WebGL demo,epsylon,http://akirodic.com/p/jellyfish/
11,The Fuzzball Fix for a Black Hole Paradox,ghosh,http://www.wired.com/2015/06/fuzzball-fix-black-hole-paradox/
6,Rust the Language for Growth,neverminder,http://joelmccracken.github.io/entries/rust-the-language-for-growth/
5,Power Supplies and Wires (2013),edward,http://etbe.coker.com.au/2013/01/24/power-supplies-wires/
14,Building Conversational Alexa Apps for Amazon Echo,stefann42,https://freebusy.io/blog/building-conversational-alexa-apps-for-amazon-echo
5,So robots will make us their pets? I can’t wait,edward,http://www.theguardian.com/commentisfree/2015/jun/29/robots-make-humans-pets-steve-wozniak-intelligent-machines
8,Is Google Degrading Search? Consumer Harm from Universal Search,mhomde,http://www.slideshare.net/lutherlowe/wu-l
13,We can do better – Please fix plaintext credential storage in Chrome,shayanjm,https://medium.com/@shayanjm/we-can-do-better-a69547999f3e
3,“So Where Else Are You Applying?”,SunTzu55,http://insights.dice.com/2015/06/29/so-where-else-are-you-applying/
1,Segment is hiring engineers to build the future of analytics infrastructure,calvinfo,https://segment.com/jobs/
6,Keeping a clean Git history,invalid_arg,http://mat-mcloughlin.net/2015/06/27/keeping-a-clean-git-history
42,Linear-Log Bucketing: Fast Versatile Simple,luu,http://pvk.ca/Blog/2015/06/27/linear-log-bucketing-fast-versatile-simple/
738,Organizing complexity is the most important skill in software development,speg,http://www.johndcook.com/blog/2015/06/18/most-important-skill-in-software/
94,My Parents Were Home-Schooling Anarchists (2011),akbarnama,http://www.nytimes.com/2011/11/13/magazine/my-parents-were-home-schooling-anarchists.html
19,The Bad Behavior of Visionary Leaders,aaronbrethorst,http://www.nytimes.com/2015/06/27/business/dealbook/the-bad-behavior-of-visionary-leaders.html
1903,Same-Sex Marriage Is a Right Supreme Court Rules,imd23,http://www.nytimes.com/2015/06/27/us/supreme-court-same-sex-marriage.html?emc=edit_na_20150626&nlid=63565976&ref=headline&_r=0
13,Ask HN: Is it necessary to operate from the USA to succeed?,gotzephyr,
53,Why Is the Most-Viewed Gaming Video on YouTube About Cars 2?,minimaxir,http://minimaxir.com/2015/06/cars-2/?hn=1
99,Master Password,kenrose,https://ssl.masterpasswordapp.com/
7,Greece Will Shut Banks in Fallout from Debt Crisis,mackmcconnell,http://www.nytimes.com/2015/06/29/world/europe/greece-will-shut-banks-in-fallout-from-debt-crisis.html?hp&action=click&pgtype=Homepage&module=first-column-region&region=top-news&WT.nav=top-news&_r=0
5,Ask HN: I need to transfer 10TB of Data across Pacific,stkim1,
3,Show HN: What do people think of webblygems – should it be continued?,mikeux,http://www.webblygems.com/
64,Griggi: A Wi-Fi sharing ecosystem for affordable Internet everywhere,pocha,http://griggi.com
179,Stop Firefox leaking data about you,amq,https://github.com/amq/firefox-debloat
15,The Problem with Putting All the World's Code in GitHub,ghosh,http://www.wired.com/2015/06/problem-putting-worlds-code-github/
7,Walt Disney's corporate strategy chart (1957),mzehrer,http://kottke.org/15/06/walt-disneys-corporate-strategy-chart
13,Show HN: Stunning free videos for your homepage background,yoavh,http://coverr.co
7,Using the Couchbase ODBC Driver with Microsoft Excel,nraboy,http://blog.couchbase.com/using-the-couchbase-odbc-driver-with-microsoft-excel
5,Dash 3: Now Available,tbassetto,https://blog.kapeli.com/dash-3
18,How Elephant Poop Is Helping Nab Ivory Poachers,adamnemecek,http://www.smithsonianmag.com/smart-news/elephant-poop-helping-nab-ivory-poachers-180955664/
12,The Fine Art of Forgery: the Smithsonian is using 3‑D printing to copy artifacts,diodorus,http://www.theatlantic.com/magazine/archive/2015/07/art-forgery/395282/?single_page=true
115,You don't need to daemonize,vezzy-fnord,http://homepage.ntlworld.com./jonathan.deboynepollard/FGA/systemd-house-of-horror/daemonize.html
4,Google's self-driving cars are accident-prone – but it may not be their fault,edward,http://www.theguardian.com/technology/2015/jun/28/google-self-driving-cars-accidents
6,Hacker News Meetup in Boulder CO,mojoe,http://www.meetup.com/Boulder-Hacker-News-Meetup/
41,Adventures in Browser Exploitation Part II: Mac OS X Safari 8.0.5 UXSS,adamnemecek,http://joevennix.com/2015/06/24/Adventures-in-Browser-Exploitation-Part-II--Safari-8-UXSS.html
66,Perth engineer invents robotic bricklayer,gregcrv,http://www.perthnow.com.au/realestate/news/robot-brickie-perth-engineer-invents-worlds-first-robotic-bricklayer/story-fni0ckzf-1227414734482
