SCORE,TITLE,BY,URL
105,Show HN: Free Company Logo API,maccman,http://blog.clearbit.com/logo
92,Compiler Errors for Humans,luu,http://elm-lang.org/blog/compiler-errors-for-humans
46,Microsoft might be interested in buying AMD,frik,http://www.kitguru.net/components/anton-shilov/microsoft-is-interested-to-buy-advanced-micro-devices-source/
263,Introducing s2n a New Open Source TLS Implementation,ukj,http://blogs.aws.amazon.com/security/post/TxCKZM94ST1S6Y/Introducing-s2n-a-New-Open-Source-TLS-Implementation
31,Useful Python Libraries for Startups,zallarak,http://blog.instavest.com/three-useful-python-libraries-for-startups
71,How to achieve low latency with 10Gbps Ethernet,jgrahamc,https://blog.cloudflare.com/how-to-achieve-low-latency/
12,Fluoridation May Not Prevent Cavities Scientific Review Shows,rl3,http://www.newsweek.com/fluoridation-may-not-prevent-cavities-huge-study-shows-348251
158,Clojure 1.7 is now available,Spendar89,http://blog.cognitect.com/blog/2015/6/30/clojure-17
11,Show HN: Eduhunt – ProductHunt for Education,freetonik,http://eduhunt.co/
22,The Universal Data Structure,elbenshira,http://elbenshira.com/blog/the-universal-data-structure/
1,GetGoing (YC S12) Is Looking for a Technical PM Travel Platform,astrygin,http://www.jobscore.com/jobs2/getgoing/technical-product-manager-travel-platform/aydSp8gqur5yi0iGalkWKP
230,Pete Sampras: Letter to My Younger Self,yarapavan,http://www.theplayerstribune.com/pete-sampras-letter-to-my-younger-self/
493,Safari is the new IE,nolanl,http://nolanlawson.com/2015/06/30/safari-is-the-new-ie/
14,What a 4am haircut taught me about hackathons,theamydance,http://news.mlh.io/what-a-4-a-m-haircut-taught-me-about-hackathons-06-30-2015
76,Free three-month trial of Apple Music now available,knowbody,http://www.apple.com/music/
290,Vim Colors,TheHydroImpulse,http://vimcolors.com/
9,Introducing DeepLinkDispatch: Easy Declaration and Routing of Your Deep Links,cblock811,http://nerds.airbnb.com/deeplinkdispatch/
5,U.S. Chamber of Commerce Works Globally to Fight Antismoking Measures,zameerb,http://www.nytimes.com/2015/07/01/business/international/us-chamber-works-globally-to-fight-antismoking-measures.html
50,Cisco Announces Intent to Acquire OpenDNS,randomname2,http://newsroom.cisco.com/press-release-content?type=webcontent&articleId=1667697
7,The Taos Operating System (1991),vezzy-fnord,http://www.dickpountain.co.uk/home/computing/byte-articles/the-taos-operating-system-1991?hn
7,The Mathematician by John von Neumann (1947),danso,http://www-history.mcs.st-and.ac.uk/Extras/Von_Neumann_Part_1.html
8,Show HN: NewsBot – An ML-powered Chrome extension for instant related news,fxgr,https://chrome.google.com/webstore/detail/newsbot/gahbhdbjjomehdmbjielhoflcmnecief
5,How Arel Converts Ruby Queries into SQL Statements,moritzplassnig,http://blog.codeship.com/how-arel-converts-ruby-queries-into-sql-statements/
79,About the OS X Yosemite v10.10.4 Update,tachion,https://support.apple.com/en-gb/HT204928
9,Understanding HTTP Strict Transport Security,paukiatwee,http://www.troyhunt.com/2015/06/understanding-http-strict-transport.html
10,Show HN: Distributed Cloud Compilation API,jpetrucc,https://www.mimirhq.com/blog-eng.php?p=26
76,Impossible Mission – Commodore 64 game remake in JavaScript,ingve,http://impossible-mission.krissz.hu/
10,Hacking StumpWM with Common Lisp,gkya,http://www.kaashif.co.uk/2015/06/28/hacking-stumpwm-with-common-lisp/index.html
119,Awesome D3,chrtze,https://github.com/wbkd/awesome-d3
79,Releasing a Commercial ASCII Roguelike a Post-Mortem,jarcane,http://www.gridsagegames.com/blog/2015/06/releasing-commercial-ascii-roguelike-post-mortem/
91,Get your Google calendar into tmux,mzehrer,https://blog.hauck.io/get-your-google-calendar-into-tmux/
106,A Walk Around Chernobyl [video],SeoxyS,https://www.youtube.com/watch?v=9DWnjcSo9J0
47,Most Internet anonymity software leaks users’ details,Libertatea,http://www.qmul.ac.uk/media/news/items/se/158459.html
7,Ask HN: If money's not a problem why Docker over Heroku?,shockzzz,
1,AptDeco (YC W14) Is Hiring Engineers and Operations Biz Dev CX Managers in NYC,reham,https://www.aptdeco.com/jobs
326,Test Pilot Admits the F-35 Can’t Dogfight,suprgeek,https://medium.com/war-is-boring/test-pilot-admits-the-f-35-can-t-dogfight-cdb9d11a875
153,A game whose source code fits in one tweet,eigenbom,https://github.com/omnus/tiny-twitch
70,Breathing Is the Key to Persuasive Public Speaking,dpflan,https://hbr.org/2015/06/breathing-is-the-key-to-persuasive-public-speaking
5,Refactoring with Loops and Collection Pipelines,kilimchoi,http://martinfowler.com/articles/refactoring-pipelines.html
78,PixQL: SQL for image processing,GuiA,https://github.com/Phildo/pixQL
42,NsJail: A lightweight process isolation tool,arunc,http://google.github.io/nsjail/
73,Introducing the ‘right to eavesdrop on your things’,henrycg,http://www.politico.com/agenda/story/2015/06/internet-of-things-privacy-concerns-000107
75,TIS-100: An emulator for a CPU that doesn't exist,EvilTrout,http://eviltrout.com/2015/06/29/an-emulator-for-tis-100.html
7,Sshguard protects networked hosts from brute force attacks,edward,http://www.sshguard.net/
41,Making Pictures With GNU PIC,brudgers,http://floppsie.comp.glam.ac.uk/Glamorgan/gaius/web/pic.html
60,Cellauto.js – a library for creating cellular automata simulations in JavaScript,bemmu,http://sanojian.github.io/cellauto/
49,Craigslist 3taps settle scraping/antitrust suits with $1M donation to EFF,sinak,http://techcrunch.com/2015/06/29/craigslist-3taps-settle-their-scrapingantitrust-suits-3taps-to-pay-1m-to-be-donated-to-the-eff?
4,IndieGoGo down following Bailout Greece campaign,greaterthan,https://www.indiegogo.com/
42,UI Testing in Xcode 7,adamnemecek,http://masilotti.com/ui-testing-xcode-7/
106,Ask HN: Why use Docker and what are the business cases for using it?,dmarg,
8,Meet the new Pushbullet,intull,https://blog.pushbullet.com/2015/06/30/meet-the-new-pushbullet/
39,Linux Mint 17.2 “Rafaela” Cinnamon Released,whoisthemachine,http://blog.linuxmint.com/?p=2863
1,Like data engineering? Stealth-mode big data startup is hiring founding engineer,romming,
217,Reality doesn’t exist until it is measured quantum experiment finds,lermontov,http://www.anu.edu.au/news/all-news/experiment-confirms-quantum-theory-weirdness
727,Tota11y,chrtze,http://khan.github.io/tota11y/
8,Scripts to Rule Them All,jonmaddox,http://githubengineering.com/scripts-to-rule-them-all/
5,The Miraculous 1880s,pross356,http://spectrum.ieee.org/geek-life/history/the-miraculous-1880s
312,Energy,jordanmessina,http://blog.samaltman.com/energy
513,Own-Mailbox the first 100% confidential mailbox,yannski,http://www.own-mailbox.com/
12,Driven by Open Source,daniel_levine,http://blog.getsentry.com/2015/06/30/driven-by-open-source.html
6,Ask HN: Should I learn to type properly?,clessg,
6,Google Scrambles After Software IDs Photo of Two Black People as “Gorillas”,lingben,http://www.slate.com/blogs/future_tense/2015/06/30/google_s_image_recognition_software_returns_some_surprisingly_racist_results.html
206,Could dark matter not exist?,strttn,https://medium.com/starts-with-a-bang/ask-ethan-94-could-dark-matter-not-exist-de5cd810e446
9,Kentik: netflow-based traffic visibility at Terabit scale,lafay,http://www.kentik.com
28,How Cotap Is Building a HIPAA-Compliant Messaging Service on AWS,sergiotapia,http://stackshare.io/cotap/how-cotap-is-building-a-hipaa-compliant-messaging-service-on-aws?utm=email
11,Empty stomach poor decisions,ph0rque,https://signalvnoise.com/posts/3885-empty-stomach-poor-decisions
9,SimplyInsured (YC W13) Scores $5.9M Series A from Polaris,vivekajayshah,http://techcrunch.com/2015/06/30/simplyinsured-series-a/
90,Greece to Default on $1.73B IMF Payment,tormeh,http://www.wsj.com/articles/european-union-prepares-for-potential-fallout-from-greek-bank-shutdown-1435573213
7,Jesse Jackson Is Taking on Silicon Valley's Epic Diversity Problem,blatherard,http://www.motherjones.com/politics/2015/05/tech-industry-diversity-jesse-jackson
3,Experiments with the Cairo Video Codec,specular,http://bertolami.com/index.php?engine=blog&content=posts&detail=cairo-experiment-results
7,Show HN: Bear CMS – A new much better way to build websites,ivopetkov,https://bearcms.com/
213,Livecoding.tv (YC S15) Is Twitch.tv for Coding,kevin,http://techcrunch.com/2015/06/29/yc-backed-livecoding-tv-is-the-twitch-tv-for-coding/
518,New WikiLeaks Documents Reveal NSA Spied on French Companies,maelito,http://techcrunch.com/2015/06/29/new-wikileaks-documents-reveal-nsa-spied-on-top-french-companies/
185,What is C in practice?,0x09,http://www.cl.cam.ac.uk/~pes20/cerberus/notes50-2015-05-24-survey-discussion.html
4,Ask HN: Do you want to be a billionaire?,biznerd,
66,EU Telecoms deal: Mobile roaming charges ban in 2017,endijs,http://www.politico.eu/article/telecoms-single-market-connected-continent-deal-reached/
27,Collection of FPV Racing Builds,thomasfromcdnjs,http://fpvracing.tv/builds
26,What's the Best Medium for a Storyteller in 2015 and Beyond?,T-A,http://www.antipope.org/charlie/blog-static/2015/06/hugh-hancock-here-again-charli.html
10,Pipefy – Organize and run all your processes in one place,alessioalionco3,http://www.pipefy.com/?ref=hackernews&amp;utm_source=hackernews
6,Greek bailout crowdfunding,skimmas,https://www.indiegogo.com/projects/greek-bailout-fund/x/11240399#/story
4,Ask HN: What do developers look for in a job listing?,adibchoudhury,
14,Show HN: A site to post and read code snippets and generate a PNG of the source,thepythonguy,http://blinkofcode.com
12,The Taos Operating System (1991),vezzy-fnord,http://www.dickpountain.co.uk/home/computing/byte-articles/the-taos-operating-system-1991
9,Data roaming charges to end in EU within two years,mattcollins,http://www.bbc.co.uk/news/technology-33325031
31,William Tutte the humble math professor who cracked top Nazi code,jdnier,https://uwaterloo.ca/magazine/spring-2015/features/keeping-secrets
1,Clever (YC S12) is hiring a lead designer,greattypo,https://clever.com/about/jobs#lead-designer
9,ScreenTime – movies from periodic OS X screenshots,beefburger,http://seriot.ch/screentime/
12,ShareTheMeal,sgift,https://sharethemeal.org/en/
11,Show HN: Zephyr – Collaboration for teams and freelancers,gotzephyr,https://zephyrplatform.com/demo/login/?fname=hacker&lname=news&email=hn@zephyr.email
4,Show HN: Especser – easy way to read the ES6 spec,awalGarg,https://github.com/awalGarg/especser
109,A Doom-like engine on the Raspberry Pi – 9800 lines of bare metal assembly,kcsongor,https://www.reddit.com/r/raspberry_pi/comments/3bg21j/we_made_doom_1993_on_the_raspberry_pi_9800_lines/
84,UT Austin provides free access to more than 22000 images of library materials,Petiver,http://blog.hrc.utexas.edu/2015/06/29/open_access_reveal/
117,Fairy Lights in Femtoseconds,alternize,http://digitalnature.slis.tsukuba.ac.jp/2015/06/fairy-lights-in-femtoseconds/
38,Computing with traps,varjag,https://www.github.com/jbangert/trapcc
132,Elixir 1.0.5 released,gandarojin,https://github.com/elixir-lang/elixir/blob/3eb938a0ba7db5c6cc13d390e6242f66fdc9ef00/CHANGELOG.md#v105-2015-06-29
3,This Is What World War III Will Look Like,rpm4321,http://time.com/3934583/world-war-3/
7,Answers to password reset questions are passwords too – so store them that way,ComputerGuru,http://neosmart.net/blog/2015/never-store-answers-to-security-questions-in-plain-text/
95,The Law on Cursing at Cops,danso,https://www.themarshallproject.org/2015/06/26/you-re-really-being-an-asshole-officer
5,Dino latest spying malware from an allegedly French espionage group analyzed,tesla23,http://www.welivesecurity.com/2015/06/30/dino-spying-malware-analyzed/
22,Cisco to Buy Cloud Security Company OpenDNS for $635M in Cash,doppp,http://techcrunch.com/2015/06/30/cisco-to-buy-cloud-security-company-opendns-for-635m-in-cash/
97,Uber Bonds Term Sheet Reveals $470M in Operating Losses,dzhao,http://www.bloomberg.com/news/articles/2015-06-30/uber-bonds-term-sheet-reveals-470-million-in-operating-losses
49,The first port of Unix (1998) [pdf],akkartik,http://www.uow.edu.au/content/groups/public/@web/@inf/@scsse/documents/doc/uow103747.pdf
274,The NoScript Misnomer,dwgirvan,http://thehackerblog.com/the-noscript-misnomer-why-should-i-trust-vjs-zendcdn-net/
5,Docker and the ‘coolification’ of containers,sirduncan,http://sdtimes.com/docker-and-the-coolification-of-containers/
194,Google hacked account,hmoghnie,
6,Elixir in times of microservices,phatle,http://blog.plataformatec.com.br/2015/06/elixir-in-times-of-microservices/
62,Hitler’s Flak Towers Were Anti-Aircraft Castles,vinnyglennon,https://medium.com/war-is-boring/hitlers-flak-towers-were-anti-aircraft-castles-4da8c423b725
7,Can you trust Airbnb reviews: How the sharing economy uses data to build trust,jmethvin,http://blog.import.io/post/can-you-really-trust-airbnb-reviews?utm_source=ycombinator.com&utm_medium=referral&utm_campaign=can-you-really-trust-airbnb-reviews
104,With 61 Seconds in a Minute Markets Brace for Trouble,rsgoheen,http://www.bloomberg.com/news/articles/2015-06-28/with-61-seconds-in-a-minute-markets-brace-for-trouble
88,AOL Takes Over Majority of Microsoft’s Ad Business Swaps Google Search for Bing,whatgoodisaroad,http://blogs.wsj.com/cmo/2015/06/29/aol-takes-over-majority-of-microsofts-ad-business-swaps-google-search-for-bing/
143,DataLake,PaulHoule,http://martinfowler.com/bliki/DataLake.html
9,Uber Is Rewarding $5 in Cash for Referrals Through API,natelam,https://devblog.uber.com/introducing-cash-rewards-a-new-way-for-developers-to-monetize/
25,A threading riddle,davidtgoldblatt,http://dgoldblatt.com/a-threading-riddle.html
302,ICANN's assault on personal and small business privacy,fieryscribe,https://blog.nearlyfreespeech.net/2015/06/27/icanns-assault-on-personal-and-small-business-privacy/
9,Retrochallenge,empressplay,http://retrochallenge.org
120,Uber Acquires Part of Bing’s Mapping Assets,caseysoftware,http://techcrunch.com/2015/06/29/uber-acquires-part-of-bings-mapping-assets-will-absorb-around-100-microsoft-employees/
5,Amazon Prime Now launches in London offering one-hour deliveries,davidbarker,http://www.amazon.co.uk/b?ie=UTF8&node=6584642031
76,London: the city that ate itself,smacktoward,http://www.theguardian.com/uk-news/2015/jun/28/london-the-city-that-ate-itself-rowan-moore
143,The Man Who Saved Southwest Airlines with a '10-Minute' Idea,ghosh,http://www.npr.org/2015/06/28/418147961/the-man-who-saved-southwest-airlines-with-a-10-minute-idea
5,NSA Claims It Doesn't Engage in Economic Espionage-Engaged in Economic Espionage,Errorcod3,https://www.techdirt.com/articles/20150629/16134031494/nsa-despite-claiming-it-doesnt-engage-economic-espionage-engaged-economic-espionage.shtml
14,Cisco to Acquire OpenDNS for $635M,hackinsider,http://www.securityweek.com/cisco-acquire-opendns-635-million
28,Ask HN: What books should I read as a software manager?,mmelih,
79,How Primedice was exploited for $1M in Bitcoin,jbardnz,https://medium.com/@Stunna/breaking-the-house-63f1021a3e6d
6,The War Situation: House Of Many Mansions (1940),jonathanehrlich,http://www.winstonchurchill.org/resources/speeches/1940-the-finest-hour/the-war-situation-house-of-many-mansions
31,Founder Depression Research Survey,foundersgrid,https://docs.google.com/forms/d/1Je9bidatgwAkL57KtWN2Z2jOLJfo4Shpw9ImIb1qjbE/viewform
194,Why ClojureScript Matters,jonpither,http://blog.juxt.pro/posts/why-clojurescript-matters.html
31,The Agile Delivery Blanket Purchase Agreement is almost here,rburhum,https://18f.gsa.gov/2015/06/15/agile-bpa-is-here/
32,“A Toast to Your Health”: Getting Drunk in Colonial America (2013),benbreen,https://theappendix.net/blog/2013/2/getting-drunk-in-colonial-america
9,Labellio – easy deep-learning platform for computer vision,umitanuki,https://www.labell.io/
158,What’s the best way to spend $20K to help the common good?,BenjaminTodd,https://80000hours.org/2015/06/whats-the-best-way-to-spend-20000-to-help-the-common-good/
8,Barclays.com now redirects to home.barclays,ca98am79,http://barclays.com
35,Automatic bug repair,namanyayg,http://newsoffice.mit.edu/2015/automatic-code-bug-repair-0629
35,Show HN: A Cryptocurrency in 4K Lines of Scala Code,kushti,https://github.com/ConsensusResearch/Scorex-Lagonaki
10,EU cripples Net-Neutrality by proposing fast-lanes,donkeyd,http://www.ft.com/fastft/352281/europe-end-mobile-roaming-charges
381,SpaceX – Launch Vehicle Failure,onwardly,
211,Ask HN: What problem in your industry is a potential startup?,ThomPete,
91,Vassal: Engine for building and playing online board games and card games,lobo_tuerto,http://www.vassalengine.org/
42,Option 9: A Shoot'em Up Miniature Video Game in Common Lisp,lispm,http://pages.cs.wisc.edu/~psilord/lisp-public/option-9.html
91,Pando (tree),lelf,https://en.wikipedia.org/wiki/Pando_(tree)
156,React.js koans,andrzejkrzywda,https://github.com/arkency/reactjs_koans
22,Is the Network the Limit? Dealing with Weave CoreOS and Azure,SanderMak,https://arjanschaaf.github.io/is-the-network-the-limit/
80,Oslo creates world's first 'highway' to protect endangered bees,fillskills,http://www.theguardian.com/environment/2015/jun/25/oslo-creates-worlds-first-highway-to-protect-endangered-bees
7,EU plans to destroy net neutrality by allowing Internet fast lanes,Tsiolkovsky,http://arstechnica.co.uk/tech-policy/2015/06/eu-plans-to-destroy-net-neutrality-by-allowing-internet-fast-lanes/
5,How the Potato Changed the World (2011),adamnemecek,http://www.smithsonianmag.com/history/how-the-potato-changed-the-world-108470605/?all
27,Failure is an Option,mcfunley,http://www.indecorous.com/failure/
161,Back to SF After the U.S. Digital Service,hodgesmr,https://insouciant.org/tech/back-to-sf-after-usds/
39,What If the Biggest Solar Storm on Record Happened Today? (2011),nhebb,http://news.nationalgeographic.com/news/2011/03/110302-solar-flares-sun-storms-earth-danger-carrington-event-science/
105,R at Microsoft,vladiim,http://blog.revolutionanalytics.com/2015/06/r-at-microsoft.html
36,Show HN: ES-Checker a feature detection library for ECMAScript,ruanyf,http://ruanyf.github.io/es-checker
40,Bitcoin is Unsustainable?,ForHackernews,http://motherboard.vice.com/read/bitcoin-is-unsustainable
13,Show HN: MarkSheet.io – a free guide to learn HTML and CSS,bbx,http://marksheet.io/
32,Loyalists vs. Mercenaries,randomname2,http://avc.com/2015/06/loyalists-vs-mercenaries/
354,Fighting spam with Haskell,vamega,https://code.facebook.com/posts/745068642270222/fighting-spam-with-haskell/
4,Ask HN: What do you wish Microsoft was doing better re: web?,colinmegill,
195,Ask HN: How big does an open-source project need to be for a lifestyle business?,jnbiche,
82,Rats Dream About the Places They Want to Explore,antimora,http://blogs.discovermagazine.com/d-brief/2015/06/26/rats-dream-places/
4,Betting on a scarcity of rare earth elements leads to bankruptcy for Mollycorp,rsgoheen,http://www.bloomberg.com/news/articles/2015-06-28/how-a-bet-on-rare-earths-flopped-as-scarcity-was-a-mirage
18,[Indiegogo] Greek bailout fund,xtrm1,https://www.indiegogo.com/projects/greek-bailout-fund#/story
8,Show HN: Knomad – A Social Platform for Podcasts,alcarter,https://www.producthunt.com/tech/knomad
13,Why I'm Leaving London,ascorbic,http://boingboing.net/2015/06/29/why-im-leaving-london.html
6,Signing in to Medium by email,thesumofall,https://medium.com/the-story/signing-in-to-medium-by-email-aacc21134fcd
8,Google patents Classification,qpleple,http://www.freepatentsonline.com/y2015/0178383.html
211,Squib: A Ruby DSL for prototyping card and board games,selvan,http://andymeneely.github.io/squib/
46,Replete: A Standalone iOS CLJS REPL,jarcane,http://blog.fikesfarm.com/posts/2015-06-27-replete-a-standalone-ios-cljs-repl.html
6,The Brain on Trial (2011),webnrrd2k,http://www.theatlantic.com/magazine/archive/2011/07/the-brain-on-trial/308520/?single_page=true
27,Webviews on the Rise and the Challenge of Testing Them,martin_tipgain,http://blog.testmunk.com/how-to-test-webviews-calabash/
3,We Should Drop the Leap Second Before It Causes Real Damage,ghosh,http://www.wired.com/2015/06/just-drop-leap-second-unnecessary/
3,Should Your Startup Rent an Office or Not?,simeondd,https://www.oxxy.com/blog/startup-rent-office-not/
25,Understanding the critical rendering path,luisvieira_gmr,https://medium.com/@luisvieira_gmr/understanding-the-critical-rendering-path-rendering-pages-in-1-second-735c6e45b47a
10,Shiller P/E Ratio,bemmu,http://www.multpl.com/shiller-pe/
14,Why Is It So Hard to Kill a College?,diodorus,http://chronicle.com/article/Why-Is-It-So-Hard-to-Kill-a/231161/?key=SzpzJFE7MHdPNnFlMTZFYjcHO3VoMUkiYydKaHslbl5TEQ==
17,Omega and what it means for Kubernetes,ahmetmsft,http://blog.kismatic.com/qa-with-malte-schwarzkopf-on-distributed-systems-orchestration-in-the-modern-data-center/?
5,Indiegogo: Greek Bailout Fund,HipstaJules,https://www.indiegogo.com/projects/greek-bailout-fund/x/2086816#/story
26,This is Rikers: From the people who live and work there,sergeant3,https://www.themarshallproject.org/2015/06/28/this-is-rikers
6,Powering desalination with the sun,prostoalex,http://newsoffice.mit.edu/2015/student-profile-natasha-wright-0622
90,Fred Dibnah – Steeplejack (1979) [video],grhmc,https://www.youtube.com/watch?v=tBQrcKF5_rA
6,'Ask Siri “what is zero divided by zero?”',tomkwok,https://twitter.com/aaronpaul_8/status/615762867480989696
34,Computer museum seeks BBC Micro fixers,benjamta,http://www.bbc.co.uk/news/technology-33291036
22,Technology and The Evolution of Storytelling,sohkamyung,https://medium.com/art-science/technology-and-the-evolution-of-storytelling-d641d4a27116
1,Build the front-end of Flexport's global trade platform,thedogeye,https://flexport.com/careers
63,Era of Distraction,zkanda,http://www.raymundtamayo.com/2014/09/era-of-distraction.html
48,Whispererly,wilozxc,http://whispererly.weebly.com/
62,Samsung Exynos 7420 Deep Dive – Inside a Modern 14nm SoC,ismavis,http://anandtech.com/show/9330/exynos-7420-deep-dive
57,String Interning – Trie vs. Hash Table Deathmatch,ScottWRobinson,http://loup-vaillant.fr/projects/string-interning/benchmark
5,Study Suggests That Google Has Its Thumb on Scale in Search,tim_sw,http://www.nytimes.com/2015/06/30/business/study-suggests-that-google-has-its-thumb-on-scale-in-search.html?_r=0
14,Show HN: FDA Drug Reactions,RA_Fisher,http://www.statwonk.com/openfda-dashboard/
53,Making Great VR: Lessons Learned from “I Expect You to Die”,sagargv,http://www.gamasutra.com/blogs/JesseSchell/20150626/247113/
11,Ants build complex structures with a few simple rules (2014),treefire86,https://www.quantamagazine.org/20140409-the-remarkable-self-organization-of-ants/
5,Mr. Difficult: William Gaddis and the Problem of Hard-To-Read Books (2002),Jimmy,http://adilegian.com/FranzenGaddis.htm
7,Math as code,bpierre,https://github.com/Jam3/math-as-code
316,U.S. Manufacturing costs are almost as low as China’s,prostoalex,http://fortune.com/2015/06/26/fracking-manufacturing-costs/
12,Apache Storm Roadmap at Yahoo,eloycoto,http://yahoohadoop.tumblr.com/post/122544585051/apache-storm-roadmap-at-yahoo
8,Generating a gift book with Clojure and LaTeX,shriphani,http://blog.shriphani.com/2015/06/29/a-beautiful-gift-with-clojure-and-latex/
25,Dmoz – The Open Directory Project,peter_l_downs,http://www.dmoz.org/?x
69,U.S. Supreme Court Denies Google's Request to Appeal Oracle API Case,spiralpolitik,http://www.supremecourt.gov/Search.aspx?FileName=/docketfiles%5C14-410.htm
3,European Commission welcomes agreement to end roaming charges,neverminder,http://europa.eu/rapid/press-release_IP-15-5265_en.htm
97,Ask HN: Who's looking for a cofounder?,philippnagel,
39,The Frenzy About High-Tech Talent,prostoalex,http://www.nybooks.com/articles/archives/2015/jul/09/frenzy-about-high-tech-talent/?utm_medium=email&utm_campaign=NYR+STEM+frenzy+Boko+Haram+Midsummer+Nights+Dream&utm_content=NYR+STEM+frenzy+Boko+Haram+Midsummer+Nights+Dream+CID_869a7e4df211b9f2091810c10f23c98f&utm_source=Email%20marketing%20software&utm_term=STEM%20Frenzy
55,SaaS Pricing: Our Big Free Plan Mistake,AliCollins,http://blog.hubstaff.stfi.re/saas-pricing-free-plan-mistake/
107,Supreme Court denies review of Google v. Oracle API copyright case [pdf],mikecb,http://www.supremecourt.gov/orders/courtorders/062915zor_4g25.pdf
8,Improving on Git Flow: Code Reviews,softwaredoug,http://opensourceconnections.com/blog/2015/06/29/improving-on-git-flow-code-reviews/
447,What happens when you stop relying on resumes,appamatto,http://blog.alinelerner.com/what-happens-when-you-stop-relying-on-resumes/
1,Rainforest QA (YC S12) Is Hiring Full Stack Ops and Front End Remote or SF,ukd1,https://www.rainforestqa.com/jobs/
74,Amartya Sen: The economic consequences of austerity,MaysonL,http://www.newstatesman.com/politics/2015/06/amartya-sen-economic-consequences-austerity
76,High-Profile Study Turns Up the Antitrust Heat on Google,IBM,http://www.bloomberg.com/news/articles/2015-06-29/high-profile-study-turns-up-the-antitrust-heat-on-google
5,Re: Telnet/FTP in Mozilla? (1998),ruda,http://173.79.223.25/?l=mozilla-wishlist&m=89294275217391
10,Design patterns for invariant suspension,joaquintides,http://bannalia.blogspot.com/2015/06/design-patterns-for-invariant-suspension.html
13,Ask HN: How to retain IP as a software contractor,confiscate,
11,Unix Client-Server Program Interface (1996),gandarojin,http://cr.yp.to/proto/ucspi.txt
164,Why Wolfram Mathematica did not use Lisp (2002),gearhart,http://www.ymeme.com/why-wolfram-(mathematica)-did-not-use-lisp.html
18,Visual Studio 2015 RTM on July 20th,snorge,http://blogs.msdn.com/b/somasegar/archive/2015/06/29/save-the-date-visual-studio-2015-rtm-on-july-20th.aspx
3,Supreme Court Denies Google Appeal on Oracle Suit,chrramirez,http://www.wsj.com/articles/supreme-court-denies-google-appeal-on-oracle-suit-1435585873
